asin,name,brand,price,regular_price,total_reviews,average_rating,seller,seller_url,availability_status,availability_quantity,shipping_charge,is_prime,author,available_book_formats,is_aplus_page,small_description,full_description,images,video_count,productCategory,url,attributes,size,color,model,product_information,parent_asin,variation_asin,product_variations,product_condition,frequently_bought_together,product_badges,five_star,four_star,three_star,two_star,one_star
B0D1XD1ZV3,"Apple AirPods Pro 2 Wireless Earbuds, Bluetooth Headphones, Active Noise Cancellation, Hearing Aid Feature, Transparency, Personalized Spatial Audio, High-Fidelity Sound, H2 Chip, USB-C Charging",Apple,$199.00,$249.00,"8,441",4.6,Amazon.com,,In Stock,,,True,,,False,"PIONEERING HEARING — AirPods Pro 2 unlock the world’s first all-in-one hearing health experience: a scientifically validated Hearing Test,* clinical-grade Hearing Aid feature,* and active Hearing Protection.* Coming fall 2024. - INTELLIGENT NOISE CONTROL — Active Noise Cancellation removes up to 2x more background noise.* Transparency mode lets you hear the world around you, and Adaptive Audio seamlessly blends Active Noise Cancellation and Transparency mode for the best listening experience in any environment.* And when you’re speaking with someone nearby, Conversation Awareness automatically lowers the volume of what’s playing.* - IMPROVED SOUND AND CALL QUALITY — The Apple-designed H2 chip helps to create deeply immersive sound. The low-distortion, custom-built driver delivers crisp, clear high notes and full, rich bass in stunning definition. Voice Isolation improves the quality of phone calls in loud conditions.* - CUSTOMIZABLE FIT — Includes four pairs of silicone tips (XS, S, M, L) to fit a wide range of ear shapes and provide all-day comfort. The tips create an acoustic seal to help keep out noise and secure AirPods Pro 2 in place. - DUST, SWEAT, AND WATER RESISTANT — Both AirPods Pro and the MagSafe Charging Case are IP54 dust, sweat, and water resistant, so you can listen comfortably in more conditions.* - PERSONALIZED SPATIAL AUDIO — With sound that suits your unique ear shape along with dynamic head tracking, AirPods Pro 2 deliver an immersive listening experience that places sound all around you.* You can also listen to select songs, shows, and movies in Dolby Atmos. - A HIGHER LEVEL OF CONTROL — Simply swipe, press, and hold the stem to manage playback functions using Touch control. And with Siri Interactions, simply nod your head yes or shake your head no when Siri asks if you’d like to hear a message, answer a call, or manage a notification.* - LONG BATTERY LIFE — Get up to 6 hours of listening time with Active Noise Cancellation enabled. And get up to 30 hours of total listening time with Active Noise Cancellation enabled, using the case.* - A MORE CAPABLE CASE— Keep track of AirPods Pro 2 with Precision Finding and a built-in speaker.* A lanyard loop helps keep your AirPods Pro 2 close. Charge with an Apple Watch or MagSafe Charger, USB-C Charge Cable, or Qi-certified charger. - LEGAL DISCLAIMERS — This is a summary of the main product features. See “Additional information” to learn more.",,"['https://m.media-amazon.com/images/I/61SUj2aKoEL._AC_SL1500_.jpg', 'https://m.media-amazon.com/images/I/611pEx7220L._AC_SL1500_.jpg', 'https://m.media-amazon.com/images/I/81Zg3Ev2M5L._AC_SL1500_.jpg', 'https://m.media-amazon.com/images/I/71d1WoCdwwL._AC_SL1500_.jpg', 'https://m.media-amazon.com/images/I/71wkJxedzjL._AC_SL1500_.jpg', 'https://m.media-amazon.com/images/I/91ip8vAXaeL._AC_SL1500_.jpg', 'https://m.media-amazon.com/images/I/61n7MpBGeBL._AC_SL1500_.jpg']",0,,https://www.amazon.com/-/dp/B0D1XD1ZV3?_encoding=UTF8&th=1&psc=1&pf_rd_i=desktop&ref_=pd_gw_unk,,,,,"{'Brand': 'Apple', 'Color': 'White', 'Ear Placement': 'In Ear', 'Form Factor': 'In Ear', 'Noise Control': 'Active Noise Cancellation'}",B0D1XD1ZV3,[],{},new,[],"[{'badge': ""Amazon's Choice"", 'badge_text': None}]",84%,7%,2%,2%,5%
B0D54JZTHY,Apple AirTag 4 Pack,Apple,$79.98,$99.00,"4,579",4.7,Amazon.com,,In Stock,,,True,,,False,"Keep track of and find your items alongside friends and devices in the Find My app - Simple one-tap setup instantly connects AirTag with your iPhone or iPad - Play a sound on the built-in speaker to help find your things, or just ask Siri for help - Precision Finding with Ultra Wideband technology leads you right to your nearby AirTag (on select iPhone models) - Find items further away with the help of hundreds of millions of Apple devices in the Find My network",,"['https://m.media-amazon.com/images/I/61bMNCeAUAL._AC_SL1500_.jpg', 'https://m.media-amazon.com/images/I/71JJueCRWJS._AC_SL1500_.jpg', 'https://m.media-amazon.com/images/I/61OH+f1MSSL._AC_SL1500_.jpg', 'https://m.media-amazon.com/images/I/91bsFWILPGS._AC_SL1500_.jpg', 'https://m.media-amazon.com/images/I/51hTpTblWoL._AC_SL1500_.jpg', 'https://m.media-amazon.com/images/I/61lSfyjRyRL._AC_SL1500_.jpg']",0,,https://www.amazon.com/-/dp/B0D54JZTHY?_encoding=UTF8&th=1&psc=1&pf_rd_i=desktop&ref_=pd_gw_unk,style: 4Pack,,,,"{'Brand': 'Apple', 'Are Batteries Included': 'Yes', 'Number of Batteries': '4 CR2032 batteries required. (included)', 'Compatible Devices': 'airtag', 'Item Weight': '0.39 Ounces'}",B0DJD6351J,"[{'style_name': '4Pack', 'asin': 'B0D54JZTHY'}]",{'style_name': ['4Pack']},new,[],"[{'badge': ""Amazon's Choice"", 'badge_text': None}]",86%,7%,2%,1%,3%
B0CWXNS552,Apple AirTag,Apple,$24.99,$29.00,"11,314",4.6,Amazon.com,,In Stock,,,True,,,False,"Keep track of and find your items alongside friends and devices in the Find My app - Simple one-tap setup instantly connects AirTag with your iPhone or iPad - Play a sound on the built-in speaker to help find your things, or just ask Siri for help - Precision Finding with Ultra Wideband technology leads you right to your nearby AirTag (on select iPhone models) - Find items further away with the help of hundreds of millions of Apple devices in the Find My network",,"['https://m.media-amazon.com/images/I/71rP7f78eFL._AC_SL1500_.jpg', 'https://m.media-amazon.com/images/I/71JJueCRWJS._AC_SL1500_.jpg', 'https://m.media-amazon.com/images/I/91bsFWILPGS._AC_SL1500_.jpg', 'https://m.media-amazon.com/images/I/71PQ-kScRrL._AC_SL1500_.jpg', 'https://m.media-amazon.com/images/I/61KbGwMyRiL._AC_SL1500_.jpg', 'https://m.media-amazon.com/images/I/71mC9ZpwpAL._AC_SL1500_.jpg']",0,,https://www.amazon.com/-/dp/B0CWXNS552?_encoding=UTF8&th=1&psc=1&pf_rd_i=desktop&ref_=pd_gw_unk,style: Single,,,,"{'Brand': 'Apple', 'Are Batteries Included': 'Yes', 'Number of Batteries': '1 CR2032 batteries required. (included)', 'Compatible Devices': 'Smartphone', 'Item Weight': '0.39 Ounces'}",B0D85TNX1M,"[{'style_name': 'Single', 'asin': 'B0CWXNS552'}]",{'style_name': ['Single']},new,[],"[{'badge': ""Amazon's Choice"", 'badge_text': None}]",83%,7%,3%,1%,5%
B092J8LPWR,"Surge Protector Power Strip - 8 Outlets with 4 USB (2 USB C) Charging Ports, Multi Plug Outlet Extender, 5Ft Braided Extension Cord, Flat Plug Wall Mount Desk USB Charging Station for Home Office ETL",HANYCONY,$12.99,$19.99,"44,842",4.8,HANYCONY,https://www.amazon.com/gp/help/seller/at-a-glance.html/ref=dp_merchant_link?ie=UTF8&seller=A2G94U39RCB9AL&asin=B092J8LPWR&ref_=dp_merchant_link&isAmazonFulfilled=1,In Stock,,,True,,,True,"【12 IN 1 Power Strip & 2.2 IN Wide Space】- 3-side design power strip surge protector with 8AC widely outlets and 4 USB (2 USB C) charging ports can power up to 12 devices simultaneously. That makes it easier to make the plugs not covering any outlet, and the 2.2 inchces widely spced in between outlets, larger than standard socket, fit big adapters without blocking each other. The compact design saves more space, suitable for the home, office, and college dorm room essentials - 【2 x USB C Power Strip】- Added extra 2 USB C ports for your devices, the USB C port can charge up to 5V/3A. USB-A ports can charge up to 5V/2.4A Max, all USB Ports Output is 5V/3.1A, 15.5W max which is 30% faster than other usb c charging station. With smart charging technology, it can auto-detects your devices and can reach faster charging efficiency, perfectly fit for your iphone, ipad, tablet etc - 【Overload Surge Protection】- The surge protector power strip with overload protection protects your electrical appliances from lighting, surges or spikes. The minimum energy-absorbing capacity of 1080 Joules. Lighted on/off switch with integrated circuit breaker for overload protection of all outlets.(The ""Surge Protected” indicator light on to show your devices are protected) - 【Wall Mountable Extension Cord with Flat Plug】- The low-profile flat plug fits easily in tight spaces; and the right angle flat plug design prevents bottom plug blocking; the 5ft(included the plug) upgraded braided extension cord is very thick and has better current carrying capacity; the two mounting holes on back allows this power strip to be securely installed in various applications - 【Multi Safety Protection】- RoHS, ETL Certificates. It will automatically cut power to protect connected devices when voltage surge is overwhelming. Environmental protection and fire-resistance PC shell with flame retardant at 1382℉ makes it more durable and longer lifetime","Power Strip Surge Protector with USB C A Desktop Charging Station 8 WIDE AC outlets with 2.2 inches space in between and 4 USB high-speed charging ports. Charge and power everything from major appliances to your phone. All-round Safety Protection Overload protection switch, surge protection, thick braided power cable, fire-retardant shell, combine to provide superior safety. Compatibility Apple iPhone / iPad: iPhone X / 8 / 7 / 7 Plus / 6s / 6s Plus / 6 / 5, iPad Pro / Air series / mini series Samsung Galaxy: S9 / S8 / S8 edge / S7 / S6 / S5 / S4, and other USB devices. NOTE： ->The USB charging is NOT Fast Charge QC 3.0, It can meet most USB devices charging needs. ->For your safety, ensure that the current power DO NOT exceed the rated power of 1875W, or it may cause damage to the unit and fire hazards. HANYCONY Surge Protector Power Strip with USB C Want to find a power strip meet your different needs? HANYCONY with 3-side design power strip with 8 widely outlets & 4 smart usb charging ports allows you to make reasonable use of the socket. It makes up little space on your desk or floor, and makes your desktop organized, suitable for home and office. Surge protector can protect your devices from lighting, surges or spikes. Overload protection switch will trip off automatically to protect your devices and your home when power overload. Wall mount design and right angle flat plug with 5ft extension cord can allow you install this power strip on various places, its a great desk or wall usb charging station for phone, tablet, PC, TV and more. Specification Rated Voltage: 110-125 V/ 50/ 60 Hz Rated Current: 15A Maximum Power: 1875W Surge Protector Rating: 1080 joules USB A Rated Current: MAX 5V/2.4A USB C Rated Current: MAX 5V/3 A Length of Cable: 5Ft/1.5m(include plug) Product Size: 4.5*3.75*1.5in 3 Side Outlet Extender 3 Side design 8 widely spaced AC outlets can fit for larger adapters without blocking each other. The compact design saves more space, suitable for the home, office, and college dorm room Fireproof ABS Shell fire-resistance PC shell with flame resistance at 1382℉ makes it more durable and longer lifetime. Upgraded Extension Cord The power cord is very thick and has better current carrying capacity, and the braided extension cord is not easy to deform, durable and more safety than other power cord. Wall Mountable Power Strip Two holes on back allow you install this power strip on different applications. 1. Measure the distance between the 2 keyhole slots with the same direction on the back of the power strip. 2. Punch 2 holes on the baseboard with the distance you just measured and insert two self-tapping screws. 3. Put the power strip into the screws and then pull it down a little bit. Please ensure that the screws slide into the smaller holes. FAQ: 1. What's the size of the product, and how long is the extension cord? A：The product size is：4.5*3.75*1.5in, and the extension cord is 5ft(include plug). 2. Do the USB c ports charge fast?? A：The power strip has 4 USB ports in total, with 2 USB C ports and 2 USB A ports. The USB C ports can charge up to 5V/3A, while the USB A ports can charge up to 5V/2.4A max, but not support quick charge. 3. Which devices are compatible with USB ports? This power strip can meet most USB devices charging needs, such as Apple iPhone / iPad series: iPhone X / 8 / 7 / 7 Plus / 6s / 6s Plus / 6 / 5, iPad Pro / Air series / mini series, Samsung Galaxy: S9 / S8 / S8 edge / S7 / S6 / S5 / S4, and other USB devices.","['https://m.media-amazon.com/images/I/61q9hmplGFL._AC_SL1500_.jpg', 'https://m.media-amazon.com/images/I/61nkWvxSW+L._AC_SL1500_.jpg', 'https://m.media-amazon.com/images/I/714r3QENpoL._AC_SL1500_.jpg', 'https://m.media-amazon.com/images/I/61nsfJRq2BL._AC_SL1500_.jpg', 'https://m.media-amazon.com/images/I/713KywGgVqL._AC_SL1500_.jpg', 'https://m.media-amazon.com/images/I/51O0+0p6tTL._AC_SL1500_.jpg', 'https://m.media-amazon.com/images/I/71xYY01JmuL._AC_SL1500_.jpg']",10,Electronics > Accessories & Supplies > Power Strips & Surge Protectors > Power Strips,https://www.amazon.com/-/dp/B092J8LPWR?_encoding=UTF8&th=1&psc=1&pf_rd_i=desktop&ref_=pd_gw_unk,"size: 5Ft, color: White",5Ft,White,,"{'Item Dimensions L x W': '8.3""W', 'Item Shape': 'Rectangle', 'Color': 'White', 'ASIN': 'B092J8LPWR', 'Brand Name': 'HANYCONY', 'Material': 'Copper', 'Recommended Uses For Product': 'Indoor, Office, College Dorm Room', 'Power Plug': 'Type B - 3 pin (North American)', 'Surge Protection Rating': '1080 Joules', 'Amperage': '3.1 Amps', 'Number of Ports': '12', 'Compatible Devices': 'Projector, Laptop, Printer, DVD Player, Tablet, Camera, Radio, MP3 player, PC, televison, Phone and more', 'Plug Type': 'Type B', 'Special Features': 'Braided Extension Cord, Overload Protection Switch, 2 x USB C Power Strip, 1080 Surge Protection, 2.2in Wide Space;', 'Total Usb Ports': '4', 'Maximum Current': '15 Amps', 'Number of Outlets': '8', 'Voltage': '125 Volts', 'Amazon Best Sellers Rank': '#7 in Electronics , #1 in Power Strips'}",B0D9RWDM2J,"[{'size_name': '25Ft', 'color_name': 'White', 'asin': 'B0D66MLSHT'}, {'size_name': '10Ft', 'color_name': 'White', 'asin': 'B092YTLYC7'}, {'size_name': '6Ft', 'color_name': 'Black', 'asin': 'B0D66CKHGK'}, {'size_name': '6Ft', 'color_name': 'White', 'asin': 'B0BX9BSPDZ'}, {'size_name': '15Ft', 'color_name': 'White', 'asin': 'B0CG91YPKR'}, {'size_name': '5Ft', 'color_name': 'Black', 'asin': 'B0CNPVWGJ1'}, {'size_name': '15Ft', 'color_name': 'Black', 'asin': 'B0D66MK7WQ'}, {'size_name': '5Ft', 'color_name': 'White', 'asin': 'B092J8LPWR'}, {'size_name': '20Ft', 'color_name': 'White', 'asin': 'B0CN2NW76Q'}, {'size_name': '10Ft', 'color_name': 'Black', 'asin': 'B0CPP7ZQV2'}]","{'size_name': ['5Ft', '6Ft', '10Ft', '15Ft', '20Ft', '25Ft'], 'color_name': ['Black', 'White']}",new,"[{'title': 'Wall Charger, Surge Protector, QINLIANF 5 Outlet Extender with 4 USB Charging Ports (4.8A Total) 3-Sided 1680J Power Strip Multi Plug Adapter Spaced for Home Travel Office (3U1C)', 'link': 'https://www.amazon.com/Charger-Protector-QINLIANF-Extender-Charging/dp/B08R6S1M1K/ref=pd_bxgy_d_sccl_1/000-0000000-0000000?pd_rd_w=NRpaP&content-id=amzn1.sym.3858a394-39a9-4946-90e6-86a3153d2546&pf_rd_p=3858a394-39a9-4946-90e6-86a3153d2546&pf_rd_r=P81QE9QMTJ65TFG57FMG&pd_rd_wg=PYyhh&pd_rd_r=b9c1780a-8563-487c-8cb1-72dbd47c2057&pd_rd_i=B08R6S1M1K&psc=1', 'price': '$12.97'}, {'title': 'Surge Protector Outlet Extender - with Rotating Plug, 6 AC Multi Plug Outlet with 3 USB Ports (1 USB C), 1800J Wall Charger, 3-Sided Power Strip with Spaced Outlet Splitter for Home, Office, Travel', 'link': 'https://www.amazon.com/Surge-Protector-Outlet-Extender-Rotating/dp/B0B5X5DQPT/ref=pd_bxgy_d_sccl_2/000-0000000-0000000?pd_rd_w=NRpaP&content-id=amzn1.sym.3858a394-39a9-4946-90e6-86a3153d2546&pf_rd_p=3858a394-39a9-4946-90e6-86a3153d2546&pf_rd_r=P81QE9QMTJ65TFG57FMG&pd_rd_wg=PYyhh&pd_rd_r=b9c1780a-8563-487c-8cb1-72dbd47c2057&pd_rd_i=B0B5X5DQPT&psc=1', 'price': '$9.99'}]","[{'badge': ""Amazon's Choice"", 'badge_text': None}]",84%,11%,2%,1%,1%
B09G9FPHY6,"Apple iPad (9th Generation): with A13 Bionic chip, 10.2-inch Retina Display, 64GB, Wi-Fi, 12MP front/8MP Back Camera, Touch ID, All-Day Battery Life – Space Gray",Apple,$224.00,$329.00,"69,333",4.8,Amazon.com,,In Stock,,,True,,,False,"WHY IPAD — All the essentials in the most affordable iPad, with a beautiful 10.2-inch Retina display, powerful A13 Bionic chip, and an Ultra Wide front camera with Center Stage. Work, play, create, learn, stay connected, and more. - IPADOS + APPS — iPadOS makes iPad more productive, intuitive, and versatile. With iPadOS, run multiple apps at once, use Apple Pencil to write in any text field with Scribble, and edit and share photos. iPad comes with essential apps like Safari, Messages, and Keynote, with over a million more apps available on the App Store. - FAST WI-FI CONNECTIVITY — Fast Wi-Fi keeps you connected at home, work, school, or wherever you go with your iPad. - PERFORMANCE AND STORAGE — The A13 Bionic chip gives you the graphics performance you need. And with all-day battery life, iPad is perfect for playing immersive games and more. Choose from 64GB or 256GB storage options. - APPLE PENCIL AND SMART KEYBOARD — Apple Pencil (1st generation) transforms iPad into an immersive drawing canvas and the world’s best note‑taking device. The Smart Keyboard features a comfortable typing experience and folds into a slim, lightweight cover for protection. Accessories sold separately - 10.2-INCH RETINA DISPLAY — With incredible detail and vivid colors, it’s perfect for watching movies or drawing your next masterpiece. True Tone adjusts the display to the color temperature of the room to make viewing comfortable in any light. - UNLOCK AND PAY WITH TOUCH ID — Touch ID is built in, so you can use your fingerprint to unlock your iPad, sign in to apps, and make payments securely with Apple Pay. - FRONT AND BACK CAMERAS — iPad features a 12MP Ultra Wide front camera that supports Center Stage for videoconferencing and selfies. The 8MP Wide back camera is perfect for capturing photos, 1080p HD video, and scanning documents. - LEGAL DISCLAIMERS — This is a summary of the main product features.",,"['https://m.media-amazon.com/images/I/61NGnpjoRDL._AC_SL1500_.jpg', 'https://m.media-amazon.com/images/I/61JamrBdMSL._AC_SL1500_.jpg', 'https://m.media-amazon.com/images/I/81+h4mcrL0L._AC_SL1500_.jpg', 'https://m.media-amazon.com/images/I/61GjAak00vL._AC_SL1500_.jpg']",0,,https://www.amazon.com/-/dp/B09G9FPHY6?_encoding=UTF8&th=1&psc=1&pf_rd_i=desktop&ref_=pd_gw_unk,"size: 64GB, configuration: Without AppleCare+, color: Space Gray, style: WiFi",64GB,Space Gray,,"{'Brand': 'Apple', 'Model Name': 'iPad', 'Memory Storage Capacity': '64 GB', 'Screen Size': '10.2 Inches', 'Display Resolution Maximum': '2160x1620 Pixels'}",B09G9Z8FWK,"[{'size_name': '64GB', 'configuration': 'With AppleCare+ (2 Years)', 'color_name': 'Space Gray', 'style_name': 'WiFi', 'asin': 'B09QHXJ3YP'}, {'size_name': '64GB', 'configuration': 'With AppleCare+ (2 Years)', 'color_name': 'Silver', 'style_name': 'WiFi', 'asin': 'B09QHYRY98'}, {'size_name': '256GB', 'configuration': 'With AppleCare+ (2 Years)', 'color_name': 'Space Gray', 'style_name': 'WiFi + Cellular', 'asin': 'B0B8FXHND6'}, {'size_name': '256GB', 'configuration': 'Without AppleCare+', 'color_name': 'Silver', 'style_name': 'WiFi', 'asin': 'B09G91TLNJ'}, {'size_name': '64GB', 'configuration': 'Without AppleCare+', 'color_name': 'Space Gray', 'style_name': 'WiFi + Cellular', 'asin': 'B09G9GLLRN'}, {'size_name': '256GB', 'configuration': 'Without AppleCare+', 'color_name': 'Space Gray', 'style_name': 'WiFi', 'asin': 'B09G96TFF7'}, {'size_name': '64GB', 'configuration': 'Without AppleCare+', 'color_name': 'Silver', 'style_name': 'WiFi', 'asin': 'B09G9CJM1Z'}, {'size_name': '64GB', 'configuration': 'Without AppleCare+', 'color_name': 'Space Gray', 'style_name': 'WiFi', 'asin': 'B09G9FPHY6'}, {'size_name': '256GB', 'configuration': 'Without AppleCare+', 'color_name': 'Silver', 'style_name': 'WiFi + Cellular', 'asin': 'B09G97CV82'}, {'size_name': '64GB', 'configuration': 'Without AppleCare+', 'color_name': 'Silver', 'style_name': 'WiFi + Cellular', 'asin': 'B09G9LD3HC'}, {'size_name': '256GB', 'configuration': 'Without AppleCare+', 'color_name': 'Space Gray', 'style_name': 'WiFi + Cellular', 'asin': 'B09G96P9RM'}]","{'size_name': ['64GB', '256GB'], 'configuration': ['With AppleCare+ (2 Years)', 'Without AppleCare+'], 'color_name': ['Silver', 'Space Gray'], 'style_name': ['WiFi', 'WiFi + Cellular']}",new,[],"[{'badge': ""Amazon's Choice"", 'badge_text': None}]",87%,8%,2%,1%,2%
B09BKCDXZC,"Roku Streaming Stick 4K | Portable Roku Streaming Device 4K/HDR/Dolby Vision, Roku Voice Remote, Free & Live TV",Roku,$42.97,$49.99,"82,121",4.7,Amazon.com,,In Stock,,,True,,,True,"Hides behind your TV: The stick design plugs right into your TV with a simple setup - Super-fast startup: Stream your favorite channels like Netflix, Apple TV+, Prime Video, and more in a snap - Long-range Wi-Fi: Enjoy fast, smooth TV streaming in any room with a strong Wi-Fi connection - No more juggling remotes: Power up your TV, adjust the volume, and control your Roku device with one remote - Voice search & control: Quickly search, play entertainment, and control your streaming device with the voice remote - Breathtaking picture: Stream in 4K, Dolby Vision, and HDR10 plus with sharp resolution and vivid color - Watch what you love: Stream a massive selection of free, live, and premium TV including 350+ free live TV channels - Works with popular voice assistants: Enjoy easy voice control with Siri, Alexa, and Hey Google","Roku Streaming Stick 4K is faster and more powerful than ever. The redesigned long-range Wi-Fi receiver is super-charged with up to 2x the speed—exactly what you need for seamless streaming in spectacular 4K, Dolby Vision, and HDR10+ picture. A sleek, compact design hides behind your TV and gives you portability that can’t be beat, making it easier than ever to turn any TV into your favorite streaming TV. Whether you’re setting up a dorm room or traveling for work, all you have to do is plug in and play. And controlling your entertainment? That’s easier than ever too, thanks to the included push-to-talk voice remote—just say what you’re looking for and let the remote do the rest. Upgrade to America’s #1 TV streaming platform* and enjoy a massive selection of free, live, and premium TV. The customizable home screen puts your favorite channels like Netflix, Prime Video, Amazon Freevee, Disney+, HBO Max, Apple TV+, and Hulu front and center. All this in one tiny device? Portable’s never been so powerful. Roku is America’s #1 TV streaming platform based on hours streamed – Hypothesis Group, December 2022","['https://m.media-amazon.com/images/I/71nulLJ9VmL._AC_SL1500_.jpg', 'https://m.media-amazon.com/images/I/71FkIEESffL._AC_SL1500_.jpg', 'https://m.media-amazon.com/images/I/91dtiigYjoL._AC_SL1500_.jpg', 'https://m.media-amazon.com/images/I/716FzkrnRUL._AC_SL1500_.jpg', 'https://m.media-amazon.com/images/I/81tOY7BPuzL._AC_SL1500_.jpg', 'https://m.media-amazon.com/images/I/81LhFwbTeoL._AC_SL1500_.jpg', 'https://m.media-amazon.com/images/I/716uAOEPnrL._AC_SL1500_.jpg', 'https://m.media-amazon.com/images/I/71eYUD68DqL._AC_SL1500_.jpg', 'https://m.media-amazon.com/images/I/71+gF4jz0rL._AC_SL1500_.jpg']",10,Electronics > Television & Video > Streaming Media Players,https://www.amazon.com/-/dp/B09BKCDXZC?_encoding=UTF8&th=1&psc=1&pf_rd_i=desktop&ref_=pd_gw_unk,style: Stick,,,,"{'ASIN': 'B09BKCDXZC', 'Model Name': 'Roku Streaming Stick 4K', 'UPC': '829610004853', 'Brand Name': 'Roku', 'Model Number': 'Roku_Streaming_Stick_4K', 'Color': 'Black', 'Item Dimensions L x W x H': '3.7""L x 0.8""W x 0.45""H', 'Item Weight': '0.9 Ounces', 'Form Factor': 'TV Stick', 'RAM Memory Installed': '1 GB', 'Compatible Devices': 'TV', 'Memory Storage Capacity': '16 GB', 'Video Output Resolution': '4K UHD (up to 2160p at 60fps)', 'Video Codec': 'H.265 (HEVC)', 'Resolution': '4k', 'Internet Applications': 'Netflix, Prime Video, Pandora, Hulu, Vudu', 'Controller Type': 'Remote Control, Voice Control', 'Connectivity Technology': 'Wi-Fi', 'Connector Type': 'HDMI', 'Additional Features': 'Dolby Vision, TV Control', 'Amazon Best Sellers Rank': '#9 in Electronics , #4 in Streaming Media Players'}",B0DFLZZZQD,"[{'style_name': 'Stick', 'asin': 'B09BKCDXZC'}]",{'style_name': ['Stick']},new,"[{'title': 'Roku Express 4K+ | Roku Streaming Device 4K/HDR, Roku Voice Remote, Free & Live TV', 'link': 'https://www.amazon.com/Roku-Express-Streaming-Wireless-Controls/dp/B0916TKFF2/ref=pd_bxgy_d_sccl_1/000-0000000-0000000?pd_rd_w=udnlc&content-id=amzn1.sym.3858a394-39a9-4946-90e6-86a3153d2546&pf_rd_p=3858a394-39a9-4946-90e6-86a3153d2546&pf_rd_r=64VK5GSXFMQDPTVD6BGQ&pd_rd_wg=wXrgL&pd_rd_r=fb0f8fdd-7c30-4514-a90d-3760c45db79c&pd_rd_i=B0916TKFF2&psc=1', 'price': '$37.72'}, {'title': 'Roku Express | HD Roku Streaming Device with Standard Remote (no TV controls), Free & Live TV', 'link': 'https://www.amazon.com/Roku-Express-Streaming-High-Speed-controls/dp/B0BCH5H2R3/ref=pd_bxgy_d_sccl_2/000-0000000-0000000?pd_rd_w=udnlc&content-id=amzn1.sym.3858a394-39a9-4946-90e6-86a3153d2546&pf_rd_p=3858a394-39a9-4946-90e6-86a3153d2546&pf_rd_r=64VK5GSXFMQDPTVD6BGQ&pd_rd_wg=wXrgL&pd_rd_r=fb0f8fdd-7c30-4514-a90d-3760c45db79c&pd_rd_i=B0BCH5H2R3&psc=1', 'price': '$27.36'}]","[{'badge': ""Amazon's Choice"", 'badge_text': None}]",82%,11%,3%,1%,3%
