asin,name,brand,price,regular_price,total_reviews,average_rating,seller,seller_url,availability_status,availability_quantity,shipping_charge,is_prime,author,available_book_formats,is_aplus_page,small_description,full_description,images,video_count,productCategory,url,attributes,size,color,model,product_information,parent_asin,variation_asin,product_variations,product_condition,frequently_bought_together,product_badges,five_star,four_star,three_star,two_star,one_star
B07GL8SLKY,"Arm & Hammer Platinum SLIDE Easy Clean, Clumping Litter, Multi-Cat, 37 Lbs",Arm & Hammer,$29.72,$34.99,"34,173",4.6,Amazon.com,,In Stock,,,True,,,True,"PATENTED EZ CLEAN TECHNOLOGY clumping cat litter slides out of the cat litter box, no scraping, no scrubbing. Revolutionary non-stick Slide Cat Litter clumping takes the dread out of kitty litter box cleanup. Uses easy cat litter Multi-Cat formula. - DESTROYS SEALED-IN ODORS ON CONTACT. Complete odor-sealing clumping cat litter with powerful odor eliminators plus ARM & HAMMER Baking Soda. A breakthrough in cat odor control. The odor control benefits of a cat odor eliminating litter box. - 10% MORE ODOR ELIMINATORS than our Slide Non-Stop Odor Control Cat Litter. Clump & Seal Cat Litter Multi-Cat Slide Cat Litter odor control clumping cat litter with powerful odor eliminators plus Baking Soda. - ROCK HARD CLUMPS FOR EASY SCOOPING with Clump & Seal technology. Slide cat litter’s Moisture-activated micro-granules form a tight odor control seal around waste, plant-derived particles help form rock-hard clumps. Easy-scoop clumping cat litter. - 7-DAY ODOR-FREE HOME, GUARANTEED. Slide cat litter is a complete odor-sealing, odor control cat litter with powerful odor eliminators plus Baking Soda. Guaranteed odor control for 7 days. An odor-free home starts with ARM & HAMMER. - Directions: 1) Start with a clean, empty litter box. 2) Fill with 3-4 inches of ARM & HAMMER SLIDE Litter. 3) Scoop regularly and add litter to maintain 3-4 inch fill. 4) When it's time to change the litter, ARM & HAMMER SLIDE Litter pours right out. 5) You may never have to scrape or scrub again!","ARM & HAMMER SLIDE Platinum Cat Litter is our most advanced litter, with patented EZ Clean technology to give you a non-stick litter. When it comes time to clean the litter box, this litter slides right out of the pan with no scraping or scrubbing necessary. Plus, the Clump & Seal technology forms an odor-containing seal around urine and feces. So, odors are caught and contained before they can leave the litter box. Our Platinum formula has 10% more odor eliminators than our Arm & Hammer SLIDE Non-Stop Odor Control Cat Litter. Those powerful odor eliminators combine with the power of ARM & HAMMER Baking Soda to destroy sealed-in odors on contact. The litter forms rock-hard clumps and slides right out – so cleaning up after your cat (or cats) is no problem! Your home stays odor-free for 7 days, guaranteed. Includes one 37 lbs. box ARM & HAMMER SLIDE Platinum Cat Litter. For generations of families, ARM & HAMMER Baking Soda has been the standard of purity, and a trusted household staple in millions of cabinets and pantries. It's also a natural choice for taking care of every member of your family. Many of our laundry, cat litter, toothpastes and personal care products are made with ARM & HAMMER Baking Soda, delivering the quality you can count on, from the brand you trust.","['https://m.media-amazon.com/images/I/71d4grOMlyL._AC_SL1500_.jpg', 'https://m.media-amazon.com/images/I/81Cv905gMAL._AC_SL1500_.jpg', 'https://m.media-amazon.com/images/I/71Uu8MJZ3dL._AC_SL1500_.jpg', 'https://m.media-amazon.com/images/I/61c+8BKhoeL._AC_SL1500_.jpg', 'https://m.media-amazon.com/images/I/71CylTUzsSL._AC_SL1500_.jpg', 'https://m.media-amazon.com/images/I/61blpE41w6L._AC_SL1500_.jpg', 'https://m.media-amazon.com/images/I/719Sjh7SecL._AC_SL1500_.jpg', 'https://m.media-amazon.com/images/I/71JuOxhx9pL._AC_SL1500_.jpg', 'https://m.media-amazon.com/images/I/71BcNvjSwVL._AC_SL1500_.jpg', 'https://m.media-amazon.com/images/I/7148Hrs+TeL._AC_SL1500_.jpg']",10,Pet Supplies > Cats > Litter & Housebreaking > Litter,https://www.amazon.com/-/dp/B07GL8SLKY?_encoding=UTF8&th=1&psc=1&pf_rd_i=desktop&ref_=pd_gw_unk,size: 37 lb,37 lb,,20505679,"{'Is Discontinued By Manufacturer': 'No', 'Product Dimensions': '7 x 11.75 x 13.69 inches; 37 Pounds', 'Item model number': '20505679', 'Date First Available': 'August 17, 2018', 'Manufacturer': 'Church & Dwight - Pet', 'ASIN': 'B07GL8SLKY', 'Country of Origin': 'USA', 'Amazon Best Sellers Rank': '#11 in Pet Supplies , #3 in Cat Litter'}",B0BKVX5VTQ,"[{'size_name': '18 lb', 'asin': 'B089LLHMQL'}, {'size_name': '27.5 lb', 'asin': 'B09V65VY5J'}, {'size_name': '37 lb', 'asin': 'B07GL8SLKY'}]","{'size_name': ['18 lb', '27.5 lb', '37 lb']}",new,"[{'title': 'Purina Fancy Feast Grilled Wet Cat Food Seafood Collection in Wet Cat Food Variety Pack - (Pack of 24) 3 oz. Cans', 'link': 'https://www.amazon.com/Purina-Fancy-Feast-Grilled-Collection/dp/B001STX13U/ref=pd_bxgy_d_sccl_1/000-0000000-0000000?pd_rd_w=WULyw&content-id=amzn1.sym.3858a394-39a9-4946-90e6-86a3153d2546&pf_rd_p=3858a394-39a9-4946-90e6-86a3153d2546&pf_rd_r=3HT3J6C3QEF50XWX2RYF&pd_rd_wg=9obSb&pd_rd_r=13674a0e-83a4-4489-9ffd-ec74e8d2d0d4&pd_rd_i=B001STX13U&psc=1', 'price': '$17.49'}, {'title': 'Purina Fancy Feast Seafood Classic Pate Collection Grain Free Wet Cat Food Variety Pack - (Pack of 30) 3 oz. Cans', 'link': 'https://www.amazon.com/Fancy-Feast-Sea-Variety-Pack/dp/B00JT3TP1O/ref=pd_bxgy_d_sccl_2/000-0000000-0000000?pd_rd_w=WULyw&content-id=amzn1.sym.3858a394-39a9-4946-90e6-86a3153d2546&pf_rd_p=3858a394-39a9-4946-90e6-86a3153d2546&pf_rd_r=3HT3J6C3QEF50XWX2RYF&pd_rd_wg=9obSb&pd_rd_r=13674a0e-83a4-4489-9ffd-ec74e8d2d0d4&pd_rd_i=B00JT3TP1O&psc=1', 'price': '$23.19'}]",[],78%,11%,5%,2%,4%
B01ALT2IRM,Fancy Feast Poultry and Beef Feast Classic Pate Collection Grain Free Wet Cat Food Variety Pack - (Pack of 30) 3 oz. Cans,Fancy Feast,$21.64,$26.70,"37,624",4.7,Amazon.com,,In Stock,,,True,,,True,"Fancy Feast wet cat food made without artificial colors or preservatives - Crafted with real, high-quality ingredients to deliver a 100 percent complete and balanced canned cat food for adult cats - Fancy Feast pate cat food developed in partnership with our expert nutritionists to create a unique and unforgettable taste experience for your cat - Canned cat food variety pack crafted with real chicken, turkey or beef as the number one ingredient with a smooth cat food wet pate texture - Protein-rich, gourmet soft cat food recipe creates a flavor-filled experience. Savory gravy adds to the delicious taste","Bring home Purina Fancy Feast Classic Poultry and Beef Pate Collection adult wet cat food, and let your cat find her favorite gourmet flavors. This trio of classic flavors gives her the delightful textures and flavors she enjoys while providing the 100 percent complete and balanced nutrition your adult cat needs to help her enjoy a long and happy life. Tender pate tempts her to her dish each day, with its delightful texture and gourmet taste. With essential vitamins and minerals helping to care for her whole-body health, this collection of classic Fancy Feast recipes lets you feel good about indulging your favorite feline with gourmet wet cat food. Each delectable serving contained this Purina Fancy Feast wet cat food variety pack answers her desires with the flavors of poultry and beef in combinations that ensure a clean dish at the end of the day. Let your cat try this Purina Fancy Feast Collection today, and show her how much you care about her happiness.","['https://m.media-amazon.com/images/I/81sGVUT6RSL._AC_SL1500_.jpg', 'https://m.media-amazon.com/images/I/71Vm8HishOL._AC_SL1500_.jpg', 'https://m.media-amazon.com/images/I/81jjVS6pqhL._AC_SL1500_.jpg', 'https://m.media-amazon.com/images/I/81Ndu-8iBAL._AC_SL1500_.jpg', 'https://m.media-amazon.com/images/I/81WJEi6W5FL._AC_SL1500_.jpg', 'https://m.media-amazon.com/images/I/81mvt9CaauL._AC_SL1500_.jpg', 'https://m.media-amazon.com/images/I/812-YLcYl8L._AC_SL1500_.jpg', 'https://m.media-amazon.com/images/I/716f7HNAXCL._AC_SL1500_.jpg', 'https://m.media-amazon.com/images/I/812-YLcYl8L._AC_SL1500_.jpg', 'https://m.media-amazon.com/images/I/81ITZltJP1L._AC_SL1500_.jpg', 'https://m.media-amazon.com/images/I/71OvCl6a4AL._AC_SL1500_.jpg', 'https://m.media-amazon.com/images/I/81ITZltJP1L._AC_SL1500_.jpg', 'https://m.media-amazon.com/images/I/71JgrvmJwaL._AC_SL1500_.jpg']",10,Pet Supplies > Cats > Food > Wet > Canned,https://www.amazon.com/-/dp/B01ALT2IRM?_encoding=UTF8&th=1&psc=1&pf_rd_i=desktop&ref_=pd_gw_unk,"size: 3 Ounce (Pack of 30), flavor: Poultry & Beef",3 Ounce (Pack of 30),,29222,"{'Is Discontinued By Manufacturer': 'No', 'Product Dimensions': '5.2 x 7.85 x 6.15 inches; 5.63 Pounds', 'Item model number': '29222', 'Date First Available': 'October 7, 2015', 'Manufacturer': 'Nestle Purina Pet', 'ASIN': 'B01ALT2IRM', 'Country of Origin': 'USA', 'Amazon Best Sellers Rank': '#11 in Pet Supplies , #1 in Canned Cat Food'}",B0CX95HFK4,"[{'size_name': '3 Ounce (Pack of 24)', 'flavor_name': 'Seafood', 'asin': 'B0012KB4BG'}, {'size_name': '3 Fl Oz (Pack of 1)', 'flavor_name': 'Chicken', 'asin': 'B00H3R387K'}, {'size_name': '3 Ounce (Pack of 24)', 'flavor_name': 'Chicken & Beef', 'asin': 'B07JHQGCZ8'}, {'size_name': '3 Ounce (Pack of 30)', 'flavor_name': 'Poultry & Beef', 'asin': 'B01ALT2IRM'}, {'size_name': '3 Ounce (Pack of 24)', 'flavor_name': 'Chicken', 'asin': 'B0012KH08M'}, {'size_name': '3 Ounce (Pack of 24)', 'flavor_name': 'Beef', 'asin': 'B0012KGZYM'}, {'size_name': '4.5 Pound (Pack of 1)', 'flavor_name': 'Marinated Morsels', 'asin': 'B001VJ58XI'}, {'size_name': '3 Ounce (Pack of 1)', 'flavor_name': 'Chicken', 'asin': 'B0010B3A6E'}, {'size_name': '3 Ounce (Pack of 24)', 'flavor_name': 'Ocean Whitefish & Tuna', 'asin': 'B0012KIBD0'}, {'size_name': '4.5 Pound (Pack of 1)', 'flavor_name': 'Tuna', 'asin': 'B00H3R38OS'}, {'size_name': '3 Ounce (Pack of 12)', 'flavor_name': 'Chicken', 'asin': 'B0B3HMNYCQ'}, {'size_name': '3 Ounce (Pack of 24)', 'flavor_name': 'Beef & Liver', 'asin': 'B0012KIB9O'}, {'size_name': '3 Ounce (Pack of 24)', 'flavor_name': 'Salmon & Shrimp', 'asin': 'B0012KB3ZI'}, {'size_name': '3 Ounce (Pack of 1)', 'flavor_name': 'beef;liver', 'asin': 'B0014CZ4DG'}, {'size_name': '3 Ounce (Pack of 24)', 'flavor_name': 'Poultry & Beef', 'asin': 'B001STPJJO'}, {'size_name': '3 Ounce (Pack of 24)', 'flavor_name': 'Turkey & Giblets', 'asin': 'B006P03AOC'}, {'size_name': '3 Ounce (Pack of 1)', 'flavor_name': 'Tuna', 'asin': 'B000RYDOQ6'}, {'size_name': '3 Ounce (Pack of 1)', 'flavor_name': 'Seafood', 'asin': 'B000VDT7DW'}]","{'size_name': ['3 Ounce (Pack of 1)', '3 Ounce (Pack of 12)', '3 Ounce (Pack of 24)', '3 Ounce (Pack of 30)', '3 Fl Oz (Pack of 1)', '4.5 Pound (Pack of 1)'], 'flavor_name': ['Beef', 'Beef & Liver', 'Chicken', 'Chicken & Beef', 'Marinated Morsels', 'Ocean Whitefish & Tuna', 'Poultry & Beef', 'Salmon & Shrimp', 'Seafood', 'Tuna', 'Turkey & Giblets', 'beef;liver']}",new,"[{'title': 'Purina Fancy Feast Seafood Classic Pate Collection Grain Free Wet Cat Food Variety Pack - (Pack of 30) 3 oz. Cans', 'link': 'https://www.amazon.com/Fancy-Feast-Sea-Variety-Pack/dp/B00JT3TP1O/ref=pd_bxgy_d_sccl_1/000-0000000-0000000?pd_rd_w=BY9Qe&content-id=amzn1.sym.3858a394-39a9-4946-90e6-86a3153d2546&pf_rd_p=3858a394-39a9-4946-90e6-86a3153d2546&pf_rd_r=FANEDTCC4AX5TEFWE0X4&pd_rd_wg=uA018&pd_rd_r=bdbd2357-66af-4f27-a7b4-e35993dae77e&pd_rd_i=B00JT3TP1O&psc=1', 'price': '$23.19'}, {'title': 'Fancy Feast Poultry and Beef Feast Classic Pate Collection Grain Free Wet Cat Food Variety Pack - (Pack of 30) 3 oz. Cans', 'link': 'https://www.amazon.com/Purina-Fancy-Feast-Classic-Collection/dp/B07CTBXRXD/ref=pd_bxgy_d_sccl_2/000-0000000-0000000?pd_rd_w=BY9Qe&content-id=amzn1.sym.3858a394-39a9-4946-90e6-86a3153d2546&pf_rd_p=3858a394-39a9-4946-90e6-86a3153d2546&pf_rd_r=FANEDTCC4AX5TEFWE0X4&pd_rd_wg=uA018&pd_rd_r=bdbd2357-66af-4f27-a7b4-e35993dae77e&pd_rd_i=B07CTBXRXD&psc=1', 'price': '$25.99'}]",[],80%,12%,4%,1%,2%
B00BAGTNAQ,"Chom Chom Roller Pet Hair Remover and Reusable Lint Roller - ChomChom Cat and Dog Hair Remover for Furniture, Couch, Carpet, Clothing and Bedding - Portable, Multi-Surface Fur Removal Tool",ChomChom Roller,$24.99,$27.99,"187,196",4.5,ChomChomRoller,https://www.amazon.com/gp/help/seller/at-a-glance.html/ref=dp_merchant_link?ie=UTF8&seller=A3VV0QMOMH4I0D&asin=B00BAGTNAQ&ref_=dp_merchant_link&isAmazonFulfilled=1,In Stock,,,True,,,True,"Nylon - Imported - NO MORE HAIR EVERYWHERE: The ultimate pet hair roller for effective dog and cat hair removal. Far superior to traditional lint rollers for pet hair or sticky rollers, the ChomChom ensures deep cleaning. - CONVENIENT: Take the ‘fur’ out of ‘furniture’ once and for all! Ideal for cleaning couches, pillows, rugs, and more. Whether it's furniture, your car, or a carpet, this pet lint roller is an essential tool for all pet owners. - VERSATILE: Not just a dog lint roller, it's adept at cat hair removal too. The lint roller for pet hair extra sticky capability ensures every strand is picked up, leaving your spaces hair-free. - EASY TO USE: Just roll back and forth along any surface to trap fur and lint into the built-in receptacle. When you’re all done, just press down on the release button to open the pet fur remover and empty it out completely. Purr-fectly simple! - SUSTAINABLE - This reusable lint roller requires no adhesives or sticky tape, and can be used again and again.","EASY & EFFECTIVE This paw-some lint roller creates a hair-grabbing electrostatic charge, tackling thick hair, fine furballs, and everything in between. Just roll it back and forth and you’re ready to go! NO ADHESIVE OR STICKY TAPE Say goodbye to single-use sticky tape lint rollers, and give our reusable pet hair remover a go. It works without the need of batteries or other power sources, so you can use it again and again without waste. NO MORE FURRY CAR SEATS Take your fur-busting ChomChom pet hair roller on the go! Toss one in your car and wave farewell to pesky pet hair all over your car seats and outfits. Original Pet Hair Roller Black Pet Hair Roller Mini Pet Hair & Lint Roller Limited Cat Edition Pet Hair Roller Limited Dog Edition Pet Hair Roller Add to Cart See Details Customer Reviews 4.5 out of 5 stars 187,196 4.3 out of 5 stars 245 Price $24.99 $ 24 . 99 — $23.99 23 Removes all types of pet hair ✓ Color White Black Orange Brown Size 7.5 in x 7.5 in (19 cm x 19 cm) 2.75 in x 9 in (7 cm x 23 cm)","['https://m.media-amazon.com/images/I/71YFOZ2k0XL._AC_SL1500_.jpg', 'https://m.media-amazon.com/images/I/91AngPLToTL._AC_SL1500_.jpg', 'https://m.media-amazon.com/images/I/81k0mn2Gx0L._AC_SL1500_.jpg', 'https://m.media-amazon.com/images/I/91-6CxM-1tL._AC_SL1500_.jpg', 'https://m.media-amazon.com/images/I/91gEqe-eBmL._AC_SL1500_.jpg', 'https://m.media-amazon.com/images/I/91BULCLTS2L._AC_SL1500_.jpg', 'https://m.media-amazon.com/images/I/81vaUKO++tL._AC_SL1500_.jpg', 'https://m.media-amazon.com/images/I/81dScmFYoCL._AC_SL1500_.jpg', 'https://m.media-amazon.com/images/I/91V9-M9+3JL._AC_SL1500_.jpg']",10,Pet Supplies > Cats > Grooming > Hair Removal Mitts & Rollers,https://www.amazon.com/-/dp/B00BAGTNAQ?_encoding=UTF8&th=1&psc=1&pf_rd_i=desktop&ref_=pd_gw_unk,color: White,,White,,"{'Global Trade Identification Number': '00856957004000', 'ASIN': 'B00BAGTNAQ', 'UPC': '641517551915 856957004000 641517551892 641517551908 641517551922', 'Brand Name': 'ChomChom Roller', 'Manufacturer': 'ChomChom Roller', 'Operation Mode': 'Manual', 'Item Dimensions D x W x H': '2.5""D x 7.5""W x 7.5""H', 'Color': 'White', 'Amazon Best Sellers Rank': '#43 in Pet Supplies , #1 in Cat Hair Removal Products , #1 in Dog Hair Removal Products'}",B0BNVLH8BF,"[{'color_name': 'White', 'asin': 'B00BAGTNAQ'}, {'color_name': 'Dog', 'asin': 'B07F17DZM9'}, {'color_name': 'Black', 'asin': 'B0C2FMZMHP'}]","{'color_name': ['Black', 'Dog', 'White']}",new,"[{'title': 'Allerpet Aloe Vera Free Cat Dander Remover - Pet Dander Allergy Relief, Natural & Safe Allergy Relief for Cats and Humans, Soothing Chamomile & Rosemary, Made in USA (12 oz)', 'link': 'https://www.amazon.com/Allerpet-Cat-Pet-Dander-Remover/dp/B07GL335GN/ref=pd_bxgy_d_sccl_1/000-0000000-0000000?pd_rd_w=bpUVq&content-id=amzn1.sym.3858a394-39a9-4946-90e6-86a3153d2546&pf_rd_p=3858a394-39a9-4946-90e6-86a3153d2546&pf_rd_r=HXB8W4GZ0C4S7NTD6XMJ&pd_rd_wg=QV1G1&pd_rd_r=a98d802f-7406-4dcb-9469-24766e32a7ae&pd_rd_i=B07GL335GN&psc=1', 'price': '$26.99'}, {'title': 'aumuca Cat Brush with Release Button, Cat Brushes for Indoor Cats Shedding, Cat Brush for Long or Short Haired Cats, Cat Grooming Brush Cat Comb for Kitten Rabbit Massage Removes Loose Fur, White', 'link': 'https://www.amazon.com/Aumuca-Shedding-Grooming-Cleaning-Undercoat/dp/B098P6164W/ref=pd_bxgy_d_sccl_2/000-0000000-0000000?pd_rd_w=bpUVq&content-id=amzn1.sym.3858a394-39a9-4946-90e6-86a3153d2546&pf_rd_p=3858a394-39a9-4946-90e6-86a3153d2546&pf_rd_r=HXB8W4GZ0C4S7NTD6XMJ&pd_rd_wg=QV1G1&pd_rd_r=a98d802f-7406-4dcb-9469-24766e32a7ae&pd_rd_i=B098P6164W&psc=1', 'price': '$15.99'}]",[],73%,14%,7%,3%,3%
B09PF4KVHJ,"Pooph Pet Odor Eliminator, 32oz Spray - Dismantles Odors on a Molecular Basis, Dogs, Cats, Freshener, Urine, Poop, Pee, Deodorizer, Natures, Puppy, Fresh, Clean, Furniture, Potty, Safe",POOPH,$23.97,$29.99,"50,839",4.1,POOPH,https://www.amazon.com/gp/help/seller/at-a-glance.html/ref=dp_merchant_link?ie=UTF8&seller=A33ZBJU6YIWEHG&asin=B09PF4KVHJ&ref_=dp_merchant_link&isAmazonFulfilled=1,In Stock,,,True,,,True,"It’s Not Water: Pooph is totally fragrance free because it eliminates odor instead of covering it up! Pooph contains no harsh chemicals—it’s a proprietary mineral-based formula so clean and pure you could actually mistake it for pure natural spring water until you actually use it and see for yourself how miraculously it works! - Risk-Free Guarantee: Try POOPH for 30 days and if you aren’t happy, simply return it for a 100% no-hassle refund. Just send us a message via your Amazon order page and we’ll take care of the rest! - Instant & Safe: Instantly and safely freshens and dismantles puppy, dog, cat, pet, and litter urine and feces odors on a molecular basis – so they never return! Safe for people, pets, plants, and the planet! - Eliminates: Safely eliminates (doesn’t just cover up) urine, feces, vomit, and other pet odors that may invite your pets to defecate in the same spot over and over - SIMPLICITY OF USE: Embrace the ease of a dog odor eliminator that requires no complex instructions. A few sprays of POOPH make any space a puppy must-haves zone with guaranteed freshness. How it works, find the source of the stink, get in contact with the source of the odor. Rub it in and let pooph work its magic. Pooph is safe to use on your pet if the odor persists! The moment of truth: Smell it.","POOPH Pet Odor Eliminator - Dismantles Odors on a Molecular Level Pooph takes “stink” out of the equation – completely and permanently dismantling odors on a molecular level Pooph works instantly (molecularly not enzymatically) to eliminate odors at the source – so there is, quite literally, no stink OR fragrance left ... when you use Pooph, it's as if the odor was never there! And as amazingly powerful as it is, Pooph is safe for people and pets Pooph instantly dismantles odors on a molecular basis – so they never return! Odorless/Colorless Pooph is completely colorless, odorless, and non-staining Won't hurt people or pets Pooph is 100% safe but will get rid of any stink Safe & Natural Pooph is a proprietary blend of minerals all of which each can be found in your average daily multivitamin It Works Pooph works on any organic odor, so it works on much more than pet odors 1:1 As long as Pooph can reach the source of the odor and there’s as much Pooph as there is stink, Pooph will get it and dismantle the odor Longevity Pooph’s exact formula has been used for over 10 years getting rid of odors in North America’s top municipal waste management facilities Works Everywhere Pooph can be used on any type of surface How To Use Find the source of the stink, get in contact with the source of the odor. Rub it in and let Pooph work its magic. Pooph is safe to use on your pet if the odor persists! The moment of truth: Smell it. Used by the 5 largest Waste Treatment companies in the country to eliminate odor and improve the quality of life in the surrounding communities!","['https://m.media-amazon.com/images/I/61UfWwUq+vL._AC_SL1500_.jpg', 'https://m.media-amazon.com/images/I/81KprVXNvJL._AC_SL1500_.jpg', 'https://m.media-amazon.com/images/I/81uJip+kAWL._AC_SL1500_.jpg', 'https://m.media-amazon.com/images/I/81cNaNty4JL._AC_SL1500_.jpg', 'https://m.media-amazon.com/images/I/81qWEfzYegL._AC_SL1500_.jpg', 'https://m.media-amazon.com/images/I/916j8Bk02hL._AC_SL1500_.jpg', 'https://m.media-amazon.com/images/I/81TCGB+Yq-L._AC_SL1500_.jpg', 'https://m.media-amazon.com/images/I/81wPVRs70PL._AC_SL1500_.jpg', 'https://m.media-amazon.com/images/I/916yzzIVDpL._AC_SL1500_.jpg']",10,Pet Supplies > Dogs > Grooming > Deodorizers,https://www.amazon.com/-/dp/B09PF4KVHJ?_encoding=UTF8&th=1&psc=1&pf_rd_i=desktop&ref_=pd_gw_unk,style: Pet Odor Eliminator - 32 oz Spray,,,Spray-32-N,"{'Product Dimensions': '11 x 4 x 4 inches; 2.25 Pounds', 'Item model number': 'Spray-32-N', 'Date First Available': 'December 28, 2021', 'Manufacturer': 'Pooph', 'ASIN': 'B09PF4KVHJ', 'Country of Origin': 'USA', 'Amazon Best Sellers Rank': '#22 in Pet Supplies , #1 in Dog Deodorizers'}",B0C42P2365,"[{'style_name': 'Pet Odor Eliminator - 32 oz Spray (3-Pack)', 'asin': 'B09V57VLX3'}, {'style_name': 'Skunk Odor Eliminator - 32 oz Spray', 'asin': 'B0BZQRRFSJ'}, {'style_name': 'Pet Odor Eliminator & Kitty Litter Box Deodorizer - 32 oz Bottles', 'asin': 'B0C42M839N'}, {'style_name': 'Pet Odor Eliminator - 32 oz Spray', 'asin': 'B09PF4KVHJ'}, {'style_name': 'Pet Odor Eliminator & Laundry Additive - 32 oz Bottles', 'asin': 'B0C42GHVRN'}, {'style_name': 'Pet Odor Eliminator - 20 oz Spray', 'asin': 'B0D258GTYY'}, {'style_name': 'Pet Odor Eliminator - 32 oz Spray (2-Pack)', 'asin': 'B09V57YWN2'}]","{'style_name': ['Pet Odor Eliminator - 20 oz Spray', 'Pet Odor Eliminator & Kitty Litter Box Deodorizer - 32 oz Bottles', 'Pet Odor Eliminator & Laundry Additive - 32 oz Bottles', 'Pet Odor Eliminator - 32 oz Spray', 'Skunk Odor Eliminator - 32 oz Spray', 'Pet Odor Eliminator - 32 oz Spray (2-Pack)', 'Pet Odor Eliminator - 32 oz Spray (3-Pack)']}",new,"[{'title': 'POOPH Litterizer - Litter Box Civilizer, 16oz - Dismantles Odors on a Molecular Basis, Freshener, Eliminator, Urine, Pee, Deodorizer, Fresh, Clean, Potty, Safe', 'link': 'https://www.amazon.com/Pooph-Litterizer-Deodorizer-Eco-Friendly-Fragrance-Free/dp/B0BZT3M3L1/ref=pd_bxgy_d_sccl_1/000-0000000-0000000?pd_rd_w=pPM16&content-id=amzn1.sym.3858a394-39a9-4946-90e6-86a3153d2546&pf_rd_p=3858a394-39a9-4946-90e6-86a3153d2546&pf_rd_r=6D6PNWYJ7CJ4GA3JVHSJ&pd_rd_wg=1Z0iw&pd_rd_r=fd79551b-97f3-43f3-8e38-cbeebb54ff05&pd_rd_i=B0BZT3M3L1&psc=1', 'price': '$24.95'}, {'title': 'Pooph Laundry Additive, 32oz Bottle (16 Loads) - Dismantles Odors on a Molecular Basis, Dogs, Cats, Freshener, Eliminator, Urine, Poop, Pee, Deodorizer, Natures, Puppy, Fresh, Clean, Furniture, Potty', 'link': 'https://www.amazon.com/Pooph-Laundry-Additive-Bottle-Loads/dp/B0B145TPWV/ref=pd_bxgy_d_sccl_2/000-0000000-0000000?pd_rd_w=pPM16&content-id=amzn1.sym.3858a394-39a9-4946-90e6-86a3153d2546&pf_rd_p=3858a394-39a9-4946-90e6-86a3153d2546&pf_rd_r=6D6PNWYJ7CJ4GA3JVHSJ&pd_rd_wg=1Z0iw&pd_rd_r=fd79551b-97f3-43f3-8e38-cbeebb54ff05&pd_rd_i=B0B145TPWV&psc=1', 'price': '$23.97'}]",[],62%,14%,10%,5%,10%
