asin,name,brand,price,regular_price,total_reviews,average_rating,seller,seller_url,availability_status,availability_quantity,shipping_charge,is_prime,author,available_book_formats,is_aplus_page,small_description,full_description,images,video_count,productCategory,url,attributes,size,color,model,product_information,parent_asin,variation_asin,product_variations,product_condition,frequently_bought_together,product_badges,five_star,four_star,three_star,two_star,one_star
B08QR8X2N5,"Huggies Size 5 Diapers, Little Movers Baby Diapers, Size 5 (27+ lbs), 120 Count (2 Packs of 60)",HUGGIES,$52.98,$52.98,"36,739",4.8,Amazon.com,,In Stock,,,True,,,True,"Huggies Size 5 Diapers: 120 Little Movers Baby Diapers (2 packs of 60), size 5 (27+ lbs); packaging may vary - Up to Zero Leaks, Even from Blowouts: Our toddler diapers have a curved and stretchy fit and are designed to help eliminate gaps at the legs and waist - Our Perfect Fitting Diaper: Huggies Little Movers disposable diapers are designed for worry-free running, jumping, and playing - The Only Leading Brand Entirely Fragrance Free**: All Huggies sensitive diapers are free of fragrance and elemental chlorine and made without parabens or natural rubber latex (**among leading national diaper brands, across all offered variants) - Unique Waistband: Huggies Little Movers toddler diapers come with a waistband that is designed to prevent leaks and help keep your baby comfortable while on the move - For Babies on the Move: Double Grip Strips help provide a secure, flexible fit that moves with your baby - Fast-Absorbing Dry Touch Liner helps the disposable diaper lock away 99% of wetness to help keep skin dry - The only brand with a blowout blocker across all our offerings** (**among branded open diapers. Excludes preemie size.) - Little Movers baby diapers packaging may vary","Huggies Little Movers Baby Diapers are designed to stay in place through active play! These disposable baby diapers are designed for worry-free running, jumping and playing without any leaks or disruptions. Each Little Movers diaper is up to 100% leak-free (even for blowouts!) and offers up to 12 hours of comfortable protection to keep your baby active and clean. Our diapers feature a curved and stretchy fit and a flexible, yet secure waistband designed to prevent leaks and help keep your baby comfortable while on the move. Double Grip Strips provide a secure, flexible fit and the diaper is designed to help eliminate gaps at the legs and waist to protect against leaks and irritation. These Huggies diapers are extra soft and contoured around the legs to help provide red-mark free, gentle protection. Little Movers are made with a fast-absorbing DryTouch Liner and our baby diaper locks away 99% of wetness to help keep skin dry. Plus, a wetness indicator easily lets you know when your baby is ready for a diaper change. Little Movers Diapers are available in size 3 (16-28 lbs), size 4 (22-37 lbs), size 5 (27+ lbs), size 6 (35+ lbs) and size 7 (41+ lbs).","['https://m.media-amazon.com/images/I/81Ma5ScoS3L._AC_SL1500_.jpg', 'https://m.media-amazon.com/images/I/81qtnOh06vL._AC_SL1500_.jpg', 'https://m.media-amazon.com/images/I/71j9N7RK29L._AC_SL1500_.jpg', 'https://m.media-amazon.com/images/I/71j+X4z+DZL._AC_SL1500_.jpg', 'https://m.media-amazon.com/images/I/81axWcgQ5TL._AC_SL1500_.jpg', 'https://m.media-amazon.com/images/I/71Yhx8i-LgL._AC_SL1500_.jpg', 'https://m.media-amazon.com/images/I/718z5GlBesL._AC_SL1500_.jpg', 'https://m.media-amazon.com/images/I/71A4bg3LHVL._AC_SL1500_.jpg', 'https://m.media-amazon.com/images/I/81xgcNlNjbL._AC_SL1500_.jpg', 'https://m.media-amazon.com/images/I/71c8+aGaH2L._AC_SL1500_.jpg', 'https://m.media-amazon.com/images/I/81QGe3pFhWL._AC_SL1500_.jpg', 'https://m.media-amazon.com/images/I/81wTepJhdKL._AC_SL1500_.jpg', 'https://m.media-amazon.com/images/I/81X2qp9yNNL._AC_SL1500_.jpg', 'https://m.media-amazon.com/images/I/71TmIirJPuL._AC_SL1500_.jpg']",10,Baby Products > Diapering > Disposable Diapers,https://www.amazon.com/-/dp/B08QR8X2N5?_encoding=UTF8&th=1&psc=1&pf_rd_i=desktop&ref_=pd_gw_unk,"size: Size 5, unit_count: 120",Size 5,,00036000534993,"{'Product Dimensions': '9 x 18.5 x 13.13 inches; 10.6 Pounds', 'Item model number': '00036000534993', 'Department': 'Unisex Baby', 'Date First Available': 'December 16, 2020', 'Manufacturer': 'Kimberly-Clark Corp.', 'ASIN': 'B08QR8X2N5', 'Country of Origin': 'USA', 'Amazon Best Sellers Rank': '#10 in Baby , #3 in Disposable Diapers'}",B0CWRXS9NX,"[{'size_name': 'Size 7', 'unit_count': '68', 'asin': 'B08VC54G15'}, {'size_name': 'Size 4', 'unit_count': '140', 'asin': 'B08QRGJ2SC'}, {'size_name': 'Size 3', 'unit_count': '136', 'asin': 'B08VBH6QFB'}, {'size_name': 'Size 7', 'unit_count': '36', 'asin': 'B09NS4QZZD'}, {'size_name': 'Size 5', 'unit_count': '120', 'asin': 'B08QR8X2N5'}, {'size_name': 'Size 7', 'unit_count': '14', 'asin': 'B0BC2FZXV7'}, {'size_name': 'Size 3', 'unit_count': '68', 'asin': 'B09NS4PHQ2'}, {'size_name': 'Size 6', 'unit_count': '16', 'asin': 'B07MDRNHY4'}, {'size_name': 'Size 4', 'unit_count': '58', 'asin': 'B08BJC5NWQ'}, {'size_name': 'Size 5', 'unit_count': '104', 'asin': 'B07W1J2FLC'}, {'size_name': 'Size 8', 'unit_count': '72', 'asin': 'B0CP2YSYRG'}, {'size_name': 'Size 4', 'unit_count': '22', 'asin': 'B07M6FL9V2'}, {'size_name': 'Size 5', 'unit_count': '19', 'asin': 'B07M9Q9829'}, {'size_name': 'Size 6', 'unit_count': '44', 'asin': 'B09NS4XN5J'}, {'size_name': 'Size 6', 'unit_count': '96', 'asin': 'B08QRR73ZJ'}, {'size_name': 'Size 3', 'unit_count': '25', 'asin': 'B07L9FQTLR'}, {'size_name': 'Size 8', 'unit_count': '34', 'asin': 'B0CP2YN6J9'}, {'size_name': 'Size 3', 'unit_count': '156', 'asin': 'B08QRYHC38'}, {'size_name': 'Size 6', 'unit_count': '84', 'asin': 'B08VCK1M1X'}, {'size_name': 'Size 4', 'unit_count': '120', 'asin': 'B08VC33TDN'}, {'size_name': 'Size 5', 'unit_count': '50', 'asin': 'B09NS42GRV'}, {'size_name': 'Size 7', 'unit_count': '80', 'asin': 'B08SJ4KSWJ'}, {'size_name': 'Size 8', 'unit_count': '62', 'asin': 'B0CP2Z4F3Y'}]","{'size_name': ['Size 3', 'Size 4', 'Size 5', 'Size 6', 'Size 7', 'Size 8'], 'unit_count': ['14', '16', '19', '22', '25', '34', '36', '44', '50', '58', '62', '68', '72', '80', '84', '96', '104', '120', '136', '140', '156']}",new,"[{'title': 'Huggies Size 5 Overnites Baby Diapers: Overnight Diapers, Size 5 (27+ lbs), 100 Ct (2 Packs of 50)', 'link': 'https://www.amazon.com/Overnight-Diapers-Huggies-Overnites-Nighttime/dp/B09X222JQC/ref=pd_bxgy_d_sccl_1/000-0000000-0000000?pd_rd_w=cdGQ8&content-id=amzn1.sym.3858a394-39a9-4946-90e6-86a3153d2546&pf_rd_p=3858a394-39a9-4946-90e6-86a3153d2546&pf_rd_r=6B0XMN40X1DQPYN3X534&pd_rd_wg=aEpF9&pd_rd_r=7db5e091-81e4-4552-b9a5-5765985af030&pd_rd_i=B09X222JQC&psc=1', 'price': '$52.99'}, {'title': 'Huggies Natural Care Sensitive Baby Wipes, Unscented, Hypoallergenic, 99% Purified Water, 15 Flip-Top Packs (960 Wipes Total)', 'link': 'https://www.amazon.com/Sensitive-Unscented-Hypoallergenic-Purified-Flip-Top/dp/B0BL8RWHV2/ref=pd_bxgy_d_sccl_2/000-0000000-0000000?pd_rd_w=cdGQ8&content-id=amzn1.sym.3858a394-39a9-4946-90e6-86a3153d2546&pf_rd_p=3858a394-39a9-4946-90e6-86a3153d2546&pf_rd_r=6B0XMN40X1DQPYN3X534&pd_rd_wg=aEpF9&pd_rd_r=7db5e091-81e4-4552-b9a5-5765985af030&pd_rd_i=B0BL8RWHV2&psc=1', 'price': '$24.79'}]","[{'badge': ""Amazon's Choice"", 'badge_text': None}]",89%,7%,2%,1%,2%
B015XBYDLM,"Dr. Brown’s Natural Flow Level 2 Narrow Baby Bottle Silicone Nipple, Medium Flow, 3m+, 100% Silicone Bottle Nipple, 6 Count",Dr. Brown's,$10.98,$11.99,"86,599",4.8,Amazon.com,,In Stock,,,True,,,True,"NIPPLE FOR GROWING BABY. Dr. Brown’s Medium Flow Nipple is the next step for growing babies. - ANTI-COLIC BABY BOTTLE WITH NIPPLE. Level 2 Nipple, with Anti-Colic internal vent system, is clinically proven to reduce colic. Decreases spit-up, burping and gas and provides a more comfortable feeding experience for baby. - CONSISTENT FLOW RATE. Vacuum-free feeding is closest to breastfeeding and Dr. Brown’s Medium Flow Nipples provide a consistent flow so babies can feed at their own pace. - DEPENDABLE NIPPLE FLOW. Each nipple level provides clinical consistency within the flow rate, so baby’s feeding experience is constant and comfortable. - BREASTFEEDING SILICONE NIPPLE. The breast-like nipple shape encourages a proper latch for a more natural bottle feeding experience and eases the transition from breast to bottle and back again. - PRESERVES NUTRIENTS. The Level 2 Nipple and Anti-Colic vent system is proven to help preserve bottle milk nutrients and aid in digestion for a better night’s sleep. - SOFT 100% SILICONE. Silicone nipple fits all Dr. Brown’s narrow bottles. - DISHWASHER SAFE. Safe for use in dishwasher (top rack only), electric and microwave sterilizers or boiling water. BPA Free.","Dr. Brown’s Natural Flow® Level 2 Nipple is the next step for babies 3 months+. Dr. Brown’s® Level 2 Nipple, together with the Anti-Colic internal vent system, is clinically proven to reduce colic. Dr. Brown’s® bottle and nipple provide a more comfortable feeding experience for baby by decreasing spit-up, burping and gas. This vacuum-free feeding is closest to breastfeeding and Dr. Brown’s® Medium Flow Nipples provide a consistent flow so baby can feed at their own pace. The breast-like nipple shape encourages a proper latch for a more natural bottle feeding experience and eases the transition from breast to bottle and back again. The Level 2 Nipple and Anti-Colic vent system is proven to help preserve bottle milk nutrients and aid in digestion for a better night’s sleep. Made of super-soft, 100% silicone, the Level 2 Nipple fits all Dr. Brown’s® narrow bottles. The suggested age range for the Level 2 Nipple is 3 months+, but baby’s preferred flow rate may vary. Safe for use in dishwasher (top rack only), electric and microwave sterilizers or boiling water. BPA free.","['https://m.media-amazon.com/images/I/81HSlA5aTuL._SL1500_.jpg', 'https://m.media-amazon.com/images/I/71iOalFq9KL._SL1500_.jpg', 'https://m.media-amazon.com/images/I/81OQcfwNMXL._SL1500_.jpg', 'https://m.media-amazon.com/images/I/71Tkj3Q2L+L._SL1500_.jpg', 'https://m.media-amazon.com/images/I/81a5rdK-EJL._SL1500_.jpg', 'https://m.media-amazon.com/images/I/81tbabm-1HL._SL1500_.jpg', 'https://m.media-amazon.com/images/I/81-fkTOSc2L._SL1500_.jpg', 'https://m.media-amazon.com/images/I/81uvR3+ZAAL._SL1500_.jpg', 'https://m.media-amazon.com/images/I/71fUn7PgkgL._SL1500_.jpg']",10,Baby Products > Feeding > Bottle-Feeding > Nipples,https://www.amazon.com/-/dp/B015XBYDLM?_encoding=UTF8&th=1&psc=1&pf_rd_i=desktop&ref_=pd_gw_unk,"color: Level 2, Medium Flow, 3m+",,"Level 2, Medium Flow, 3m+",,"{'ASIN': 'B015XBYDLM', 'Manufacturer': ""Dr. Brown's"", 'UPC': '072239305775', 'Brand Name': ""Dr. Brown's"", 'Age Range Description': 'Baby', 'Material Type FREE': 'Bisphenol A Free', 'Material Type': 'Silicone', 'Liquid Flow Speed': 'medium flow', 'Bottle Nipple Type': 'Vented', 'Size': '6 Count (Pack of 1)', 'Amazon Best Sellers Rank': '#11 in Baby , #1 in Baby Bottle Nipples'}",B0DB8N66QB,"[{'color_name': 'Level 4, Fast Flow, 9m+', 'asin': 'B015XBYL4Q'}, {'color_name': 'Y-Cut, Ideal for Thicker Liquid, 9m+', 'asin': 'B015XBYKVA'}, {'color_name': 'Level 2, Medium Flow, 3m+', 'asin': 'B015XBYDLM'}, {'color_name': '1 Preemie, 6 Pack, 0m+', 'asin': 'B015XBYDE4'}, {'color_name': 'Level 3, Medium-Fast Flow, 6m+', 'asin': 'B015XBYDD0'}, {'color_name': 'Level 1, Slow Flow, 0m+', 'asin': 'B015XBYDG2'}]","{'color_name': ['1 Preemie, 6 Pack, 0m+', 'Level 1, Slow Flow, 0m+', 'Level 2, Medium Flow, 3m+', 'Level 3, Medium-Fast Flow, 6m+', 'Level 4, Fast Flow, 9m+', 'Y-Cut, Ideal for Thicker Liquid, 9m+']}",new,"[{'title': ""Dr. Brown's Natural Flow Anti-Colic Options+ Narrow Baby Bottle, 8 oz/250 mL, with Level 1 Slow Flow Nipple, 0m+, 4 count"", 'link': 'https://www.amazon.com/Dr-Browns-Options-Bottle-4-Pack/dp/B01845QH7M/ref=pd_bxgy_d_sccl_1/000-0000000-0000000?pd_rd_w=vkTmg&content-id=amzn1.sym.3858a394-39a9-4946-90e6-86a3153d2546&pf_rd_p=3858a394-39a9-4946-90e6-86a3153d2546&pf_rd_r=102CQQ8BMT9ATWZ9KQK4&pd_rd_wg=Kvtg9&pd_rd_r=353d0329-47f3-48d0-9aa1-a9c3957d064f&pd_rd_i=B01845QH7M&psc=1', 'price': '$27.96'}]",[],90%,6%,2%,1%,1%
B072QXWXS6,"The Honest Company 2-in-1 Cleansing Shampoo + Body Wash | Gentle for Baby | Naturally Derived, Tear-free, Hypoallergenic | Fragrance Free Sensitive, 10 fl oz",The Honest Company,$8.92,$8.92,"7,175",4.7,DailyMarketShop,https://www.amazon.com/gp/help/seller/at-a-glance.html/ref=dp_merchant_link?ie=UTF8&seller=A21F2JLNNW04C4&asin=B072QXWXS6&ref_=dp_merchant_link,In Stock,,,True,,,True,"Best-selling 2-in-1 Shampoo and Body Wash leaves skin and hair soft and clean; Tear free and perfect for sensitive skin, our formula is gentle for baby, but great for the whole family - Available in CALM (Lavender), NOURISH (Sweet Almond), REFRESH (Citrus Vanilla), and SENSITIVE (Fragrance Free); Each scent was created with a blend of naturally derived botanicals and essential oils for a treat with every bathtime or shower routine - Made With: chamomile extract, aloe, and four naturally derived scents - Made Without: parabens, dyes, synthetic fragrances, silicones, sulfates, formaldehyde donors, and phthalates - NEA Recognized; Tear-Free; Hypoallergenic; Dermatologist-tested; Naturally Derived ingredients; Cruelty Free; Made in USA; Sensitive Skin-Approved","Get a tear-free cleanse from head to toe with our 2-in-1 gentle shampoo + body wash. Our gentle formula will leave your lil one’s scalp and skin (or yours!) clean and moisturized. Available in CALM (Lavender), NOURISH (Sweet Almond), REFRESH (Citrus Vanilla), and SENSITIVE (Fragrance Free). Each of our scents was created with a blend of naturally derived botanicals and essential oils—the whole fam is in for a treat with every bathtime or shower routine. Select scents available as Refills: SHAMPOO + BODY WASH REFILLS MADE WITH: Chamomile extract, aloe and four naturally derived scents MADE WITHOUT: Parabens, Phthalates, Dyes, Synthetic Fragrances, Formaldehyde Donors, SLS/SLES Made in the USA with US and imported materials. Not Tested on Animals and No Animal Byproducts. Please Recycle! Discard pump. Always check with your local municipality for recyclability acceptance.","['https://m.media-amazon.com/images/I/61PM0wEsbKL._SL1500_.jpg', 'https://m.media-amazon.com/images/I/81oIl1U-qNL._SL1500_.jpg', 'https://m.media-amazon.com/images/I/71YqxZ-6X+L._SL1500_.jpg', 'https://m.media-amazon.com/images/I/81sYnvhfUZL._SL1500_.jpg', 'https://m.media-amazon.com/images/I/71e3r6ofp6L._SL1500_.jpg', 'https://m.media-amazon.com/images/I/81Q-5oohiUL._SL1500_.jpg', 'https://m.media-amazon.com/images/I/81FZEejOnuL._SL1500_.jpg', 'https://m.media-amazon.com/images/I/71x9INb-+QL._SL1500_.jpg', 'https://m.media-amazon.com/images/I/81almXagkEL._SL1500_.jpg']",10,Baby Products > Baby Care > Bathing > Soaps & Cleansers > Body Wash,https://www.amazon.com/-/dp/B072QXWXS6?_encoding=UTF8&th=1&psc=1&pf_rd_i=desktop&ref_=pd_gw_unk,"size: 10 Fl Oz (Pack of 1), scent: Fragrance Free Sensitive",10 Fl Oz (Pack of 1),,816645023966,"{'Is Discontinued By Manufacturer': 'No', 'Product Dimensions': '7.75 x 2 x 2 inches; 12.8 ounces', 'Manufacturer recommended age': '3 months and up', 'Item model number': '816645023966', 'UPC': '313551945080 816645023966', 'Manufacturer': 'The Honest Company', 'ASIN': 'B072QXWXS6', 'Amazon Best Sellers Rank': '#15 in Baby , #1 in Baby Body Wash'}",B0D5MNXDPN,"[{'size_name': '10 Fl Oz (Pack of 1)', 'scent_name': 'Fragrance Free Sensitive', 'asin': 'B072QXWXS6'}, {'size_name': '10 Fl Oz (Pack of 1)', 'scent_name': 'Sweet Almond Nourish', 'asin': 'B07LBMKWWH'}, {'size_name': '10 Fl Oz (Pack of 1)', 'scent_name': 'Citrus Vanilla Refresh', 'asin': 'B00EHD9872'}, {'size_name': '10 Fl Oz (Pack of 1)', 'scent_name': 'Lavender Calm', 'asin': 'B01M4QMQ4B'}, {'size_name': '32 Fl Oz (Pack of 1)', 'scent_name': 'Lavender Calm', 'asin': 'B0CT9H19TH'}, {'size_name': '18 Fl Oz (Pack of 1)', 'scent_name': 'Sweet Almond Nourish', 'asin': 'B07Z7W7BD1'}, {'size_name': '18 Fl Oz (Pack of 1)', 'scent_name': 'Citrus Vanilla Refresh', 'asin': 'B07DTQSYMS'}, {'size_name': '18 Fl Oz (Pack of 1)', 'scent_name': 'Lavender Calm', 'asin': 'B07DTJM47S'}, {'size_name': '32 Fl Oz (Pack of 1)', 'scent_name': 'Citrus Vanilla Refresh', 'asin': 'B0CTB76GV2'}]","{'size_name': ['10 Fl Oz (Pack of 1)', '18 Fl Oz (Pack of 1)', '32 Fl Oz (Pack of 1)'], 'scent_name': ['Citrus Vanilla Refresh', 'Fragrance Free Sensitive', 'Lavender Calm', 'Sweet Almond Nourish']}",new,"[{'title': 'Frida Baby Control The Flow Bath Rinse Cup | Rinser Cup to Wash Hair + Body | Rinser Cup for Bath Time with Easy Grip Handle + Removable Rain Shower', 'link': 'https://www.amazon.com/Control-Rinser-Handle-Removable-Shower/dp/B099FK72PW/ref=pd_bxgy_d_sccl_1/000-0000000-0000000?pd_rd_w=8D4md&content-id=amzn1.sym.3858a394-39a9-4946-90e6-86a3153d2546&pf_rd_p=3858a394-39a9-4946-90e6-86a3153d2546&pf_rd_r=S1THC8X7CZPQ78N8JV8K&pd_rd_wg=OOGdp&pd_rd_r=5eafa9a0-fc9e-4176-a3b3-23539502a585&pd_rd_i=B099FK72PW&psc=1', 'price': '$9.97'}, {'title': 'Angelcare Baby Bath Support (Gray) | Ideal for Babies Less Than 6 Months Old', 'link': 'https://www.amazon.com/Angelcare-Baby-Bath-Support-Grey/dp/B01M6YVW7B/ref=pd_bxgy_d_sccl_2/000-0000000-0000000?pd_rd_w=8D4md&content-id=amzn1.sym.3858a394-39a9-4946-90e6-86a3153d2546&pf_rd_p=3858a394-39a9-4946-90e6-86a3153d2546&pf_rd_r=S1THC8X7CZPQ78N8JV8K&pd_rd_wg=OOGdp&pd_rd_r=5eafa9a0-fc9e-4176-a3b3-23539502a585&pd_rd_i=B01M6YVW7B&psc=1', 'price': '$19.99'}]",[],83%,10%,4%,1%,3%
B078WBDSBF,"Pampers Easy Ups Boys & Girls Bluey Potty Training Pants - Size 4T-5T, One Month Supply (104 Count), Training Underwear (Packaging May Vary)",Pampers,$45.94,$45.94,"9,481",4.8,Amazon.com,,In Stock,,,True,,,True,"Make potty training easy with Easy Ups training underwear for boys and girls - Fun Characters: Features Bluey OR My Little Pony graphics to motivate your toddler and make potty training fun - Soft and Comfortable, Underwear-like Fit: Helps your toddler transition out of diapers and into breathable training pants - 360 Stretchy Waistband: To make it easy for toddlers to pull up and down independently - Day and Night Protection: Up to 100% leakproof with extra absorb channels for protection you can trust - Convenient Changes: Features easy tear sides for easy changes, even on the go - From Pampers #1 pediatrician recommended brand - Packaging and prints may vary. Available in sizes 2T-3T (16-34 lb), 3T-4T (30-40 lb), 4T-5T (37+ lb) and 5T- 6T (41+ lb).","Start your potty training journey with Pampers Easy Ups Potty Training Underwear for Girls and Boys! Featuring your favorite characters – Bluey and My Little Pony - these super soft, comfortable, and breathable training pants fit just like real cotton underwear allowing your toddler to feel like they have transitioned out of diapers! With a 360 stretchy waistband that is gentle on your child's skin, Easy Ups make it easy for your toddler to pull up and down their training pants independently. For easy changing, Easy Ups feature easy tear sides for convenience, even on the go! When it comes to potty accidents, your toddler will be covered with up to 100% leakproof protection Day OR Night. To protect where leaks happen most, Easy Ups are made with Dual Leak-Guard Barriers around the leg cuffs and Extra Absorb Channels for all around coverage to absorb accidents and lock them away from your toddler's skin. Plus, they're dermatologically tested, hypoallergenic, and free of parabens and latex.* That's just one of the many reasons Pampers is the #1 pediatrician recommended brand. Toilet training is a journey and can take your toddler 90 days on average to catch on. So, Pampers Easy Ups makes it easy with each box containing a one-month supply of training pants. Available in sizes 2T-3T (16-34 lb), 3T-4T (30-40 lb), 4T-5T (37+ lb) and 5T- 6T (41+ lb).*Natural Rubber","['https://m.media-amazon.com/images/I/713Dmnujm9L._AC_SL1500_.jpg', 'https://m.media-amazon.com/images/I/71DvxWZNF-L._AC_SL1500_.jpg', 'https://m.media-amazon.com/images/I/71KzZGCqxML._AC_SL1500_.jpg', 'https://m.media-amazon.com/images/I/71fNTtwca3L._AC_SL1500_.jpg', 'https://m.media-amazon.com/images/I/81JydZqGS2L._AC_SL1500_.jpg', 'https://m.media-amazon.com/images/I/719BOfU8grL._AC_SL1500_.jpg', 'https://m.media-amazon.com/images/I/81HmhcXmegL._AC_SL1500_.jpg', 'https://m.media-amazon.com/images/I/71sVK965hVL._AC_SL1500_.jpg', 'https://m.media-amazon.com/images/I/71E9a3kJd2L._AC_SL1500_.jpg', 'https://m.media-amazon.com/images/I/71JdxaykCpL._AC_SL1500_.jpg']",10,Baby Products > Potty Training > Training Pants,https://www.amazon.com/-/dp/B078WBDSBF?_encoding=UTF8&th=1&psc=1&pf_rd_i=desktop&ref_=pd_gw_unk,"size: 4T-5T, unit_count: 104",4T-5T,,37000764410,"{'Is Discontinued By Manufacturer': 'No', 'Product Dimensions': '11.26 x 19.53 x 10.63 inches; 7.55 Pounds', 'Manufacturer recommended age': '24 months and up', 'Item model number': '37000764410', 'Department': 'baby-boys', 'Date First Available': 'February 27, 2018', 'Manufacturer': 'Procter & Gamble', 'ASIN': 'B078WBDSBF', 'Country of Origin': 'USA', 'Amazon Best Sellers Rank': '#13 in Baby , #1 in Toilet Training Pants'}",B0CNRTJ9CZ,"[{'size_name': '4T-5T', 'unit_count': '18', 'asin': 'B078SY4C84'}, {'size_name': '4T-5T', 'unit_count': '100', 'asin': 'B07SWLD5W3'}, {'size_name': '5T-6T', 'unit_count': '15', 'asin': 'B08WQZMDR6'}, {'size_name': '2T-3T', 'unit_count': '74', 'asin': 'B07856YZ5W'}, {'size_name': '4T-5T', 'unit_count': '86', 'asin': 'B077VMRQYN'}, {'size_name': '3T-4T', 'unit_count': '100', 'asin': 'B01M5JQ66A'}, {'size_name': '3T-4T', 'unit_count': '124', 'asin': 'B078W9SH24'}, {'size_name': '2T-3T', 'unit_count': '140', 'asin': 'B078WB74R9'}, {'size_name': '5T-6T', 'unit_count': '80', 'asin': 'B01M2CZBCD'}, {'size_name': '3T-4T', 'unit_count': '116', 'asin': 'B07STDS8MY'}, {'size_name': '3T-4T', 'unit_count': '66', 'asin': 'B077VNNKLM'}, {'size_name': '4T-5T', 'unit_count': '104', 'asin': 'B078WBDSBF'}, {'size_name': '5T-6T', 'unit_count': '46', 'asin': 'B08SNNX8ZR'}, {'size_name': '2T-3T', 'unit_count': '25', 'asin': 'B078SX8N7Y'}, {'size_name': '3T-4T', 'unit_count': '22', 'asin': 'B078SXLCY3'}, {'size_name': '4T-5T', 'unit_count': '56', 'asin': 'B078CR8CCH'}, {'size_name': '5T-6T', 'unit_count': '84', 'asin': 'B08SNLW94K'}]","{'size_name': ['2T-3T', '3T-4T', '4T-5T', '5T-6T'], 'unit_count': ['15', '18', '22', '25', '46', '56', '66', '74', '80', '84', '86', '100', '104', '116', '124', '140']}",new,"[{'title': 'Amazon Brand - Mama Bear Gentle Touch Diapers, Hypoallergenic, Size 5, 132 Count (4 packs of 33), White', 'link': 'https://www.amazon.com/Amazon-Brand-Gentle-Touch-Diapers/dp/B07SXBX1DM/ref=pd_bxgy_d_sccl_1/000-0000000-0000000?pd_rd_w=JvXa2&content-id=amzn1.sym.3858a394-39a9-4946-90e6-86a3153d2546&pf_rd_p=3858a394-39a9-4946-90e6-86a3153d2546&pf_rd_r=X8GHNMDGVEXK4G2D74T2&pd_rd_wg=DknI2&pd_rd_r=eeb3313b-6abd-4d30-9653-e6d1cf383174&pd_rd_i=B07SXBX1DM&psc=1', 'price': '$34.70'}, {'title': 'Huggies Simply Clean Fragrance-Free Baby Wipes, Unscented Diaper Wipes, 11 Flip-Top Packs (704 Wipes Total)', 'link': 'https://www.amazon.com/Unscented-Huggies-Simply-Fragrance-Free-Diaper/dp/B08QRKY3NJ/ref=pd_bxgy_d_sccl_2/000-0000000-0000000?pd_rd_w=JvXa2&content-id=amzn1.sym.3858a394-39a9-4946-90e6-86a3153d2546&pf_rd_p=3858a394-39a9-4946-90e6-86a3153d2546&pf_rd_r=X8GHNMDGVEXK4G2D74T2&pd_rd_wg=DknI2&pd_rd_r=eeb3313b-6abd-4d30-9653-e6d1cf383174&pd_rd_i=B08QRKY3NJ&psc=1', 'price': '$16.97'}]",[],86%,8%,3%,1%,2%
