asin,name,brand,price,regular_price,total_reviews,average_rating,seller,seller_url,availability_status,availability_quantity,shipping_charge,is_prime,author,available_book_formats,is_aplus_page,small_description,full_description,images,video_count,productCategory,url,attributes,size,color,model,product_information,parent_asin,variation_asin,product_variations,product_condition,frequently_bought_together,product_badges,five_star,four_star,three_star,two_star,one_star
0593712641,"Good Energy: The Surprising Connection Between Metabolism and Limitless Health Hardcover – May 14, 2024",,$22.40,$32.00,"1,655",4.6,Amazon.com,,In Stock,,,True,Casey Means MD | Calley Means,"[{'Kindle': {'asin': '0593712641', 'price': '$16.99'}}, {'Audiobook': {'asin': '0593712641', 'price': '$0.99'}}, {'Hardcover': {'asin': '0593712641', 'price': '$22.40'}}, {'Spiral-bound': {'asin': '0593712641', 'price': '$42.99'}}]",True,,"The instant #1 New York Times bestseller! A bold new vision for optimizing our health now and in the future What if depression, anxiety, infertility, insomnia, heart disease, erectile dysfunction, type 2 diabetes, Alzheimer’s, dementia, cancer and many other health conditions that torture and shorten our lives actually have the same root cause? Our ability to prevent and reverse these conditions - and feel incredible today - is under our control and simpler than we think. The key is our metabolic function - the most important and least understood factor in our overall health. As Dr. Casey Means explains in this groundbreaking book, nearly every health problem we face can be explained by how well the cells in our body create and use energy. To live free from frustrating symptoms and life-threatening disease, we need our cells to be optimally powered so that they can create “good energy,” the essential fuel that impacts every aspect of our physical and mental wellbeing. If you are battling minor signals of “bad energy” inside your body, it is often a warning sign that more life-threatening illness may emerge later in life. But here’s the good news: for the first time ever, we can monitor our metabolic health in great detail and learn how to improve it ourselves. Weaving together cutting-edge research and personal stories, as well as groundbreaking data from the health technology company Dr. Means founded, Good Energy offers an essential four-week plan and explains: The five biomarkers that determine your risk for a deadly disease. How to use inexpensive tools and technology to “see inside your body” and take action. Why dietary philosophies are designed to confuse us, and six lifelong food principles you can implement whether you’re carnivore or vegan. The crucial links between sleep, circadian rhythm, and metabolism A new framework for exercise focused on building simple movement into everyday activities How cold and heat exposure helps build our body’s resilience Steps to navigate the medical system to get what you need for optimal health Good Energy offers a new, cutting-edge understanding of the true cause of illness that until now has remained hidden. It will help you optimize your ability to live well and stay well at every age.",['https://m.media-amazon.com/images/I/71KTwO53SnL._SY522_.jpg'],10,"Books > Health, Fitness & Dieting > Aging",https://www.amazon.com/-/dp/0593712641?_encoding=UTF8&th=1&psc=1&pf_rd_i=desktop&ref_=pd_gw_unk,Hardcover,,,,"{'Publisher': 'Avery (May 14, 2024)', 'Language': 'English', 'Hardcover': '400 pages', 'ISBN-10': '0593712641', 'ISBN-13': '978-0593712641', 'Item Weight': '1.4 pounds', 'Dimensions': '6.22 x 1.37 x 9.27 inches', 'Amazon Best Sellers Rank': '#4 in Books , #1 in Nutrition (Books) , #1 in Longevity'}",0593712641,[],{},new,"[{'title': ""The 30-Minute Good Energy Cookbook • Quick Recipes for Limitless Energy: 250+ Metabolism-Boosting Meals, 120-Day Meal Plan, and All-Inclusive Food ... Dr. Casey Means' Teachings to Your Table"", 'link': 'https://www.amazon.com/30-Minute-Energy-Cookbook-Recipes-Limitless/dp/B0DH4PRD51/ref=pd_bxgy_d_sccl_1/138-1842735-6061230?pd_rd_w=1rzUf&content-id=amzn1.sym.f7fa8b58-6436-47b8-8741-9e90c231669e&pf_rd_p=f7fa8b58-6436-47b8-8741-9e90c231669e&pf_rd_r=98M7CXWAF6S887GBDG5S&pd_rd_wg=WZ5nk&pd_rd_r=00be5354-5c35-49a9-866e-252e0577ab32&pd_rd_i=B0DH4PRD51&psc=1', 'price': '$17.87'}, {'title': ""Super Easy Good Energy Cookbook for Beginners: 150+ Tasty & Nutritious Recipes Inspired by Dr. Casey Means' Teachings to Help You Lose Weight and Eat Healthier"", 'link': 'https://www.amazon.com/Super-Easy-Energy-Cookbook-Beginners/dp/B0DFCZHLJJ/ref=pd_bxgy_d_sccl_2/138-1842735-6061230?pd_rd_w=1rzUf&content-id=amzn1.sym.f7fa8b58-6436-47b8-8741-9e90c231669e&pf_rd_p=f7fa8b58-6436-47b8-8741-9e90c231669e&pf_rd_r=98M7CXWAF6S887GBDG5S&pd_rd_wg=WZ5nk&pd_rd_r=00be5354-5c35-49a9-866e-252e0577ab32&pd_rd_i=B0DFCZHLJJ&psc=1', 'price': '$12.99'}]","[{'badge': 'Amazon Charts', 'badge_text': '#4 this week'}]",78%,11%,6%,2%,3%
1649374186,"Onyx Storm (Deluxe Limited Edition) (The Empyrean, 3) Hardcover – January 21, 2025",,$19.78,$32.99,,,Amazon.com,,"This title will be released on January 21, 2025.",,,True,Rebecca Yarros,"[{'Kindle': {'asin': '1649374186', 'price': '$14.99'}}, {'Audiobook': {'asin': '1649374186', 'price': '$0.00'}}, {'Hardcover': {'asin': '1649374186', 'price': '$19.78'}}]",True,,"Preorder now and receive the stunning DELUXE LIMITED EDITION while supplies last ―featuring gorgeous sprayed edges with stenciled artwork, as well as exclusive special design features. This incredible collectible is only available for a limited time, a must-have for any book lover while supplies last in the US and Canada only. After nearly eighteen months at Basgiath War College, Violet Sorrengail knows there’s no more time for lessons. No more time for uncertainty. Because the battle has truly begun, and with enemies closing in from outside their walls and within their ranks, it’s impossible to know who to trust. Now Violet must journey beyond the failing Aretian wards to seek allies from unfamiliar lands to stand with Navarre. The trip will test every bit of her wit, luck, and strength, but she will do anything to save what she loves―her dragons, her family, her home, and him . Even if it means keeping a secret so big, it could destroy everything. They need an army. They need power. They need magic . And they need the one thing only Violet can find―the truth. But a storm is coming...and not everyone can survive its wrath. The Empyrean series is best enjoyed in order. Reading Order: Book #1 Fourth Wing Book #2 Iron Flame Book #3 Onyx Storm",['https://m.media-amazon.com/images/I/9101MLPcFTL._SY522_.jpg'],0,Books > Science Fiction & Fantasy > Fantasy,https://www.amazon.com/-/dp/1649374186?_encoding=UTF8&th=1&psc=1&pf_rd_i=desktop&ref_=pd_gw_unk,Hardcover,,,,"{'Publisher': 'Entangled: Red Tower Books; Deluxe,Limited edition (January 21, 2025)', 'Language': 'English', 'Hardcover': '544 pages', 'ISBN-10': '1649374186', 'ISBN-13': '978-1649374189', 'Item Weight': '2.31 pounds', 'Dimensions': '6 x 1.66 x 9 inches', 'Amazon Best Sellers Rank': '#10 in Books , #3 in Romantic Fantasy (Books) , #3 in Epic Fantasy (Books) , #4 in Fantasy Romance (Books)'}",1649374186,[],{},new,"[{'title': 'Iron Flame (The Empyrean, 2)', 'link': 'https://www.amazon.com/Iron-Flame-Empyrean-Rebecca-Yarros/dp/1649374178/ref=pd_bxgy_d_sccl_1/000-0000000-0000000?pd_rd_w=pxGxu&content-id=amzn1.sym.3858a394-39a9-4946-90e6-86a3153d2546&pf_rd_p=3858a394-39a9-4946-90e6-86a3153d2546&pf_rd_r=HTC3P0KEF0R4NQNDZSQN&pd_rd_wg=Qo7Jg&pd_rd_r=c9401444-d143-4a93-84f1-620e310f9060&pd_rd_i=1649374178&psc=1', 'price': '$11.46'}, {'title': 'Fourth Wing (The Empyrean, 1)', 'link': 'https://www.amazon.com/Fourth-Wing-Empyrean-Rebecca-Yarros/dp/1649374046/ref=pd_bxgy_d_sccl_2/000-0000000-0000000?pd_rd_w=pxGxu&content-id=amzn1.sym.3858a394-39a9-4946-90e6-86a3153d2546&pf_rd_p=3858a394-39a9-4946-90e6-86a3153d2546&pf_rd_r=HTC3P0KEF0R4NQNDZSQN&pd_rd_wg=Qo7Jg&pd_rd_r=c9401444-d143-4a93-84f1-620e310f9060&pd_rd_i=1649374046&psc=1', 'price': '$16.99'}]",[],0%,0%,0%,0%,0%
1250859999,"Does This Taste Funny?: Recipes Our Family Loves Hardcover – September 17, 2024",,$24.48,$35.00,257,4.7,Amazon.com,,In Stock,,,True,Stephen Colbert | Evie McGee Colbert,"[{'Kindle': {'asin': '1250859999', 'price': '$16.99'}}, {'Hardcover': {'asin': '1250859999', 'price': '$24.48'}}]",True,,"INSTANT NEW YORK TIMES BESTSELLER Stephen and Evie Colbert invite you to pull up a chair as they share their favorite recipes from family and friends and offer a glimpse of food and fun in their South Carolina home. “Hopefully reading this book and cooking these recipes will feel like hanging out with us at home. We basically live in the kitchen anyway.” ―Evie and Stephen Colbert As Evie and Stephen explain it, Does This Taste Funny? had its beginnings in the Covid lockdown. “We were all stuck together and couldn’t go out, so we cooked. We had all three kids back under one roof for the first time in a long time, and we had dinner each night as a family. Cooking together became a major source of entertainment.” Now, the Colberts invite us into their kitchen and around their dining room table. Sharing Stephen and Evie’s favorite recipes, as well as those of their family and friends, this book offers everything from Party Food (called “party food” because “appetizers” implies something to follow when we all know that, often, this is the only course), to Seafood, to Poultry and Meat (“Evie and I have different relationships to meat. I like it. Evie can take it or leave it, and mostly she leaves it.”), to Desserts (“This is one of the largest sections of the book. Evie always reminds me that desserts are a great way to postpone clearing up.”), to Drinks (“I love cocktail hour. It feels like a reward for having gone so long without a cocktail”), all tied together with playful dialogue between Stephen and Evie and gorgeous shots of their food, family, and home.",['https://m.media-amazon.com/images/I/81VNFid7TkL._SY522_.jpg'],1,"Books > Cookbooks, Food & Wine > Regional & International",https://www.amazon.com/-/dp/1250859999?_encoding=UTF8&th=1&psc=1&pf_rd_i=desktop&ref_=pd_gw_unk,Hardcover,,,,"{'Publisher': 'Celadon Books (September 17, 2024)', 'Language': 'English', 'Hardcover': '336 pages', 'ISBN-10': '1250859999', 'ISBN-13': '978-1250859990', 'Item Weight': '2.31 pounds', 'Dimensions': '7.65 x 1 x 9.4 inches', 'Amazon Best Sellers Rank': '#62 in Books , #1 in Southern U.S. Cooking, Food & Wine , #1 in Christmas Cooking , #4 in Celebrity & TV Show Cookbooks'}",1250859999,[],{},new,"[{'title': 'Be Ready When the Luck Happens: A Memoir', 'link': 'https://www.amazon.com/Be-Ready-When-Luck-Happens/dp/0593799895/ref=pd_bxgy_d_sccl_1/000-0000000-0000000?pd_rd_w=ZfHPu&content-id=amzn1.sym.3858a394-39a9-4946-90e6-86a3153d2546&pf_rd_p=3858a394-39a9-4946-90e6-86a3153d2546&pf_rd_r=BRMQJSBG28CBQ33Y04N0&pd_rd_wg=F7a4C&pd_rd_r=aa15579b-a713-450c-b09c-707975520cdf&pd_rd_i=0593799895&psc=1', 'price': '$21.00'}, {'title': ""Good Lookin' Cookin': A Year of Meals - A Lifetime of Family, Friends, and Food [A Cookbook]"", 'link': 'https://www.amazon.com/Good-Lookin-Cookin-Lifetime-Cookbook/dp/1984863169/ref=pd_bxgy_d_sccl_2/000-0000000-0000000?pd_rd_w=ZfHPu&content-id=amzn1.sym.3858a394-39a9-4946-90e6-86a3153d2546&pf_rd_p=3858a394-39a9-4946-90e6-86a3153d2546&pf_rd_r=BRMQJSBG28CBQ33Y04N0&pd_rd_wg=F7a4C&pd_rd_r=aa15579b-a713-450c-b09c-707975520cdf&pd_rd_i=1984863169&psc=1', 'price': '$24.50'}]",[],86%,7%,3%,1%,3%
1419766953,"Hot Mess (Diary of a Wimpy Kid Book 19) (Volume 19) Hardcover – October 22, 2024",,$10.49,$14.99,,,Amazon.com,,"This title will be released on October 22, 2024.",,,True,Jeff Kinney,"[{'Kindle': {'asin': '1419766953', 'price': '$9.97'}}, {'Audiobook': {'asin': '1419766953', 'price': '$0.00'}}, {'Hardcover': {'asin': '1419766953', 'price': '$10.49'}}, {'Audio CD': {'asin': '1419766953', 'price': '$29.99'}}]",True,,"In Hot Mess, book 19 of the Diary of a Wimpy Kid series from #1 international bestselling author Jeff Kinney, Greg Heffley is in for a particularly awkward summer with his whole family. The pressure is building for Greg Heffley, who discovers that when you mix heaps of family, a tiny beach house, and sweltering heat, it’s a recipe for disaster. Speaking of recipes—the secret ingredients behind Gramma’s famous meatballs have been closely guarded for years. Can Greg unpack all of his family’s mysteries before their vacation is over? Or will he just stir the pot? This sidesplittingly relatable summer story is the funniest Wimpy Kid book yet! Collect all the books in the #1 bestselling Diary of a Wimpy Kid series: Diary of a Wimpy Kid (#1) | Rodrick Rules (#2) | The Last Straw (#3) | Dog Days (#4) | The Ugly Truth (#5) | Cabin Fever (#6) | The Third Wheel (#7) | Hard Luck (#8) | The Long Haul (#9) | Old School (#10) | Double Down (#11) | The Getaway (#12) | The Meltdown (#13) | Wrecking Ball (#14) | The Deep End (#15) | Big Shot (#16) | Diper Överlöde (#17) | No Brainer (#18) | Hot Mess (#19) See the Wimpy Kid World in a whole new way with the #1 bestselling Awesome Friendly books, told from the perspective of Greg Heffley’s best friend Rowley Jefferson: Diary of an Awesome Friendly Kid: Rowley Jefferson’s Journal | Rowley Jefferson’s Awesome Friendly Adventure | Rowley Jefferson’s Awesome Friendly Spooky Stories",['https://m.media-amazon.com/images/I/81mFBsBFYXL._SY522_.jpg'],0,Books > Children's Books > Growing Up & Facts of Life,https://www.amazon.com/-/dp/1419766953?_encoding=UTF8&th=1&psc=1&pf_rd_i=desktop&ref_=pd_gw_unk,Hardcover,,,,"{'Publisher': 'Amulet Books (October 22, 2024)', 'Language': 'English', 'Hardcover': '224 pages', 'ISBN-10': '1419766953', 'ISBN-13': '978-1419766954', 'Reading age': '8 - 12 years', 'Grade level': '3 - 7', 'Item Weight': '12.8 ounces', 'Dimensions': '10 x 2 x 2.7 inches', 'Amazon Best Sellers Rank': ""#7 in Books , #1 in Children's Books on Boys' & Men's Issues , #1 in Children's Friendship Books , #1 in Children's Humorous Comics & Graphic Novels""}",1419766953,[],{},new,"[{'title': 'Dog Man: Big Jim Begins: A Graphic Novel (Dog Man #13): From the Creator of Captain Underpants', 'link': 'https://www.amazon.com/Dog-Man-Graphic-Creator-Underpants/dp/1338896458/ref=pd_bxgy_d_sccl_1/000-0000000-0000000?pd_rd_w=sflFL&content-id=amzn1.sym.3858a394-39a9-4946-90e6-86a3153d2546&pf_rd_p=3858a394-39a9-4946-90e6-86a3153d2546&pf_rd_r=9MH6F9R087H9JG87336F&pd_rd_wg=2JP0k&pd_rd_r=9df97302-ec64-4c32-99c0-0eeba71e815f&pd_rd_i=1338896458&psc=1', 'price': '$10.49'}, {'title': 'Dog Man: The Scarlet Shedder: A Graphic Novel (Dog Man #12): From the Creator of Captain Underpants', 'link': 'https://www.amazon.com/Dog-Man-Scarlet-Shedder-Underpants/dp/1338896431/ref=pd_bxgy_d_sccl_2/000-0000000-0000000?pd_rd_w=sflFL&content-id=amzn1.sym.3858a394-39a9-4946-90e6-86a3153d2546&pf_rd_p=3858a394-39a9-4946-90e6-86a3153d2546&pf_rd_r=9MH6F9R087H9JG87336F&pd_rd_wg=2JP0k&pd_rd_r=9df97302-ec64-4c32-99c0-0eeba71e815f&pd_rd_i=1338896431&psc=1', 'price': '$8.24'}]",[],0%,0%,0%,0%,0%
0593799895,"Be Ready When the Luck Happens: A Memoir Hardcover – October 1, 2024",,$21.00,$34.00,"1,109",4.7,Amazon.com,,In Stock,,,True,Ina Garten,"[{'Kindle': {'asin': '0593799895', 'price': '$14.99'}}, {'Audiobook': {'asin': '0593799895', 'price': '$0.99'}}, {'Hardcover': {'asin': '0593799895', 'price': '$21.00'}}, {'Paperback': {'asin': '0593799895', 'price': '$25.47'}}]",True,,"#1 NEW YORK TIMES BESTSELLER • In her long-awaited memoir, Ina Garten—aka the Barefoot Contessa, author of thirteen bestselling cookbooks, beloved Food Network personality, Instagram sensation, and cultural icon—shares her personal story with readers hungry for a seat at her table. Here, for the first time, Ina Garten presents an intimate, entertaining, and inspiring account of her remarkable journey. Ina’s gift is to make everything look easy, yet all her accomplishments have been the result of hard work, audacious choices, and exquisite attention to detail. In her unmistakable voice (no one tells a story like Ina), she brings her past and her process to life in a high-spirited and no-holds-barred memoir that chronicles decades of personal challenges, adventures (and misadventures) and unexpected career twists, all delivered with her signature combination of playfulness and purpose. From a difficult childhood to meeting the love of her life, Jeffrey, and marrying him while still in college, from a boring bureaucratic job in Washington, D.C., to answering an ad for a specialty food store in the Hamptons, from the owner of one Barefoot Contessa shop to author of bestselling cookbooks and celebrated television host, Ina has blazed her own trail and, in the meantime, taught millions of people how to cook and entertain. Now, she invites them to come closer to experience her story in vivid detail and to share the important life lessons she learned along the way: do what you love because if you love it you’ll be really good at it, swing for the fences, and always Be Ready When the Luck Happens .",['https://m.media-amazon.com/images/I/81g+Hs6XF5L._SY522_.jpg'],2,Books > Biographies & Memoirs > Arts & Literature,https://www.amazon.com/-/dp/0593799895?_encoding=UTF8&th=1&psc=1&pf_rd_i=desktop&ref_=pd_gw_unk,Hardcover,,,,"{'Publisher': 'Crown (October 1, 2024)', 'Language': 'English', 'Hardcover': '320 pages', 'ISBN-10': '0593799895', 'ISBN-13': '978-0593799895', 'Item Weight': '2.31 pounds', 'Dimensions': '6.43 x 1.04 x 9.5 inches', 'Amazon Best Sellers Rank': '#20 in Books , #1 in Television Performer Biographies , #2 in Culinary Biographies & Memoirs , #5 in Memoirs (Books)'}",0593799895,[],{},new,"[{'title': ""From Here to the Great Unknown: Oprah's Book Club: A Memoir"", 'link': 'https://www.amazon.com/Here-Great-Lisa-Marie-Presley/dp/0593733878/ref=pd_bxgy_d_sccl_1/000-0000000-0000000?pd_rd_w=7fpj5&content-id=amzn1.sym.3858a394-39a9-4946-90e6-86a3153d2546&pf_rd_p=3858a394-39a9-4946-90e6-86a3153d2546&pf_rd_r=WJPR0V3FV1TH4AM4Q5H0&pd_rd_wg=RKbzW&pd_rd_r=2551a304-f129-41a8-a455-3d2caebdb4c2&pd_rd_i=0593733878&psc=1', 'price': '$21.49'}, {'title': 'Does This Taste Funny?: Recipes Our Family Loves', 'link': 'https://www.amazon.com/Does-This-Taste-Funny-Recipes/dp/1250859999/ref=pd_bxgy_d_sccl_2/000-0000000-0000000?pd_rd_w=7fpj5&content-id=amzn1.sym.3858a394-39a9-4946-90e6-86a3153d2546&pf_rd_p=3858a394-39a9-4946-90e6-86a3153d2546&pf_rd_r=WJPR0V3FV1TH4AM4Q5H0&pd_rd_wg=RKbzW&pd_rd_r=2551a304-f129-41a8-a455-3d2caebdb4c2&pd_rd_i=1250859999&psc=1', 'price': '$24.48'}]","[{'badge': 'Amazon Charts', 'badge_text': '#2 this week'}]",81%,12%,4%,1%,1%
1728235200,"The Leaf Thief: (The Perfect Fall Book for Children and Toddlers) Paperback – Picture Book, August 3, 2021",,$10.71,$17.99,"2,828",4.8,Amazon.com,,In Stock,,,True,Alice Hemming | Nicola Slater (Illustrator),"[{'Kindle': {'asin': '1728235200', 'price': '$4.49'}}, {'Paperback': {'asin': '1728235200', 'price': '$10.71'}}, {'Board book': {'asin': '1728235200', 'price': '$19.24'}}]",False,,"A New York Times Bestseller! Perfect for fans of Fletcher and the Falling Leaves , The Leaf Thief is a funny picture book that teaches kids about autumn, adapting to change, and the seasons. Squirrel loves counting the leaves on his tree―red leaves, gold leaves, orange, and more. But hold on! One of his leaves is missing! On a quest to find the missing leaf, Squirrel teams up with his good friend Bird to discover who the leaf thief could be among their forest friends. With vibrant art and captivating characters, the magic of autumn is captured beautifully on each page as readers tag along Squirrel's forest adventure. Is there truly a leaf thief afoot, or is something else going on in Squirrel's forest? A perfect exploration of change―both seasonal, and the anxiety that change sometimes causes. Bonus material explaining about the changing of the seasons. Poised to be a new fall classic. Pick up The Leaf Thief if you are looking for: A classic read for ages 4 and up Back to school books, ideal for your classroom, homeschool curriculum, and more! Seasonal and educational stories about the changing seasons",['https://m.media-amazon.com/images/I/A18OnuYW2dL._SY522_.jpg'],10,Books > Children's Books > Animals,https://www.amazon.com/-/dp/1728235200?_encoding=UTF8&th=1&psc=1&pf_rd_i=desktop&ref_=pd_gw_unk,Paperback,,,,"{'Publisher': 'Sourcebooks Jabberwocky (August 3, 2021)', 'Language': 'English', 'Paperback': '32 pages', 'ISBN-10': '1728235200', 'ISBN-13': '978-1728235202', 'Reading age': '2 - 5 years, from customers', 'Lexile measure': 'AD500L', 'Grade level': 'Preschool - 3', 'Item Weight': '2.31 pounds', 'Dimensions': '10.09 x 0.33 x 11.08 inches', 'Amazon Best Sellers Rank': ""#33 in Books , #1 in Children's Humor , #1 in Children's Mouse & Rodent Books""}",1728235200,[],{},new,"[{'title': 'How to Catch a Witch', 'link': 'https://www.amazon.com/How-Catch-Witch-Alice-Walstead/dp/1728210356/ref=pd_bxgy_d_sccl_1/000-0000000-0000000?pd_rd_w=PPnec&content-id=amzn1.sym.3858a394-39a9-4946-90e6-86a3153d2546&pf_rd_p=3858a394-39a9-4946-90e6-86a3153d2546&pf_rd_r=0VGYWTD563R9KE37BRDX&pd_rd_wg=E91r2&pd_rd_r=70b36d06-f0cc-4c50-a0c9-1f76fbf34025&pd_rd_i=1728210356&psc=1', 'price': '$5.95'}, {'title': 'How to Catch a Turkey', 'link': 'https://www.amazon.com/How-Catch-Turkey-Adam-Wallace/dp/1492664359/ref=pd_bxgy_d_sccl_2/000-0000000-0000000?pd_rd_w=PPnec&content-id=amzn1.sym.3858a394-39a9-4946-90e6-86a3153d2546&pf_rd_p=3858a394-39a9-4946-90e6-86a3153d2546&pf_rd_r=0VGYWTD563R9KE37BRDX&pd_rd_wg=E91r2&pd_rd_r=70b36d06-f0cc-4c50-a0c9-1f76fbf34025&pd_rd_i=1492664359&psc=1', 'price': '$5.86'}]",[],88%,8%,2%,1%,1%
