asin,name,brand,price,regular_price,total_reviews,average_rating,seller,seller_url,availability_status,availability_quantity,shipping_charge,is_prime,author,available_book_formats,is_aplus_page,small_description,full_description,images,video_count,productCategory,url,attributes,size,color,model,product_information,parent_asin,variation_asin,product_variations,product_condition,frequently_bought_together,product_badges,five_star,four_star,three_star,two_star,one_star
B086LKQDJG,"The Honest Company Clean Conscious Unscented Wipes | Over 99% Water, Compostable, Plant-Based, Baby Wipes | Hypoallergenic for Sensitive Skin, EWG Verified | Pattern Play, 720 Count",The Honest Company,$44.99,$44.99,"6,112",4.9,Amazon.com,,In Stock,,,True,,,True,"Clean up all of life’s messes. Compostable, plant-based multi-use Wipes are made with over 99% water and only 7 transparent ingredients, making them gentle and safe for baby’s sensitive skin but great for the whole family - Hypoallergenic, fragrance free, dermatologist tested, and recognized with the National Eczema seal of acceptance, which means you can trust that this product is safe and suitable for people with sensitive skin - Diaper duty and beyond: these water Wipes are ultra durable and extra thick with a convenient flip-top dispenser - use on all household surfaces, for a post-workout refresh, to clean your pet's paws, and wipe down gunked-up toys, messy fingers, and dusty plants - Hypoallergenic; Dermatologist Tested; EWG Verified; Cruelty Free; NEA Recognized; Compostable and disintegrates in 8 weeks - Made without: Plastic Cloth/Fabric, Fragrances, Parabens, Alcohol, Chlorine Processing","Clean up all of life’s messes with our compostable plant-based baby wipes, made with over 99% water and gentle on sensitive skin. From diaper change duty and messy fingers to sticky counters and gunked-up toys — our ultra-durable, extra thick wipes get the job done! These hypoallergenic plant-based wipes are dermatologist-tested and are made with only 7 transparent ingredients that are toxicologist-audited, making them safe + gentle for baby and the whole family. Wipes made without plastic, fragrances, parabens, and chlorine processing – containing everything you need and nothing you don’t. Now Compostable! Honest Baby Wipes disintegrate in 8 weeks.** For municipal: Always check for the availability and acceptance of municipal/institutional composting facilities as they may be limited in your area. For home: Do not compost if wipes are used to clean non-compostable items like human/animal waste or mixed with cleaning soaps/sprays. Generally, wipes shouldn't be more than 10% of your compost heap. **Following Modified ISO 20200 standards to assess disintegration under home composting conditions.","['https://m.media-amazon.com/images/I/81W3iWS7ptL._SL1500_.jpg', 'https://m.media-amazon.com/images/I/A1umeG63HmL._SL1500_.jpg', 'https://m.media-amazon.com/images/I/71Xigsm347L._SL1500_.jpg', 'https://m.media-amazon.com/images/I/81WiFoylCNL._SL1500_.jpg', 'https://m.media-amazon.com/images/I/81qpyrjwYAL._SL1500_.jpg', 'https://m.media-amazon.com/images/I/71L-pjh+gFL._SL1500_.jpg', 'https://m.media-amazon.com/images/I/61iOwe4yomL._SL1500_.jpg', 'https://m.media-amazon.com/images/I/61nI4-JvvBL._SL1200_.jpg', 'https://m.media-amazon.com/images/I/81almXagkEL._SL1500_.jpg', 'https://m.media-amazon.com/images/I/7189a8PTopL._SL1500_.jpg']",10,Baby Products > Diapering > Wipes & Holders > Wipes & Refills,https://www.amazon.com/-/dp/B086LKQDJG?_encoding=UTF8&th=1&psc=1&pf_rd_i=desktop&ref_=pd_gw_unk,"size: 72 Count (Pack of 10), color: Pattern Play",72 Count (Pack of 10),Pattern Play,H01WP7003W00R,"{'Product Dimensions': '17.32 x 8.07 x 8.86 inches; 4.97 ounces', 'Item model number': 'H01WP7003W00R', 'UPC': '810022912423', 'Manufacturer': 'The Honest Company', 'ASIN': 'B086LKQDJG', 'Country of Origin': 'China', 'Amazon Best Sellers Rank': '#4 in Baby , #3 in Diaper Wipes & Refills'}",B0D5MVRHPB,"[{'size_name': '72 Count (Pack of 9)', 'color_name': 'Classic', 'asin': 'B0CK1C7ZCD'}, {'size_name': '72 Count (Pack of 9)', 'color_name': 'Geo Mood', 'asin': 'B0CJZY1S52'}, {'size_name': '72 Count (Pack of 8)', 'color_name': 'Balance Blues', 'asin': 'B07YXNCYLW'}, {'size_name': '72 Count (Pack of 8)', 'color_name': 'Pattern Play', 'asin': 'B07SH6HN2X'}, {'size_name': '72 Count (Pack of 4)', 'color_name': 'Rose Blossom', 'asin': 'B07B191WPY'}, {'size_name': '72 Count (Pack of 12)', 'color_name': 'Sunburst', 'asin': 'B0DCHPP188'}, {'size_name': '72 Count (Pack of 1)', 'color_name': 'Geo Mood', 'asin': 'B00A8VVPOG'}, {'size_name': '72 Count (Pack of 1)', 'color_name': 'Balance Blues', 'asin': 'B0761T9DJ5'}, {'size_name': '72 Count (Pack of 1)', 'color_name': 'Rainbow', 'asin': 'B097KMD2GF'}, {'size_name': '60 Count (Pack of 1)', 'color_name': 'Rose Blossom', 'asin': 'B0BWH8LMVL'}, {'size_name': '60 Count (Pack of 1)', 'color_name': 'Pattern Play', 'asin': 'B0BPFLG759'}, {'size_name': '60 Count (Pack of 1)', 'color_name': 'Rainbow', 'asin': 'B0BWH9XJ27'}, {'size_name': '72 Count (Pack of 1)', 'color_name': 'Rose Blossom', 'asin': 'B0792MTNHP'}, {'size_name': '72 Count (Pack of 10)', 'color_name': 'Pattern Play', 'asin': 'B086LKQDJG'}, {'size_name': '72 Count (Pack of 4)', 'color_name': 'Geo Mood', 'asin': 'B013C9OKVU'}, {'size_name': '72 Count (Pack of 4)', 'color_name': 'Balance Blues', 'asin': 'B07B195TT6'}, {'size_name': '36 Count (Pack of 1)', 'color_name': 'Terrazzo', 'asin': 'B099R2D5YF'}, {'size_name': '72 Count (Pack of 4)', 'color_name': 'Pattern Play', 'asin': 'B07B14D6MD'}, {'size_name': '72 Count (Pack of 8)', 'color_name': 'Rose Blossom', 'asin': 'B07YXN58SK'}, {'size_name': '60 Count (Pack of 1)', 'color_name': 'Balance Blues', 'asin': 'B0BWHCRR3S'}, {'size_name': '72 Count (Pack of 8)', 'color_name': 'Geo Mood', 'asin': 'B01NASH63G'}, {'size_name': '60 Count (Pack of 1)', 'color_name': 'Geo Mood', 'asin': 'B0BWGZH14G'}, {'size_name': '10 Count (Pack of 1)', 'color_name': 'Pattern Play', 'asin': 'B00IFWO8PI'}]","{'size_name': ['60 Count (Pack of 1)', '72 Count (Pack of 1)', '72 Count (Pack of 4)', '72 Count (Pack of 8)', '72 Count (Pack of 9)', '10 Count (Pack of 1)', '72 Count (Pack of 10)', '72 Count (Pack of 12)', '36 Count (Pack of 1)'], 'color_name': ['Balance Blues', 'Classic', 'Geo Mood', 'Pattern Play', 'Rainbow', 'Rose Blossom', 'Sunburst', 'Terrazzo']}",new,"[{'title': 'The Honest Company 2-in-1 Cleansing Shampoo + Body Wash | Gentle for Baby | Naturally Derived, Tear-free, Hypoallergenic | Fragrance Free Sensitive, 10 fl oz', 'link': 'https://www.amazon.com/Cleansing-Naturally-Tear-free-Hypoallergenic-Fragrance/dp/B072QXWXS6/ref=pd_bxgy_d_sccl_1/000-0000000-0000000?pd_rd_w=2PnwJ&content-id=amzn1.sym.3858a394-39a9-4946-90e6-86a3153d2546&pf_rd_p=3858a394-39a9-4946-90e6-86a3153d2546&pf_rd_r=C68VDTYQ5GVYWMHQVNAW&pd_rd_wg=MrtqE&pd_rd_r=7feefa4b-c848-48aa-9d02-fcabe1b42094&pd_rd_i=B072QXWXS6&psc=1', 'price': '$9.94'}, {'title': 'The Honest Company Clean Conscious Diapers | Plant-Based, Sustainable | Above It All + Barnyard Babies | Club Box, Size 1 (8-14 lbs), 78 Count', 'link': 'https://www.amazon.com/Honest-Company-Conscious-Plant-Based-Sustainable/dp/B0CKV2ZL1Y/ref=pd_bxgy_d_sccl_2/000-0000000-0000000?pd_rd_w=2PnwJ&content-id=amzn1.sym.3858a394-39a9-4946-90e6-86a3153d2546&pf_rd_p=3858a394-39a9-4946-90e6-86a3153d2546&pf_rd_r=C68VDTYQ5GVYWMHQVNAW&pd_rd_wg=MrtqE&pd_rd_r=7feefa4b-c848-48aa-9d02-fcabe1b42094&pd_rd_i=B0CKV2ZL1Y&psc=1', 'price': '$29.99'}]","[{'badge': ""Amazon's Choice"", 'badge_text': None}]",92%,4%,2%,1%,1%
B07MP6VXRN,"Huggies Size 1 Diapers, Little Snugglers Diapers, Size 1 (8-14 lbs), 198 Ct (6 packs of 33)",HUGGIES,$51.49,$51.49,"113,764",4.8,Amazon.com,,In Stock,,,True,,,True,"Huggies Size 1 Diapers: 198 Little Snugglers Newborn Diapers (6 packs of 33), size 1 (8-14 lbs) - Up to 100% Leak-Free Protection: Our baby diapers have Huggies Leak Lock System that offers up to 12 hours of leak protection - Gentle Skin Protection: These Huggies infant diapers offer a curved and stretchy fit with all-around comfort for a gentle tummy fit - The only brand with a blowout blocker across all our offerings*: A soft, pocketed back waistband helps prevent diaper leaks and blowouts and helps keep mess away from your baby's skin (*among branded open diapers. Excludes preemie size.) - The Only Brand Entirely Fragrance Free**: All Huggies newborn diapers are safe for sensitive skin, hypoallergenic and free of fragrances (**among leading national diaper brands, across all offered variants) - GentleAbsorb Liner: Each disposable diaper is made with Huggies’ GentleAbsorb Liner** that absorbs wetness on contact to help keep your baby’s skin clean and healthy(**Available in Little Snugglers sizes Preemie-2) - Wetness Indicator: Our infant diaper features a color-changing wetness indicator that lets you know when your baby’s diaper is ready to be changed - Our disposable diapers feature Disney designs as cute as your baby - Huggies Little Snugglers packaging may vary","With up to 12 hours of leak protection for your baby’s delicate skin, Huggies Little Snugglers Diapers are our perfect choice for your little one. Huggies Little Snugglers newborn diapers offer gentle skin protection and showcase a curved and stretchy fit with all-around comfort for a gentle tummy fit. These baby diapers feature Huggies' GentleAbsorb Liner that absorbs wetness on contact to help keep your baby’s skin clean and healthy. Plus, with a soft, pocketed back waistband, these disposable baby diapers help prevent leaks and blowouts while helping keep mess away from your baby's skin. Extra soft materials provide belly comfort and protection from red marks during Tummy Time. Little Snugglers baby diapers are made with a breathable outer cover and are hypoallergenic, dermatologist tested and safe for sensitive skin. Huggies is the only leading brand entirely fragrance free*, our diapers are also made without parabens, lotions, elemental chlorine and natural rubber latex. Little Snugglers also feature a color-changing wetness indicator that lets you know when your baby’s diaper is ready to be changed. Featuring Disney Winnie the Pooh designs, Little Snugglers Diapers are available in size Preemie (up to 6 lbs), size Newborn (up to 10 lbs), size 1 (8-14 lbs), size 2 (12-18 lbs), size 3 (16-28 lbs), size 4 (22-37 lbs), size 5 (27+ lbs) and size 6 (35+ lbs). For the perfect diapering duo, pair Huggies diapers with Huggies Natural Care Sensitive Baby Wipes! (*among leading national diaper brands, across all offered variants)","['https://m.media-amazon.com/images/I/81xbzONjhrL._AC_SL1500_.jpg', 'https://m.media-amazon.com/images/I/81riYLCYTuL._AC_SL1500_.jpg', 'https://m.media-amazon.com/images/I/71NIvZPywKL._AC_SL1500_.jpg', 'https://m.media-amazon.com/images/I/815MD2KRw5L._AC_SL1500_.jpg', 'https://m.media-amazon.com/images/I/812-on7MSfL._AC_SL1500_.jpg', 'https://m.media-amazon.com/images/I/81jJX5avjdL._AC_SL1500_.jpg', 'https://m.media-amazon.com/images/I/81S9yBpF8cL._AC_SL1500_.jpg', 'https://m.media-amazon.com/images/I/71RoFl3HVwL._AC_SL1500_.jpg', 'https://m.media-amazon.com/images/I/71FdTI-ClLL._AC_SL1500_.jpg', 'https://m.media-amazon.com/images/I/81vU5gubtKL._AC_SL1500_.jpg', 'https://m.media-amazon.com/images/I/81WyY5WXKcL._AC_SL1500_.jpg', 'https://m.media-amazon.com/images/I/718BAtRZNGL._AC_SL1500_.jpg', 'https://m.media-amazon.com/images/I/81OYDoLIpSL._AC_SL1500_.jpg', 'https://m.media-amazon.com/images/I/71TmIirJPuL._AC_SL1500_.jpg']",10,Baby Products > Diapering > Disposable Diapers,https://www.amazon.com/-/dp/B07MP6VXRN?_encoding=UTF8&th=1&psc=1&pf_rd_i=desktop&ref_=pd_gw_unk,"size: Size 1, unit_count: 198",Size 1,,00036000495577,"{'Product Dimensions': '9 x 21.5 x 14.75 inches; 0.18 ounces', 'Manufacturer recommended age': '0 - 4 years', 'Item model number': '00036000495577', 'Department': 'Unisex Baby', 'Date First Available': 'February 21, 2019', 'Manufacturer': 'Kimberly-Clark Corp.', 'ASIN': 'B07MP6VXRN', 'Country of Origin': 'USA', 'Amazon Best Sellers Rank': '#5 in Baby , #2 in Disposable Diapers'}",B0CWRX39FV,"[{'size_name': 'Size 2', 'unit_count': '29', 'asin': 'B07M9Q91LP'}, {'size_name': 'Size 1', 'unit_count': '192', 'asin': 'B014OG8M1E'}, {'size_name': 'Size 1', 'unit_count': '198', 'asin': 'B07MP6VXRN'}, {'size_name': 'Size 3', 'unit_count': '162', 'asin': 'B00QQA23KI'}, {'size_name': 'Size 5', 'unit_count': '50', 'asin': 'B09PGZD7JQ'}, {'size_name': 'Newborn', 'unit_count': '76', 'asin': 'B09NS5FJ6D'}, {'size_name': 'Size 1', 'unit_count': '148', 'asin': 'B00HB0WIMK'}, {'size_name': 'Size 4', 'unit_count': '58', 'asin': 'B09NS4PQ9W'}, {'size_name': 'Size 1', 'unit_count': '168', 'asin': 'B07VZDMSZD'}, {'size_name': 'Size 1', 'unit_count': '216.0', 'asin': 'B00HB0WGAY'}, {'size_name': 'Size 4', 'unit_count': '120', 'asin': 'B07VZDMM5C'}, {'size_name': 'Size 6', 'unit_count': '96', 'asin': 'B08QRDLL7Y'}, {'size_name': 'Preemie', 'unit_count': '30', 'asin': 'B00J7PIH2C'}, {'size_name': 'Newborn', 'unit_count': '31', 'asin': 'B07M6FL57T'}, {'size_name': 'Size 4', 'unit_count': '140', 'asin': 'B07MDRNHYC'}, {'size_name': 'Size 3', 'unit_count': '136', 'asin': 'B07VY9KHY5'}, {'size_name': 'Size 4', 'unit_count': '22', 'asin': 'B07MYWDHNQ'}, {'size_name': 'Newborn', 'unit_count': '144', 'asin': 'B0CM4H9CSB'}, {'size_name': 'Size 3', 'unit_count': '68', 'asin': 'B0B1JQ69H1'}, {'size_name': 'Newborn', 'unit_count': '128', 'asin': 'B07MDRNNNZ'}, {'size_name': 'Size 2', 'unit_count': '148', 'asin': 'B07VY9JFR1'}, {'size_name': 'Size 3', 'unit_count': '26', 'asin': 'B07MYWC7XF'}, {'size_name': 'Size 5', 'unit_count': '120', 'asin': 'B07MRQ9PKY'}, {'size_name': 'Size 1', 'unit_count': '20', 'asin': 'B00GD8K1AW'}, {'size_name': 'Size 1', 'unit_count': '76', 'asin': 'B07MYJFN51'}, {'size_name': 'Size 1', 'unit_count': '84', 'asin': 'B09NS37ZHX'}, {'size_name': 'Size 6', 'unit_count': '44', 'asin': 'B0B1JP7JJ8'}, {'size_name': 'Newborn', 'unit_count': '88.0', 'asin': 'B00HJKP6PI'}, {'size_name': 'Size 1', 'unit_count': '32', 'asin': 'B07MB5PZBF'}, {'size_name': 'Size 3', 'unit_count': '76', 'asin': 'B07N93Y8PD'}, {'size_name': 'Size 3', 'unit_count': '156', 'asin': 'B07MKYKPCK'}, {'size_name': 'Size 5', 'unit_count': '104', 'asin': 'B07W1J299H'}, {'size_name': 'Size 2', 'unit_count': '180', 'asin': 'B07M6FLDVZ'}, {'size_name': 'Size 4', 'unit_count': '52', 'asin': 'B07MYD18HS'}, {'size_name': 'Newborn', 'unit_count': '288', 'asin': 'B0CFGDKTZN'}, {'size_name': 'Newborn', 'unit_count': '72', 'asin': 'B00N1VX7GO'}, {'size_name': 'Size 5', 'unit_count': '19', 'asin': 'B07MDB7KS4'}, {'size_name': 'Size 2', 'unit_count': '72', 'asin': 'B09NS85RFD'}]","{'size_name': ['Size 1', 'Size 2', 'Size 3', 'Size 4', 'Size 5', 'Size 6', 'Preemie', 'Newborn'], 'unit_count': ['20', '32', '76', '84', '96', '148', '168', '192', '198', '216.0', '29', '72', '180', '26', '68', '136', '156', '162', '22', '52', '58', '120', '140', '19', '50', '104', '44', '30', '31', '88.0', '128', '144', '288']}",new,"[{'title': 'Huggies Natural Care Sensitive Baby Wipes, Unscented, Hypoallergenic, 99% Purified Water, 12 Flip-Top Packs (768 Wipes Total), Packaging May Vary', 'link': 'https://www.amazon.com/HUGGIES-Natural-Unscented-Sensitive-Water-Based/dp/B07SCL613T/ref=pd_bxgy_d_sccl_1/000-0000000-0000000?pd_rd_w=BZf1I&content-id=amzn1.sym.3858a394-39a9-4946-90e6-86a3153d2546&pf_rd_p=3858a394-39a9-4946-90e6-86a3153d2546&pf_rd_r=5486WFCC4MH12FVTRMW9&pd_rd_wg=V6QxN&pd_rd_r=96ce91c0-172b-403b-8d04-d618c6f2c011&pd_rd_i=B07SCL613T&psc=1', 'price': '$22.99'}]","[{'badge': ""Amazon's Choice"", 'badge_text': None}]",90%,6%,2%,1%,1%
B08QRKY3NJ,"Huggies Simply Clean Fragrance-Free Baby Wipes, Unscented Diaper Wipes, 11 Flip-Top Packs (704 Wipes Total)",HUGGIES,$16.97,$16.97,"61,374",4.7,Amazon.com,,In Stock,,,True,,,True,"Huggies Simply Clean Fragrance-Free Baby Wipes: 11 flip-top packs of 64 unscented baby wipes (704 wipes total) - Family Wipes: These baby wipes are great for hands, faces and bottoms with a gentle and reliable clean for the whole family - Grab & Go: Cleans messes here, there and everywhere; take these unscented diaper wipes wherever you take messes - No Harsh Ingredients: Our diaper wipes are free of lotions, fragrances, parabens, alcohol, dyes and elemental chlorine; does not contain MIT or phenoxyethanol - Hypoallergenic & Dermatologist-Tested: Simply Clean Fragrance Free disposable wipes are hypoallergenic, dermatologist-tested and pH balanced to help maintain healthy skin - EZ Pull 1-Handed Dispensing: One-handed dispensing makes it easy to grab disposable diaper wipes without wasting sheets - Exclusive Disney Packaging: Simply Clean Fragrance Free unscented wipes packaging features exclusive Disney designs - Simply Clean Fragrance Free Unscented Baby Wipes Packaging may vary from image shown - Simply Clean Fragrance Free Unscented Baby Wipes Packaging may vary from image shown","Huggies Simply Clean Fragrance Free Baby Wipes offer convenience and cleanliness, making them a must-have for the whole family. Not only are they soft and safe for sensitive baby bottoms, but they can also be used to wipe hands and faces for toddlers and children. Kids outgrow diapers, not messes, so the Simply Clean unscented disposable wipes are the perfect solution wherever you go. These disposable diaper wipes are made with plant-based ingredients and have been for over 20 years to provide you and your baby a reliable clean. To help maintain healthy skin, the Simply Clean baby wipes are hypoallergenic, dermatologist-tested and pH-balanced. They also are fragrance free, alcohol free, paraben free and do not contain phenoxyethanol or MIT. The Huggies Simply Clean Baby Wipes feature flip-tops with EZ Pull 1-Handed Dispensing and exclusive Disney-themed packaging.","['https://m.media-amazon.com/images/I/71NCICgdEcL._AC_SL1500_.jpg', 'https://m.media-amazon.com/images/I/81dHYaT3YNL._AC_SL1500_.jpg', 'https://m.media-amazon.com/images/I/81LRQ-NAf0L._AC_SL1500_.jpg', 'https://m.media-amazon.com/images/I/71fk2tCC32L._AC_SL1500_.jpg', 'https://m.media-amazon.com/images/I/71I9YSroDZL._AC_SL1500_.jpg', 'https://m.media-amazon.com/images/I/7161rcuq9CL._AC_SL1500_.jpg', 'https://m.media-amazon.com/images/I/818oorPVqrL._AC_SL1500_.jpg', 'https://m.media-amazon.com/images/I/81ORMBkPk+L._AC_SL1500_.jpg']",10,Baby Products > Diapering > Wipes & Holders > Wipes & Refills,https://www.amazon.com/-/dp/B08QRKY3NJ?_encoding=UTF8&th=1&psc=1&pf_rd_i=desktop&ref_=pd_gw_unk,size: 64 Count (Pack of 11),64 Count (Pack of 11),,00036000536119,"{'Product Dimensions': '4.33 x 4.33 x 4.33 inches; 11.52 Pounds', 'Item model number': '00036000536119', 'Department': 'Unisex Baby', 'Date First Available': 'December 16, 2020', 'Manufacturer': 'Kimberly-Clark Corp.', 'ASIN': 'B08QRKY3NJ', 'Country of Origin': 'USA', 'Amazon Best Sellers Rank': '#9 in Baby , #5 in Diaper Wipes & Refills'}",B0CWRYW41J,"[{'size_name': '64 Count (Pack of 11)', 'asin': 'B08QRKY3NJ'}, {'size_name': '64 Count (Pack of 1)', 'asin': 'B078XYF78X'}, {'size_name': '64 Count (Pack of 3)', 'asin': 'B0795VNC6Z'}, {'size_name': '64 Count (Pack of 9)', 'asin': 'B078XXN56G'}]","{'size_name': ['64 Count (Pack of 1)', '64 Count (Pack of 3)', '64 Count (Pack of 9)', '64 Count (Pack of 11)']}",new,"[{'title': 'Pampers Sensitive Baby Wipes, Water Based, Hypoallergenic and Unscented, 16 Flip-Top Packs (1344 Wipes Total)', 'link': 'https://www.amazon.com/Pampers-Sensitive-Hypoallergenic-Unscented-Packaging/dp/B0CMVJXXZ2/ref=pd_bxgy_d_sccl_1/000-0000000-0000000?pd_rd_w=QaSeM&content-id=amzn1.sym.3858a394-39a9-4946-90e6-86a3153d2546&pf_rd_p=3858a394-39a9-4946-90e6-86a3153d2546&pf_rd_r=HZ0GTZ0TDSXNX6MQABSN&pd_rd_wg=AkCL2&pd_rd_r=33e430d4-d0e1-4f0b-a945-8071b7df0bdc&pd_rd_i=B0CMVJXXZ2&psc=1', 'price': '$39.94'}]","[{'badge': ""Amazon's Choice"", 'badge_text': None}]",85%,8%,3%,1%,2%
B07SXBX1DM,"Amazon Brand - Mama Bear Gentle Touch Diapers, Hypoallergenic, Size 5, 132 Count (4 packs of 33), White",Mama Bear,$34.70,$34.70,"58,203",4.3,Amazon.com,,In Stock,,,True,,,True,"IN THE BOX: Mama Bear Gentle Touch Diapers for babies; size 5; (4 packs of 33 diapers each, 132 total) - HYPOALLERGENIC & PARABEN-FREE: Dermatologist tested and hypoallergenic for baby’s sensitive skin; Free of chlorine bleaching, perfumes, lotions, parabens, and phthalates - LEAKAGE PROTECTION: Up to 12 hours of protection; Wetness Indicator shows when it’s time for a change - COMFORT FIT: Thin design with flexible fit for comfortable movement - BREATHEABLE COVER: Outer cover helps keep baby’s skin dry and healthy - SIZING RECOMMENDATION: First-time users, consider getting the size your child currently wears; if the fit is snug, size up - An Amazon brand; Bags contain 20% Post Consumer Recycled Materials","Mama Bear Gentle Touch Diapers. Gentle on skin. Cute on behinds. Our diapers offer trusted leakage protection, secure fit, and cozy comfort. They’re hypoallergenic and made with a soft, breathable outer cover to help keep your baby comfortable day and night. Our diapers are rigorously tested for quality and effectiveness, and your satisfaction is guaranteed.","['https://m.media-amazon.com/images/I/71lGOW28DoL._AC_SL1500_.jpg', 'https://m.media-amazon.com/images/I/71brlGWe9hL._AC_SL1500_.jpg', 'https://m.media-amazon.com/images/I/711Cw7AgEFL._AC_SL1500_.jpg', 'https://m.media-amazon.com/images/I/71-jcJr2-cL._AC_SL1500_.jpg', 'https://m.media-amazon.com/images/I/71823gcECiL._AC_SL1500_.jpg', 'https://m.media-amazon.com/images/I/71UHu4DWDEL._AC_SL1500_.jpg', 'https://m.media-amazon.com/images/I/716DK+gerqL._AC_SL1500_.jpg', 'https://m.media-amazon.com/images/I/71KqxCO6POL._AC_SL1500_.jpg']",10,Baby Products > Diapering > Disposable Diapers,https://www.amazon.com/-/dp/B07SXBX1DM?_encoding=UTF8&th=1&psc=1&pf_rd_i=desktop&ref_=pd_gw_unk,size: Size 5 (132 Count),Size 5 (132 Count),,,"{'Product Dimensions': '20.07 x 8.07 x 9.64 inches; 7.78 Pounds', 'Date First Available': 'September 28, 2019', 'Manufacturer': 'Amazon.com Services LLC.', 'ASIN': 'B07SXBX1DM', 'Country of Origin': 'USA', 'Amazon Best Sellers Rank': '#14 in Baby , #5 in Disposable Diapers'}",B0BMQ3G124,"[{'size_name': 'Size 7 (20 Count)', 'asin': 'B07T612L77'}, {'size_name': 'Size 2 (184 Count)', 'asin': 'B07SXBZQBX'}, {'size_name': 'Size 3 (42 Count)', 'asin': 'B07SZLKQJ9'}, {'size_name': 'Size 4 (148 Count)', 'asin': 'B07SV3XWZ7'}, {'size_name': 'Size 2 (46 Count)', 'asin': 'B07SZLLBBG'}, {'size_name': 'Size 3, 42 Count (Pack of 4)', 'asin': 'B07SYCRR58'}, {'size_name': 'Size 5 (132 Count)', 'asin': 'B07SXBX1DM'}, {'size_name': 'Size 1 (49 Count)', 'asin': 'B07T4WQRN1'}, {'size_name': 'Size 5 (33 Count) (Pack of 3)', 'asin': 'B0CPYLFGWB'}, {'size_name': 'Size 6 (108 Count)', 'asin': 'B07SXBZQCG'}, {'size_name': 'Size 3 (42 Count) (Pack of 3)', 'asin': 'B0CPYNX78R'}, {'size_name': 'Size 6 (27 Count)', 'asin': 'B07T2QM32L'}, {'size_name': 'Size 7 (80 Count)', 'asin': 'B07SYCRDR8'}, {'size_name': 'Newborn (30 Count)', 'asin': 'B07T3SD4XY'}, {'size_name': 'Size 6 (27 Count) (Pack of 3)', 'asin': 'B0CPYMV46H'}, {'size_name': 'Size 5 (33 Count)', 'asin': 'B07T4WQRNJ'}, {'size_name': 'Size 4 (37 Count) (Pack of 3)', 'asin': 'B0CPYKJT7Q'}, {'size_name': 'Newborn, 30 Count (Pack of 4)', 'asin': 'B07ST1YMH1'}, {'size_name': 'Size 4 (37 Count)', 'asin': 'B07T1PYLGL'}, {'size_name': 'Size 1 (196 Count)', 'asin': 'B07SYCR7QY'}]","{'size_name': ['Size 1 (49 Count)', 'Size 1 (196 Count)', 'Size 2 (46 Count)', 'Size 2 (184 Count)', 'Size 3 (42 Count)', 'Size 3 (42 Count) (Pack of 3)', 'Size 3, 42 Count (Pack of 4)', 'Size 4 (37 Count)', 'Size 4 (37 Count) (Pack of 3)', 'Size 4 (148 Count)', 'Size 5 (33 Count)', 'Size 5 (33 Count) (Pack of 3)', 'Size 5 (132 Count)', 'Size 6 (27 Count)', 'Size 6 (27 Count) (Pack of 3)', 'Size 6 (108 Count)', 'Size 7 (20 Count)', 'Size 7 (80 Count)', 'Newborn (30 Count)', 'Newborn, 30 Count (Pack of 4)']}",new,"[{'title': 'Amazon Elements Baby Wipes, Unscented, Hypoallergenic, 810 Count, Flip-Top Packs, Pack of 9', 'link': 'https://www.amazon.com/Amazon-Elements-Wipes-Unscented-Flip-Top/dp/B07H53W5WP/ref=pd_bxgy_d_sccl_1/000-0000000-0000000?pd_rd_w=kqs7g&content-id=amzn1.sym.3858a394-39a9-4946-90e6-86a3153d2546&pf_rd_p=3858a394-39a9-4946-90e6-86a3153d2546&pf_rd_r=HC3FXSZMC8RZT6ESW24A&pd_rd_wg=u4hBn&pd_rd_r=94b21bee-f91d-4adb-a83c-2f1030da2bde&pd_rd_i=B07H53W5WP&psc=1', 'price': '$22.25'}, {'title': 'Desitin Daily Defense Baby Diaper Rash Cream with Zinc Oxide to Treat, Relieve & Prevent diaper rash, Hypoallergenic, Dye-, Phthalate- & Paraben-Free, 4.8 oz', 'link': 'https://www.amazon.com/Desitin-Defense-Hypoallergenic-Phthalate-Paraben-Free/dp/B07H7GBJC4/ref=pd_bxgy_d_sccl_2/000-0000000-0000000?pd_rd_w=kqs7g&content-id=amzn1.sym.3858a394-39a9-4946-90e6-86a3153d2546&pf_rd_p=3858a394-39a9-4946-90e6-86a3153d2546&pf_rd_r=HC3FXSZMC8RZT6ESW24A&pd_rd_wg=u4hBn&pd_rd_r=94b21bee-f91d-4adb-a83c-2f1030da2bde&pd_rd_i=B07H7GBJC4&psc=1', 'price': '$7.19'}]","[{'badge': ""Amazon's Choice"", 'badge_text': None}]",68%,12%,8%,5%,7%
