asin,name,brand,price,regular_price,total_reviews,average_rating,seller,seller_url,availability_status,availability_quantity,shipping_charge,is_prime,author,available_book_formats,is_aplus_page,small_description,full_description,images,video_count,productCategory,url,attributes,size,color,model,product_information,parent_asin,variation_asin,product_variations,product_condition,frequently_bought_together,product_badges,five_star,four_star,three_star,two_star,one_star
B000VDR8LA,"Fresh Step Clumping Cat Litter Multi-Cat Extra Strength Formula With Febreze Freshness, Multi Cat Litter With Ammonia Block Technology, 14 lb. Box",Fresh Step,$9.99,$9.99,"78,582",4.6,Amazon.com,,In Stock,,,True,,,True,"MULTI-CAT CLUMPING LITTER: Made with larger particles to keep paws and floors clean, and 99.9% dust-free while fighting litter box odors with the power of Febreze in a Fresh Scent; Packaging may vary - ODOR CONTROL MULTI-CAT LITTER: Formulated with Ammonia Block Technology, this litter has a 10-day odor control guarantee, as it controls bacterial odor growth and keeps ammonia odors away from your litter box and home - 99.9% DUST FREE LITTER: Keep surfaces cleaner and the air clearer with this low dust formula; The paw activated litter releases a Febreze freshness scent with each step your cat makes in the litter box - SCOOPABLE KITTY LITTER: Clumping litter with ClumpLock technology absorbs liquid and forms tight clumps to minimize the crumbles left behind, making clean up fast and easy - FRESH STEP CAT LITTER: Fight litter box odors with your cat’s health and happiness in mind; Certain trademarks used under license from The Procter & Gamble Company or its affiliates","Fight litter box odors in your multi-cat home with Fresh Step Multi-Cat Clumping Cat Litter. Featuring an extra-strength formula, this Fresh Step clumping cat litter delivers even more odor-fighting protection with the power of Febreze to leave behind a fresh, clean scent. This multi cat litter uses Ammonia Block technology to guarantee 10 days of odor control in your multi cat litter box (1). Featuring ClumpLock technology, the Fresh Step litter multi cat formula locks in liquid and cat urine odor on contact to form tight clumps. This makes scooping your kitty litter box quick and effortless, and it helps prevent crumbles from being left behind. In addition to easy cat litter clumping, the cat litter has a low-dust formula to help keep surfaces cleaner in your home. Enjoy more catnaps and cuddle time with your kitty when you choose Fresh Step cat litter. (1) See package for more information on terms and conditions","['https://m.media-amazon.com/images/I/81BiWXf8BsL._AC_SL1500_.jpg', 'https://m.media-amazon.com/images/I/81213cDYqFL._AC_SL1500_.jpg', 'https://m.media-amazon.com/images/I/81EUvZYxxbL._AC_SL1500_.jpg', 'https://m.media-amazon.com/images/I/71K+UPu5W1L._AC_SL1500_.jpg', 'https://m.media-amazon.com/images/I/81nj0N9jmWL._AC_SL1500_.jpg', 'https://m.media-amazon.com/images/I/71pjdHDEhtL._AC_SL1500_.jpg', 'https://m.media-amazon.com/images/I/81qt6e9SyLL._AC_SL1500_.jpg', 'https://m.media-amazon.com/images/I/71KkyBaH3JL._AC_SL1500_.jpg', 'https://m.media-amazon.com/images/I/61mzKGwiNyL._AC_SL1500_.jpg', 'https://m.media-amazon.com/images/I/818YXN5h5iL._AC_SL1500_.jpg', 'https://m.media-amazon.com/images/I/81xdkGYcPgL._AC_SL1500_.jpg', 'https://m.media-amazon.com/images/I/91pcFuTFtaL._AC_SL1500_.jpg', 'https://m.media-amazon.com/images/I/91354sCwXoL._AC_SL1500_.jpg']",10,Pet Supplies > Cats > Litter & Housebreaking > Litter,https://www.amazon.com/-/dp/B000VDR8LA?_encoding=UTF8&th=1&psc=1&pf_rd_i=desktop&ref_=pd_gw_unk,scent: Multi-Cat,,,02049,"{'Item Weight': '14.8 Pounds', 'Manufacturer': 'Fresh Step', 'ASIN': 'B000VDR8LA', 'Country of Origin': 'USA', 'Item model number': '02049', 'Date First Available': 'September 17, 2014', 'Item Package Dimensions L x W x H': '11.23 x 10.34 x 4.34 inches', 'Item Dimensions LxWxH': '10.13 x 4.19 x 10.13 inches', 'Brand Name': 'Fresh Step', 'Target Audience Keyword': 'house-cats', 'Directions': 'For best results, do not mix with non clumping cat litter. For first time use, start with an empty, clean cat litter box. Fill it with 3 to 4 inches of Fresh Step Cat Litter. Remove clumps and solids daily and dispose in trash. Do not flush. The rest of the litter stays fresh. Add more Fresh Step Cat Litter to refresh your litter box each time you scoop. Maintain level of litter at 3 to 4 inches.', 'Model Name': 'Fresh Step-Multi Cat', 'Color': '14 lb', 'Size': '14 lb', 'Material': 'Clay', 'Age Range Description': 'Adult', 'Number of Items': '1', 'Style': 'Multi-Cat', 'Breed Recommendation': 'All Breed Sizes', 'Included Components': '1 14.0 lb carton', 'Specific Uses for Product': 'Indoor', 'Is Discontinued By Manufacturer': 'No', 'Product Dimensions': '10.13 x 4.19 x 10.13 inches; 14.8 Pounds', 'Amazon Best Sellers Rank': '#4 in Pet Supplies , #2 in Cat Litter'}",B0DK194FS7,"[{'scent_name': 'Gain Scented', 'asin': 'B08CPQVT5N'}, {'scent_name': 'Multi-Cat', 'asin': 'B000VDR8LA'}, {'scent_name': 'Extreme', 'asin': 'B0747RSKTG'}, {'scent_name': 'Unscented', 'asin': 'B0CQDGCQCX'}]","{'scent_name': ['Extreme', 'Gain Scented', 'Multi-Cat', 'Unscented']}",new,"[{'title': 'Meow Mix Original Choice Dry Cat Food, 6.3 Pound, Complete & Balanced Nutrition', 'link': 'https://www.amazon.com/Meow-Mix-Original-Dry-Food/dp/B007JXVR76/ref=pd_bxgy_d_sccl_1/130-8659367-6704410?pd_rd_w=9y3uT&content-id=amzn1.sym.3858a394-39a9-4946-90e6-86a3153d2546&pf_rd_p=3858a394-39a9-4946-90e6-86a3153d2546&pf_rd_r=9Y8QZETNZY5NJM344X24&pd_rd_wg=16mAS&pd_rd_r=51ca7f04-a1c8-4d76-8082-844ebd0bd3a9&pd_rd_i=B007JXVR76&psc=1', 'price': '$8.45'}, {'title': 'Fresh Step Extreme Clumping Litter With Febreze Freshness, Mountain Spring Scent Clumping Cat Litter With Guaranteed Odor Control, 14 lb. Box', 'link': 'https://www.amazon.com/Fresh-Step-Extreme-Control-Scoopable/dp/B0747RSKTG/ref=pd_bxgy_d_sccl_2/130-8659367-6704410?pd_rd_w=9y3uT&content-id=amzn1.sym.3858a394-39a9-4946-90e6-86a3153d2546&pf_rd_p=3858a394-39a9-4946-90e6-86a3153d2546&pf_rd_r=9Y8QZETNZY5NJM344X24&pd_rd_wg=16mAS&pd_rd_r=51ca7f04-a1c8-4d76-8082-844ebd0bd3a9&pd_rd_i=B0747RSKTG&psc=1', 'price': '$11.39'}]",[],77%,12%,6%,2%,3%
B0009YWKUA,"Blue Buffalo Life Protection Formula Adult Dry Dog Food, Helps Build and Maintain Strong Muscles, Made with Natural Ingredients, Chicken & Brown Rice Recipe, 30-lb. Bag",Blue Buffalo,$64.98,$64.98,"48,022",4.6,Amazon.com,,In Stock,,,True,,,True,"REAL CHICKEN FIRST: Blue Buffalo's premium dog food features high quality deboned chicken as the primary ingredient; brown rice, cranberries and vegetables for a balanced diet; and high quality protein that promotes strong muscles - HIGH QUALITY NATURAL FOOD: BLUE's natural dry dog food is made with premium ingredients and contains no chicken or poultry by-products, corn, wheat or soy - THE PERFECT BALANCE OF FLAVOR AND NUTRITION: Formulated with essential proteins and carbs for energy needs and Omega-3 & 6 fatty acids to promote healthy skin and coat - CONTAINS IMMUNITY-BOOSTING LIFESOURCE BITS: LifeSource Bits contain a precise blend of antioxidants, vitamins and minerals to support immune system health, life stage needs and a healthy oxidative balance - Contains: One (1) 30-lb. bag of BLUE Life Protection Formula Natural Chicken and Brown Rice Flavor - ENHANCED IMAGERY: We have enhanced our digital product packaging to highlight our products’ ingredients and essential benefits; While the physical packaging will differ slightly, all information is accurate","Formulated for the health and well-being of adult dogs, BLUE Life Protection Formula Chicken and Brown Rice dry dog food is made with the finest natural ingredients enhanced with vitamins, minerals, and other nutrients. It’s a high-quality, balanced recipe you can both feel great about. Designed to help your dog thrive, this formula starts with real chicken and contains no chicken (or poultry) by-product meals, no corn, wheat, or soy, and no artificial flavors or preservatives. Like all BLUE dry foods, BLUE Life Protection Formula includes exclusive, antioxidant-rich LifeSource Bits to support a healthy immune system in your adult dog. Give your dog the balanced nutrition of BLUE Life Protection Formula today. BLUE Life Protection Formula is brought to you by Blue Buffalo, the leader in natural pet food. Blue Buffalo makes premium-quality pet foods featuring real meat, fruit, and vegetables. Love them like family. Feed them like family.","['https://m.media-amazon.com/images/I/71jQsmvE0pL._AC_SL1500_.jpg', 'https://m.media-amazon.com/images/I/71ikzZ7bGqL._AC_SL1500_.jpg', 'https://m.media-amazon.com/images/I/71GwxqTKhvL._AC_SL1500_.jpg', 'https://m.media-amazon.com/images/I/81GepT8hwhL._AC_SL1500_.jpg', 'https://m.media-amazon.com/images/I/81HHcrP+49L._AC_SL1500_.jpg', 'https://m.media-amazon.com/images/I/81GjSAyaP6L._AC_SL1500_.jpg', 'https://m.media-amazon.com/images/I/71E5Wojhn8L._AC_SL1500_.jpg', 'https://m.media-amazon.com/images/I/81110xZvC8L._AC_SL1500_.jpg', 'https://m.media-amazon.com/images/I/81f4j6GK26L._AC_SL1500_.jpg', 'https://m.media-amazon.com/images/I/81uV8xLCfbL._AC_SL1500_.jpg', 'https://m.media-amazon.com/images/I/81ldlB9zDBL._AC_SL1500_.jpg']",10,Pet Supplies > Dogs > Food > Dry,https://www.amazon.com/-/dp/B0009YWKUA?_encoding=UTF8&th=1&psc=1&pf_rd_i=desktop&ref_=pd_gw_unk,"size: 30 Pound (Pack of 1), flavor: Chicken & Brown Rice",30 Pound (Pack of 1),,800154,"{'Is Discontinued By Manufacturer': 'No', 'Product Dimensions': '25.5 x 16 x 5 inches; 30.28 Pounds', 'Manufacturer recommended age': '1 month and up', 'Item model number': '800154', 'Department': 'dog-dry-food', 'Date First Available': 'October 1, 2004', 'Manufacturer': 'Blue Buffalo Company, Ltd', 'ASIN': 'B0009YWKUA', 'Country of Origin': 'USA', 'Amazon Best Sellers Rank': '#7 in Pet Supplies , #1 in Dry Dog Food'}",B0D2XDY6VD,"[{'size_name': '6 Pound (Pack of 1)', 'flavor_name': 'Healthy Weight Chicken & Brown Rice', 'asin': 'B0009YUI7M'}, {'size_name': '15 Pound (Pack of 1)', 'flavor_name': 'Healthy Weight Chicken & Brown Rice', 'asin': 'B0009YWMVM'}, {'size_name': '5 Pound (Pack of 1)', 'flavor_name': 'Chicken & Brown Rice', 'asin': 'B09K8YYVWV'}, {'size_name': '15 Pound (Pack of 1)', 'flavor_name': 'Lamb & Brown Rice Recipe', 'asin': 'B0BNHRXMGT'}, {'size_name': '5 Pound (Pack of 1)', 'flavor_name': 'Beef & Brown Rice', 'asin': 'B09K8M96MD'}, {'size_name': '30 Pound (Pack of 1)', 'flavor_name': 'Beef & Brown Rice', 'asin': 'B09MVC3QFQ'}, {'size_name': '30 Pound (Pack of 1)', 'flavor_name': 'Fish & Brown Rice', 'asin': 'B000XZFZI4'}, {'size_name': '34 Pound (Pack of 1)', 'flavor_name': 'Lamb & Brown Rice', 'asin': 'B09K8ZZJTB'}, {'size_name': '15 Pound (Pack of 1)', 'flavor_name': 'Small Bite Chicken & Brown Rice', 'asin': 'B00CTJ8D2W'}, {'size_name': '34 Pound (Pack of 1)', 'flavor_name': 'Chicken & Brown Rice', 'asin': 'B09K8MHNQ9'}, {'size_name': '15 Pound (Pack of 1)', 'flavor_name': 'Fish & Brown Rice', 'asin': 'B000XZA09I'}, {'size_name': '30 Pound (Pack of 1)', 'flavor_name': 'Lamb & Brown Rice', 'asin': 'B000XZBXP8'}, {'size_name': '34 Pound (Pack of 1)', 'flavor_name': 'Small Bite Chicken & Brown Rice', 'asin': 'B09K8T6N6Y'}, {'size_name': '30 Pound (Pack of 1)', 'flavor_name': 'Chicken & Brown Rice', 'asin': 'B0009YWKUA'}, {'size_name': '6 Pound (Pack of 1)', 'flavor_name': 'Chicken and Brown Rice Recipe', 'asin': 'B0030N7BJC'}, {'size_name': '30 Pound (Pack of 1)', 'flavor_name': 'Small Bite Chicken & Brown Rice', 'asin': 'B00CTJ8E8K'}, {'size_name': '24 Pound (Pack of 1)', 'flavor_name': 'Lamb', 'asin': 'B0CN1S737Y'}, {'size_name': '30 Pound (Pack of 1)', 'flavor_name': 'Healthy Weight Chicken & Brown Rice', 'asin': 'B0009YUI86'}, {'size_name': '34 Pound (Pack of 1)', 'flavor_name': 'Healthy Weight Chicken & Brown Rice', 'asin': 'B09K9JDZS4'}, {'size_name': '34 Pound (Pack of 1)', 'flavor_name': 'Fish & Brown Rice', 'asin': 'B09K8PG98V'}, {'size_name': '34 Pound (Pack of 1)', 'flavor_name': 'Beef & Brown Rice', 'asin': 'B09K8VQJ77'}, {'size_name': '15 Pound (Pack of 1)', 'flavor_name': 'Beef & Brown Rice', 'asin': 'B09K8MBYBQ'}, {'size_name': '5 Pound (Pack of 1)', 'flavor_name': 'Healthy Weight Chicken & Brown Rice', 'asin': 'B09K8XV4ZS'}, {'size_name': '15 Pound (Pack of 1)', 'flavor_name': 'Chicken & Brown Rice', 'asin': 'B0009YUGAG'}]","{'size_name': ['5 Pound (Pack of 1)', '6 Pound (Pack of 1)', '15 Pound (Pack of 1)', '24 Pound (Pack of 1)', '30 Pound (Pack of 1)', '34 Pound (Pack of 1)'], 'flavor_name': ['Small Bite Chicken & Brown Rice', 'Beef & Brown Rice', 'Chicken & Brown Rice', 'Chicken and Brown Rice Recipe', 'Fish & Brown Rice', 'Healthy Weight Chicken & Brown Rice', 'Lamb', 'Lamb & Brown Rice', 'Lamb & Brown Rice Recipe']}",new,"[{'title': 'Blue Buffalo Homestyle Recipe Natural Adult Wet Dog Food Variety Pack, Chicken & Beef 12.5 oz cans (6 Count- 3 of Each Flavor)', 'link': 'https://www.amazon.com/Blue-Buffalo-Homestyle-Chicken-Variety/dp/B0BMDXQ4FF/ref=pd_bxgy_d_sccl_1/000-0000000-0000000?pd_rd_w=bZm5C&content-id=amzn1.sym.3858a394-39a9-4946-90e6-86a3153d2546&pf_rd_p=3858a394-39a9-4946-90e6-86a3153d2546&pf_rd_r=R4HSPZKTXCG5NDPXGE7M&pd_rd_wg=NtQOR&pd_rd_r=eb2935e1-6cc9-4356-9def-7308015681eb&pd_rd_i=B0BMDXQ4FF&psc=1', 'price': '$17.58'}, {'title': 'Blue Buffalo Life Protection Formula Senior Dry Dog Food, Supports Joint Health and Mobility, Made with Natural Ingredients, Chicken & Brown Rice Recipe, 30-lb. Bag', 'link': 'https://www.amazon.com/Blue-Buffalo-Protection-Formula-Senior/dp/B0009YUGA6/ref=pd_bxgy_d_sccl_2/000-0000000-0000000?pd_rd_w=bZm5C&content-id=amzn1.sym.3858a394-39a9-4946-90e6-86a3153d2546&pf_rd_p=3858a394-39a9-4946-90e6-86a3153d2546&pf_rd_r=R4HSPZKTXCG5NDPXGE7M&pd_rd_wg=NtQOR&pd_rd_r=eb2935e1-6cc9-4356-9def-7308015681eb&pd_rd_i=B0009YUGA6&psc=1', 'price': '$64.98'}]",[],80%,11%,4%,1%,3%
B01LNB6SA0,"Temptations Classic Crunchy and Soft Cat Treats Tasty Chicken Flavor, 30 oz. Tub",Temptations,$15.48,$15.48,"71,324",4.8,Amazon.com,,In Stock,,,True,,,True,"Cats Lose Their Cool: Your cat can’t wait to get their paws on these irresistible cat treats that are crunchy on the outside and soft on the inside, so shake the pack, and they’ll come running. - Under 2 Calories Per Treat: Feel good about rewarding your cat every day because each crunchy cat treat is under 2 calories and can be used as a cat snack, meal, or cat food topper. - 100% Complete and Balanced For Adult Cats: Feel great about treating your phenomenal feline with a cat treat that’s 100% nutritionally complete and balanced for adult cat maintenance. - Convenient Stay-Fresh Tub: Resealable tub make for easy treating and keeps your cat’s paws off when you’re not watching. - 30 oz. Tub: Contains one (1) 30 oz. tub of Temptations Classic Cat Treats Tasty Chicken Flavor.","Cats love the delicious, crunchy taste of Temptations, so give your cat purr-worthy Temptations Classic Crunchy and Soft Cat Treats Tasty Chicken Flavor, and they’ll come running the moment you open the pack. Each of these chicken-flavored cat treats has less than 2 calories and provides an irresistible combination of both crunchy and soft textures. They also come in a stay-fresh tub, so your feline friend can enjoy their favorite cat snack when you open it, but not when they shouldn’t! These Temptations Classic Cat Treats are a perfect addition to your cat’s regular feeding routine: Use them as a treat, a meal, or a cat food topper. Temptations Classic Cat Treats are the purr-fect way to show your feline friend how much you care.","['https://m.media-amazon.com/images/I/8108Aln7zcL._AC_SL1500_.jpg', 'https://m.media-amazon.com/images/I/81P3GAjyGHL._AC_SL1500_.jpg', 'https://m.media-amazon.com/images/I/71qqVWHNRWL._AC_SL1500_.jpg', 'https://m.media-amazon.com/images/I/417cfj7QtyL._AC_.jpg', 'https://m.media-amazon.com/images/I/7131icTkm5L._AC_SL1500_.jpg', 'https://m.media-amazon.com/images/I/81k8sE++9gL._AC_SL1500_.jpg', 'https://m.media-amazon.com/images/I/81-G0N1LViL._AC_SL1500_.jpg', 'https://m.media-amazon.com/images/I/812fqYW38YL._AC_SL1500_.jpg', 'https://m.media-amazon.com/images/I/616rWOyWzaL._AC_SL1500_.jpg', 'https://m.media-amazon.com/images/I/71pMN8YrIKL._AC_SL1500_.jpg', 'https://m.media-amazon.com/images/I/81OozQj2WYL._AC_SL1500_.jpg', 'https://m.media-amazon.com/images/I/814mF+39b0L._AC_SL1500_.jpg', 'https://m.media-amazon.com/images/I/81hFe+hQqkL._AC_SL1500_.jpg', 'https://m.media-amazon.com/images/I/81EFhD0uNIL._AC_SL1500_.jpg']",10,Pet Supplies > Cats > Treats > Snacks > Crunchy Treats,https://www.amazon.com/-/dp/B01LNB6SA0?_encoding=UTF8&th=1&psc=1&pf_rd_i=desktop&ref_=pd_gw_unk,"size: 1.88 Pound (Pack of 1), flavor: Chicken",1.88 Pound (Pack of 1),,10149930,"{'Is Discontinued By Manufacturer': 'No', 'Product Dimensions': '5.5 x 5 x 7.28 inches; 1.88 Pounds', 'Item model number': '10149930', 'Date First Available': 'August 23, 2016', 'Manufacturer': 'Mars Petcare', 'ASIN': 'B01LNB6SA0', 'Country of Origin': 'Canada', 'Amazon Best Sellers Rank': '#9 in Pet Supplies , #1 in Crunchy Cat Treats'}",B0CVR27QGV,"[{'size_name': '0.63 Ounce (Pack of 10)', 'flavor_name': 'Chicken', 'asin': 'B0029O0XGQ'}, {'size_name': '1 Pound (Pack of 1)', 'flavor_name': 'Dairy', 'asin': 'B00OLSARSW'}, {'size_name': '3 Ounce (Pack of 12)', 'flavor_name': 'Dairy', 'asin': 'B00BIZO9YO'}, {'size_name': '1.88 Pound (Pack of 1)', 'flavor_name': 'Chicken', 'asin': 'B01LNB6SA0'}, {'size_name': '1 Pound (Pack of 2)', 'flavor_name': 'Dairy', 'asin': 'B0D7VQ7LWT'}, {'size_name': '1 Pound (Pack of 1)', 'flavor_name': 'Chicken', 'asin': 'B00IOTB7PG'}, {'size_name': '3 Pound (Pack of 1)', 'flavor_name': 'Chicken', 'asin': 'B09DQ753C4'}, {'size_name': '6.3 Ounce (Pack of 10)', 'flavor_name': 'Dairy', 'asin': 'B00AAUVSB0'}, {'size_name': '3 Ounce (Pack of 12)', 'flavor_name': 'Chicken', 'asin': 'B00BIZO89K'}]","{'size_name': ['0.63 Ounce (Pack of 10)', '3 Ounce (Pack of 12)', '6.3 Ounce (Pack of 10)', '1 Pound (Pack of 1)', '1 Pound (Pack of 2)', '1.88 Pound (Pack of 1)', '3 Pound (Pack of 1)'], 'flavor_name': ['Chicken', 'Dairy']}",new,"[{'title': 'Temptations MixUps Backyard Cookout Flavor Crunchy and Soft Cat Treats, 30 oz. Tub', 'link': 'https://www.amazon.com/Temptations-Mixups-Backyard-Cookout-Holiday/dp/B01MXZW6RV/ref=pd_bxgy_d_sccl_1/000-0000000-0000000?pd_rd_w=5zXA6&content-id=amzn1.sym.3858a394-39a9-4946-90e6-86a3153d2546&pf_rd_p=3858a394-39a9-4946-90e6-86a3153d2546&pf_rd_r=RQVRR6ACPPTGJABSMTW8&pd_rd_wg=rMPGu&pd_rd_r=215540c5-822b-42bf-a5b7-f204aac28614&pd_rd_i=B01MXZW6RV&psc=1', 'price': '$15.48'}, {'title': 'TEMPTATIONS Classic Crunchy and Soft Cat Treats, SEAFOOD MEDLEY, Multiple Sizes', 'link': 'https://www.amazon.com/TEMPTATIONS-Classic-Crunchy-SEAFOOD-Multiple/dp/B01LNB6SKU/ref=pd_bxgy_d_sccl_2/000-0000000-0000000?pd_rd_w=5zXA6&content-id=amzn1.sym.3858a394-39a9-4946-90e6-86a3153d2546&pf_rd_p=3858a394-39a9-4946-90e6-86a3153d2546&pf_rd_r=RQVRR6ACPPTGJABSMTW8&pd_rd_wg=rMPGu&pd_rd_r=215540c5-822b-42bf-a5b7-f204aac28614&pd_rd_i=B01LNB6SKU&psc=1', 'price': '$15.48'}]",[],88%,7%,2%,1%,2%
B001650NNW,"Purina Pro Plan Veterinary Supplements FortiFlora Dog Probiotic Supplement, Canine Nutritional Supplement - 30 Ct. Box",Pro Plan Veterinary Diets,$30.99,$37.19,"45,990",4.7,Amazon.com,,In Stock,,,True,,,True,"Number one probiotic supplement recommended by veterinarians (Kantar Veterinary Tracker, 2020) - Probiotic supplement for the dietary management of puppies and adult dogs with diarrhea - Contains a probiotic for dogs proven to promote intestinal health and balance - Promotes a strong immune system and contains antioxidants for dogs - Easy-to-feed dog supplement powder","Provide specialized support for your dog by introducing Purina Pro Plan Veterinary Diets FortiFlora Probiotic for Dogs Powder Supplement to their diet. This FortiFlora Purina probiotics for dogs contains a strain proven to promote intestinal health and balance. Formulated for the dietary management of dogs with diarrhea, this safe and effective probiotic digestive support dog food supplement powder is simple to administer by adding it to your dog’s regular food. Each packet of these digestive dog food supplements contains a guaranteed level of live microorganisms that help promote beneficial intestinal microflora. A proprietary microencapsulation process helps enhance the stability and survival of the probiotics until they reach your dog’s intestinal tract. This probiotic supplement contains antioxidants and also offers immune support for dogs. These gentle digestive probiotic for dogs also helps reduce gas in dogs. FortiFlora probiotics for dogs are appropriate for administration to both puppies and adult dogs.","['https://m.media-amazon.com/images/I/71NHJn8UsCL._AC_SL1500_.jpg', 'https://m.media-amazon.com/images/I/81Xr3rg9RgL._AC_SL1500_.jpg', 'https://m.media-amazon.com/images/I/71a2P29eUkL._AC_SL1500_.jpg', 'https://m.media-amazon.com/images/I/81cNalM+VDL._AC_SL1500_.jpg', 'https://m.media-amazon.com/images/I/71OYZyUnrDL._AC_SL1500_.jpg', 'https://m.media-amazon.com/images/I/61UEVEJUK-L._AC_SL1500_.jpg', 'https://m.media-amazon.com/images/I/71zayJCIYwL._AC_SL1500_.jpg', 'https://m.media-amazon.com/images/I/71rM8pRHlJL._AC_SL1500_.jpg', 'https://m.media-amazon.com/images/I/91Uc94dEjFL._AC_SL1500_.jpg']",10,Pet Supplies > Dogs > Health Supplies > Supplements & Vitamins > Probiotics,https://www.amazon.com/-/dp/B001650NNW?_encoding=UTF8&th=1&psc=1&pf_rd_i=desktop&ref_=pd_gw_unk,"size: 30 Count (Pack of 1), style: Powder Sachets",30 Count (Pack of 1),,30011,"{'Is Discontinued By Manufacturer': 'No', 'Product Dimensions': '3 x 2.25 x 3.25 inches; 1.06 ounces', 'Item model number': '30011', 'Department': 'dog-vitamins-supplements', 'Date First Available': 'December 20, 2002', 'Manufacturer': 'Nestle Purina Pet', 'ASIN': 'B001650NNW', 'Country of Origin': 'USA', 'Amazon Best Sellers Rank': '#8 in Pet Supplies , #1 in Dog Probiotic Supplements'}",B0B4YVRW9Z,"[{'size_name': '30 Count (Pack of 1)', 'style_name': 'Powder Sachets', 'asin': 'B001650NNW'}, {'size_name': '45 Count (Pack of 1)', 'style_name': 'Chewable Tablets', 'asin': 'B083XLYRYH'}, {'size_name': '90 Count (Pack of 1)', 'style_name': 'Chewable Tablets', 'asin': 'B083XD2V4C'}]","{'size_name': ['30 Count (Pack of 1)', '45 Count (Pack of 1)', '90 Count (Pack of 1)'], 'style_name': ['Chewable Tablets', 'Powder Sachets']}",new,"[{'title': 'Purina Pro Plan Veterinary Supplements FortiFlora Cat Probiotic Supplement for Cats with Diarrhea - 30 ct. Box', 'link': 'https://www.amazon.com/Purina-Veterinary-Fortiflora-Nutritional-Supplement/dp/B001650OE0/ref=pd_bxgy_d_sccl_1/000-0000000-0000000?pd_rd_w=58O5K&content-id=amzn1.sym.3858a394-39a9-4946-90e6-86a3153d2546&pf_rd_p=3858a394-39a9-4946-90e6-86a3153d2546&pf_rd_r=ZBECM0Y1H1W0DDHNPNFM&pd_rd_wg=3dQ1g&pd_rd_r=b0d4fceb-bd22-497b-8ad3-dd1edeab9724&pd_rd_i=B001650OE0&psc=1', 'price': '$30.99'}, {'title': 'Vetoquinol Pro-Pectalin Oral Paste for Dogs & Cats – 30cc, Chicken Flavor – Helps Reduce Occasional Loose Stool & Diarrhea, Balance Gut pH, Support Normal Digestion & Intestinal Flora', 'link': 'https://www.amazon.com/Vetoquinol-Pro-Pectalin-Paste-Dogs-Cats/dp/B00AMEBAXK/ref=pd_bxgy_d_sccl_2/000-0000000-0000000?pd_rd_w=58O5K&content-id=amzn1.sym.3858a394-39a9-4946-90e6-86a3153d2546&pf_rd_p=3858a394-39a9-4946-90e6-86a3153d2546&pf_rd_r=ZBECM0Y1H1W0DDHNPNFM&pd_rd_wg=3dQ1g&pd_rd_r=b0d4fceb-bd22-497b-8ad3-dd1edeab9724&pd_rd_i=B00AMEBAXK&psc=1', 'price': '$22.49'}]","[{'badge': ""Amazon's Choice"", 'badge_text': None}]",83%,10%,4%,1%,2%
