asin,name,brand,price,regular_price,total_reviews,average_rating,seller,seller_url,availability_status,availability_quantity,shipping_charge,is_prime,author,available_book_formats,is_aplus_page,small_description,full_description,images,video_count,productCategory,url,attributes,size,color,model,product_information,parent_asin,variation_asin,product_variations,product_condition,frequently_bought_together,product_badges,five_star,four_star,three_star,two_star,one_star
B0CZPLV566,"Beats Solo 4 - Wireless Bluetooth On-Ear Headphones, Apple & Android Compatible, Up to 50 Hours of Battery Life - Matte Black",Beats,$129.99,$199.95,"1,834",4.5,Amazon.com,,In Stock,,,True,,,False,"Custom acoustic architecture and updated drivers for powerful Beats sound. - Personalized Spatial Audio with dynamic head tracking. - Ultralight ergonomic design for all-day comfort. Flex-grip headband and ergonomically angled, adjustable ear cups for a stable fit. - UltraPlush ear cushions are designed for comfort and durability. - Up to 50 hours of battery life. - Fast Fuel means a quick 10-minute charge gives up to 5 hours of playback. - High-resolution lossless audio via USB-C or 3.5 mm audio cable. - Dual compatibility including one-touch pairing for both iOS and Android. - High-quality call performance and voice assistant interaction via built-in microphone. - Industry-leading Class 1 Bluetooth for extended range and fewer dropouts.",,"['https://m.media-amazon.com/images/I/51sZFm7L2BL._AC_SL1500_.jpg', 'https://m.media-amazon.com/images/I/71BMVXXgwWL._AC_SL1500_.jpg', 'https://m.media-amazon.com/images/I/61dIDnS-GaL._AC_SL1500_.jpg', 'https://m.media-amazon.com/images/I/61nNjcRzbAL._AC_SL1500_.jpg', 'https://m.media-amazon.com/images/I/71F7YMIV39L._AC_SL1500_.jpg', 'https://m.media-amazon.com/images/I/71j17QMkB0L._AC_SL1500_.jpg', 'https://m.media-amazon.com/images/I/61Gvxw3lauL._AC_SL1500_.jpg']",0,,https://www.amazon.com/-/dp/B0CZPLV566?_encoding=UTF8&th=1&psc=1&pf_rd_i=desktop&ref_=pd_gw_unk,"configuration: Without AppleCare+, color: Matte Black, style: Solo4",,Matte Black,,"{'Brand': 'Beats', 'Color': 'Matte Black', 'Ear Placement': 'On Ear', 'Form Factor': 'On Ear', 'Noise Control': 'Sound Isolation'}",B0DHDNXM2B,"[{'configuration': 'Without AppleCare+', 'color_name': 'Cloud Pink', 'style_name': 'Solo4', 'asin': 'B0CZPGX972'}, {'configuration': 'Without AppleCare+', 'color_name': 'Black/Gold', 'style_name': 'Solo4', 'asin': 'B0DDQLGDY3'}, {'configuration': 'Without AppleCare+', 'color_name': 'Cloud Pink', 'style_name': 'Solo4 & Power Adapter', 'asin': 'B0D2F2D2VJ'}, {'configuration': 'Without AppleCare+', 'color_name': 'Slate Blue', 'style_name': 'Solo4 & Power Adapter', 'asin': 'B0D2DXR339'}, {'configuration': 'Without AppleCare+', 'color_name': 'Slate Blue', 'style_name': 'Solo4', 'asin': 'B0CZPHPJLN'}, {'configuration': 'Without AppleCare+', 'color_name': 'Matte Black', 'style_name': 'Solo4 & Power Adapter', 'asin': 'B0D2F52XZ3'}, {'configuration': 'Without AppleCare+', 'color_name': 'Black/Gold', 'style_name': 'Solo4 & Power Adapter', 'asin': 'B0DGBDMJXV'}, {'configuration': 'Without AppleCare+', 'color_name': 'Matte Black', 'style_name': 'Solo4', 'asin': 'B0CZPLV566'}]","{'configuration': ['Without AppleCare+'], 'color_name': ['Black/Gold', 'Cloud Pink', 'Matte Black', 'Slate Blue'], 'style_name': ['Solo4', 'Solo4 & Power Adapter']}",new,[],"[{'badge': ""Amazon's Choice"", 'badge_text': None}]",77%,11%,4%,2%,5%
B0BRKPVZB4,"Bluetooth Speaker with HD Sound, Portable Wireless, IPX5 Waterproof, Up to 20H Playtime, TWS Pairing, BT5.3, for Home/Party/Outdoor/Beach, Electronic Gadgets, Birthday Gift (Black)",BolaButty,$19.99,$59.99,"15,797",4.5,BolaButty Audio Direct,https://www.amazon.com/gp/help/seller/at-a-glance.html/ref=dp_merchant_link?ie=UTF8&seller=A393XY2DO5OC7B&asin=B0BRKPVZB4&ref_=dp_merchant_link&isAmazonFulfilled=1,In Stock,,,True,,,True,"[Immersive Sound Experience & Dual Connectivity] Experience unparalleled sound quality with this wireless Bluetooth speaker's 2 drivers and advanced technology that delivers powerful, well-balanced sound with minimal distortion. Connect two speakers together to create an immersive stereo sound experience and fill any room with powerful sound. Perfect for gaming, music, and movie playback - [Tough & Weather-Resistant] Engineered to handle rough use and adverse weather conditions, this speaker features a durable design and an IPX5 rating for protection against water splashes and spills. It's an ideal choice for outdoor events, and is perfect for use at parties, at the pool, on the beach, while camping or hiking, and more - [Long-lasting Playtime & Extended Bluetooth Connectivity] Experience extended playtime with up to 20 hours(50% Vol and light off) per charge and extended wireless range with Bluetooth 5.3, reaching up to 33 feet from your device. The multicolor lights on the speaker can also be turned off with a simple button press to save the battery and adapt to your needs. Keep in mind that the actual playtime can vary depending on volume level, audio content, and usage - [Vibrant Light Effects] Bring a new level of excitement to your party with the dynamic multi-color light show that syncs to the beat of the music, you can easily customize the light effects to suit your preference by simply pressing the Light button. Make any gathering more memorable with these visually stunning light effects that will elevate the atmosphere - [Everything You Need] The package includes 1 waterproof Bluetooth speaker (Item Dimensions D x W x H: 7.87""D x 2.76""W x 2.81""H, Weight: 1.28lb), 1 Type-C charging cable, and a quick start guide, all backed by lifetime technical support. The built-in microphone allows for hands-free phone calls and you can also play music from other devices using the AUX jack (not included). It's a perfect gift for music lovers and tech enthusiasts alike.","Small Speaker, Big Sound. Experience unparalleled sound quality with our top-of-the-line Bluetooth speaker. Bring the party with you, wherever you go. Play your favorite tunes, adjust the volume, and even take calls all with the touch of a button. Up to 24H Playtime This rechargeable battery can provide up to 24 hours of playback at 50% volume and lights off. LED Breathing Light The dancers move to the beat of the music, their breath, and bodies synchronizing with the rhythm. TWS Pairing Connect two speakers to a device for enhanced sound quality, resulting in true stereo output. 1 Excellent Sound Quality 2 Hands-free Calling 3 Long Time Music Enjoy 4 Dancing with Lighting 5 Dual X-GO Speaker Pairing The video showcases the product in use. The video guides you through product setup. The video compares multiple products. The video shows the product being unpacked. Enjoying music on foot Whether you're camping, hiking, or trekking, X-GO speaker's solid design allows it to fit easily into your backpack and is easy to carry. Add an extra touch of musical excitement to your journey. Bluetooth 5.3 Technology This Bluetooth speaker is compatible with a wide range of devices and allows you to enjoy your music without interruption up to 33 feet away. Exclusive Design A sleek design with a polished finish makes it the ideal audio device for both indoor and outdoor use. Music Anywhere, Anytime Take your music with you wherever you go with our portable Bluetooth speaker. Perfect for outdoor events and adventures. Pair Your Playlist The multi-color options of the speaker allow you to match your music and enhance your mood with vibrant hues. How to Pair Two Bluetooth Speakers? 1. Turn on two speakers. 2. Ensure they're not paired. Long press play/pause to disconnect from the previous device. 3. Press play/pause on one speaker until prompt tone. 4. Go to Bluetooth settings, tap speaker name X-GO, and pair. What is the maximum playtime for the Bluetooth speaker? The speaker can play up to 20 hours with the light off, 50% vol. However, the actual playtime may vary based on factors such as volume level, audio content, and usage. What type of adapter is recommended to charge the Bluetooth speaker? We recommend using a 5V/1A adapter to help extend the battery life. The adapter is not included in the box. What is the waterproof rating of BolaButty Bluetooth speaker? The speaker has an IPX5 waterproof rating. For waterproofing, ensure the rubber flap is tightly sealed. We do not recommend completely submerging the speaker in water. What's included in the box? 1 x Bluetooth Speaker 1 x Type C Charging Cable 1 x Portable Rope 1 x Quick-Start Guide","['https://m.media-amazon.com/images/I/81djh1gfUwL._AC_SL1500_.jpg', 'https://m.media-amazon.com/images/I/61jIE9+BgDL._AC_SL1500_.jpg', 'https://m.media-amazon.com/images/I/71jCksqtqwL._AC_SL1500_.jpg', 'https://m.media-amazon.com/images/I/61E8OofR8yL._AC_SL1500_.jpg', 'https://m.media-amazon.com/images/I/71KcqXN99KL._AC_SL1500_.jpg', 'https://m.media-amazon.com/images/I/61fXQzMGSbL._AC_SL1500_.jpg', 'https://m.media-amazon.com/images/I/71SBEFBZ+QL._AC_SL1500_.jpg', 'https://m.media-amazon.com/images/I/71xPBXerDoL._AC_SL1500_.jpg']",10,Electronics > Portable Audio & Video > Portable Speakers & Docks > Portable Bluetooth Speakers,https://www.amazon.com/-/dp/B0BRKPVZB4?_encoding=UTF8&th=1&psc=1&pf_rd_i=desktop&ref_=pd_gw_unk,color: 1pcs-Glossy Black,,1pcs-Glossy Black,,"{'ASIN': 'B0BRKPVZB4', 'Manufacturer': 'BolaButty', 'Number of Items': '1', 'Brand Name': 'BolaButty', 'Model Number': 'C27C', 'Included Components': ""'1 waterproof Bluetooth speaker, 1 Type-C charging cable, and a quick start guide'"", 'Subwoofer Connectivity Technology': 'Wireless', 'Connectivity Protocol': 'Bluetooth', 'Wireless Technology': 'Bluetooth', 'Connectivity Technology': 'Bluetooth, Auxiliary', 'Audio Driver Type': 'Dynamic Driver', 'Item Dimensions D x W x H': '7.87""D x 2.76""W x 2.81""H', 'Unit Count': '1.0 Count', 'Number of Batteries': '1 Lithium Ion batteries required. (included)', 'Power Source': 'Battery Powered', 'Speaker Maximum Output Power': '10 Watts', 'Compatible Devices': 'Smartphone', 'Woofer Diameter': '2.81 Inches', 'Water Resistance Level': 'Waterproof', 'Bluetooth Range': '30.48 Meters', 'Specific Uses For Product': 'outdoor events, parties, poolside, beach, camping, hiking', 'Controller Type': 'Push Button', 'Color': '1pcs-Glossy Black', 'Battery Average Life': '24 Hours', 'Is Waterproof': 'True', 'Maximum Range': '30.48 Meters', 'Control Method': 'Touch', 'Audio Output Mode': 'Stereo', 'Mounting Type': 'Tabletop Mount', 'Speaker Type': 'Portable,Outdoor', 'Additional Features': 'Portable', 'Recommended Uses For Product': 'For Parties, For Outdoor Activities, For Home Use, For Camping, For Hiking, For Beach Visits', 'Amazon Best Sellers Rank': '#8 in Electronics , #1 in Portable Bluetooth Speakers'}",B0CDLG1RMG,"[{'color_name': '1pcs-Glossy Black', 'asin': 'B0BRKPVZB4'}, {'color_name': '1pcs-Night Blue', 'asin': 'B0BRKQDS3S'}, {'color_name': '1pcs-Pink', 'asin': 'B0BRKPK85W'}, {'color_name': '2pcs-Black', 'asin': 'B0CWG8MX2J'}, {'color_name': '1pcs-Red', 'asin': 'B0BX5DKMBJ'}, {'color_name': '1pcs-Teal', 'asin': 'B0BX5BBM9M'}]","{'color_name': ['1pcs-Glossy Black', '1pcs-Night Blue', '1pcs-Pink', '1pcs-Red', '1pcs-Teal', '2pcs-Black']}",new,"[{'title': 'JBL Vibe Beam - True Wireless JBL Deep Bass Sound Earbuds, Bluetooth 5.2, Water & Dust Resistant, Hands-free call with VoiceAware, Up to 32 hours of battery life (Black)', 'link': 'https://www.amazon.com/JBL-Vibe-Beam-Wireless-Headphones/dp/B0BQPNMXQV/ref=pd_bxgy_d_sccl_1/000-0000000-0000000?pd_rd_w=d1lld&content-id=amzn1.sym.3858a394-39a9-4946-90e6-86a3153d2546&pf_rd_p=3858a394-39a9-4946-90e6-86a3153d2546&pf_rd_r=ECYKHZDZF8W99PT8AXZF&pd_rd_wg=vwZBk&pd_rd_r=37e9573e-ad3f-4326-bfa8-de190e7d7a05&pd_rd_i=B0BQPNMXQV&psc=1', 'price': '$29.95'}, {'title': 'Anker Soundcore 2 Portable Bluetooth Speaker with 12W Stereo Sound, Bluetooth 5, Bassup, IPX7 Waterproof, 24-Hour Playtime, Wireless Stereo Pairing, Speaker for Home, Outdoors, Travel', 'link': 'https://www.amazon.com/Anker-Soundcore-Bluetooth-Exclusive-Water-Resistant/dp/B01MTB55WH/ref=pd_bxgy_d_sccl_2/000-0000000-0000000?pd_rd_w=d1lld&content-id=amzn1.sym.3858a394-39a9-4946-90e6-86a3153d2546&pf_rd_p=3858a394-39a9-4946-90e6-86a3153d2546&pf_rd_r=ECYKHZDZF8W99PT8AXZF&pd_rd_wg=vwZBk&pd_rd_r=37e9573e-ad3f-4326-bfa8-de190e7d7a05&pd_rd_i=B01MTB55WH&psc=1', 'price': '$29.98'}]","[{'badge': ""Amazon's Choice"", 'badge_text': None}]",73%,13%,6%,3%,5%
B0CD7C12L2,PYAJUU Stray Kids Laser Photocard 50pcs Stray Kids Laser Card Kpop Stray Kids LOMO Cards Kpop Straykids 5-Strar Album Card Stray Kids Photo Cards 5-Star Postcard Gift for Fans Daugher,PYAJUU,$8.90,,117,4.8,Musite,https://www.amazon.com/gp/help/seller/at-a-glance.html/ref=dp_merchant_link?ie=UTF8&seller=A16SIHV16BCBRJ&asin=B0CD7C12L2&ref_=dp_merchant_link&isAmazonFulfilled=1,In Stock,,,True,,,True,"50pcs Stray kids laser card.non-repeating Stray Kids photo cards, each made with high-quality materials. - Stray Kids Members: Bang Chan, Lee Know, Chang-Bin, Hyun-Jin, Han, Felix, Seung-min, I.N. - Size:2.24*3.34 inches,55 pcs exquisite stray kids lomo cards. Package in Box. - 55 PCS Stray Kids photo cards can be used to collect, decorate the room and use it in any place you want to decorate. - Gift Choice:If your friend or daughter is a fan of Stray Kids, they will be very happy to receive this awesome gift.","Stray Kids Holo Effect Photocards Laser Photocards The Stray Kids laser photocards. Covered with laser film on both sides. There will be colorful lights in the sun or under the lamp. 50PCS Contains 50 non-duplicate photos of Stray Kids members Real photo A unique effect in light,This is the actual photo taken 8 Members Contains photos of 8 members and group photos, which is worth collecting Stray Kids laser cards Stray Kids holo effect card Hyunjin laser photocards Felix laser photocards Stray Kids Magic School Photocards Magic School Holo Cards Add to Cart Hole Effect ✓","['https://m.media-amazon.com/images/I/71qaXX3BynL._AC_SL1500_.jpg', 'https://m.media-amazon.com/images/I/71Ba8gYT1gL._AC_SL1500_.jpg', 'https://m.media-amazon.com/images/I/71L7DmN6EtL._AC_SL1500_.jpg', 'https://m.media-amazon.com/images/I/81rVdk6GhWL._AC_SL1500_.jpg', 'https://m.media-amazon.com/images/I/71Z3coC44jL._AC_SL1500_.jpg', 'https://m.media-amazon.com/images/I/71uWzIGm66L._AC_SL1500_.jpg', 'https://m.media-amazon.com/images/I/71eDbEIc7gL._AC_SL1500_.jpg', 'https://m.media-amazon.com/images/I/71p9P8T9JHL._AC_SL1500_.jpg']",4,Collectibles & Fine Art > Entertainment > Trading Cards,https://www.amazon.com/-/dp/B0CD7C12L2?_encoding=UTF8&th=1&psc=1&pf_rd_i=desktop&ref_=pd_gw_unk,,,,,"{'ASIN': 'B0CD7C12L2', 'Age Range Description': 'Kid', 'Brand Name': 'PYAJUU', 'Team Name': 'Stray Kids', 'Color': 'Black', 'Theme': 'Music', 'Size': 'Medium', 'Item Dimensions L x W': '3.34""L x 2.24""W', 'Unit Count': '50.0 Count', 'Is Autographed': 'No', 'Grade Rating': 'Ungraded', 'Amazon Best Sellers Rank': '#1 in Entertainment Collectibles , #1 in Entertainment Collectible Trading Cards'}",B0CD7C12L2,[],{},new,"[{'title': 'Stray Kids Photocards Kpop Stray Kids ATE Album Photocards 55PCS Stray Kids Lomo Cards ATE Photo Cards Stray Kids Merch Felix Photocards Hyunjin Photocards (Black)', 'link': 'https://www.amazon.com/Stray-Photocards-ATE-Album-Hyunjin/dp/B0D91LSDYB/ref=pd_bxgy_d_sccl_1/000-0000000-0000000?pd_rd_w=Y05w5&content-id=amzn1.sym.3858a394-39a9-4946-90e6-86a3153d2546&pf_rd_p=3858a394-39a9-4946-90e6-86a3153d2546&pf_rd_r=D7K4Y3SGEFHA8HKPXCGD&pd_rd_wg=p62Uq&pd_rd_r=4c5c3286-e057-42c6-9272-da2bea5b8135&pd_rd_i=B0D91LSDYB&psc=1', 'price': '$8.49'}, {'title': 'KPOPBP Stray Kids ATE Album Photocards 55 PCS KPOP Photo Cards SKZ Album LOMO Card Set, Gift for Boys and Girls Merch', 'link': 'https://www.amazon.com/KPOPBP-Stray-Album-Photocards-Card/dp/B0D8L5935B/ref=pd_bxgy_d_sccl_2/000-0000000-0000000?pd_rd_w=Y05w5&content-id=amzn1.sym.3858a394-39a9-4946-90e6-86a3153d2546&pf_rd_p=3858a394-39a9-4946-90e6-86a3153d2546&pf_rd_r=D7K4Y3SGEFHA8HKPXCGD&pd_rd_wg=p62Uq&pd_rd_r=4c5c3286-e057-42c6-9272-da2bea5b8135&pd_rd_i=B0D8L5935B&psc=1', 'price': '$8.90'}]",[],81%,13%,6%,0%,0%
B0D9QRC5TZ,Trump Trading Card - Assasination Attempt- Gem 10 Graded - Trump Collectible Card - Trump Gifts - Trump 2024 - Make America Great Again,ASVP Shop,$16.99,,11,5.0,ASVP Shop US,https://www.amazon.com/gp/help/seller/at-a-glance.html/ref=dp_merchant_link?ie=UTF8&seller=A3Q3ED2UCPES3N&asin=B0D9QRC5TZ&ref_=dp_merchant_link&isAmazonFulfilled=1,In Stock,,,True,,,True,"UNIQUE COLLECTIBLE: This trading card captures the dramatic moment of the Donald Trump assassination attempt, memorializing a historic event in a 9cm by 6.4cm high-quality card format, making it a rare and highly sought-after piece among collectors. - PERFECT GIFT FOR TRUMP FANS: Ideal for avid supporters of Donald Trump, this trading card is a unique and memorable gift, offering fans a tangible piece of Trump's legacy and resilience. - HISTORICAL SIGNIFICANCE: On July 13, 2024, during a rally in Butler, Pennsylvania, Donald Trump was targeted in an assassination attempt. As shots rang out, Trump was wounded in the ear but remained undeterred. Amidst the chaos, he shouted, ""Fight, fight, fight!"" to rally his supporters. This card symbolizes this pivotal moment, appealing to collectors of political memorabilia and cultural artifacts. - PRISTINE CONDITION: This card retains its mint condition, ensuring its value and appeal to collectors who prioritize high quality collectibles. - SECURE PROTECTION: Encased in a hard case, this trading card is protected from damage, guaranteeing its longevity and maintaining its pristine condition for years to come. This added layer of protection enhances its value and reassures collectors seeking the highest standards of preservation.","Memorialize a pivotal moment in history with this exclusive Trump Trading Card featuring the dramatic Donald Trump assassination attempt. This high-quality collectible card, measuring 9cm by 6.4cm, captures the resilience of the 45th president during a life-threatening event. Perfectly graded at Gem 10, this card is a rare and valuable keepsake for collectors and Trump supporters alike. Encased in a secure hard case, it guarantees lasting protection, ensuring that its pristine condition remains intact for future generations. Unique Collectible for Enthusiasts This immortalizes the shocking moment of the assassination attempt on Donald Trump, making it a highly sought-after collectible. Crafted with high-quality materials, this 9cm by 6.4cm card offers a rare opportunity for collectors to own a piece of political history, commemorating Trump’s unwavering courage during a critical event. Perfect Gift for Trump Fans For passionate Trump supporters, this trading card is more than just a collectible—it's a symbol of Trump's resilience. As a Gem 10 graded card, it serves as a memorable gift, offering fans a unique way to connect with their favorite political figure. Whether as a personal keepsake or a gift, this card stands as a tribute to Trump's legacy. Pristine Condition & Secure Protection With a perfect Gem 10 grading, this card is guaranteed to be in flawless condition. Encased in a hard protective case, it remains shielded from potential damage, ensuring its longevity and value. Collectors can feel confident in their investment, knowing that this rare card will remain in mint condition for years to come. Trump Trading Card - The Mugshot - Gem 10 Graded - Trump Collectible Card - T... ASVP Shop Trump Playing Cards - Family & Allies - Premium Collectors Deck Fea... ASVP Shop USA Flag Wrap Sunglasses with Trump Logo and Mirrored Lens - Perfec... Donald Trump Car Air Freshner - Pack Of 3 Different Scents - Jail Mugshot Add to Cart See Details Customer Reviews 4.0 out of 5 stars 9 4.6 out of 5 stars 3 6 — Price $11.99 $ 11 . 99 $12.99 12 $14.99 14 Description This trading card features the infamous Donald Trump mugshot, capturing a historic moment in a 9cm by 6.4cm high-quality card format, ensuring its rarity and desirability among collectors. The face cards showcase Donald Trump as the King, Melania as the Queen, and Ivanka, Trump Jr., Elon Musk, and J.D. Vance as Jacks. Every face card has a unique, detailed design representing these influential figures. Show your American pride with wrap sunglasses featuring the USA flag on the arms. Distinctive mirrored lenses with the word ""Trump,"" perfect for political events and rallies. Featuring Donald Trump's iconic mugshot, captured during a memorable incident, these air fresheners offer a one-of-a-kind conversation piece for enthusiasts and collectors alike.","['https://m.media-amazon.com/images/I/71J+klYoGbL._AC_SL1500_.jpg', 'https://m.media-amazon.com/images/I/71l789dk1yL._AC_SL1500_.jpg', 'https://m.media-amazon.com/images/I/81yrc83fJ5L._AC_SL1500_.jpg', 'https://m.media-amazon.com/images/I/51TAlGsI9AL._AC_SL1500_.jpg']",0,Collectibles & Fine Art > Entertainment > Trading Cards,https://www.amazon.com/-/dp/B0D9QRC5TZ?_encoding=UTF8&th=1&psc=1&pf_rd_i=desktop&ref_=pd_gw_unk,,,,,"{'ASIN': 'B0D9QRC5TZ', 'Included Components': 'Card', 'Age Range Description': 'Adult', 'Brand Name': 'ASVP Shop', 'Material': 'Cardboard', 'Theme': 'Politics', 'Item Dimensions L x W': '3.5""L x 2.5""W', 'Is Autographed': 'No', 'Grading Provided By': 'PSA', 'Grade Rating': '10', 'Amazon Best Sellers Rank': '#2 in Entertainment Collectibles , #2 in Entertainment Collectible Trading Cards'}",B0D9QRC5TZ,[],{},new,"[{'title': 'Trump Mugshot Collector Trading Card - Graded Gem Mint 10 - Trump Collectibles, Trump Gifts, Trump 2024, Perfect Patriotic & Political Donald Trump Gifts. Proudly Made in America!', 'link': 'https://www.amazon.com/Trump-Mugshot-Collector-Trading-Card/dp/B0CGRZRGRD/ref=pd_bxgy_d_sccl_1/000-0000000-0000000?pd_rd_w=19G0w&content-id=amzn1.sym.3858a394-39a9-4946-90e6-86a3153d2546&pf_rd_p=3858a394-39a9-4946-90e6-86a3153d2546&pf_rd_r=HBZREZNJ4HYTCH8GBPMP&pd_rd_wg=ccScZ&pd_rd_r=06abd349-72ec-4ff3-9a04-1a0703ab2586&pd_rd_i=B0CGRZRGRD&psc=1', 'price': '$24.99'}, {'title': 'Proud Patriots - Trump Stand Strong Trading Card - Perfect Political Gift for Trump Supporters and Patriotic Americans | The #1 Trump Gifts, Trump 2024', 'link': 'https://www.amazon.com/Proud-Patriots-Political-Supporters-Patriotic/dp/B0D9HZMFJT/ref=pd_bxgy_d_sccl_2/000-0000000-0000000?pd_rd_w=19G0w&content-id=amzn1.sym.3858a394-39a9-4946-90e6-86a3153d2546&pf_rd_p=3858a394-39a9-4946-90e6-86a3153d2546&pf_rd_r=HBZREZNJ4HYTCH8GBPMP&pd_rd_wg=ccScZ&pd_rd_r=06abd349-72ec-4ff3-9a04-1a0703ab2586&pd_rd_i=B0D9HZMFJT&psc=1', 'price': '$25.98'}]",[],100%,0%,0%,0%,0%
B0DJHD77W4,"SONIC THE HEDGEHOG 3-12""x18"" Original Promo Movie Poster 2024 Shadow",Generic,$19.99,,,,THE CINEMA COLLECTION,https://www.amazon.com/gp/help/seller/at-a-glance.html/ref=dp_merchant_link?ie=UTF8&seller=ALN2575HFSN1J&asin=B0DJHD77W4&ref_=dp_merchant_link,Only 1 left in stock - order soon.,1,6,True,,,False,"Grading Scale: Mint, Near Mint, Very Good, Fair & Poor - Original Promo Movie Poster - Not a Reprint - Posters come rolled in a plastic sleeve and shipped in a sturdy cardboard tube - Posters are from Movie Studios and sizes are approximate. - Poster is in Mint Condition","This is a mini original promotional movie poster for the movie SONIC THE HEDGEHOG 3 (2024). Limited Edition posters that were only available at select Transformers One screenings. Poster measures approximately 12"" x 18"" and is in Mint Condition.",['https://m.media-amazon.com/images/I/91ZX6RbpaIL._AC_SL1500_.jpg'],0,Collectibles & Fine Art > Entertainment > Prints & Posters,https://www.amazon.com/-/dp/B0DJHD77W4?_encoding=UTF8&th=1&psc=1&pf_rd_i=desktop&ref_=pd_gw_unk,,,,,"{'ASIN': 'B0DJHD77W4', 'Country of Origin': 'USA', 'Date First Available': 'October 4, 2024', 'Amazon Best Sellers Rank': '#103 in Entertainment Collectibles , #4 in Entertainment Collectible Prints & Posters'}",B0DJHD77W4,[],{},new,[],[],0%,0%,0%,0%,0%
B09LZ9QDMW,2020 FORTNITE Series 2 Trading Cards 3-Pack Retail Lot 6 Cards Per Pack 18 Cards total Superior Sports Investments,Panini,$16.95,,79,4.4,Superior-Sports-Investments,https://www.amazon.com/gp/help/seller/at-a-glance.html/ref=dp_merchant_link?ie=UTF8&seller=A2OXABHJDYWUXI&asin=B09LZ9QDMW&ref_=dp_merchant_link&isAmazonFulfilled=1,In Stock,,,True,,,False,,2020 FORTNITE Series 2 Trading Cards 3-Pack Retail Lot 6 Cards Per Pack 18 Cards total,"['https://m.media-amazon.com/images/I/61m4eUBkoLL._AC_SL1280_.jpg', 'https://m.media-amazon.com/images/I/61vBE4TTa+L._AC_SL1000_.jpg']",1,Collectibles & Fine Art > Entertainment > Trading Cards,https://www.amazon.com/-/dp/B09LZ9QDMW?_encoding=UTF8&th=1&psc=1&pf_rd_i=desktop&ref_=pd_gw_unk,,,,,"{'Package Dimensions': '4.96 x 2.76 x 0.55 inches; 1.45 ounces', 'Item Weight': '1.44 ounces', 'ASIN': 'B09LZ9QDMW', 'Date First Available': 'November 16, 2021', 'Amazon Best Sellers Rank': '#45 in Entertainment Collectibles , #9 in Entertainment Collectible Trading Cards'}",B09LZ9QDMW,[],{},new,[],[],75%,9%,6%,3%,7%
