asin,name,brand,price,regular_price,total_reviews,average_rating,seller,seller_url,availability_status,availability_quantity,shipping_charge,is_prime,author,available_book_formats,is_aplus_page,small_description,full_description,images,video_count,productCategory,url,attributes,size,color,model,product_information,parent_asin,variation_asin,product_variations,product_condition,frequently_bought_together,product_badges,five_star,four_star,three_star,two_star,one_star
B00BSYR7K8,"Earth Rated Dog Poop Bags, Guaranteed Leak Proof and Extra Thick Waste Bag Refill Rolls For Dogs, Lavender Scented, 270 Count",Earth Rated,$13.99,$16.79,"229,293",4.8,Earth Rated,https://www.amazon.com/gp/help/seller/at-a-glance.html/ref=dp_merchant_link?ie=UTF8&seller=A38VXSOWQ4K79M&asin=B00BSYR7K8&ref_=dp_merchant_link&isAmazonFulfilled=1,In Stock,,,True,,,True,"DOG POOP BAGS: Our durable poop bags are a dog-walking essential. They are extremely portable and pair perfectly with the Earth Rated Poop Bag Dispenser for easy access while on the go. - 100% LEAK-PROOF CONSTRUCTION: These dog poop bags are extra long, extra strong, and 100% leak-proof, ensuring that your hands stay clean while out and about with your dog. Each individual bag measures 13"" L x 9"" W. - EASY-TO-USE: To use, pull one of our poop bags away from the roll and tear on the built-in line. With the ""3 Bags Left"" sticker, you will always know when you are getting low. - A BETTER POOP BAG: We make our dog poop bags with 65% certified post-consumer recycled plastic, giving a second life to over 5 million pounds of landfill-bound plastic a year. - EARTH RATED: Our mission is to make everyday moments for people and their dogs simpler and better. We do this by designing innovative products that are thoughtfully unexpected. We are also proudly B Corp Certified.","1 Compact & convenient 2 Made with 65% PCR 3 100% Leak-proof 4 Extra long and strong 5 Pairs with our dispenser The video showcases the product in use. The video guides you through product setup. The video compares multiple products. The video shows the product being unpacked. What’s your mission? Our mission is to make everyday moments for people and their dogs simpler and better. We do this by designing innovative products that are thoughtfully-unexpected. Why choose Earth Rated? In 2009, we set out to encourage responsible dog-ownership by creating poop bags and a dispenser that made picking up less of a chore. Today, as a B Corp certified company, we integrate environmental and social considerations into everything we do. Are your bags still the same thickness? Yes, our dark green-colored bags are 15 microns thick. Do you offer any larger bags for bigger messes? We do. Our easy-tie handle bags are extra wide and perfect for handling big messes. Our refill rolls are also surprisingly long (measuring 9”x13”), and roomy enough to pick up after dogs of all sizes. Earth Rated Poop Bags Refill Rolls Add to Cart Single Rolls Easy-tie Handle Dispenser & Bags Grooming Wipes Customer Reviews 4.8 out of 5 stars 229,293 20,181 16,324 4.7 out of 5 stars 22,861 4.6 out of 5 stars 49,146 Price $13.99 $ 13 . 99 $14.99 14 $7.99 7 $36.99 36 $34.99 34 Leak-proof ✔ ✘ Bag Count 120, 270, or 315 Refill Rolls 100 or 300 Single Rolls 120 Handle Bags 900 or 15 Refill Rolls 100 or 400 Wipes Dimensions 9"" x 13"" 8"" x 13"" 13.5"" x 7"" 8"" x 8"" Thickness 15 microns Extra Thick Scent Lavender or Unscented","['https://m.media-amazon.com/images/I/71DiX5xIC1L._AC_SL1500_.jpg', 'https://m.media-amazon.com/images/I/71TevOPRBgL._AC_SL1500_.jpg', 'https://m.media-amazon.com/images/I/71y45AgbLeL._AC_SL1500_.jpg', 'https://m.media-amazon.com/images/I/71RarZzeNIL._AC_SL1500_.jpg', 'https://m.media-amazon.com/images/I/81PBR4QW99L._AC_SL1500_.jpg', 'https://m.media-amazon.com/images/I/71c6tyjopKL._AC_SL1500_.jpg', 'https://m.media-amazon.com/images/I/715lVE-6kSL._AC_SL1500_.jpg', 'https://m.media-amazon.com/images/I/71Sn6POarEL._AC_SL1500_.jpg']",10,Pet Supplies > Dogs > Litter & Housebreaking > Pooper Scoopers & Bags > Bags,https://www.amazon.com/-/dp/B00BSYR7K8?_encoding=UTF8&th=1&psc=1&pf_rd_i=desktop&ref_=pd_gw_unk,"size: 15 Count (Pack of 18), style: Lavender",15 Count (Pack of 18),,BIO270,"{'Brand': 'Earth Rated', 'Capacity': '4.3 Liters', 'Unit Count': '270 Count', 'Recommended Uses For Product': 'Cat Litter, Baby Diapers, Dog Poop', 'Material Feature': 'Disposable', 'Color': 'Lavender-Scented', 'Material': 'Paper', 'Item Form': 'Bag', 'Scent': 'Lavender', 'Number of Items': '1', 'Item Weight': '1.3 pounds', 'Item dimensions L x W x H': '5.2 x 3.82 x 3.82 inches', 'Manufacturer': 'Earth Rated', 'UPC': '870856000123', 'Global Trade Identification Number': '00737989663451, 00870856000123', 'ASIN': 'B00BSYR7K8', 'Item model number': 'BIO270', 'Date First Available': 'March 15, 2013', 'Item Package Dimensions L x W x H': '5.12 x 3.82 x 3.78 inches', 'Item Dimensions LxWxH': '5.2 x 3.82 x 3.82 inches', 'Brand Name': 'Earth Rated', 'Target Audience Keyword': 'dogs, Dog', 'Directions': 'Use as instructed', 'Model Name': 'Rated Dog Poop Bags, Guaranteed Leak', 'Size': '15 Count (Pack of 18)', 'Age Range Description': 'All Life Stages', 'Style': 'Lavender', 'Breed Recommendation': 'All Breed Sizes', 'Included Components': '270 lavender-scented dog poop bags', 'Specific Uses for Product': 'Outdoor, Indoor', 'Is Discontinued By Manufacturer': 'No', 'Product Dimensions': '5.2 x 3.82 x 3.82 inches; 1.3 Pounds', 'Amazon Best Sellers Rank': '#3 in Pet Supplies , #1 in Dog Waste Bags'}",B0CZVW45BT,"[{'size_name': '270 Bags', 'style_name': 'Unscented', 'asin': 'B00LAI9OM6'}, {'size_name': '600 Bags', 'style_name': 'Lavender', 'asin': 'B0CS81Q6Z7'}, {'size_name': '120 Bags', 'style_name': 'Unscented', 'asin': 'B00EJXIZ60'}, {'size_name': '15 Count (Pack of 18)', 'style_name': 'Lavender', 'asin': 'B00BSYR7K8'}, {'size_name': '600 Bags', 'style_name': 'Unscented', 'asin': 'B0CS8GCYS1'}, {'size_name': '120 Bags', 'style_name': 'Lavender', 'asin': 'B0088LIINY'}]","{'size_name': ['15 Count (Pack of 18)', '120 Bags', '270 Bags', '600 Bags'], 'style_name': ['Lavender', 'Unscented']}",new,[],[],89%,8%,2%,1%,1%
B0009X29WK,Dr. Elsey's Cat Litter - Premium Unscented Cat Litter w/ Natural Ingredients - Low Dust Superior Odor Control Cat Litter - Hard Clumping Moisture Absorbing Clay Multi Cat Litter (For All Cats - 40lbs),Dr. Elsey's,$20.99,$23.99,"80,538",4.3,Amazon.com,,In Stock,,,True,,,False,"PREMIUM QUALITY: A combination of premium texture and granule size made with 100% bentonite clay for maximum clumping creates litter particles that are just the right size. - LOW DUST: Ideal for cats and owners who suffer from allergies with a 99.9% dust-free and hypoallergenic litter formulation. - HARD CLUMPING: Hard clumping medium grain clay helps prevent moisture from reaching the bottom of the tray and forms hard clumps that won't break down, making it easier to scoop. - SUPERIOR ODOR CONTROL: Formulated for single or multi-cat households with natural ingredients to keep your home smelling clean and fresh between litter box cleanings. - LOW TRACKING: A unique formulation of medium grain clay helps keep litter in the box where it belongs.","Dr. Elsey's Precious Cat Ultra Clumping Cat Litter is a unique formulation that combines the heavy non-tracking granules of classic with a medium-grain clay. The result is an excellent clumping litter that prevents moisture from reaching the bottom of the tray while providing a clump that will not break down. This cat litter is perfect for multi-cat households and those cat parents with sifting or mechanical litter boxes. With its superior odor control, you can be sure your home will always smell fresh and clean.","['https://m.media-amazon.com/images/I/71yvqBnUtKL._AC_SL1500_.jpg', 'https://m.media-amazon.com/images/I/71jFJ12LytL._AC_SL1500_.jpg', 'https://m.media-amazon.com/images/I/81CXKhePqwL._AC_SL1500_.jpg', 'https://m.media-amazon.com/images/I/71mYyrFJEFL._AC_SL1500_.jpg', 'https://m.media-amazon.com/images/I/71zYjdZpDGL._AC_SL1500_.jpg', 'https://m.media-amazon.com/images/I/71QT0v9rEZL._AC_SL1500_.jpg', 'https://m.media-amazon.com/images/I/812qtW4ksKL._AC_SL1500_.jpg', 'https://m.media-amazon.com/images/I/71a0ZHLy3LL._AC_SL1500_.jpg']",10,Pet Supplies > Cats > Litter & Housebreaking > Litter,https://www.amazon.com/-/dp/B0009X29WK?_encoding=UTF8&th=1&psc=1&pf_rd_i=desktop&ref_=pd_gw_unk,size: 40 lb,40 lb,,460U,"{'Is Discontinued By Manufacturer': 'No', 'Product Dimensions': '20 x 14 x 4 inches; 40 Pounds', 'Item model number': '460U', 'Department': 'Litter & Accessories', 'Date First Available': 'November 1, 2005', 'Manufacturer': 'Precious Cat', 'ASIN': 'B0009X29WK', 'Country of Origin': 'USA', 'Amazon Best Sellers Rank': '#2 in Pet Supplies , #1 in Cat Litter'}",B0CRC2DMMD,"[{'size_name': '40 lb', 'asin': 'B0009X29WK'}, {'size_name': '20 lb', 'asin': 'B007S8YDBE'}, {'size_name': '18 lb', 'asin': 'B0009X0QSY'}]","{'size_name': ['18 lb', '20 lb', '40 lb']}",new,"[{'title': 'Purina Friskies Gravy Wet Cat Food Variety Pack, Poultry Shreds, Meaty Bits and Prime Filets - 5.5 Ounce (Pack of 32)', 'link': 'https://www.amazon.com/Purina-Friskies-Poultry-Adult-Variety/dp/B00283MYSI/ref=pd_bxgy_d_sccl_1/000-0000000-0000000?pd_rd_w=fjopT&content-id=amzn1.sym.3858a394-39a9-4946-90e6-86a3153d2546&pf_rd_p=3858a394-39a9-4946-90e6-86a3153d2546&pf_rd_r=RZWZMSF45HRCPF2SQZQG&pd_rd_wg=ZmqCF&pd_rd_r=f0184d15-6a56-48d0-8c18-f9def55f99bf&pd_rd_i=B00283MYSI&psc=1', 'price': '$22.49'}, {'title': 'Meow Mix Original Choice Dry Cat Food, 6.3 Pound, Complete & Balanced Nutrition', 'link': 'https://www.amazon.com/Meow-Mix-Original-Dry-Food/dp/B007JXVR76/ref=pd_bxgy_d_sccl_2/000-0000000-0000000?pd_rd_w=fjopT&content-id=amzn1.sym.3858a394-39a9-4946-90e6-86a3153d2546&pf_rd_p=3858a394-39a9-4946-90e6-86a3153d2546&pf_rd_r=RZWZMSF45HRCPF2SQZQG&pd_rd_wg=ZmqCF&pd_rd_r=f0184d15-6a56-48d0-8c18-f9def55f99bf&pd_rd_i=B007JXVR76&psc=1', 'price': '$8.45'}]",[],66%,14%,9%,5%,7%
B00NABTC8M,"Amazon Basics Dog Poop Leak Proof Bags With Dispenser and Leash Clip, Unscented, 300 Count, 20 Pack of 15, Black, 13 Inch x 9 Inch",Amazon Basics,$7.99,$8.68,"207,912",4.8,Amazon.com,,In Stock,,,True,,,True,"Dog poop bags for quick, easy pick-ups - Neatly contains waste and minimizes odors - Leakproof design keeps hands clean and protected - Includes 300 unscented plastic bags (15 bags per roll; 20 rolls), a dispenser, and a matching leash clip - Large 13 x 9-inch bag size for generous coverage - Carabiner for clipping the dispenser onto a leash (leash not included) - Plastic dispenser makes it easy to remove a bag from the roll during walks","Product Description Amazon Basics Unscented Standard Dog Poop Bags with Dispenser and Leash Clip, 13 x 9 Inches, Black - 20 Rolls (300 Bags) From the Manufacturer Amazon Basics","['https://m.media-amazon.com/images/I/71pS4O3AJ6L._AC_SL1500_.jpg', 'https://m.media-amazon.com/images/I/71Uz1lv-weL._AC_SL1500_.jpg', 'https://m.media-amazon.com/images/I/81i34OkQlRL._AC_SL1500_.jpg', 'https://m.media-amazon.com/images/I/61YiVPsHHNL._AC_SL1500_.jpg', 'https://m.media-amazon.com/images/I/71PuEAP9C4L._AC_SL1500_.jpg', 'https://m.media-amazon.com/images/I/81U+P9h5aGL._AC_SL1500_.jpg']",10,Pet Supplies > Dogs > Litter & Housebreaking > Pooper Scoopers & Bags > Bags,https://www.amazon.com/-/dp/B00NABTC8M?_encoding=UTF8&th=1&psc=1&pf_rd_i=desktop&ref_=pd_gw_unk,unit_count: 300,,,100320,"{'Item model number': '100320', 'Date First Available': 'September 3, 2020', 'Manufacturer': 'Amazon', 'ASIN': 'B00NABTC8M', 'Country of Origin': 'China', 'Amazon Best Sellers Rank': '#5 in Pet Supplies , #2 in Dog Waste Bags'}",B0DJS3GB23,"[{'unit_count': '300', 'asin': 'B00NABTC8M'}, {'unit_count': '600', 'asin': 'B00NABTG60'}, {'unit_count': '900', 'asin': 'B00NABTGY2'}]","{'unit_count': ['300', '600', '900']}",new,"[{'title': 'Pecute Self-Cleaning Slicker Brush for Dogs, Cats, Lightweight Dog Brush for Shedding Massaging Grooming, Cat Brush Gently Removes Loose Fur Undercoat for Small Dogs Cats Rabbits of All Hair Types', 'link': 'https://www.amazon.com/Pecute-Self-Cleaning-Lightweight-Massaging-Undercoat/dp/B0C1RQ67PW/ref=pd_bxgy_d_sccl_1/000-0000000-0000000?pd_rd_w=EDh83&content-id=amzn1.sym.3858a394-39a9-4946-90e6-86a3153d2546&pf_rd_p=3858a394-39a9-4946-90e6-86a3153d2546&pf_rd_r=15K9892TXP51S1BC4H4Y&pd_rd_wg=qtYu8&pd_rd_r=f2cf2189-8316-452c-8e6f-c53f53149618&pd_rd_i=B0C1RQ67PW&psc=1', 'price': '$8.99'}]",[],86%,9%,3%,1%,1%
B07D323MFZ,"INABA Churu Cat Treats, Grain-Free, Lickable, Squeezable Creamy Purée Cat Treat/Topper with Vitamin E & Taurine, 0.5 Ounces Each Tube, 50 Tubes, Tuna & Chicken Variety",INABA,$24.99,$44.99,"38,795",4.8,Amazon.com,,In Stock,,,True,,,True,"MADE WITH WHOLESOME INGREDIENTS YOU CAN TRUST: Every Inaba product is made with yummy, human-grade ingredients including farm-raised chicken and/or wild-caught tuna - KEEP OUR FELINE HYDRATED WITHOUT ADDING CALORIES: Each delicious, creamy Churu tube contains 91% moisture and only 6 calories (a tenth of the calories of traditional dry cat treats), which makes it a healthy snack you can feel good about feeding - FREE OF THE BAD STUFF: Your feline friend is important to us, which is why we've kept things like grains, preservatives, artificial colors and carrageenan out of our cat treats, but we added things like Taurine to help with their overall health - HAVE THEM EATING OUT OF YOUR HAND: These lickable purée meat tubes for cats were designed to be fed by hand, as an interactive way to spend time with your feline, but you can use as a wet/dry cat food topper or as a way to disguise medication - ADD SOME VARIETY TO YOUR CAT'S LIFE: Available in eleven savory flavors, cats of all stages (kitten to senior) will be able to find a flavor they love","Here at Inaba, we know your cat is a beloved family member. That's why each of our Churu Lickable Creamy Purée Natural Cat Treats are made from high-quality ingredients, including wild-caught tuna and farm-raised chicken. Since cats are not naturally drawn to water, we have made these a high-moisture, low calorie cat treat that your kitties will love. They contain 91% moisture and have only 6 calories per tube. That's a tenth of the calories of traditional dry cat treats and more than 1000 times the moisture (8% vs. 91% moisture). In addition, we've also added Taurine to help with their vision, digestions and heart health, as well as, Vitamin E for immunity and Green Tea Extract for its natural antioxidants. What they're missing? They're grain-free, preservative-free, carrageenan-free and free from artificial colors, making them a cat treat you can feel good about feeding. Designed to be hand fed, you can use to help calm the feistiest of outdoor ferals or treat your pampered indoor pussycat. They can be used a dry/canned cat food topper or to assist with giving medications. Available in 19 savory flavors, you'll be able to find a flavor that your kitty will crave no matter what stage of life they are (kitten to senior). Inaba Churu makes snack time fun for you and your feline friends.","['https://m.media-amazon.com/images/I/71sgD3kIhLL._AC_SL1500_.jpg', 'https://m.media-amazon.com/images/I/81yHLF5ht5L._AC_SL1500_.jpg', 'https://m.media-amazon.com/images/I/81ecgnsPEnL._AC_SL1500_.jpg', 'https://m.media-amazon.com/images/I/81a77Qeo3LL._AC_SL1500_.jpg', 'https://m.media-amazon.com/images/I/71+x8611+FL._AC_SL1500_.jpg', 'https://m.media-amazon.com/images/I/81aircUGzwL._AC_SL1500_.jpg', 'https://m.media-amazon.com/images/I/81b6dCxGCLL._AC_SL1500_.jpg', 'https://m.media-amazon.com/images/I/81sGhg3c5CL._AC_SL1500_.jpg', 'https://m.media-amazon.com/images/I/81lI5-wHIKL._AC_SL1500_.jpg']",10,Pet Supplies > Cats > Treats > Pastes,https://www.amazon.com/-/dp/B07D323MFZ?_encoding=UTF8&th=1&psc=1&pf_rd_i=desktop&ref_=pd_gw_unk,"size: 0.5 Ounce (Pack of 50), flavor: Tuna and Chicken Variety",0.5 Ounce (Pack of 50),,USA653A,"{'Is Discontinued By Manufacturer': 'No', 'Product Dimensions': '4.8 x 6.4 x 11.5 inches; 1.56 Pounds', 'Item model number': 'USA653A', 'Department': 'Unisex-Adult', 'Date First Available': 'May 15, 2018', 'Manufacturer': 'INABA', 'ASIN': 'B07D323MFZ', 'Country of Origin': 'Thailand', 'Amazon Best Sellers Rank': '#6 in Pet Supplies , #1 in Treat Pastes for Cats'}",B0D7JQNJX2,"[{'size_name': '0.5 Ounce (Pack of 24)', 'flavor_name': 'Chicken with Beef', 'asin': 'B099XDKGKL'}, {'size_name': '0.5 Ounce (Pack of 60)', 'flavor_name': 'Tuna Variety', 'asin': 'B0B52D1K3F'}, {'size_name': '0.5 Ounce (Pack of 40)', 'flavor_name': 'Tuna Variety', 'asin': 'B0B52DC8N4'}, {'size_name': '0.5 Ounce (Pack of 20)', 'flavor_name': 'Chicken Variety', 'asin': 'B0B52D7BBD'}, {'size_name': '0.5 Ounce (Pack of 24)', 'flavor_name': 'Chicken with Cheese Recipe', 'asin': 'B07SFD669C'}, {'size_name': '0.5 Ounce (Pack of 50)', 'flavor_name': 'Tuna Variety', 'asin': 'B07D356XY8'}, {'size_name': '0.5 Ounce (Pack of 24)', 'flavor_name': 'Tuna with Cheese Recipe', 'asin': 'B0B1W1N7MV'}, {'size_name': '0.5 Ounce (Pack of 50)', 'flavor_name': 'Beef & Cheese Variety', 'asin': 'B0B1W33761'}, {'size_name': '0.5 Ounce (Pack of 24)', 'flavor_name': 'Chicken with Scallop Recipe', 'asin': 'B07DVWFP4M'}, {'size_name': '0.5 Ounce (Pack of 24)', 'flavor_name': 'Chicken', 'asin': 'B07D338L38'}, {'size_name': '0.5 Ounce (Pack of 20)', 'flavor_name': 'Chicken & Beef Variety', 'asin': 'B0B52FQX9C'}, {'size_name': '0.5 Ounce (Pack of 20)', 'flavor_name': 'Tuna & Seafood Variety', 'asin': 'B0B52F6Q1M'}, {'size_name': '0.5 Ounce (Pack of 24)', 'flavor_name': 'Tuna Recipe with Seafood Flavors', 'asin': 'B0B1W26MJW'}, {'size_name': '0.5 Ounce (Pack of 60)', 'flavor_name': 'Chicken Variety', 'asin': 'B0B52CS77L'}, {'size_name': '0.5 Ounce (Pack of 24)', 'flavor_name': 'Chicken with Shrimp Recipe', 'asin': 'B07DCFBZY8'}, {'size_name': '0.5 Ounce (Pack of 24)', 'flavor_name': 'Tuna Recipe with Shrimp Flavor', 'asin': 'B0B1W2QGPN'}, {'size_name': '0.5 Ounce (Pack of 24)', 'flavor_name': 'Chicken with Crab Recipe', 'asin': 'B07FTNQXXN'}, {'size_name': '0.5 Ounce (Pack of 24)', 'flavor_name': 'Tuna with Beef', 'asin': 'B099XBTD8Z'}, {'size_name': '0.5 Ounce (Pack of 20)', 'flavor_name': 'Chicken Variety Bag', 'asin': 'B07D32MLPX'}, {'size_name': '0.5 Ounce (Pack of 50)', 'flavor_name': 'Chicken & Seafood Variety', 'asin': 'B0B1W3R21D'}, {'size_name': '0.5 Ounce (Pack of 20)', 'flavor_name': 'Seafood Variety Bag', 'asin': 'B081H4PM3Z'}, {'size_name': '0.5 Ounce (Pack of 20)', 'flavor_name': 'Seafood', 'asin': 'B0B52FX4WX'}, {'size_name': '0.5 Ounce (Pack of 20)', 'flavor_name': 'Tuna Variety Bag', 'asin': 'B07PHKHT4P'}, {'size_name': '0.5 Ounce (Pack of 50)', 'flavor_name': 'Tuna and Chicken Variety', 'asin': 'B07D323MFZ'}, {'size_name': '0.5 Ounce (Pack of 24)', 'flavor_name': 'Tuna with Chicken Recipe', 'asin': 'B07DVRNQ5L'}, {'size_name': '0.5 Ounce (Pack of 20)', 'flavor_name': 'Tuna Variety', 'asin': 'B0B52F4SBT'}, {'size_name': '0.5 Ounce (Pack of 24)', 'flavor_name': 'Tuna Recipe with Clam Flavor', 'asin': 'B0B1W1YTZF'}, {'size_name': '0.5 Ounce (Pack of 24)', 'flavor_name': 'Tuna Recipe', 'asin': 'B07DVZFWCB'}, {'size_name': '0.5 Ounce (Pack of 40)', 'flavor_name': 'Tuna & Seafood Variety', 'asin': 'B0B52D1P2M'}, {'size_name': '0.5 Ounce (Pack of 24)', 'flavor_name': 'Tuna with Salmon Recipe', 'asin': 'B07DVW97KP'}, {'size_name': '0.5 Ounce (Pack of 40)', 'flavor_name': 'Chicken Variety', 'asin': 'B0B52MBWNB'}, {'size_name': '0.5 Ounce (Pack of 50)', 'flavor_name': 'Tuna & Seafood Variety', 'asin': 'B0B1W1ZZGQ'}, {'size_name': '0.5 Ounce (Pack of 10)', 'flavor_name': 'Chicken Variety', 'asin': 'B07D33DSZG'}, {'size_name': '0.5 Ounce (Pack of 50)', 'flavor_name': 'Chicken Variety', 'asin': 'B07D34KQNW'}, {'size_name': '0.5 Ounce (Pack of 24)', 'flavor_name': 'Tuna with Crab Recipe', 'asin': 'B0B1W2CKXZ'}, {'size_name': '0.5 Ounce (Pack of 10)', 'flavor_name': 'Tuna Variety', 'asin': 'B07D2YVPSH'}, {'size_name': '0.5 Ounce (Pack of 24)', 'flavor_name': 'Chicken with Salmon Recipe', 'asin': 'B0B1W2LQGL'}, {'size_name': '0.5 Ounce (Pack of 24)', 'flavor_name': 'Tuna with Scallop Recipe', 'asin': 'B07DMTLSTV'}, {'size_name': '1 Count (Pack of 24)', 'flavor_name': 'Tuna with Bonito Flakes Recipe', 'asin': 'B0B1W2146J'}]","{'size_name': ['0.5 Ounce (Pack of 50)', '0.5 Ounce (Pack of 24)', '0.5 Ounce (Pack of 20)', '0.5 Ounce (Pack of 10)', '0.5 Ounce (Pack of 40)', '0.5 Ounce (Pack of 60)', '1 Count (Pack of 24)'], 'flavor_name': ['Beef & Cheese Variety', 'Chicken', 'Chicken & Beef Variety', 'Chicken & Seafood Variety', 'Chicken Variety', 'Chicken Variety Bag', 'Chicken with Beef', 'Chicken with Cheese Recipe', 'Chicken with Crab Recipe', 'Chicken with Salmon Recipe', 'Chicken with Scallop Recipe', 'Chicken with Shrimp Recipe', 'Seafood', 'Seafood Variety Bag', 'Tuna & Seafood Variety', 'Tuna Recipe', 'Tuna Recipe with Clam Flavor', 'Tuna Recipe with Seafood Flavors', 'Tuna Recipe with Shrimp Flavor', 'Tuna Variety', 'Tuna Variety Bag', 'Tuna and Chicken Variety', 'Tuna with Beef', 'Tuna with Bonito Flakes Recipe', 'Tuna with Cheese Recipe', 'Tuna with Chicken Recipe', 'Tuna with Crab Recipe', 'Tuna with Salmon Recipe', 'Tuna with Scallop Recipe']}",new,[],"[{'badge': ""Amazon's Choice"", 'badge_text': None}]",89%,6%,2%,1%,2%
