asin,name,brand,price,regular_price,total_reviews,average_rating,seller,seller_url,availability_status,availability_quantity,shipping_charge,is_prime,author,available_book_formats,is_aplus_page,small_description,full_description,images,video_count,productCategory,url,attributes,size,color,model,product_information,parent_asin,variation_asin,product_variations,product_condition,frequently_bought_together,product_badges,five_star,four_star,three_star,two_star,one_star
B07K98XDX8,"McAfee Total Protection 2024 | 3 Device | Cybersecurity Software Includes Antivirus, Secure VPN, Password Manager, Dark Web Monitoring",McAfee,$20.99,$99.99,"5,058",4.0,,,Available now,,,True,,,True,"MCAFEE TOTAL PROTECTION IS ALL-IN-ONE PROTECTION — delivering award-winning antivirus for 5 devices, with identity monitoring and VPN - ID MONITORING — we'll monitor everything from email addresses to IDs and phone numbers for signs of breaches. If your info is found, we'll notify you so you can take action - BANK, SHOP, AND BROWSE ANYWHERE SECURELY WITH UNLIMITED VPN — protect your online privacy automatically when connecting to public Wi-Fi - SECURE YOUR ACCOUNTS — generate and store complex passwords with a password manager - AWARD-WINNING ANTIVIRUS — rest easy knowing McAfee will notify you of risky websites and protect you from the latest threats - CONTINUOUS PROTECTION - 1 year subscription with Amazon Auto Renewal","McAfee Total Protection for 3 devices is all-in-one online protection — award-winning antivirus, and online services to protect your security, identity, and privacy so you can live your life online freely & confidently.","['https://m.media-amazon.com/images/I/71qzG0gtV2L._AC_SL1500_.jpg', 'https://m.media-amazon.com/images/I/71UlylOb-ZL._AC_SL1427_.jpg', 'https://m.media-amazon.com/images/I/71ovq3XI4gL._AC_SL1427_.jpg', 'https://m.media-amazon.com/images/I/71PByrBi-IL._AC_SL1427_.jpg', 'https://m.media-amazon.com/images/I/61jFVfH0vsL._AC_SL1427_.jpg', 'https://m.media-amazon.com/images/I/711o-7LZRdL._AC_SL1427_.jpg']",9,Software > Antivirus & Security > Antivirus,https://www.amazon.com/-/dp/B07K98XDX8?_encoding=UTF8&th=1&psc=1&pf_rd_i=desktop&ref_=pd_gw_unk,"edition: 3 Devices Total Protection, subscription_term: 1 Year with Amazon Auto Renewal, platform_for_display: Download",,,,"{'Date First Available': 'November 1, 2018', 'Manufacturer': 'McAfee', 'ASIN': 'B07K98XDX8', 'Amazon Best Sellers Rank': '#11 in Software , #3 in Antivirus , #4 in Internet Security Suites , #8 in Mac Software'}",B0BQSBBKV5,"[{'edition': '5 Devices Total Protection', 'subscription_term_name': '1 Year with Amazon Auto Renewal', 'platform_for_display': 'Download', 'asin': 'B07K98LLVV'}, {'edition': '3 Devices Total Protection', 'subscription_term_name': '1 Year', 'platform_for_display': 'Mailed Keycard', 'asin': 'B0B9VY13PM'}, {'edition': '3 Devices Total Protection', 'subscription_term_name': '1 Year with Amazon Auto Renewal', 'platform_for_display': 'Download', 'asin': 'B07K98XDX8'}, {'edition': 'Unlimited Devices Total Protection', 'subscription_term_name': '1 Year with Amazon Auto Renewal', 'platform_for_display': 'Download', 'asin': 'B07K995RWG'}, {'edition': '3 Devices Total Protection', 'subscription_term_name': '1 Year', 'platform_for_display': 'Download', 'asin': 'B0BB2N69J8'}, {'edition': '5 Devices Total Protection', 'subscription_term_name': '1 Year', 'platform_for_display': 'Mailed Keycard', 'asin': 'B0B9W5QP16'}, {'edition': '5 Devices Total Protection', 'subscription_term_name': '1 Year', 'platform_for_display': 'Download', 'asin': 'B0BB2GF9WW'}]","{'edition': ['3 Devices Total Protection', '5 Devices Total Protection', 'Unlimited Devices Total Protection'], 'subscription_term_name': ['1 Year', '1 Year with Amazon Auto Renewal'], 'platform_for_display': ['Download', 'Mailed Keycard']}",new,[],"[{'badge': ""Amazon's Choice"", 'badge_text': None}]",62%,13%,8%,3%,14%
B0CLBVVRF3,"TurboTax Premier 2023 Tax Software, Federal & State Tax Return [Amazon Exclusive] [PC/Mac Download]",Intuit,$104.99,,"6,052",4.3,Amazon.com,https://www.amazon.com/gp/help/seller/at-a-glance.html/ref=dp_merchant_link?ie=UTF8&seller=A3ODHND3J0WMC8&asin=B0CLBVVRF3&ref_=dp_merchant_link,Available now,,,True,,,True,"Recommended if you sold stock, bonds or mutual funds, sold employee stock, own rental property or are a trust beneficiary - Includes 5 Federal e-files and 1 State via download. State e-file sold separately. Free U.S.-based product support (hours may vary). - Get your taxes done right and keep more of your investment and rental property income - Step-by-step guidance on stocks, bonds, ESPPs and other investment income - Up-to-date with the latest tax laws","TurboTax 2023 – File your taxes with 100% confidence TurboTax is tailored to your unique situation. It searches for hundreds of deductions and credits and handles even the toughest tax situations, so you can be confident you’re getting every dollar you deserve. • Recommended if you sold stock, bonds or mutual funds, sold employee stock, own rental property or are a trust beneficiary • Includes 5 Federal e-files and 1 State via download. State e-file sold separately. Free U.S.-based product support (hours may vary). • Your downloaded software resides on your computer, so you can view and manage your tax data (Intuit Account required) • Searches 350+ deductions and credits, so you can keep more of your investment income • Helps you report sales of stocks, bonds, and mutual funds, plus calculate capital gains/losses • Up-to-date with the latest tax laws so you have the latest information • Retirement tax help and IRA tool show how to get more money back this year and when you retire • Avoid mistakes by importing W-2s, investment & mortgage information from participating companies • Audit Risk Meter checks your return for audit triggers and shows your risk level • Runs thousands of checks before you file to help identify missing deductions or credits","['https://m.media-amazon.com/images/I/71ABLSmFI3L._AC_SL1500_.jpg', 'https://m.media-amazon.com/images/I/611TyopF3nL._AC_SL1333_.jpg', 'https://m.media-amazon.com/images/I/61PXzz7OQLL._AC_SL1333_.jpg', 'https://m.media-amazon.com/images/I/71dkPqCVakL._AC_SL1500_.jpg', 'https://m.media-amazon.com/images/I/61gHZoCGjJL._AC_SL1333_.jpg']",9,Software > Featured Categories > Mac Software,https://www.amazon.com/-/dp/B0CLBVVRF3?_encoding=UTF8&th=1&psc=1&pf_rd_i=desktop&ref_=pd_gw_unk,"edition: Premier + State, platform_for_display: PC/Mac Download",,,,"{'Date First Available': 'October 18, 2023', 'Manufacturer': 'Intuit', 'ASIN': 'B0CLBVVRF3', 'Amazon Best Sellers Rank': '#6 in Software , #3 in Tax Preparation , #5 in Mac Software'}",B0CY38TK15,"[{'edition': 'Business', 'platform_for_display': 'PC Disc', 'asin': 'B0CJYJBJNQ'}, {'edition': 'Deluxe + State', 'platform_for_display': 'PC/Mac Disc', 'asin': 'B0CJYL7JYV'}, {'edition': 'Home & Business + State', 'platform_for_display': 'PC/Mac Download', 'asin': 'B0CLC5MKTP'}, {'edition': 'Premier + State', 'platform_for_display': 'PC/Mac Download', 'asin': 'B0CLBVVRF3'}, {'edition': 'Business', 'platform_for_display': 'PC Download', 'asin': 'B0CLBPQX99'}, {'edition': 'Basic', 'platform_for_display': 'PC/Mac Download', 'asin': 'B0CLBPM8HZ'}, {'edition': 'Premier + State', 'platform_for_display': 'PC/Mac Disc', 'asin': 'B0CJYJH2YS'}, {'edition': 'Deluxe + State', 'platform_for_display': 'PC/Mac Download', 'asin': 'B0CLBV27N2'}, {'edition': 'Deluxe', 'platform_for_display': 'PC/Mac Download', 'asin': 'B0CLCC3GSN'}]","{'edition': ['Business', 'Deluxe + State', 'Home & Business + State', 'Premier + State', 'Basic', 'Deluxe'], 'platform_for_display': ['PC Disc', 'PC Download', 'PC/Mac Disc', 'PC/Mac Download']}",new,"[{'title': 'LiCB CR2032 3V Lithium Battery(10-Pack)', 'link': 'https://www.amazon.com/LiCB-CR2032-Lithium-Battery-10-Pack/dp/B071D4DKTZ/ref=pd_day0fbt_d_sccl_1/000-0000000-0000000?pd_rd_w=5ljC7&content-id=amzn1.sym.dbf20214-5add-4d96-a0b6-bb9d4c2e8362&pf_rd_p=dbf20214-5add-4d96-a0b6-bb9d4c2e8362&pf_rd_r=2TBDGZTQAJK8GARC733B&pd_rd_wg=pQMrm&pd_rd_r=03986420-31a7-4275-9b23-7a9f973d5e80&pd_rd_i=B071D4DKTZ&psc=1', 'price': '$5.99'}]","[{'badge': ""Amazon's Choice"", 'badge_text': None}]",68%,15%,6%,3%,9%
B07Q8JGCSQ,"Norton 360 Deluxe 2024, Antivirus software for 3 Devices with Auto Renewal - Includes VPN, PC Cloud Backup & Dark Web Monitoring [Download]",Norton,$19.99,$74.99,"5,206",4.0,Amazon.com,https://www.amazon.com/gp/help/seller/at-a-glance.html/ref=dp_merchant_link?ie=UTF8&seller=A3ODHND3J0WMC8&asin=B07Q8JGCSQ&ref_=dp_merchant_link,Available now,,,True,,,True,"ONGOING PROTECTION Download instantly & install protection for up to 3 PCs, Macs, iOS or Android devices in minutes! - REAL-TIME THREAT PROTECTION Advanced security protects against existing and emerging malware threats, including ransomware and viruses, and it won’t slow down your device performance - SECURE VPN Browse anonymously and securely with a no-log VPN while using public Wi-Fi Add bank-grade encryption to help keep your information like passwords and bank details secure and private - DARK WEB MONITORING will monitor and notify you if we find your personal information on the Dark Web** - 25GB SECURE PC CLOUD BACKUP store and help protect important files as a preventative measure to data loss due to hard drive failures, stolen devices and even ransomware*** - PRE-PAID SUBSCRIPTION A payment method must be stored in your Norton account to activate* You won’t be charged until the prepaid term ends For new Norton subscriptions only at an introductory price - AUTO-RENEWAL Never have a service disruption since this subscription auto-renews annually If you do not wish to renew, you can cancel in your Norton account anytime","Norton 360 Deluxe gives you comprehensive malware protection for up to 3 PCs, Macs, Android or iOS devices, including 25GB of secure PC cloud backup and Secure VPN for your devices. Enrolling in our auto-renewing subscription and storing a payment method is required for activation and use.* We won't charge you until your renewal period. You will get an email reminder before we charge your payment method and can cancel your automatic renewal at any time in your Norton account. Also included are additional features such as Password Manager, SafeCam that alerts you and blocks unauthorized access to your PC’s webcam, and Dark Web Monitoring,** where we monitor and notify you if we find your personal information on the dark web.","['https://m.media-amazon.com/images/I/71uuBMzSgrL._AC_SL1500_.jpg', 'https://m.media-amazon.com/images/I/714SeDpUatL._AC_SL1500_.jpg', 'https://m.media-amazon.com/images/I/81q0-niCOHL._AC_SL1500_.jpg', 'https://m.media-amazon.com/images/I/71UbjIDmdYL._AC_SL1500_.jpg', 'https://m.media-amazon.com/images/I/71wtNz81uYL._AC_SL1500_.jpg', 'https://m.media-amazon.com/images/I/715qqdmIXML._AC_SL1500_.jpg', 'https://m.media-amazon.com/images/I/71xC4ycosnL._AC_SL1500_.jpg']",4,Software > Antivirus & Security > Internet Security Suites,https://www.amazon.com/-/dp/B07Q8JGCSQ?_encoding=UTF8&th=1&psc=1&pf_rd_i=desktop&ref_=pd_gw_unk,"edition: 3 Devices, subscription_term: 12 Month with Auto-Renewal, platform_for_display: Emailed Product Key",,,,"{'Date First Available': 'March 27, 2019', 'Manufacturer': 'NortonLifeLock', 'ASIN': 'B07Q8JGCSQ', 'Amazon Best Sellers Rank': '#8 in Software , #3 in Internet Security Suites , #6 in Mac Software'}",B0CXTBHJY3,"[{'edition': '3 Devices', 'subscription_term_name': '12 Month with Auto-Renewal', 'platform_for_display': 'Emailed Product Key', 'asin': 'B07Q8JGCSQ'}, {'edition': '3 Devices', 'subscription_term_name': '12 Month with Auto-Renewal', 'platform_for_display': 'Mailed Product Key', 'asin': 'B07QFXSQFP'}]","{'edition': ['3 Devices'], 'subscription_term_name': ['12 Month with Auto-Renewal'], 'platform_for_display': ['Emailed Product Key', 'Mailed Product Key']}",new,"[{'title': 'Flash Drive Case USB Storage Case JBOS USB Holder Storage Bag, Electronic Accessories Organizer for USB Flash Drive, USB Case, Thumb Drive Caes, Jump Drive Case, USB Organizer', 'link': 'https://www.amazon.com/JBOS-Electronic-Accessories-Organizer-DriveThumb/dp/B07RTMTV92/ref=pd_day0fbt_d_sccl_1/000-0000000-0000000?pd_rd_w=scLhU&content-id=amzn1.sym.dbf20214-5add-4d96-a0b6-bb9d4c2e8362&pf_rd_p=dbf20214-5add-4d96-a0b6-bb9d4c2e8362&pf_rd_r=NTW5C8ANDJP6CWCV5FTE&pd_rd_wg=1Tu0Q&pd_rd_r=8ea244a0-5bc3-40a1-8e42-bcfa0751af9a&pd_rd_i=B07RTMTV92&psc=1', 'price': '$6.99'}, {'title': 'PNY 64GB Turbo Attaché 3 USB 3.0 Flash Drive, 5-Pack, Grey, P-FD64GX5TBOP-MP, 100MB/s, Light-Weight Durable - Data Storage and Transfer', 'link': 'https://www.amazon.com/PNY-Turbo-Attach%C3%A9-Flash-5-Pack/dp/B09RG1TNM7/ref=pd_day0fbt_d_sccl_2/000-0000000-0000000?pd_rd_w=scLhU&content-id=amzn1.sym.dbf20214-5add-4d96-a0b6-bb9d4c2e8362&pf_rd_p=dbf20214-5add-4d96-a0b6-bb9d4c2e8362&pf_rd_r=NTW5C8ANDJP6CWCV5FTE&pd_rd_wg=1Tu0Q&pd_rd_r=8ea244a0-5bc3-40a1-8e42-bcfa0751af9a&pd_rd_i=B09RG1TNM7&psc=1', 'price': '$20.99'}]","[{'badge': ""Amazon's Choice"", 'badge_text': None}]",62%,13%,7%,3%,15%
B07F3TQ6DQ,"Microsoft 365 Personal | 12-Month Subscription, 1 person | Word, Excel, PowerPoint | 1TB OneDrive cloud storage | PC/Mac Instant Download | Activation Required",Microsoft,$69.99,,"10,917",4.4,,,Available now,,,True,,,True,"With a Microsoft 365 12‑month subscription, you can create, organize, and get things done. - Bring out your best with premium Office apps, including Word, Excel, and PowerPoint. - Easily access, edit, and share files and photos across all devices with 1 TB of OneDrive cloud storage. - Keep it all together with Outlook, an ad‑free app for your email, calendars, to‑do lists and contacts plus security tools that keep your information protected. - Protect your files with advanced security features like built‑in ransomware detection and recovery, and you can use two‑step identity verification to access your most important files in OneDrive Personal Vault. - Enjoy the flexibility to use multiple PCs, Macs, iPads, iPhones and Android phones.","One convenient subscription for 1 person. Microsoft 365 Personal comes with premium Office apps, including Word, Excel, PowerPoint, Outlook, and more. Receive 1 TB of OneDrive cloud storage for 1 person which allows you to access, edit, and share your files and photos across all your devices—all while knowing your information is always backed up and protected.","['https://m.media-amazon.com/images/I/61pCCojbi-L._AC_SL1500_.jpg', 'https://m.media-amazon.com/images/I/71RLGtwxWOL._AC_SL1500_.jpg', 'https://m.media-amazon.com/images/I/71sjgrzxSIL._AC_SL1500_.jpg', 'https://m.media-amazon.com/images/I/81xK9QsDTOL._AC_SL1500_.jpg', 'https://m.media-amazon.com/images/I/71PXKk3TvuL._AC_SL1500_.jpg', 'https://m.media-amazon.com/images/I/81ESYLDNfVL._AC_SL1500_.jpg', 'https://m.media-amazon.com/images/I/61eHsy2ZZzL._AC_SL1500_.jpg']",10,Software > Business & Office > Office Suites,https://www.amazon.com/-/dp/B07F3TQ6DQ?_encoding=UTF8&th=1&psc=1&pf_rd_i=desktop&ref_=pd_gw_unk,"edition: Microsoft 365 Personal, subscription_term: Subscription - 12months, platform_for_display: Subscription (PC/Mac)",,,,"{'Date First Available': 'June 28, 2018', 'Manufacturer': 'Microsoft', 'ASIN': 'B07F3TQ6DQ', 'Amazon Best Sellers Rank': '#13 in Software , #2 in Business & Office Management , #9 in Mac Software'}",B0CRKMY1RZ,"[{'edition': 'Microsoft Office Home & Business 2021', 'subscription_term_name': 'One-Time Purchase', 'platform_for_display': 'Download (PC/Mac)', 'asin': 'B09H7F77JR'}, {'edition': 'Microsoft 365 Personal', 'subscription_term_name': 'Subscription - 12months', 'platform_for_display': 'Subscription (PC/Mac)', 'asin': 'B07F3TQ6DQ'}, {'edition': 'Microsoft 365 Family', 'subscription_term_name': 'Subscription - 12months', 'platform_for_display': 'Subscription (PC/Mac)', 'asin': 'B07F3SNQT5'}, {'edition': 'Microsoft Office Professional 2021', 'subscription_term_name': 'One-Time Purchase', 'platform_for_display': 'Download (PC/Mac)', 'asin': 'B09HSCR294'}, {'edition': 'Microsoft 365 Business Standard', 'subscription_term_name': 'One-Time Purchase', 'platform_for_display': 'Download (PC/Mac)', 'asin': 'B07H5C1X31'}]","{'edition': ['Microsoft 365 Business Standard', 'Microsoft 365 Family', 'Microsoft 365 Personal', 'Microsoft Office Home & Business 2021', 'Microsoft Office Professional 2021'], 'subscription_term_name': ['Subscription - 12months', 'One-Time Purchase'], 'platform_for_display': ['Download (PC/Mac)', 'Subscription (PC/Mac)']}",new,[],"[{'badge': ""Amazon's Choice"", 'badge_text': None}]",72%,12%,5%,2%,9%
B0CJCWHXH2,H&R Block Tax Software Deluxe + State 2023 with Refund Bonus Offer (Amazon Exclusive) (PC/MAC Download),H&R Block,$39.97,$49.99,"4,222",4.1,Amazon.com,https://www.amazon.com/gp/help/seller/at-a-glance.html/ref=dp_merchant_link?ie=UTF8&seller=A3ODHND3J0WMC8&asin=B0CJCWHXH2&ref_=dp_merchant_link,Available now,,,True,,,True,"Choose to put your refund on an Amazon gift card and you can get a 2% bonus. - One state program download included. State e-file sold separately. - Reporting assistance on income from investments, stock options, home sales, and retirement - Guidance on maximizing mortgage interest and real estate tax deductions (Schedule A) - Step-by-step Q&A and guidance - Quickly import your W-2, 1099, 1098, and last year's personal tax return, even from TurboTax and Quicken Software - Accuracy Review checks for issues and assesses your audit risk - Five free federal e-files and unlimited federal preparation and printing","H&R Block Deluxe Tax Software helps tax filers maximize deductions on homes and other investments and gives them everything they need to easily file federal and state taxes-including a help center with over 13,000 searchable articles.","['https://m.media-amazon.com/images/I/51WNth-N57L._AC_SL1000_.jpg', 'https://m.media-amazon.com/images/I/71evDHXO5rL._AC_SL1500_.jpg', 'https://m.media-amazon.com/images/I/61dNRJVe6gL._AC_SL1000_.jpg', 'https://m.media-amazon.com/images/I/71zbp0jrkcL._AC_SL1500_.jpg']",10,Software > Featured Categories > Mac Software,https://www.amazon.com/-/dp/B0CJCWHXH2?_encoding=UTF8&th=1&psc=1&pf_rd_i=desktop&ref_=pd_gw_unk,"edition: Deluxe + State, platform_for_display: Software Download",,,,"{'Date First Available': 'September 20, 2023', 'Manufacturer': 'H&R Block', 'ASIN': 'B0CJCWHXH2', 'Amazon Best Sellers Rank': '#9 in Software , #4 in Tax Preparation , #7 in Mac Software'}",B0CMSMSYYF,"[{'edition': 'Deluxe + State', 'platform_for_display': 'Software Download', 'asin': 'B0CJCWHXH2'}, {'edition': 'Premium & Business', 'platform_for_display': 'Software Download', 'asin': 'B0CJCVFLSZ'}, {'edition': 'Basic', 'platform_for_display': 'Software Download', 'asin': 'B0CJCVGWW6'}, {'edition': 'Premium', 'platform_for_display': 'Software Download', 'asin': 'B0CJDFTC7T'}, {'edition': 'Deluxe', 'platform_for_display': 'Software Download', 'asin': 'B0CJDF53FT'}]","{'edition': ['Basic', 'Deluxe', 'Deluxe + State', 'Premium', 'Premium & Business'], 'platform_for_display': ['Software Download']}",new,[],"[{'badge': ""Amazon's Choice"", 'badge_text': None}]",63%,15%,6%,3%,12%
B09MYJ1R6L,Microsoft System Builder | Windоws 11 Home | Intended use for new systems | Install on a new PC | Branded by Microsoft,Microsoft,$119.99,$129.99,"1,437",4.3,Amazon.com,,In Stock,,,True,,,False,"STREAMLINED & INTUITIVE UI, DVD FORMAT | Intelligent desktop | Personalize your experience for simpler efficiency | Powerful security built-in and enabled. - OEM IS TO BE INSTALLED ON A NEW PC with no prior version of Windows installed and cannot be transferred to another machine. - OEM DOES NOT PROVIDE SUPPORT | To acquire product with Microsoft support, obtain the full packaged “Retail” version. - PRODUCT SHIPS IN PLAIN ENVELOPE | Activation key is located under scratch-off area on label. - GENUINE WINDOWS SOFTWARE IS BRANDED BY MIRCOSOFT ONLY.","We’ve reimagined every element of the Windows 11 UX to feel effortless, personal, and focused. It wasn’t simply built for people who use Windows, it was built by people who use Windows every day. People who understand the challenges of today’s workstyles. Streamlined and intuitive UI • Juggling complex workflows and remote collaboration while trying to find the apps, files, and people you need can be demanding. Windows 11 helps you reduce cognitive load with a simplified and streamlined experience so you can focus. • Enjoy a centered Start and effortless navigation. • Search across the web, your work, and Windows directly from your taskbar. • Make tasks easier with a clean layout and fresh icons, wallpaper, and sounds. • We’ve also enhanced familiar tools to boost your productivity. For example, Microsoft Edge is designed to be the fastest browser on Windows 11 and to work seamlessly with Microsoft 365 including Microsoft Teams, Outlook, and Office apps. Intelligent desktop - New features enable you to make the most of available desktop space. • Snap layouts organize open windows with pre-configured options that intelligently adapt to the size and dimension of your screen. • Pick up where you left off. Windows 11 remembers your layout, so you can return to it even when you dock or undock from your monitor. • Create separate, custom desktops for each workstream or project, and switch instantly between them from your taskbar. • Personalized and accessible With Windows 11, you can personalize your experience for simpler efficiency. • Work naturally and comfortably with your voice, digital pen, and multi-finger touch.1 • Use voice typing to turn ideas into text instantly in your browser and favorite apps. • Get live news, your schedule, and to-do lists in a swipe with customizable Widgets. • Easily automate workflows from your desktop with Microsoft Power Automate Also, just as with Windows 10, we are deeply committed to app compatibility in Windows 11. We stand behind our promise that your applications will work on Windows 11 with App Assure, a service that helps subscribers with 150 or more users fix any app issues they might run into at no additional cost. We’ve designed Windows 11 to ensure a smooth transition to this powerful new operating system. And we’re giving customers the flexibility to upgrade in a way that’s best for them. Protect data and access anywhere with a Zero Trust-ready OS Security has never been more important. In the most complex cybersecurity environment they’ve ever seen, businesses need a platform that is even stronger and more resilient to attacks. Windows 11 is the most secure Windows yet, providing next-generation protection without sacrificing performance or user experience. • Get powerful security built-in and enabled on all devices, including hardware isolation, encryption, and malware protection. • Easily apply password-less security with Enhanced Windows Hello for Business.5 • Combine device safeguards with multi-factor authentication for Zero Trust protection. • Use cloud configuration to simply secure a device for curated apps and access. • Gain more choice and flexibility","['https://m.media-amazon.com/images/I/61JfosHunyL._AC_SL1500_.jpg', 'https://m.media-amazon.com/images/I/41zahOtywZL._AC_.jpg', 'https://m.media-amazon.com/images/I/51U39BzIAIL._AC_.jpg', 'https://m.media-amazon.com/images/I/51C4Zig+3PL._AC_SL1025_.jpg', 'https://m.media-amazon.com/images/I/51Gbtwl4noL._AC_.jpg', 'https://m.media-amazon.com/images/I/61fe8qsSdvL._AC_SL1187_.jpg']",3,Software > Operating Systems,https://www.amazon.com/-/dp/B09MYJ1R6L?_encoding=UTF8&th=1&psc=1&pf_rd_i=desktop&ref_=pd_gw_unk,style: Windows 11 Home,,,KW9-00633,"{'Product Dimensions': '7.5 x 5.5 x 0.1 inches; 1.6 ounces', 'Item model number': 'KW9-00633', 'Date First Available': 'December 2, 2021', 'Manufacturer': 'Microsoft', 'ASIN': 'B09MYJ1R6L', 'Country of Origin': 'USA', 'Amazon Best Sellers Rank': '#16 in Software , #2 in Operating Systems (Software)'}",B09Z7M37DS,"[{'style_name': 'Windows 11 Pro (Acitvation code)', 'asin': 'B0DJ9DSRL6'}, {'style_name': 'Windows 11 Home', 'asin': 'B09MYJ1R6L'}, {'style_name': 'Windows 11 Pro', 'asin': 'B09MYBD79G'}, {'style_name': 'Windows 11 Home (Acitvation code)', 'asin': 'B0DJ9G8JPS'}]","{'style_name': ['Windows 11 Home', 'Windows 11 Home (Acitvation code)', 'Windows 11 Pro', 'Windows 11 Pro (Acitvation code)']}",new,"[{'title': 'CORSAIR 4000D AIRFLOW Tempered Glass Mid-Tower ATX Case - High-Airflow - Cable Management System - Spacious Interior - Two Included 120 mm Fans - Black', 'link': 'https://www.amazon.com/Corsair-4000D-Airflow-Tempered-Mid-Tower/dp/B08C7BGV3D/ref=pd_bxgy_d_sccl_1/000-0000000-0000000?pd_rd_w=hbMMC&content-id=amzn1.sym.3858a394-39a9-4946-90e6-86a3153d2546&pf_rd_p=3858a394-39a9-4946-90e6-86a3153d2546&pf_rd_r=TEK21QVA34F0Q0Q2B1DP&pd_rd_wg=VQy1A&pd_rd_r=1c080c10-e801-4cf1-8f17-33d62134b3ea&pd_rd_i=B08C7BGV3D&psc=1', 'price': '$79.97'}, {'title': 'Thermalright Peerless Assassin 120 SE CPU Cooler, 6 Heat Pipes AGHP Technology, Dual 120mm PWM Fans, 1550RPM Speed, for AMD:AM4 AM5/Intel LGA 1700/1150/1151/1200,PC Cooler', 'link': 'https://www.amazon.com/Thermalright-Peerless-SE-Aluminium-Technology/dp/B09LGY38L4/ref=pd_bxgy_d_sccl_2/000-0000000-0000000?pd_rd_w=hbMMC&content-id=amzn1.sym.3858a394-39a9-4946-90e6-86a3153d2546&pf_rd_p=3858a394-39a9-4946-90e6-86a3153d2546&pf_rd_r=TEK21QVA34F0Q0Q2B1DP&pd_rd_wg=VQy1A&pd_rd_r=1c080c10-e801-4cf1-8f17-33d62134b3ea&pd_rd_i=B09LGY38L4&psc=1', 'price': '$34.90'}]",[],72%,10%,5%,2%,11%
