asin,name,brand,price,regular_price,total_reviews,average_rating,seller,seller_url,availability_status,availability_quantity,shipping_charge,is_prime,author,available_book_formats,is_aplus_page,small_description,full_description,images,video_count,productCategory,url,attributes,size,color,model,product_information,parent_asin,variation_asin,product_variations,product_condition,frequently_bought_together,product_badges,five_star,four_star,three_star,two_star,one_star
B07T71FTGB,YukaBa MarshLing Antique Liberty Indian Head Ten-Dollars Coin - Great American Commemorative Old Coins- Uncirculated Morgan Dollars-Discover History of US Coins Perfect Quality,YukaBa,$8.99,,"1,318",4.3,YukaYuka,https://www.amazon.com/gp/help/seller/at-a-glance.html/ref=dp_merchant_link?ie=UTF8&seller=A3O3PFUPKJIOIX&asin=B07T71FTGB&ref_=dp_merchant_link&isAmazonFulfilled=1,In Stock,,,True,,,False,"American Commemorative Old Coins For Collectors: This American old Coin is made of Brass, It is plated with 925 sterling silver.This product is handmade crafts. It is not a tradable silver coin, but it is worth your permanent collection. - One Of The Most Collected Coins: This is a 1907 Morgan Indian Head TEN-Dollars Coins, It’s one of the most collected coins in the world, beloved by collectors, it is worth your permanent collection. - Discover History of USA Coins: Although the Morgan Indian Head TEN-Dollars not a tradable coin, it has witnessed the history of American coins.","Dear, this old Coin is made of Brass; the old Coin is plated with 925 sterling silver. This product is handmade crafts. It is a non-tradable US coins, but it is worth your permanent collection. Specification Category: American coin Color: Silver+Black Material: Brass Package including: 1 X American coin Specification: Material: brass silver plated Process: Die Casting Packing List: 1 x Old American TEN-Dollars handmade Coin","['https://m.media-amazon.com/images/I/71vOtdPzWBL._AC_SL1050_.jpg', 'https://m.media-amazon.com/images/I/71z0TWb0UvL._AC_SL1050_.jpg', 'https://m.media-amazon.com/images/I/710CTsrCGiL._AC_SL1050_.jpg', 'https://m.media-amazon.com/images/I/719ag6mvFNL._AC_SL1050_.jpg', 'https://m.media-amazon.com/images/I/61utcjPdmIL._AC_SL1050_.jpg', 'https://m.media-amazon.com/images/I/71vOtdPzWBL._AC_SL1050_.jpg']",0,Collectibles & Fine Art > Collectible Coins > Individual Coins,https://www.amazon.com/-/dp/B07T71FTGB?_encoding=UTF8&th=1&psc=1&pf_rd_i=desktop&ref_=pd_gw_unk,,,,,"{'Metal Type': 'Brass', 'Purity Percentage': '92.5', 'Material': 'Silver, Brass', 'Color': 'Silver', 'Exterior Finish': 'Brass', 'Coin Variety 1': 'Antique,Commemorative,Indian Head,Silver', 'Grade Rating': 'Mint State', 'Total Eaches': '1', 'Set': 'Single', 'ASIN': 'B07T71FTGB', 'Denomination': 'Dollar', 'Manufacturer': 'LiRanCoin', 'Year': '1907', 'Brand Name': 'YukaBa', 'Amazon Best Sellers Rank': '#13 in Collectible Coins , #10 in Individual Collectible Coins'}",B07T71FTGB,[],{},new,"[{'title': '1795, 1796, 1797, 1798 Year Dollar Coin Liberty American Liberty Coin United States of America Coin Souvenir Replica for Collection Party Gifts', 'link': 'https://www.amazon.com/Liberty-American-America-Souvenir-Collection/dp/B0CBNDG8ZJ/ref=pd_bxgy_d_sccl_1/000-0000000-0000000?pd_rd_w=Hrfox&content-id=amzn1.sym.3858a394-39a9-4946-90e6-86a3153d2546&pf_rd_p=3858a394-39a9-4946-90e6-86a3153d2546&pf_rd_r=3144TCV517FV0Y7QYNKK&pd_rd_wg=yqTnX&pd_rd_r=dbec9b45-324d-41e2-baff-3c0b24b26f03&pd_rd_i=B0CBNDG8ZJ&psc=1', 'price': '$9.99'}, {'title': '1808 Dollar Replica Coin - Antique Liberty Half Dollar Coin Great American Coin Old USA Commemorative Coin', 'link': 'https://www.amazon.com/1808-Dollar-Replica-Coin-Commemorative/dp/B07NQD74GS/ref=pd_bxgy_d_sccl_2/000-0000000-0000000?pd_rd_w=Hrfox&content-id=amzn1.sym.3858a394-39a9-4946-90e6-86a3153d2546&pf_rd_p=3858a394-39a9-4946-90e6-86a3153d2546&pf_rd_r=3144TCV517FV0Y7QYNKK&pd_rd_wg=yqTnX&pd_rd_r=dbec9b45-324d-41e2-baff-3c0b24b26f03&pd_rd_i=B07NQD74GS&psc=1', 'price': '$6.99'}]",[],66%,15%,7%,4%,7%
B011LOOKV8,50 Wheat Pennies (Unsearched Shotgun Roll) - Mixed Years Circulated Good or Better.,US Mint,$13.24,,"1,349",3.6,New Pastimes,https://www.amazon.com/gp/help/seller/at-a-glance.html/ref=dp_merchant_link?ie=UTF8&seller=AZJL65IPKIMH2&asin=B011LOOKV8&ref_=dp_merchant_link&isAmazonFulfilled=1,In Stock,,,True,,,False,50 Wheat Cent Pennies - Pre-1959,A roll of 50 wheat back Lincoln cents. Dates will vary.,['https://m.media-amazon.com/images/I/71V4oUDB5bL._AC_SL1000_.jpg'],3,Collectibles & Fine Art > Collectible Coins > Coin Sets,https://www.amazon.com/-/dp/B011LOOKV8?_encoding=UTF8&th=1&psc=1&pf_rd_i=desktop&ref_=pd_gw_unk,,,,,"{'Metal Type': 'Copper', 'Material': 'Copper', 'ASIN': 'B011LOOKV8', 'Denomination': '1 penny', 'Manufacturer': 'United States Mint', 'Year': '1958', 'Brand Name': 'US Mint', 'Total Eaches': '50', 'Set': 'Set', 'Color': 'Yellow', 'Coin Variety 1': 'Wheat', 'Grade Rating': 'Circulated', 'Amazon Best Sellers Rank': '#9 in Collectible Coins , #4 in Collectible Coin Sets'}",B011LOOKV8,[],{},new,"[{'title': '1 Full Pound of Wheat Pennies Assortment - 148 Unsearched Coins', 'link': 'https://www.amazon.com/Full-Pound-Wheat-Pennies-Assortment/dp/B003NTFKYQ/ref=pd_bxgy_d_sccl_1/000-0000000-0000000?pd_rd_w=omLku&content-id=amzn1.sym.3858a394-39a9-4946-90e6-86a3153d2546&pf_rd_p=3858a394-39a9-4946-90e6-86a3153d2546&pf_rd_r=32SV47G7CVX5Z8CV23ZM&pd_rd_wg=bmkxu&pd_rd_r=05e17451-09d7-462c-bfad-b1043f32cbae&pd_rd_i=B003NTFKYQ&psc=1', 'price': '$24.95'}]",[],48%,12%,12%,9%,20%
B07TBR1XNV,"5 Pack Donald Trump Gold Plated Coin, Seal of The President Challenge Coins, Commemorative Gift with Case and Stand",HillSpring,$13.99,,"1,025",4.8,HillSpring,https://www.amazon.com/gp/help/seller/at-a-glance.html/ref=dp_merchant_link?ie=UTF8&seller=A2WIH2ZG026ICP&asin=B07TBR1XNV&ref_=dp_merchant_link&isAmazonFulfilled=1,In Stock,,,True,,,True,"5 PACK: 5x President Trump gold plated coins. - Made of zinc alloy with enamel. - Measures 1.5 inches diameter 35mm thick. - Each coin comes encapsulated in a clear protective case to avoid oxidation. - Perfect for gift giving, and fun to have.",More to consider Lapel Pins Gold Plated Coin 2020 Gold Plated Coin 2019 Display Frame Add to Cart Customer Reviews 4.8 out of 5 stars 183 187 4.7 out of 5 stars 441 621 5.0 out of 5 stars 4 Price $6.99 $ 6 . 99 $15.99 15 $9.99 9 $16.99 16 $7.99 7 Material Metal Alloy Zinc Alloy Plastic Item count 1 Pack 10 Pack 5 Pack Pendant Challenge Coin St. Michael Police Coins 201 184 285 185 123 $8.79 8 79 $8.99 $12.99 12 Stainless Steel Bronze Alloy 2 Pack,"['https://m.media-amazon.com/images/I/610SpdgT9GL._AC_SL1100_.jpg', 'https://m.media-amazon.com/images/I/51tu4xNqwQL._AC_.jpg', 'https://m.media-amazon.com/images/I/61WMrwKYxOL._AC_SL1000_.jpg', 'https://m.media-amazon.com/images/I/61ixyH+ItOL._AC_SL1000_.jpg', 'https://m.media-amazon.com/images/I/61dR388bdOL._AC_SL1000_.jpg', 'https://m.media-amazon.com/images/I/71H4PjMAadL._AC_SL1005_.jpg']",0,Collectibles & Fine Art > Collectible Coins > Coin Sets,https://www.amazon.com/-/dp/B07TBR1XNV?_encoding=UTF8&th=1&psc=1&pf_rd_i=desktop&ref_=pd_gw_unk,,,,,"{'Metal Type': 'Zinc', 'Material': 'Gold, Zinc', 'UPC': '797805099451', 'ASIN': 'B07TBR1XNV', 'Manufacturer': 'HS', 'Brand Name': 'HillSpring', 'Item Diameter': '1.5 Inches', 'Total Eaches': '5', 'Set': 'Set', 'Color': 'gold', 'Exterior Finish': 'Zinc Alloy', 'Coin Variety 1': 'Commemorative', 'Amazon Best Sellers Rank': '#7 in Collectible Coins , #2 in Collectible Coin Sets'}",B07TBR1XNV,[],{},new,"[{'title': 'Never Surrender Trump Challenge Coin 2024 Make America Great Again 40mm Gold Plated Commemorative Coins Gift', 'link': 'https://www.amazon.com/Surrender-Challenge-America-Plated-Commemorative/dp/B0CNZLZNQK/ref=pd_bxgy_d_sccl_1/000-0000000-0000000?pd_rd_w=MnvxB&content-id=amzn1.sym.3858a394-39a9-4946-90e6-86a3153d2546&pf_rd_p=3858a394-39a9-4946-90e6-86a3153d2546&pf_rd_r=YT4GHX9B081AATRFC2FY&pd_rd_wg=PwZuK&pd_rd_r=24b1d0c4-0944-4435-8aa6-7456fcaf615a&pd_rd_i=B0CNZLZNQK&psc=1', 'price': '$6.99'}, {'title': 'Aizics Mint Trump Coin: 2017 President Donald Trump Inaugural Silver Eagle Commemorative Novelty Coin 38mm with Certificate of Authenticity Original', 'link': 'https://www.amazon.com/President-Inaugural-Commemorative-CERTIFICATE-AUTHENTICITY/dp/B01MSQINVD/ref=pd_bxgy_d_sccl_2/000-0000000-0000000?pd_rd_w=MnvxB&content-id=amzn1.sym.3858a394-39a9-4946-90e6-86a3153d2546&pf_rd_p=3858a394-39a9-4946-90e6-86a3153d2546&pf_rd_r=YT4GHX9B081AATRFC2FY&pd_rd_wg=PwZuK&pd_rd_r=24b1d0c4-0944-4435-8aa6-7456fcaf615a&pd_rd_i=B01MSQINVD&psc=1', 'price': '$8.68'}]",[],87%,7%,3%,1%,2%
B0030HBU6I,EISENHOWER (IKE) DOLLARS SET OF 4 DIFFERENT DATES BETWEEN 1971-1978,US Mint,$15.95,,"2,244",4.6,Delaware,https://www.amazon.com/gp/help/seller/at-a-glance.html/ref=dp_merchant_link?ie=UTF8&seller=A25JP4WWDXB09W&asin=B0030HBU6I&ref_=dp_merchant_link&isAmazonFulfilled=1,In Stock,,,True,,,False,"Great set of 4 coins -- all different dates. Ikes were produced from 1973 to 1978 -- an exceptionally short run. - One from the 4-coin set with be have the dual date 1776-1976. The other 3 coins will be dated 1973 to 1978 - Coins have been picked for quality and eye appeal. The coins will grade from average circulated to BU - No holes, grime or counter-stamps. Great collectible at an extremely affordable price - On hand and ships immediately.",Great coins. Hand-picked. $ separate dates -- one of the dates will be the dual dated 1776-1976 coin. The others will range in date from 1973 to 1978. On hand and ships immediately..,"['https://m.media-amazon.com/images/I/61leNRImZxL.jpg', 'https://m.media-amazon.com/images/I/61leNRImZxL.jpg', 'https://m.media-amazon.com/images/I/61leNRImZxL.jpg', 'https://m.media-amazon.com/images/I/61leNRImZxL.jpg', 'https://m.media-amazon.com/images/I/61leNRImZxL.jpg', 'https://m.media-amazon.com/images/I/61leNRImZxL.jpg']",1,Collectibles & Fine Art > Collectible Coins > Coin Sets,https://www.amazon.com/-/dp/B0030HBU6I?_encoding=UTF8&th=1&psc=1&pf_rd_i=desktop&ref_=pd_gw_unk,,,,,"{'Is Discontinued By Manufacturer': 'No', 'Package Dimensions': '5.31 x 3.03 x 0.51 inches; 1 ounces', 'Manufacturer recommended age': '12 years and up', 'Date First Available': 'December 12, 2009', 'ASIN': 'B0030HBU6I', 'Country of Origin': 'USA', 'Amazon Best Sellers Rank': '#21 in Collectible Coins , #6 in Collectible Coin Sets'}",B0030HBU6I,[],{},new,[],[],76%,15%,5%,2%,2%
B00EMGAO5Y,Walking Liberty 1 Avdp Ounce .999 Fine Copper,REEDERSONG,$6.97,,"1,573",4.7,VALENTE SALES,https://www.amazon.com/gp/help/seller/at-a-glance.html/ref=dp_merchant_link?ie=UTF8&seller=A3QSJ0BQR12NGF&asin=B00EMGAO5Y&ref_=dp_merchant_link&isAmazonFulfilled=1,In Stock,,,True,,,False,Walking Liberty Design - One Ounce Pure Copper Round - Great Items,Contains 1 AVDP oz of .999 pure copper. Design features the Walking Liberty Half Dollar design.,"['https://m.media-amazon.com/images/I/51gRXtUrfuL._AC_.jpg', 'https://m.media-amazon.com/images/I/51RA5ZOw0FL._AC_.jpg']",0,Collectibles & Fine Art > Collectible Coins > Individual Coins,https://www.amazon.com/-/dp/B00EMGAO5Y?_encoding=UTF8&th=1&psc=1&pf_rd_i=desktop&ref_=pd_gw_unk,,,,,"{'Metal Type': 'Copper', 'Purity Percentage': '100', 'Material': 'Copper', 'ASIN': 'B00EMGAO5Y', 'Denomination': '1 ounce', 'Brand Name': 'REEDERSONG', 'Total Precious Metal Weight': '1 Ounces', 'Total Eaches': '1', 'Set': 'Single', 'Color': 'Gold', 'Exterior Finish': 'Copper', 'Coin Variety 1': 'Copper', 'Grade Rating': 'Fine', 'Amazon Best Sellers Rank': '#20 in Collectible Coins , #16 in Individual Collectible Coins'}",B00EMGAO5Y,[],{},new,"[{'title': 'Peace Design 1 oz .999 Copper Round', 'link': 'https://www.amazon.com/Peace-Design-999-Copper-Round/dp/B00ZO5YVSS/ref=pd_bxgy_d_sccl_1/000-0000000-0000000?pd_rd_w=dLU2C&content-id=amzn1.sym.3858a394-39a9-4946-90e6-86a3153d2546&pf_rd_p=3858a394-39a9-4946-90e6-86a3153d2546&pf_rd_r=VXVBA24THJ44TBBNTDRZ&pd_rd_wg=1fN7o&pd_rd_r=dcce40b5-7941-474a-b9a2-080fa4818243&pd_rd_i=B00ZO5YVSS&psc=1', 'price': '$6.89'}, {'title': ""American Eagle Copper Round - 1 oz 0.999% Fine Copper Coin - Collector's Edition"", 'link': 'https://www.amazon.com/American-Eagle-Copper-Round-Collectors/dp/B0C5Y4G14F/ref=pd_bxgy_d_sccl_2/000-0000000-0000000?pd_rd_w=dLU2C&content-id=amzn1.sym.3858a394-39a9-4946-90e6-86a3153d2546&pf_rd_p=3858a394-39a9-4946-90e6-86a3153d2546&pf_rd_r=VXVBA24THJ44TBBNTDRZ&pd_rd_wg=1fN7o&pd_rd_r=dcce40b5-7941-474a-b9a2-080fa4818243&pd_rd_i=B0C5Y4G14F&psc=1', 'price': '$5.99'}]","[{'badge': ""Amazon's Choice"", 'badge_text': None}]",80%,11%,5%,2%,1%
B0DCXCXJFQ,"2024 D American Women, Washington Celia Cruz Quarter Uncirculated",United States Mint,$1.99,,10,4.5,EBW Coin,https://www.amazon.com/gp/help/seller/at-a-glance.html/ref=dp_merchant_link?ie=UTF8&seller=A2O3HKFN9RJOH4&asin=B0DCXCXJFQ&ref_=dp_merchant_link,In Stock,,3,True,,,False,Copper Nickel Clad - Uncirculated,"Celia Cruz was a Cuban-American singer, cultural icon, and one of the most popular Latin artists of the 20th century. Internationally known as the “Queen of Salsa,” Cruz’s numerous honors and awards include three American and four Latin Grammy awards, the Presidential Medal of Arts, and countless lifetime achievement awards. One coin from the Denver Mint right out of an original US Mint Roll. (Stock Photo)","['https://m.media-amazon.com/images/I/61eW+JwMVNL.jpg', 'https://m.media-amazon.com/images/I/51CwooM5MpL.jpg', 'https://m.media-amazon.com/images/I/81AN3CD1N7L._SL1500_.jpg', 'https://m.media-amazon.com/images/I/81qw9x0LIML._SL1500_.jpg']",0,Collectibles & Fine Art > Collectible Coins > Individual Coins,https://www.amazon.com/-/dp/B0DCXCXJFQ?_encoding=UTF8&th=1&psc=1&pf_rd_i=desktop&ref_=pd_gw_unk,,,,,"{'Item Weight': '2 ounces', 'Date First Available': 'August 12, 2024', 'ASIN': 'B0DCXCXJFQ', 'Country of Origin': 'USA', 'Amazon Best Sellers Rank': '#34 in Collectible Coins , #27 in Individual Collectible Coins'}",B0DCXCXJFQ,[],{},new,[],[],87%,0%,0%,0%,13%
B09BZX47BS,Kamala Harris 1st Woman Vice President in History JFK Half Dollar Official Coin,Merrick Mint,$12.95,,20,4.1,eCoins,https://www.amazon.com/gp/help/seller/at-a-glance.html/ref=dp_merchant_link?ie=UTF8&seller=A1SYNX7RF0PZ3Z&asin=B09BZX47BS&ref_=dp_merchant_link,In Stock,,,True,,,False,"Beautifully colorized JFK Kennedy Half Dollar U.S. Coin - Genuine Legal Tender - Each coin has been enhanced with a special and unique colorization process by The Merrick Mint - KAMALA HARRIS First Woman Vice President in U.S. History collectible coin - Each coin comes in a premium coin capsule. - Each coin comes with a Certificate of Authenticity to guarantee that your coin is authentic and recognized by every monetary authority around the world, assuring its Collector Edition status.","This is the KAMALA HARRIS First Woman Vice President in U.S. History collectible coin. Here is your chance to own a beautifully colorized JFK Kennedy Half Dollar U.S. Coin. This high-quality genuine Legal Tender U.S. coin has been colorized using a unique painstaking multicolor authentic process by the Merrick Mint. Colorizing coins involves the unique application of special inks directly to the surface of a coin that achieves a level of detail, color saturation, and durability that is #1 in the coin industry. The result is an everlasting colorized coin collectible of ultra-high quality. Each coin comes in a premium coin capsule with a Certificate of Authenticity to guarantee that your coin is authentic and recognized by every monetary authority around the world, assuring its Collector Edition status.",['https://m.media-amazon.com/images/I/91KYPuD5elL._AC_SL1500_.jpg'],0,Collectibles & Fine Art > Collectible Coins > Individual Coins,https://www.amazon.com/-/dp/B09BZX47BS?_encoding=UTF8&th=1&psc=1&pf_rd_i=desktop&ref_=pd_gw_unk,,,,,"{'Metal Type': 'Nickel', 'Material': 'Cupronickel', 'UPC': '749002337690', 'ASIN': 'B09BZX47BS', 'Denomination': 'Half Dollar', 'Manufacturer': 'Merrick Mint', 'Brand Name': 'Merrick Mint', 'Total Eaches': '1', 'Set': 'Single', 'Grade Rating': 'Mint State', 'Amazon Best Sellers Rank': '#19 in Collectible Coins , #15 in Individual Collectible Coins'}",B09BZX47BS,[],{},new,"[{'title': 'BARACK OBAMA FOR PRESIDENT 2008 Rare Campaign Issue Presidential $1 Dollar Coin', 'link': 'https://www.amazon.com/BARACK-PRESIDENT-Campaign-Presidential-Dollar/dp/B00LI8BRGY/ref=pd_bxgy_d_sccl_1/000-0000000-0000000?pd_rd_w=9WAgc&content-id=amzn1.sym.3858a394-39a9-4946-90e6-86a3153d2546&pf_rd_p=3858a394-39a9-4946-90e6-86a3153d2546&pf_rd_r=VTKSV8PY9KCPWV34XRZM&pd_rd_wg=12mzP&pd_rd_r=8f75cb11-3d70-4cdd-bbd0-75b6f3b2d8c3&pd_rd_i=B00LI8BRGY&psc=1', 'price': '$12.95'}, {'title': 'Biden Harris Coin', 'link': 'https://www.amazon.com/The-Matthew-Mint-Biden-Harris/dp/B08T4K7XJ5/ref=pd_bxgy_d_sccl_2/000-0000000-0000000?pd_rd_w=9WAgc&content-id=amzn1.sym.3858a394-39a9-4946-90e6-86a3153d2546&pf_rd_p=3858a394-39a9-4946-90e6-86a3153d2546&pf_rd_r=VTKSV8PY9KCPWV34XRZM&pd_rd_wg=12mzP&pd_rd_r=8f75cb11-3d70-4cdd-bbd0-75b6f3b2d8c3&pd_rd_i=B08T4K7XJ5&psc=1', 'price': '$12.95'}]",[],62%,10%,14%,5%,10%
B08RWKW75G,St Michael Archangel Challenge Coin - Psalms 91:10 - Commemorative Collector,BirchRiver,,,549,4.8,,,Currently unavailable.,,,False,,,False,"40mm x 3mm in size. - Brass with Enamel, great quality. - A religious token of luck and protection. - Great gift for service members, loved ones, or collectors item.",,"['https://m.media-amazon.com/images/I/51WMQi7q78L._AC_.jpg', 'https://m.media-amazon.com/images/I/511PhrMttwL._AC_.jpg']",0,Collectibles & Fine Art > Collectible Coins > Individual Coins,https://www.amazon.com/-/dp/B08RWKW75G?_encoding=UTF8&th=1&psc=1&pf_rd_i=desktop&ref_=pd_gw_unk,,,,,"{'Metal Type': 'Brass', 'Material': 'Brass', 'UPC': '685650069579', 'ASIN': 'B08RWKW75G', 'Manufacturer': 'BirchRiver', 'Brand Name': 'BirchRiver', 'Total Eaches': '1', 'Set': 'Single', 'Exterior Finish': 'Brass', 'Amazon Best Sellers Rank': '#88 in Collectible Coins , #67 in Individual Collectible Coins'}",B08RWKW75G,[],{},new,[],[],87%,8%,2%,1%,1%
B00ERC8U4K,"One Year Rarities Coin Collection, Genuine United States Minted Coins, Americana Collectible, Certificate of Authenticity – American Coin Treasures",American Coin Treasures,$24.95,,366,4.6,Goldtrust,https://www.amazon.com/gp/help/seller/at-a-glance.html/ref=dp_merchant_link?ie=UTF8&seller=A2FE65OYP5FUU0&asin=B00ERC8U4K&ref_=dp_merchant_link&isAmazonFulfilled=1,In Stock,,,True,,,True,"COLLECTIBLE – Coin designs that were minted for only one year make this a fun collectible. The One Year Rarities Collection contains the Lincoln Steel Penny minted only in 1943, the four Lincoln Bicentennial Pennies minted only in 2009, the four Westward Journey Nickels, and the Bicentennial Quarter, Half Dollar and Dollar. A great set for a beginning collector or advanced hobbyist. Coins are matted on an 8 by 10 inch collectible card which displays obverse and reverse. - QUALITY & DETAIL - In 1943 the Lincoln Penny was minted in steel due to the copper shortage during World War II. The 2009 Lincoln Bicentennial Pennies were minted to celebrate the 200 year anniversary of Lincoln's birth. Each penny shows a different reverse containing an important stage of Lincoln's life. The Westward Journey nickels were minted to honor Lewis and Clark's journey. The 1976 Bicentennial Series honors the Colonial drummer, Independence Hall and the Liberty Bell. - CERTIFICATE OF AUTHENTICITY - Includes a genuine Certificate of Authenticity. The certificate attests to the fact that the coins in this piece are genuine United States coins. Genuine United States coins were produced in limited quantities by the U.S. Government, then authenticated and inspected for quality by a professional numismatist, and certified in collectible condition. - GREAT GIFT - Comes packaged, perfect for the collector, your dad, husband, boyfriend, brother, sister, daughter, son, mother, father or special someone. Great for birthdays, Christmas, Father’s Day, special events, graduation, anniversaries and retirements. Coins are a perfect gift as they detail time and spirit through their obverse and reverse designs, images, wording and dates. Coins make fun keepsakes for travel, special events and holidays. Coins are historical, educational and collectible. - OUR PROMISE - Items include a 30 day money back guarantee and a 1-Year parts & labor manufacturer's warranty. We will repair or replace, at our discretion, any defective product for a period of 1-year from the date of purchase. Items will have readable dates. American Coin Treasures specializes in coin gifts, collectibles, jewelry, stamps and novelty items. American Coin Treasures collections of coins, jewelry, pocket knives and graded coins makes it a one stop site for all your gift needs.","Looking for historical, educational and collectible coins for yourself or for gifting? Look no further! A meaningful and lovely treasure to keep that brings back history and culture. American Coin Treasures Colorized $2 Bill This is one collectible you'll have to see, to believe! Using special colorizing technology, our artists have detailed the reverse of the $2 Bill based on John Trumbull's painting of the signing of the Declaration of Independence. The result is a dazzling work of art and a spectacular currency collectible displayed in a deluxe portfolio. Comes with a Certificate of Authenticity. ➀ Historic Beauty ➁ Genuine US Currency ➂ Special Ink Process Used Directly On Currency ➃ Protective Vinyl Wallet We also offer you 100% risk-free satisfaction guaranteed to let you buy with confidence; no questions asked. So, why think twice? ORDER NOW & Get this Amazing Collection Delivered to you!","['https://m.media-amazon.com/images/I/71I3fzgm0rL._AC_SL1488_.jpg', 'https://m.media-amazon.com/images/I/61z9S952Q0L._AC_SL1488_.jpg', 'https://m.media-amazon.com/images/I/71SWpH7DDOL._AC_SL1500_.jpg', 'https://m.media-amazon.com/images/I/81pyGAPBhHL._AC_SL1500_.jpg', 'https://m.media-amazon.com/images/I/61PR5QKl3ZL._AC_SL1500_.jpg']",1,Collectibles & Fine Art > Collectible Coins > Coin Sets,https://www.amazon.com/-/dp/B00ERC8U4K?_encoding=UTF8&th=1&psc=1&pf_rd_i=desktop&ref_=pd_gw_unk,,,,,"{'Metal Type': 'Alloy Steel, Copper', 'UPC': '056132114092', 'ASIN': 'B00ERC8U4K', 'Denomination': 'Penny', 'Global Trade Identification Number': '00056132114092', 'Manufacturer': 'UPM Global--DROPSHIP', 'Year': '1943', 'Brand Name': 'American Coin Treasures', 'Set': 'Set', 'Color': 'Multi', 'Exterior Finish': 'Copper,Steel', 'Coin Variety 1': 'Copper,Nickel,Rare', 'Grade Rating': 'Mint State', 'Amazon Best Sellers Rank': '#46 in Collectible Coins , #11 in Collectible Coin Sets'}",B00ERC8U4K,[],{},new,"[{'title': 'American Coin Treasures The Last 25 Years of Lincoln Wheat Penny Collection (1934-1958) Genuine United States One Cent Coinage', 'link': 'https://www.amazon.com/American-Coin-Treasures-Collection-1934-1958/dp/B002NV5N5Q/ref=pd_bxgy_d_sccl_1/000-0000000-0000000?pd_rd_w=vWYdW&content-id=amzn1.sym.3858a394-39a9-4946-90e6-86a3153d2546&pf_rd_p=3858a394-39a9-4946-90e6-86a3153d2546&pf_rd_r=XFJGEAHN2PFN0W6NTV17&pd_rd_wg=OuSpM&pd_rd_r=13ab7078-a9c0-4bef-82ab-77c967cb6a75&pd_rd_i=B002NV5N5Q&psc=1', 'price': '$19.95'}, {'title': ""American Coin Treasures Spirit of The American West Penny and Nickel Coin Collection, Protective Acrylic Case, Certificate of Authenticity, Manufacturer's Warranty"", 'link': 'https://www.amazon.com/American-Coin-Treasures-Spirit-Collection/dp/B00GYSBMEK/ref=pd_bxgy_d_sccl_2/000-0000000-0000000?pd_rd_w=vWYdW&content-id=amzn1.sym.3858a394-39a9-4946-90e6-86a3153d2546&pf_rd_p=3858a394-39a9-4946-90e6-86a3153d2546&pf_rd_r=XFJGEAHN2PFN0W6NTV17&pd_rd_wg=OuSpM&pd_rd_r=13ab7078-a9c0-4bef-82ab-77c967cb6a75&pd_rd_i=B00GYSBMEK&psc=1', 'price': '$27.80'}]","[{'badge': ""Amazon's Choice"", 'badge_text': None}]",76%,13%,6%,2%,3%
B07MVL9RK7,Vintage Indian Head Cents Collection Starter Kit U.S. Coins Old Pennies Estate Sale Liquidation United States Hoard All Over 100+ Years Old,,$13.79,,"1,220",4.5,Delaware,https://www.amazon.com/gp/help/seller/at-a-glance.html/ref=dp_merchant_link?ie=UTF8&seller=A25JP4WWDXB09W&asin=B07MVL9RK7&ref_=dp_merchant_link&isAmazonFulfilled=1,In Stock,,,True,,,False,Five genuine 100+ year old Indian Head cents - All different dates - Gift bag color may vary,"This starter kit includes five coins, all with a different date and attractively packaged in a gift bag. Gift bag color may vary.","['https://m.media-amazon.com/images/I/61Isx9PXULL._SL1171_.jpg', 'https://m.media-amazon.com/images/I/71deJgWdNdL._SL1427_.jpg', 'https://m.media-amazon.com/images/I/71KgUooesYL._SL1427_.jpg']",1,Collectibles & Fine Art > Collectible Coins > Individual Coins,https://www.amazon.com/-/dp/B07MVL9RK7?_encoding=UTF8&th=1&psc=1&pf_rd_i=desktop&ref_=pd_gw_unk,,,,,"{'Package Dimensions': '4.09 x 2.4 x 0.55 inches; 0.63 ounces', 'Date First Available': 'January 16, 2019', 'ASIN': 'B07MVL9RK7', 'Amazon Best Sellers Rank': '#164 in Collectible Coins , #126 in Individual Collectible Coins'}",B07MVL9RK7,[],{},new,[],[],70%,16%,9%,3%,3%
