asin,name,brand,price,regular_price,total_reviews,average_rating,seller,seller_url,availability_status,availability_quantity,shipping_charge,is_prime,author,available_book_formats,is_aplus_page,small_description,full_description,images,video_count,productCategory,url,attributes,size,color,model,product_information,parent_asin,variation_asin,product_variations,product_condition,frequently_bought_together,product_badges,five_star,four_star,three_star,two_star,one_star
B003ULL1NQ,"Nutramax Laboratories Cosequin Maximum Strength Joint Health Supplement for Dogs - With Glucosamine, Chondroitin, and MSM, 132 Chewable Tablets",Cosequin,$36.98,$36.98,"69,450",4.7,Amazon.com,,In Stock,,,True,,,False,"Joint Health Support for Dogs: Cosequin, the veterinarian recommended retail joint health supplement brand, contains glucosamine hydrochloride, sodium chondroitin sulfate, and methylsulfonylmethane (MSM) that helps support healthy cartilage - Easy to Serve: Cosequin Maximum Strength Joint Health Supplements come in tasty chewable tablets and soft chews for dogs of all sizes - Manufactured in the United States with Globally Sourced Ingredients: Cosequin is a high-quality, dog joint supplement - From the Veterinarian Recommended Supplement Company : Nutramax Laboratories Veterinary Sciences has been a leader in pet health for over 30 years, and provides supplements to support joint health, digestive health, and overall wellness - Backed by Science: Nutramax Laboratories Veterinary Sciences supplements are veterinarian formulated with high-quality ingredients to ensure your pet is receiving a safe supplement",,"['https://m.media-amazon.com/images/I/71HO0FsnMbL._AC_SL1500_.jpg', 'https://m.media-amazon.com/images/I/71NdOEnbDhL._AC_SL1500_.jpg', 'https://m.media-amazon.com/images/I/71PKPX7u+hL._AC_SL1500_.jpg', 'https://m.media-amazon.com/images/I/71iQ7XaexNL._AC_SL1500_.jpg', 'https://m.media-amazon.com/images/I/817L-gq2VtL._AC_SL1500_.jpg', 'https://m.media-amazon.com/images/I/81Uep-Jit-L._AC_SL1500_.jpg', 'https://m.media-amazon.com/images/I/814P2MPSajL._AC_SL1500_.jpg']",0,Pet Supplies > Dogs > Health Supplies > Hip & Joint Care,https://www.amazon.com/-/dp/B003ULL1NQ?_encoding=UTF8&th=1&psc=1&pf_rd_i=desktop&ref_=pd_gw_unk,size: 132 count,132 count,,,"{'Brand': 'Cosequin', 'Flavor': 'chicken flavor', 'Item Form': 'Tablet', 'Active Ingredients': 'Methylsulfonylmethane (MSM), Sodium Chondroitin Sulfate, Glucosamine Hydrochloride', 'Product Benefits': 'Joint Health'}",B0D32741XF,"[{'size_name': '60 count', 'asin': 'B003YKWIGC'}, {'size_name': '132 count', 'asin': 'B003ULL1NQ'}, {'size_name': '250 count', 'asin': 'B00GZWOWG0'}]","{'size_name': ['60 count', '132 count', '250 count']}",new,"[{'title': 'Greenies Pill Pockets for Dogs Capsule Size Natural Soft Dog Treats with Real Peanut Butter, 15.8 oz. Pack (60 Treats)', 'link': 'https://www.amazon.com/Greenies-Pockets-Natural-Treats-Capsule/dp/B07S2TDDCK/ref=pd_bxgy_d_sccl_1/000-0000000-0000000?pd_rd_w=Pqi4G&content-id=amzn1.sym.3858a394-39a9-4946-90e6-86a3153d2546&pf_rd_p=3858a394-39a9-4946-90e6-86a3153d2546&pf_rd_r=P4FZ08QWSKG994FVRHEA&pd_rd_wg=zzPf4&pd_rd_r=d07b9927-e43e-462d-a10d-e4e3ed696266&pd_rd_i=B07S2TDDCK&psc=1', 'price': '$17.98'}, {'title': ""Cosequin Joint Health Supplement for Dogs - With Glucosamine, Chondroitin, MSM, and Omega-3's, 120 Soft Chews"", 'link': 'https://www.amazon.com/Cosequin-Chews-Maximum-Strength-Omega/dp/B01G3V3P0Q/ref=pd_bxgy_d_sccl_2/000-0000000-0000000?pd_rd_w=Pqi4G&content-id=amzn1.sym.3858a394-39a9-4946-90e6-86a3153d2546&pf_rd_p=3858a394-39a9-4946-90e6-86a3153d2546&pf_rd_r=P4FZ08QWSKG994FVRHEA&pd_rd_wg=zzPf4&pd_rd_r=d07b9927-e43e-462d-a10d-e4e3ed696266&pd_rd_i=B01G3V3P0Q&psc=1', 'price': '$37.30'}]","[{'badge': ""Amazon's Choice"", 'badge_text': None}]",81%,12%,4%,1%,2%
B0CLC5MKTP,"TurboTax Home & Business 2023 Tax Software, Federal & State Tax Return [Amazon Exclusive] [PC/Mac Download]",Intuit,$119.99,,"4,436",4.4,Amazon.com,https://www.amazon.com/gp/help/seller/at-a-glance.html/ref=dp_merchant_link?ie=UTF8&seller=A3ODHND3J0WMC8&asin=B0CLC5MKTP&ref_=dp_merchant_link,Available now,,,True,,,True,"Recommended if you are self-employed, an independent contractor, freelancer, small business owner, sole proprietor, or consultant - Includes 5 Federal e-files and 1 State via download. State e-file sold separately. Free U.S.-based product support (hours may vary). - Get your personal and self-employed taxes done right - Finds industry-specific small business tax deductions - Create and e-file W-2s and 1099s for employees & contractors using Quick Employer Forms","TurboTax 2023 – File your taxes with 100% confidence TurboTax is tailored to your unique situation. It searches for hundreds of personal and small business deductions and credits, so you can be confident you’re getting every dollar you deserve. • Recommended if you are self-employed, an independent contractor, freelancer, small business owner, sole proprietor, or have a home office or home-based business • Includes 5 Federal e-files and 1 State via download. State e-file sold separately. Free U.S.-based product support (hours may vary) • Your downloaded software resides on your computer, so you can view and manage your tax data (Intuit Account required) • Boost your bottom line with industry-specific small business tax deductions • Get a head start by importing your info from last year's TurboTax return or other tax software • Create and e-file W-2s and 1099s for employees & contractors using Quick Employer Forms • Up-to-date with the latest tax laws so you have the latest information • Avoid mistakes by importing W-2s, investment & mortgage information from participating companies • Guides you through start-up costs that new businesses can deduct • Simplified asset depreciation and reporting • Audit Risk Meter checks your return for audit triggers • Runs thousands of checks before you file to help identify missing deductions or credits","['https://m.media-amazon.com/images/I/71K4wikrrkL._AC_SL1500_.jpg', 'https://m.media-amazon.com/images/I/611TyopF3nL._AC_SL1333_.jpg', 'https://m.media-amazon.com/images/I/61yogH93csL._AC_SL1333_.jpg', 'https://m.media-amazon.com/images/I/71-oVdF6g0L._AC_SL1333_.jpg', 'https://m.media-amazon.com/images/I/71dkPqCVakL._AC_SL1500_.jpg', 'https://m.media-amazon.com/images/I/61gHZoCGjJL._AC_SL1333_.jpg']",10,Software > Featured Categories > Mac Software,https://www.amazon.com/-/dp/B0CLC5MKTP?_encoding=UTF8&th=1&psc=1&pf_rd_i=desktop&ref_=pd_gw_unk,"edition: Home & Business + State, platform_for_display: PC/Mac Download",,,,"{'Date First Available': 'October 18, 2023', 'Manufacturer': 'Intuit', 'ASIN': 'B0CLC5MKTP', 'Amazon Best Sellers Rank': '#1 in Software , #1 in Mac Software , #1 in Tax Preparation'}",B0CY38TK15,"[{'edition': 'Business', 'platform_for_display': 'PC Disc', 'asin': 'B0CJYJBJNQ'}, {'edition': 'Deluxe + State', 'platform_for_display': 'PC/Mac Disc', 'asin': 'B0CJYL7JYV'}, {'edition': 'Home & Business + State', 'platform_for_display': 'PC/Mac Download', 'asin': 'B0CLC5MKTP'}, {'edition': 'Premier + State', 'platform_for_display': 'PC/Mac Download', 'asin': 'B0CLBVVRF3'}, {'edition': 'Business', 'platform_for_display': 'PC Download', 'asin': 'B0CLBPQX99'}, {'edition': 'Basic', 'platform_for_display': 'PC/Mac Download', 'asin': 'B0CLBPM8HZ'}, {'edition': 'Premier + State', 'platform_for_display': 'PC/Mac Disc', 'asin': 'B0CJYJH2YS'}, {'edition': 'Deluxe + State', 'platform_for_display': 'PC/Mac Download', 'asin': 'B0CLBV27N2'}, {'edition': 'Deluxe', 'platform_for_display': 'PC/Mac Download', 'asin': 'B0CLCC3GSN'}]","{'edition': ['Business', 'Deluxe + State', 'Home & Business + State', 'Premier + State', 'Basic', 'Deluxe'], 'platform_for_display': ['PC Disc', 'PC Download', 'PC/Mac Disc', 'PC/Mac Download']}",new,[],[],72%,12%,5%,1%,10%
B07Q33SJDW,"Norton 360 Deluxe 2024, Antivirus software for 5 Devices with Auto Renewal - Includes VPN, PC Cloud Backup & Dark Web Monitoring [Download]",Norton,$34.99,$89.99,"14,973",4.1,Amazon.com,https://www.amazon.com/gp/help/seller/at-a-glance.html/ref=dp_merchant_link?ie=UTF8&seller=A3ODHND3J0WMC8&asin=B07Q33SJDW&ref_=dp_merchant_link,Available now,,,True,,,True,"ONGOING PROTECTION Download instantly & install protection for up to 5 PCs, Macs, iOS or Android devices in minutes! - REAL-TIME THREAT PROTECTION Advanced security protects against existing and emerging malware threats, including ransomware and viruses, and it won’t slow down your device performance - SECURE VPN Browse anonymously and securely with a no-log VPN while using public Wi-Fi Add bank-grade encryption to help keep your information like passwords and bank details secure and private - DARK WEB MONITORING will monitor and notify you if we find your personal information on the Dark Web** - 50GB SECURE PC CLOUD BACKUP store and help protect important files as a preventative measure to data loss due to hard drive failures, stolen devices and even ransomware*** - PRE-PAID SUBSCRIPTION A payment method must be stored in your Norton account to activate* You won’t be charged until the prepaid term ends For new Norton subscriptions only at an introductory price - AUTO-RENEWAL Never have a service disruption since this subscription auto-renews annually If you do not wish to renew, you can cancel in your Norton account anytime","Norton 360 Deluxe gives you comprehensive malware protection for up to 5 PCs, Macs, Android or iOS devices, including 50GB of secure PC cloud backup and Secure VPN for your devices. Enrolling in our auto-renewing subscription and storing a payment method is required for activation and use.* We won't charge you until your renewal period. You will get an email reminder before we charge your payment method and can cancel your automatic renewal at any time in your Norton account. Also included are additional features such as Password Manager, Parental Controls, SafeCam that alerts you and blocks unauthorized access to your PC’s webcam, and Dark Web Monitoring,** where we monitor and notify you if we find your personal information on the dark web.","['https://m.media-amazon.com/images/I/71XafXsPo6L._AC_SL1500_.jpg', 'https://m.media-amazon.com/images/I/714SeDpUatL._AC_SL1500_.jpg', 'https://m.media-amazon.com/images/I/81q0-niCOHL._AC_SL1500_.jpg', 'https://m.media-amazon.com/images/I/71UbjIDmdYL._AC_SL1500_.jpg', 'https://m.media-amazon.com/images/I/71wtNz81uYL._AC_SL1500_.jpg', 'https://m.media-amazon.com/images/I/715qqdmIXML._AC_SL1500_.jpg', 'https://m.media-amazon.com/images/I/71xC4ycosnL._AC_SL1500_.jpg']",8,Software > Antivirus & Security > Antivirus,https://www.amazon.com/-/dp/B07Q33SJDW?_encoding=UTF8&th=1&psc=1&pf_rd_i=desktop&ref_=pd_gw_unk,,,,,"{'Package Dimensions': '8.07 x 5.51 x 0.75 inches; 0.04 ounces', 'Date First Available': 'March 27, 2019', 'Manufacturer': 'NortonLifeLock', 'ASIN': 'B07Q33SJDW', 'Amazon Best Sellers Rank': '#7 in Software , #2 in Antivirus , #2 in Internet Security Suites'}",B07Q33SJDW,[],{},new,[],"[{'badge': ""Amazon's Choice"", 'badge_text': None}]",63%,15%,7%,3%,12%
B0CLBV27N2,"TurboTax Deluxe 2023 Tax Software, Federal & State Tax Return [Amazon Exclusive] [PC/Mac Download]",Intuit,$69.99,,"15,118",4.4,Amazon.com,https://www.amazon.com/gp/help/seller/at-a-glance.html/ref=dp_merchant_link?ie=UTF8&seller=A3ODHND3J0WMC8&asin=B0CLBV27N2&ref_=dp_merchant_link,Available now,,,True,,,True,"Recommended if you own a home, have charitable donations, high medical expenses and need to file both Federal & State Tax Returns - Includes 5 Federal e-files and 1 State via download. State e-file sold separately. Free U.S.-based product support (hours may vary). - Get your taxes done right and your maximum refund - Maximizes 350+ deductions and credits - Up-to-date with the latest tax laws","TurboTax 2023 – File your taxes with 100% confidence TurboTax is tailored to your unique situation. It searches for hundreds of deductions and credits and handles even the toughest tax situations, so you can be confident you’re getting every dollar you deserve. • Recommended if you own a home, have charitable donations, high medical expenses, and need to file both Federal & State Tax Returns • Includes 5 Federal e-files and 1 State via download. State e-file sold separately. Free U.S.-based product support (hours may vary). • Your downloaded software resides on your computer, so you can view and manage your tax data (Intuit Account required) • TurboTax coaches you and double checks your return as you go • Up-to-date with the latest tax laws so you have the latest information • Get a head start by importing your info from last year's TurboTax return or other tax software • Track and value items you donate to charities with ItsDeductible • Avoid mistakes by importing W-2s, investment & mortgage information from participating companies • Audit Risk Meter checks your return for audit triggers and shows your risk level of a tax audit • Before you file, TurboTax runs thousands of checks to help identify missing deductions or credits","['https://m.media-amazon.com/images/I/719rCYQpjdL._AC_SL1500_.jpg', 'https://m.media-amazon.com/images/I/611TyopF3nL._AC_SL1333_.jpg', 'https://m.media-amazon.com/images/I/61mAnuStkBL._AC_SL1333_.jpg', 'https://m.media-amazon.com/images/I/71dkPqCVakL._AC_SL1500_.jpg', 'https://m.media-amazon.com/images/I/61gHZoCGjJL._AC_SL1333_.jpg']",8,Software > Featured Categories > Mac Software,https://www.amazon.com/-/dp/B0CLBV27N2?_encoding=UTF8&th=1&psc=1&pf_rd_i=desktop&ref_=pd_gw_unk,"edition: Deluxe + State, platform_for_display: PC/Mac Download",,,,"{'Date First Available': 'October 18, 2023', 'Manufacturer': 'Intuit', 'ASIN': 'B0CLBV27N2', 'Amazon Best Sellers Rank': '#2 in Software , #2 in Mac Software , #2 in Tax Preparation'}",B0CY38TK15,"[{'edition': 'Business', 'platform_for_display': 'PC Disc', 'asin': 'B0CJYJBJNQ'}, {'edition': 'Deluxe + State', 'platform_for_display': 'PC/Mac Disc', 'asin': 'B0CJYL7JYV'}, {'edition': 'Home & Business + State', 'platform_for_display': 'PC/Mac Download', 'asin': 'B0CLC5MKTP'}, {'edition': 'Premier + State', 'platform_for_display': 'PC/Mac Download', 'asin': 'B0CLBVVRF3'}, {'edition': 'Business', 'platform_for_display': 'PC Download', 'asin': 'B0CLBPQX99'}, {'edition': 'Basic', 'platform_for_display': 'PC/Mac Download', 'asin': 'B0CLBPM8HZ'}, {'edition': 'Premier + State', 'platform_for_display': 'PC/Mac Disc', 'asin': 'B0CJYJH2YS'}, {'edition': 'Deluxe + State', 'platform_for_display': 'PC/Mac Download', 'asin': 'B0CLBV27N2'}, {'edition': 'Deluxe', 'platform_for_display': 'PC/Mac Download', 'asin': 'B0CLCC3GSN'}]","{'edition': ['Business', 'Deluxe + State', 'Home & Business + State', 'Premier + State', 'Basic', 'Deluxe'], 'platform_for_display': ['PC Disc', 'PC Download', 'PC/Mac Disc', 'PC/Mac Download']}",new,"[{'title': 'LiCB CR2032 3V Lithium Battery(10-Pack)', 'link': 'https://www.amazon.com/LiCB-CR2032-Lithium-Battery-10-Pack/dp/B071D4DKTZ/ref=pd_day0fbt_d_sccl_1/000-0000000-0000000?pd_rd_w=xshSE&content-id=amzn1.sym.dbf20214-5add-4d96-a0b6-bb9d4c2e8362&pf_rd_p=dbf20214-5add-4d96-a0b6-bb9d4c2e8362&pf_rd_r=P3T4PSMH4AXAYCW908ZA&pd_rd_wg=qSGo2&pd_rd_r=95078273-62f7-40d7-b7bc-1ae1a49b7f15&pd_rd_i=B071D4DKTZ&psc=1', 'price': '$5.99'}]","[{'badge': ""Amazon's Choice"", 'badge_text': None}]",70%,15%,5%,2%,9%
B0DGVQMGBB,"Microsoft Office Home 2024 | Classic Apps: Word, Excel, PowerPoint | One-Time Purchase for 1 PC/MAC | Instant Download | Formerly Home & Student 2021 [PC/Mac Online Code]",Microsoft,$149.99,,"1,892",3.7,Amazon.com,https://www.amazon.com/gp/help/seller/at-a-glance.html/ref=dp_merchant_link?ie=UTF8&seller=A3ODHND3J0WMC8&asin=B0DGVQMGBB&ref_=dp_merchant_link,Available now,,,True,,,True,"[Ideal for One Person] — With a one-time purchase of Microsoft Office 2024, you can create, organize, and get things done. - [Classic Office Apps] — Includes Word, Excel, PowerPoint and OneNote. - [Desktop Only & Customer Support] — To install and use on one PC or Mac, on desktop only. Microsoft 365 has your back with readily available technical support through chat or phone. - [Consider Microsoft 365 Personal] — Ideal for one person, with a Microsoft 365 Personal 12-month subscription, get access to all the classic office apps and more, including 1TB of cloud storage, advanced security and access to apps on desktop/mobile.","For an individual who want classic Office apps installed on one PC or Mac for use at home or school. Office 2024 includes traditional desktop versions of Word, Excel, PowerPoint, OneNote, and Outlook.*Outlook only available in Office Home & Business 2024.","['https://m.media-amazon.com/images/I/61phY52G-OL._AC_SL1500_.jpg', 'https://m.media-amazon.com/images/I/51KoKVa4CdL._AC_SL1000_.jpg', 'https://m.media-amazon.com/images/I/51ksKxeSCcL._AC_SL1000_.jpg', 'https://m.media-amazon.com/images/I/51CJygpKMdL._AC_SL1000_.jpg', 'https://m.media-amazon.com/images/I/51TG8f0LtmL._AC_SL1000_.jpg', 'https://m.media-amazon.com/images/I/61DjUaADYrL._AC_SL1500_.jpg']",0,Software > Business & Office > Office Suites,https://www.amazon.com/-/dp/B0DGVQMGBB?_encoding=UTF8&th=1&psc=1&pf_rd_i=desktop&ref_=pd_gw_unk,style: Microsoft Office Home 2024,,,,"{'Date First Available': 'October 1, 2024', 'Manufacturer': 'Microsoft', 'ASIN': 'B0DGVQMGBB', 'Amazon Best Sellers Rank': '#5 in Software , #1 in Business & Office Management , #4 in Mac Software'}",B0DJFZQLJ8,"[{'style_name': 'Microsoft 365 Family', 'asin': 'B07YP93G2T'}, {'style_name': 'Microsoft 365 Personal', 'asin': 'B0C87YW4PB'}, {'style_name': 'Microsoft Office Home 2024', 'asin': 'B0DGVQMGBB'}]","{'style_name': ['Microsoft 365 Family', 'Microsoft 365 Personal', 'Microsoft Office Home 2024']}",new,[],[],55%,11%,5%,4%,24%
B0BB2N69J8,"McAfee Total Protection 2024 | 3 Device | Cybersecurity Software Includes Antivirus, Secure VPN, Password Manager, Dark Web Monitoring | Download",McAfee,$19.99,$99.99,"5,058",4.0,Amazon.com,https://www.amazon.com/gp/help/seller/at-a-glance.html/ref=dp_merchant_link?ie=UTF8&seller=A3ODHND3J0WMC8&asin=B0BB2N69J8&ref_=dp_merchant_link,Available now,,,True,,,True,"MCAFEE TOTAL PROTECTION IS ALL-IN-ONE PROTECTION — delivering award-winning antivirus for 3 devices, with identity monitoring and VPN - ID MONITORING — we'll monitor everything from email addresses to IDs and phone numbers for signs of breaches. If your info is found, we'll notify you so you can take action - BANK, SHOP, AND BROWSE ANYWHERE SECURELY WITH UNLIMITED VPN — protect your online privacy automatically when connecting to public Wi-Fi - SECURE YOUR ACCOUNTS — generate and store complex passwords with a password manager - AWARD-WINNING ANTIVIRUS — rest easy knowing McAfee will notify you of risky websites and protect you from the latest threats - INSTANT CODE DOWNLOAD — digital code and activation instructions will be emailed to you after purchase","McAfee Total Protection for 3 devices is all-in-one online protection — award-winning antivirus, and online services to protect your security, identity, and privacy so you can live your life online freely & confidently.","['https://m.media-amazon.com/images/I/71KwjkEdXaL._AC_SL1500_.jpg', 'https://m.media-amazon.com/images/I/71LlK5vASgL._AC_SL1427_.jpg', 'https://m.media-amazon.com/images/I/71jyJPGipPL._AC_SL1427_.jpg', 'https://m.media-amazon.com/images/I/61NeDR8hxxL._AC_SL1427_.jpg', 'https://m.media-amazon.com/images/I/71fQrmb2UiL._AC_SL1427_.jpg', 'https://m.media-amazon.com/images/I/61oSPZgY77L._AC_SL1427_.jpg', 'https://m.media-amazon.com/images/I/71Rwbm+1eHL._AC_SL1427_.jpg']",10,Software > Antivirus & Security > Antivirus,https://www.amazon.com/-/dp/B0BB2N69J8?_encoding=UTF8&th=1&psc=1&pf_rd_i=desktop&ref_=pd_gw_unk,"edition: 3 Devices Total Protection, subscription_term: 1 Year, platform_for_display: Download",,,,"{'Date First Available': 'September 18, 2022', 'Manufacturer': 'McAfee', 'ASIN': 'B0BB2N69J8', 'Amazon Best Sellers Rank': '#3 in Software , #1 in Antivirus , #1 in Internet Security Suites'}",B0BQSBBKV5,"[{'edition': '5 Devices Total Protection', 'subscription_term_name': '1 Year with Amazon Auto Renewal', 'platform_for_display': 'Download', 'asin': 'B07K98LLVV'}, {'edition': '3 Devices Total Protection', 'subscription_term_name': '1 Year', 'platform_for_display': 'Mailed Keycard', 'asin': 'B0B9VY13PM'}, {'edition': '3 Devices Total Protection', 'subscription_term_name': '1 Year with Amazon Auto Renewal', 'platform_for_display': 'Download', 'asin': 'B07K98XDX8'}, {'edition': 'Unlimited Devices Total Protection', 'subscription_term_name': '1 Year with Amazon Auto Renewal', 'platform_for_display': 'Download', 'asin': 'B07K995RWG'}, {'edition': '3 Devices Total Protection', 'subscription_term_name': '1 Year', 'platform_for_display': 'Download', 'asin': 'B0BB2N69J8'}, {'edition': '5 Devices Total Protection', 'subscription_term_name': '1 Year', 'platform_for_display': 'Mailed Keycard', 'asin': 'B0B9W5QP16'}, {'edition': '5 Devices Total Protection', 'subscription_term_name': '1 Year', 'platform_for_display': 'Download', 'asin': 'B0BB2GF9WW'}]","{'edition': ['3 Devices Total Protection', '5 Devices Total Protection', 'Unlimited Devices Total Protection'], 'subscription_term_name': ['1 Year', '1 Year with Amazon Auto Renewal'], 'platform_for_display': ['Download', 'Mailed Keycard']}",new,[],"[{'badge': ""Amazon's Choice"", 'badge_text': None}]",62%,13%,8%,3%,14%
B0823GT5JG,iFit Train - Monthly Membership,IFit,$15.00,,561,3.9,,,Available now,,,True,,,False,"Access iFIT Content on your phone or tablet - 1-month iFit Train membership auto-renews after 1 month for $15 + tax; Available on iFit mobile app, & the iFit TV app; Create or link your iFit account after purchase - Vast array of content; Stream on-demand Studio Classes; Participate in breathtaking Global Workouts; Build comprehensive wellness with yoga flows, HIIT sessions, and strength training - Diverse iFit Trainers; Learn from more than 100 hand-picked trainers, Olympians, and pro athletes; Each trainer provides unique insight into your health and fitness journey - Advanced metrics tracking; Track your workout history, health metrics, and exercise preferences across all iFit-enabled equipment and in the app; Stay informed on your health journey - iFIT Train level membership for Mobile or Tablet use, will not activate content on exercise equipment with built-in monitor","Enjoy workouts in the privacy and convenience of your own home for less than the cost of a gym or trainer. Our fitness plans include calorie-based, personalized recipes, activity tips to get your steps in, and even sleep advice. You will always know exactly what to do as iFit's incredible trainers help you achieve the results you want. With workouts filmed in gorgeous locations, coupled with energizing studio workouts, you will find your motivation. Minimum System Requirements: Operating System: Windows (All), Mac OS X (All), Android","['https://m.media-amazon.com/images/I/518nPPYk0iL._AC_SL1001_.jpg', 'https://m.media-amazon.com/images/I/61BylcsdUeL._AC_SL1500_.jpg', 'https://m.media-amazon.com/images/I/71VUx4qB53L._AC_SL1500_.jpg', 'https://m.media-amazon.com/images/I/81OwR-0iiNL._AC_SL1500_.jpg', 'https://m.media-amazon.com/images/I/71TvYYa9i6L._AC_SL1500_.jpg', 'https://m.media-amazon.com/images/I/61QjgjyWuKL._AC_SL1500_.jpg', 'https://m.media-amazon.com/images/I/61KylMb6oDL._AC_SL1500_.jpg', 'https://m.media-amazon.com/images/I/61BxkyLBtmL._AC_SL1500_.jpg']",0,Software > Featured Categories > Mac Software,https://www.amazon.com/-/dp/B0823GT5JG?_encoding=UTF8&th=1&psc=1&pf_rd_i=desktop&ref_=pd_gw_unk,"edition: 1-Month Membership, platform_for_display: Individual [Subscription]",,,,"{'Date First Available': 'March 26, 2024', 'Manufacturer': 'iFit', 'ASIN': 'B0823GT5JG', 'Amazon Best Sellers Rank': '#4 in Software , #1 in Home & Hobbies , #3 in Mac Software'}",B084KCJPXM,"[{'edition': '1-Month Membership', 'platform_for_display': 'Individual [Subscription]', 'asin': 'B0823GT5JG'}]","{'edition': ['1-Month Membership'], 'platform_for_display': ['Individual [Subscription]']}",new,[],[],66%,7%,4%,3%,20%
