asin,name,brand,price,regular_price,total_reviews,average_rating,seller,seller_url,availability_status,availability_quantity,shipping_charge,is_prime,author,available_book_formats,is_aplus_page,small_description,full_description,images,video_count,productCategory,url,attributes,size,color,model,product_information,parent_asin,variation_asin,product_variations,product_condition,frequently_bought_together,product_badges,five_star,four_star,three_star,two_star,one_star
B09T3SZ79V,Safer Home SH503 Indoor Plug-In Fly Trap Refill Pack of Glue Cards for SH502 Indoor Fly Trap – 3 Count (Pack of 1),Safer,$5.99,$6.99,"11,935",4.6,Amazon.com,,In Stock,,,True,,,True,"Say Goodbye to Bugs – The glue cards trap and kill flies, fruit flies, moths, gnats, and more when used with the compatible Safer Home Indoor Plug-in Fly Trap - Ideal for Your Home – These glue cards contain no synthetic insecticides and are the perfect choice for homes with children and pets - Easy to Use – Simply peel off the glue card backing and insert it into the trap. Discard and replace with a fresh glue card when it’s full of insects - Discreet and Effective – StickyTech glue cards trap and securely hold insects until time of disposal. Trapped insects are hidden on the back of the glue card, away from view - Extended Insect Protection – Includes 3 StickyTech Glue Cards to keep your Safer Home Indoor Plug-in Fly Trap up and running","With Safer Home Indoor Plug-In Fly Trap Refill Packs, you can enjoy non-stop protection from flies, fruit flies, moths, gnats, and more. Simply peel the backing off the StickyTech glue card and insert it into the trap. Plug the trap into a standard outlet near common insect hotspots, including near houseplants, exterior doors, pet areas, in kitchens, bedrooms, and other areas of your home. Once drawn in by the light of the trap, insects get stuck fast to the StickyTech Glue Cards and are securely held until the time of disposal. The unique glue placement on the wall side of the card keeps insects trapped and out of sight. StickyTech Glue Cards contain no synthetic insecticides and are the ideal choice for homes with children and pets.","['https://m.media-amazon.com/images/I/61LokBvQZiL._AC_SL1500_.jpg', 'https://m.media-amazon.com/images/I/51HitGCgxXL._AC_SL1000_.jpg', 'https://m.media-amazon.com/images/I/7182zKJMiuL._AC_SL1500_.jpg', 'https://m.media-amazon.com/images/I/51Fiq9nEdZL._AC_SL1000_.jpg', 'https://m.media-amazon.com/images/I/51huuv7UAYL._AC_SL1000_.jpg']",10,"Patio, Lawn & Garden > Pest Control > Traps",https://www.amazon.com/-/dp/B09T3SZ79V?_encoding=UTF8&th=1&psc=1&pf_rd_i=desktop&ref_=pd_gw_unk,style: 3 Safer Home Glue Cards,,,,"{'Item Weight': '1.1 Ounces', 'Number of Pieces': '3', 'Item Dimensions L x W x H': '0.13""L x 3.3""W x 3.9""H', 'ASIN': 'B09T3SZ79V', 'Brand Name': 'Safer', 'UPC': '024654585034', 'Style': '3 Safer Home Glue Cards', 'Color': 'White', 'Target Species': 'Moth, Fly, Gnat', 'Is Electric': 'Yes', 'Material Type': 'Paper', 'Amazon Best Sellers Rank': '#19 in Patio, Lawn & Garden , #10 in Pest Control Traps'}",B0CWJ8QQ7R,"[{'style_name': '12 Safer Home Glue Cards', 'asin': 'B0CQ8RW79V'}, {'style_name': 'Trap + 13 Glue Boards', 'asin': 'B0CQ8PDR5G'}, {'style_name': '3 Safer Home Glue Cards', 'asin': 'B09T3SZ79V'}]","{'style_name': ['3 Safer Home Glue Cards', '12 Safer Home Glue Cards', 'Trap + 13 Glue Boards']}",new,"[{'title': 'Safer Home SH502 Indoor Plug-In Fly Trap for Flies, Fruit Flies, Moths, Gnats, and Other Flying Insects – 400 Sq Ft of Protection', 'link': 'https://www.amazon.com/Safer-Brand-SH502-Chemical-Insects/dp/B09T3T1FYN/ref=pd_bxgy_d_sccl_1/000-0000000-0000000?pd_rd_w=8gRNF&content-id=amzn1.sym.3858a394-39a9-4946-90e6-86a3153d2546&pf_rd_p=3858a394-39a9-4946-90e6-86a3153d2546&pf_rd_r=0ZTA36YDKA827JK4QHDW&pd_rd_wg=SHirV&pd_rd_r=c4fdb25a-567b-4e1e-a63d-1bd6b59e0286&pd_rd_i=B09T3T1FYN&psc=1', 'price': '$13.47'}, {'title': 'Terro Fruit Fly Trap 4 Traps + 180 Days Lure Supply', 'link': 'https://www.amazon.com/Terro-Fruit-Trap-Traps-Supply/dp/B01MRHXM0I/ref=pd_bxgy_d_sccl_2/000-0000000-0000000?pd_rd_w=8gRNF&content-id=amzn1.sym.3858a394-39a9-4946-90e6-86a3153d2546&pf_rd_p=3858a394-39a9-4946-90e6-86a3153d2546&pf_rd_r=0ZTA36YDKA827JK4QHDW&pd_rd_wg=SHirV&pd_rd_r=c4fdb25a-567b-4e1e-a63d-1bd6b59e0286&pd_rd_i=B01MRHXM0I&psc=1', 'price': '$13.29'}]","[{'badge': ""Amazon's Choice"", 'badge_text': None}]",76%,14%,5%,2%,3%
B0CQ8RSTC9,Victor M150-12 Metal Pedal Sustainably Sourced FSC Wood Snap Mouse Trap - 12 Traps,Victor,$11.99,,"19,218",4.3,Amazon.com,,In Stock,,,True,,,True,"Designed for Mice - Traps mice with a simple, straightforward design which offers a clean, instant kill - Quick & Effective - Once a rodent interacts with the pedal, the precision trigger immediately springs the bar closed to eliminate the pest - Time-Tested Performance - Our original wooden snap trap has been trusted to control mice for over 120 years and is the trap of choice for consumers and professionals alike - Reusable or Disposable - After a catch, simply throw away the entire trap for quick cleanup or dispose of the mouse and reuse the trap - Made from FSC Certified Wood - Constructed of materials harvested from responsibly managed forests - Made in the USA","The original wood-based wire snap trap, the Victor Metal Pedal Mouse Trap provides instant rodent control and is safe for household use. Trusted to control mice for over 100 years, this trap allows for clean and quick trapping - ideal for maximum rodent control. Once a rodent triggers the metal petal, the trap immediately springs closed to eliminate the pest on contact. It can then be easily disposed of for quick and clean removal.","['https://m.media-amazon.com/images/I/813MLzzHmbL._AC_SL1500_.jpg', 'https://m.media-amazon.com/images/I/61PtPcGgclL._AC_SL1500_.jpg', 'https://m.media-amazon.com/images/I/71ob8oRpOXL._AC_SL1500_.jpg', 'https://m.media-amazon.com/images/I/71MzeopEu8L._AC_SL1500_.jpg', 'https://m.media-amazon.com/images/I/71FuQaNLUzL._AC_SL1500_.jpg', 'https://m.media-amazon.com/images/I/71OfCjPRjFL._AC_SL1500_.jpg']",9,"Patio, Lawn & Garden > Pest Control > Traps",https://www.amazon.com/-/dp/B0CQ8RSTC9?_encoding=UTF8&th=1&psc=1&pf_rd_i=desktop&ref_=pd_gw_unk,style: 12 Medal Pedal Traps,,,,"{'Item Weight': '0.93 Pounds', 'Number of Pieces': '12', 'Item Dimensions L x W x H': '3.9""L x 1.8""W x 0.6""H', 'ASIN': 'B0CQ8RSTC9', 'Brand Name': 'Victor', 'UPC': '072868150128', 'Style': '12 Medal Pedal Traps', 'Color': 'Wood', 'Target Species': 'Mouse', 'Amazon Best Sellers Rank': '#13 in Patio, Lawn & Garden , #5 in Pest Control Traps'}",B0CXGD9YB1,"[{'style_name': '4 Traps', 'asin': 'B00C1NN4B6'}, {'style_name': '20 Traps', 'asin': 'B09R9DBWH6'}, {'style_name': '12 Medal Pedal Traps', 'asin': 'B0CQ8RSTC9'}, {'style_name': 'Classic', 'asin': 'B0CHN36TVH'}, {'style_name': '12 Plastic Pedal Traps', 'asin': 'B0CQ8SQCP3'}]","{'style_name': ['4 Traps', '12 Medal Pedal Traps', '12 Plastic Pedal Traps', '20 Traps', 'Classic']}",new,"[{'title': 'Catchmaster Max-Catch Mouse & Insect Glue Trap 36Pk, Mouse Traps Indoor for Home, Sticky Pest Control Adhesive Tray for Catching Bugs, Rats & Rodents, Non Toxic Bulk Pre-Baited Glue Boards', 'link': 'https://www.amazon.com/Sticky-Mouse-Traps-Indoor-Home-Bulk-72/dp/B007E83LUM/ref=pd_bxgy_d_sccl_1/000-0000000-0000000?pd_rd_w=e22UJ&content-id=amzn1.sym.3858a394-39a9-4946-90e6-86a3153d2546&pf_rd_p=3858a394-39a9-4946-90e6-86a3153d2546&pf_rd_r=32GJNRP1BFED7T4CK1RJ&pd_rd_wg=vPecm&pd_rd_r=c061939b-8501-4267-bbff-b6d662d268ed&pd_rd_i=B007E83LUM&psc=1', 'price': '$22.99'}, {'title': 'Tomcat Glue Traps Mouse Size with Eugenol for Enhanced Stickiness for Mice, Cockroaches, and Spiders, 6 Traps', 'link': 'https://www.amazon.com/Tomcat-Mouse-Glue-Trap-Eugenol/dp/B012VJLZOM/ref=pd_bxgy_d_sccl_2/000-0000000-0000000?pd_rd_w=e22UJ&content-id=amzn1.sym.3858a394-39a9-4946-90e6-86a3153d2546&pf_rd_p=3858a394-39a9-4946-90e6-86a3153d2546&pf_rd_r=32GJNRP1BFED7T4CK1RJ&pd_rd_wg=vPecm&pd_rd_r=c061939b-8501-4267-bbff-b6d662d268ed&pd_rd_i=B012VJLZOM&psc=1', 'price': '$5.07'}]","[{'badge': ""Amazon's Choice"", 'badge_text': None}]",69%,13%,8%,3%,7%
B0148W0WOE,"Advion Cockroach Gel Bait, 4 Tubes x 30-Grams, 1 Plunger and 2 Tips, German Roach Insect Pest Control, Indoor and Outdoor Use, Roach Killer Gel for American, German and Other Major Cockroach Species",Syngenta,$26.60,$35.00,"46,363",4.6,What's Buggin' You?,https://www.amazon.com/gp/help/seller/at-a-glance.html/ref=dp_merchant_link?ie=UTF8&seller=A2WLY1FAWBY4J3&asin=B0148W0WOE&ref_=dp_merchant_link&isAmazonFulfilled=1,In Stock,,,True,,,True,"COCKROACH CONTROL: Advion Cockroach gel bait from Syngenta is a high-performing bait product targeting many pest species of cockroaches including German, American and gel bait-averse cockroaches. It’s formulated with 0.6% indoxacarb, which is a potent, non-repellent active ingredient used for trusted pest control. - VERSATILE USAGE: Advion Cockroach Gel Bait is suitable for indoor and outdoor use. Thanks to its targeted MetaActive effect that differentiates between target insects and non-target organisms, it’s highly unlikely to negatively affect people or pets. - HIGHLY ATTRACTIVE FORMULATION: Advion Cockroach has a high-consumption bait matrix with ingredients that attract roaches to feed. Once consumed, treated cockroaches transfer the bait to as many as 40 other cockroaches, aiding in control of the infestation in as little as 24 hours. - EFFORTLESS APPLICATION: With a plunger and user-friendly tips included, this non-repellent roach gel killer is designed for effortless placement in cracks, crevices and other hard-to-reach areas where cockroaches commonly hide. Clean areas and apply roach killer gel in cracks and crevices. - CONVENIENT PACKAGE: This package includes four 30-gram syringes of Advion roach gel, which remain effective for three years.","Advice Roach gel bait This is for - 4 tubes 30G each, 1 plunger, 2 tips. Not sold in NY","['https://m.media-amazon.com/images/I/71D+7sez6SL._AC_SL1500_.jpg', 'https://m.media-amazon.com/images/I/71z+9o+x89L._AC_SL1500_.jpg', 'https://m.media-amazon.com/images/I/51SYOy1o4OL._AC_SL1500_.jpg', 'https://m.media-amazon.com/images/I/71nBgXC7dLL._AC_SL1500_.jpg', 'https://m.media-amazon.com/images/I/710xohkxjNL._AC_SL1500_.jpg', 'https://m.media-amazon.com/images/I/71ZMQgAGIEL._AC_SL1500_.jpg', 'https://m.media-amazon.com/images/I/71MKRLcEtNL._AC_SL1500_.jpg']",10,"Patio, Lawn & Garden > Pest Control > Baits & Lures",https://www.amazon.com/-/dp/B0148W0WOE?_encoding=UTF8&th=1&psc=1&pf_rd_i=desktop&ref_=pd_gw_unk,,,,,"{'ASIN': 'B0148W0WOE', 'UPC': '701801587515 702941532069', 'Global Trade Identification Number': '00702941532069', 'Brand Name': 'Syngenta', 'Liquid Volume': '1.06 Fluid Ounces', 'Item Weight': '4.23 Ounces', 'Target Species': 'Insects', 'Item Form': 'Gel', 'Amazon Best Sellers Rank': '#25 in Patio, Lawn & Garden , #4 in Pest Control Baits & Lures'}",B0148W0WOE,[],{},new,"[{'title': 'HARRIS Boric Acid Roach and Silverfish Killer Powder w/Lure for Insects (16oz)', 'link': 'https://www.amazon.com/Harris-Boric-Silverfish-Killer-Powder/dp/B0026MD0G6/ref=pd_bxgy_d_sccl_1/000-0000000-0000000?pd_rd_w=PwkLi&content-id=amzn1.sym.3858a394-39a9-4946-90e6-86a3153d2546&pf_rd_p=3858a394-39a9-4946-90e6-86a3153d2546&pf_rd_r=A33P2C6593Q2PWY5QJKG&pd_rd_wg=7Cq8m&pd_rd_r=963fe242-52a5-426b-b8d5-0d4dc4c31206&pd_rd_i=B0026MD0G6&psc=1', 'price': '$8.78'}, {'title': 'advion 68663 Arena 12ct Bag Cockroach Bait Station, White', 'link': 'https://www.amazon.com/advion-68663-Arena-Cockroach-Station/dp/B08HWHD58L/ref=pd_bxgy_d_sccl_2/000-0000000-0000000?pd_rd_w=PwkLi&content-id=amzn1.sym.3858a394-39a9-4946-90e6-86a3153d2546&pf_rd_p=3858a394-39a9-4946-90e6-86a3153d2546&pf_rd_r=A33P2C6593Q2PWY5QJKG&pd_rd_wg=7Cq8m&pd_rd_r=963fe242-52a5-426b-b8d5-0d4dc4c31206&pd_rd_i=B08HWHD58L&psc=1', 'price': '$21.95'}]","[{'badge': ""Amazon's Choice"", 'badge_text': None}]",79%,9%,5%,2%,5%
B0CKY689WQ,"Zevo Flying Insect Trap for Indoors: Light Trap Captures Fruit Flies, Gnats and Houseflies, Starter Kit + Refills (1 Plug-in Base + 3 Cartridges)",ZEVO,$26.99,,"21,635",4.5,Front Row CPG,https://www.amazon.com/gp/help/seller/at-a-glance.html/ref=dp_merchant_link?ie=UTF8&seller=A291MBZ2XXNNKT&asin=B0CKY689WQ&ref_=dp_merchant_link&isAmazonFulfilled=1,In Stock,,,True,,,True,"Zevo fly trap, fruit fly trap, and gnat trap attracts pesky flying insects in your home using specially designed blue and UV light. - Traps flying insects on a disposable adhesive backing that you never have to touch. - Removable refill cartridges available for year round protection. - Effortless 24/7 continuous attraction works day and night to help protect your family from pesky flying insects. Designed for any room or area of your home where flying insects gather including kitchens, bathrooms, garage, near plants, and living spaces. - Includes 1 plug-in base + 3 refill cartridges","The video showcases the product in use. The video guides you through product setup. The video compares multiple products. The video shows the product being unpacked. What is the Zevo Flying Insect Trap? The Zevo Flying Insect Trap features a durable plug-in base that uses blue and UV light to attract insects to a disposable refill cartridge. Insects get stuck on an adhesive pad in the cartridge, which is easy to remove and dispose of. What type of flying insects does it catch? The Zevo Flying Insect Trap is designed to catch fruit flies, gnats, house flies, drain flies, fungus gnats, & non-biting midges. Can I use the Zevo Flying Insect Trap in spaces with kids, pets and/or near food? Yes! Zevo's U.S. device base meets third-party electrical safety standards. It is a durable, plug-in base requiring 120V/60Hz power and a standard North American plug. As with other electrical devices, keep away from children. How often should I change the cartridge? Replace the refill cartridge when it is full of insects. We recommend checking it every 2 weeks or as needed. Is there anywhere you should NOT keep your trap plugged in? Do not use the Zevo Flying Insect Trap outdoors where it might get wet. Avoid placing it near TV or computer screens, and keep it away from furniture, curtains, or corners that could block insects. If you can't see Zevo, insects can't see it either.","['https://m.media-amazon.com/images/I/71Cj97guaUL._AC_SL1500_.jpg', 'https://m.media-amazon.com/images/I/711Tt5B3WBL._AC_SL1500_.jpg', 'https://m.media-amazon.com/images/I/71qc-j+XxlL._AC_SL1500_.jpg', 'https://m.media-amazon.com/images/I/71JDniE1TwL._AC_SL1500_.jpg', 'https://m.media-amazon.com/images/I/71RC6ZMvyZL._AC_SL1500_.jpg', 'https://m.media-amazon.com/images/I/71HtGcGstsL._AC_SL1500_.jpg', 'https://m.media-amazon.com/images/I/81wk4qiTdFL._AC_SL1500_.jpg', 'https://m.media-amazon.com/images/I/71iGQ1GlwRL._AC_SL1500_.jpg', 'https://m.media-amazon.com/images/I/81825XKW0sL._AC_SL1500_.jpg']",10,"Patio, Lawn & Garden > Pest Control > Traps",https://www.amazon.com/-/dp/B0CKY689WQ?_encoding=UTF8&th=1&psc=1&pf_rd_i=desktop&ref_=pd_gw_unk,style: 1 Device & 3 Cartridges,,,,"{'Item Weight': '0.37 Pounds', 'Number of Pieces': '1', 'Item Dimensions L x W x H': '1.75""L x 4""W x 7""H', 'Target Species': 'Gnat', 'Is Electric': 'Yes', 'Material Type': 'Plastic', 'Style': '1 Device & 3 Cartridges', 'Color': 'White', 'ASIN': 'B0CKY689WQ', 'Global Trade Identification Number': '00679625663640, 00731722344515', 'Brand Name': 'ZEVO', 'UPC': '679625663640 731722344515', 'Amazon Best Sellers Rank': '#1 in Patio, Lawn & Garden , #9 in Pest Control Traps'}",B0D5J4S1MZ,"[{'style_name': 'New 4 Refill Cartridges', 'asin': 'B0DK56VCNV'}, {'style_name': '4 Devices & 4 Cartridges', 'asin': 'B0CRPHSQCQ'}, {'style_name': '6 Refill Cartridges', 'asin': 'B0CTQDTF1V'}, {'style_name': '10 Refill Cartridges', 'asin': 'B0CTQ3B8JD'}, {'style_name': '1 Device & 3 Cartridges', 'asin': 'B0CKY689WQ'}, {'style_name': '4 Refill Cartridges', 'asin': 'B0C3FTCYZL'}, {'style_name': 'New 8 Refill Cartridges', 'asin': 'B0DK57HM7S'}, {'style_name': '8 Refill Cartridges', 'asin': 'B0CYVVT3LC'}, {'style_name': '2 Devices & 4 Cartridges', 'asin': 'B0CKY5N63H'}, {'style_name': '1 Pulg-in-Base + 3 Refill Cartridge', 'asin': 'B0DK58T89V'}, {'style_name': '12 Refill Cartridges', 'asin': 'B0CTQ1TQ45'}]","{'style_name': ['1 Device & 3 Cartridges', '1 Pulg-in-Base + 3 Refill Cartridge', '2 Devices & 4 Cartridges', '4 Refill Cartridges', 'New 4 Refill Cartridges', '4 Devices & 4 Cartridges', '6 Refill Cartridges', '8 Refill Cartridges', 'New 8 Refill Cartridges', '10 Refill Cartridges', '12 Refill Cartridges']}",new,[],"[{'badge': ""Amazon's Choice"", 'badge_text': None}]",75%,13%,6%,2%,5%
B00MW8G62E,"Amazon Basics Dog and Puppy Pee Pads with Leak-Proof Quick-Dry Design for Potty Training, Standard Absorbency, Regular Size, 22 x 22 Inches, Pack of 100, Blue & White",Amazon Basics,$20.99,$20.99,"243,046",4.5,Amazon.com,,In Stock,,,True,,,True,"INCLUDES: 100 Regular-size standard-absorbency puppy pee pads; ideal for puppy training, senior dogs, car trips, and more - 5-LAYER PROTECTION: Multi-layer construction with quick-dry surface and absorbent core that turns liquid into gel on contact - LEAKPROOF: Plastic lining keeps floors safe from damage; plastic border on all 4 sides to prevent overflow - BUILT-IN ATTRACTANT: Helps aid in potty training - PRODUCT DIMENSIONS: 22 x 22 inches (LxW, overall); 19 x 19 inches (LxW, center pad); 1.65 inch border",Product Description An Amazon Brand. From the Manufacturer AmazonBasics,"['https://m.media-amazon.com/images/I/71LHksRF15L._AC_SL1500_.jpg', 'https://m.media-amazon.com/images/I/71ApeGMlewL._AC_SL1500_.jpg', 'https://m.media-amazon.com/images/I/91UW66h+kML._AC_SL1500_.jpg', 'https://m.media-amazon.com/images/I/71qil-9hZ-L._AC_SL1500_.jpg', 'https://m.media-amazon.com/images/I/71yN053+PyL._AC_SL1500_.jpg', 'https://m.media-amazon.com/images/I/71mj9NtmViL._AC_SL1500_.jpg']",10,Pet Supplies > Dogs > Litter & Housebreaking > Training Pads & Trays > Disposable Training Pads,https://www.amazon.com/-/dp/B00MW8G62E?_encoding=UTF8&th=1&psc=1&pf_rd_i=desktop&ref_=pd_gw_unk,"size: Regular (100 Count), scent: Unscented",Regular (100 Count),,TRP100R,"{'Product Dimensions': '22 x 0.1 x 22 inches; 1.76 ounces', 'Item model number': 'TRP100R', 'Date First Available': 'April 1, 2015', 'Manufacturer': 'Amazon', 'ASIN': 'B00MW8G62E', 'Country of Origin': 'China', 'Amazon Best Sellers Rank': '#1 in Pet Supplies , #1 in Disposable Dog Training Pads'}",B0CKVRVCXR,"[{'size_name': 'X-Large (50 Count)', 'scent_name': 'Heavy Duty', 'asin': 'B07CWHTQW8'}, {'size_name': 'Giant (40 Count)', 'scent_name': 'Unscented', 'asin': 'B08HSHWG89'}, {'size_name': 'X-Large (60 Count)', 'scent_name': 'Unscented', 'asin': 'B016C6EOO8'}, {'size_name': 'X-Large (40 Count)', 'scent_name': 'Unscented', 'asin': 'B016C6EJ4S'}, {'size_name': 'Regular (100 Count)', 'scent_name': 'Unscented', 'asin': 'B00MW8G62E'}, {'size_name': 'Regular (150 Count)', 'scent_name': 'Unscented', 'asin': 'B00MW8G6OC'}, {'size_name': 'Regular (50 Count)', 'scent_name': 'Heavy Duty', 'asin': 'B07CWD5PX5'}, {'size_name': 'Regular (50 Count)', 'scent_name': 'Unscented', 'asin': 'B00MW8G3YU'}, {'size_name': 'X-Large (25 Count)', 'scent_name': 'Heavy Duty', 'asin': 'B07CWHWCJZ'}, {'size_name': 'Giant (30 Count)', 'scent_name': 'Heavy Duty', 'asin': 'B08HSJMK42'}]","{'size_name': ['X-Large (25 Count)', 'Giant (30 Count)', 'Giant (40 Count)', 'X-Large (40 Count)', 'Regular (50 Count)', 'X-Large (50 Count)', 'X-Large (60 Count)', 'Regular (100 Count)', 'Regular (150 Count)'], 'scent_name': ['Heavy Duty', 'Unscented']}",new,"[{'title': 'Wellness Soft Puppy Bites Healthy Grain-Free Treats for Training, Dog Treats with Real Meat and DHA, No Artificial Flavors (Lamb & Salmon, 8-Ounce Bag)', 'link': 'https://www.amazon.com/Wellness-Healthy-Grain-Free-Training-Artificial/dp/B08MV5Y4BM/ref=pd_bxgy_d_sccl_1/000-0000000-0000000?pd_rd_w=HUmhA&content-id=amzn1.sym.3858a394-39a9-4946-90e6-86a3153d2546&pf_rd_p=3858a394-39a9-4946-90e6-86a3153d2546&pf_rd_r=GZYDHFG4HJD9ZK92W9RK&pd_rd_wg=G1HoM&pd_rd_r=8fd06f88-055c-4785-bba5-54fdb4fe4bf1&pd_rd_i=B08MV5Y4BM&psc=1', 'price': '$9.15'}, {'title': 'Nylabone Healthy Edibles Natural Puppy Chews Long Lasting Treats for Puppies, Roast Beef, Apple & Bacon Flavor, X-Small/Petite (3 Count)', 'link': 'https://www.amazon.com/Nylabone-Npe101Vp3P-Healthy-Edibles-Starter/dp/B07FD8BMDX/ref=pd_bxgy_d_sccl_2/000-0000000-0000000?pd_rd_w=HUmhA&content-id=amzn1.sym.3858a394-39a9-4946-90e6-86a3153d2546&pf_rd_p=3858a394-39a9-4946-90e6-86a3153d2546&pf_rd_r=GZYDHFG4HJD9ZK92W9RK&pd_rd_wg=G1HoM&pd_rd_r=8fd06f88-055c-4785-bba5-54fdb4fe4bf1&pd_rd_i=B07FD8BMDX&psc=1', 'price': '$5.04'}]",[],75%,13%,6%,2%,4%
