asin,name,brand,price,regular_price,total_reviews,average_rating,seller,seller_url,availability_status,availability_quantity,shipping_charge,is_prime,author,available_book_formats,is_aplus_page,small_description,full_description,images,video_count,productCategory,url,attributes,size,color,model,product_information,parent_asin,variation_asin,product_variations,product_condition,frequently_bought_together,product_badges,five_star,four_star,three_star,two_star,one_star
0593655036,"The Anxious Generation: How the Great Rewiring of Childhood Is Causing an Epidemic of Mental Illness Hardcover – March 26, 2024",,$15.24,$30.00,"3,722",4.6,Amazon.com,,In Stock,,,True,Jonathan Haidt,"[{'Kindle': {'asin': '0593655036', 'price': '$15.99'}}, {'Audiobook': {'asin': '0593655036', 'price': '$0.99'}}, {'Hardcover': {'asin': '0593655036', 'price': '$15.24'}}, {'Paperback': {'asin': '0593655036', 'price': '$25.65'}}]",False,,"THE INSTANT #1 NEW YORK TIMES BESTSELLER • A must-read for all parents: the generation-defining investigation into the collapse of youth mental health in the era of smartphones, social media, and big tech—and a plan for a healthier, freer childhood. “Erudite, engaging, combative, crusading.” — New York Times Book Review (Editors’ Choice) “Words that chill the parental heart… thanks to Mr. Haidt, we can glimpse the true horror of what happened not only in the U.S. but also elsewhere in the English-speaking world… lucid, memorable… galvanizing.” — Wall Street Journal “[An] important new book... The shift in kids’ energy and attention from the physical world to the virtual one, Haidt shows, has been catastrophic, especially for girls.” —Michelle Goldberg, The New York Times After more than a decade of stability or improvement, the mental health of adolescents plunged in the early 2010s. Rates of depression, anxiety, self-harm, and suicide rose sharply, more than doubling on many measures. Why? In The Anxious Generation , social psychologist Jonathan Haidt lays out the facts about the epidemic of teen mental illness that hit many countries at the same time. He then investigates the nature of childhood, including why children need play and independent exploration to mature into competent, thriving adults. Haidt shows how the “play-based childhood” began to decline in the 1980s, and how it was finally wiped out by the arrival of the “phone-based childhood” in the early 2010s. He presents more than a dozen mechanisms by which this “great rewiring of childhood” has interfered with children’s social and neurological development, covering everything from sleep deprivation to attention fragmentation, addiction, loneliness, social contagion, social comparison, and perfectionism. He explains why social media damages girls more than boys and why boys have been withdrawing from the real world into the virtual world, with disastrous consequences for themselves, their families, and their societies. Most important, Haidt issues a clear call to action. He diagnoses the “collective action problems” that trap us, and then proposes four simple rules that might set us free. He describes steps that parents, teachers, schools, tech companies, and governments can take to end the epidemic of mental illness and restore a more humane childhood. Haidt has spent his career speaking truth backed by data in the most difficult landscapes—communities polarized by politics and religion, campuses battling culture wars, and now the public health emergency faced by Gen Z. We cannot afford to ignore his findings about protecting our children—and ourselves—from the psychological damage of a phone-based life.",['https://m.media-amazon.com/images/I/81XP4hEXDXL._SY522_.jpg'],10,Books > Parenting & Relationships > Parenting,https://www.amazon.com/-/dp/0593655036?_encoding=UTF8&th=1&psc=1&pf_rd_i=desktop&ref_=pd_gw_unk,Hardcover,,,,"{'Publisher': 'Penguin Press (March 26, 2024)', 'Language': 'English', 'Hardcover': '400 pages', 'ISBN-10': '0593655036', 'ISBN-13': '978-0593655030', 'Item Weight': '1.2 pounds', 'Dimensions': '6.31 x 1.26 x 9.53 inches', 'Amazon Best Sellers Rank': '#12 in Books , #1 in Teen & Young Adult Books , #2 in Parenting Teenagers (Books) , #2 in Stress Management Self-Help'}",0593655036,[],{},new,"[{'title': 'The Coddling of the American Mind: How Good Intentions and Bad Ideas Are Setting Up a Generation for Failure', 'link': 'https://www.amazon.com/Coddling-American-Mind-Intentions-Generation/dp/0735224919/ref=pd_bxgy_d_sccl_1/000-0000000-0000000?pd_rd_w=P2oiU&content-id=amzn1.sym.3858a394-39a9-4946-90e6-86a3153d2546&pf_rd_p=3858a394-39a9-4946-90e6-86a3153d2546&pf_rd_r=VFPBDWFMAPT37Z46ZGY9&pd_rd_wg=hbUr8&pd_rd_r=d86a93a5-db61-4da1-b106-977f63e22c66&pd_rd_i=0735224919&psc=1', 'price': '$12.99'}, {'title': ""Bad Therapy: Why the Kids Aren't Growing Up"", 'link': 'https://www.amazon.com/Bad-Therapy-Kids-Arent-Growing/dp/0593542924/ref=pd_bxgy_d_sccl_2/000-0000000-0000000?pd_rd_w=P2oiU&content-id=amzn1.sym.3858a394-39a9-4946-90e6-86a3153d2546&pf_rd_p=3858a394-39a9-4946-90e6-86a3153d2546&pf_rd_r=VFPBDWFMAPT37Z46ZGY9&pd_rd_wg=hbUr8&pd_rd_r=d86a93a5-db61-4da1-b106-977f63e22c66&pd_rd_i=0593542924&psc=1', 'price': '$26.55'}]","[{'badge': 'Amazon Charts', 'badge_text': '#3 this week'}]",75%,18%,5%,1%,1%
1070527718,"Dad, I Want to Hear Your Story: A Father’s Guided Journal To Share His Life & His Love (Hear Your Story Books) Paperback – May 27, 2019",,$11.95,$,"6,951",4.7,Amazon.com,,In Stock,,,True,Jeffrey Mason | Hear Your Story,"[{'Hardcover': {'asin': '1070527718', 'price': '$16.79'}}, {'Paperback': {'asin': '1070527718', 'price': '$11.95'}}, {'Spiral-bound': {'asin': '1070527718', 'price': '$20.85'}}]",True,,"The Gift Your Father Will Enjoy and Appreciate Dad, I Want to Hear Your Story is the popular and cherished way for Fathers to share the memories and joys of their life while also creating a cherished legacy for you and the entire family. This is the Original and Best-Selling Way for Your Dad to Share His Life Story Dad, I Want to Hear Your Story will guide your Father with prompts and questions, making it fun and easy for him to share the stories of his childhood, teens, and adult years. This will be the tale of his life, his victories, his challenges, and his lessons. You will give your Dad a gift he will cherish while also giving yourself the gift of knowing him a little bit better. Think of all you will learn about your Dad when you read the stories of his life experiences. What will he share? What will you discover? What will you learn? Imagine Discovering the Details of His Amazing Life and Journey. Bestselling author Jeffrey Mason and Hear Your Story Books have expertly created this incredibly popular series of guided journals that have helped thousands share their story, chronicle their memories, and create a forever legacy for their families. Newly Expanded and Upgraded. More Prompts, More Pages, and More Space for your Dad to Share His Life and His Story with You! Over 250 expertly created guided prompts to make it simple for your father to share his memories with you. Each question has plenty of room for your Dad to write and share his life stories. Give your father the original memory-guided journal. Over tens of thousands have been bought for and cherished by Dads all over the world. 100% designed, created, and printed in the US. Available in Softback and Hardback Versions . ""My Dad loved telling us all of his stories."" - Samuel Robert ""I gave this book to my Dad for Christmas and he told me it was his favorite gift."" - Christy Harris ""I learned so much about my Dad because of this wonderful book."" -Joe Costa Order Dad I Want to Hear Your Story and give your Father the gift that will continue to give as the years go by.",['https://m.media-amazon.com/images/I/51ZvZFJOsrL._SY522_.jpg'],10,"Books > Crafts, Hobbies & Home > Crafts & Hobbies",https://www.amazon.com/-/dp/1070527718?_encoding=UTF8&th=1&psc=1&pf_rd_i=desktop&ref_=pd_gw_unk,Paperback,,,,"{'Publisher': 'Independently published (May 27, 2019)', 'Language': 'English', 'Paperback': '106 pages', 'ISBN-10': '1070527718', 'ISBN-13': '978-1070527710', 'Item Weight': '4.5 ounces', 'Dimensions': '6 x 0.27 x 9 inches', 'Amazon Best Sellers Rank': '#5 in Books , #1 in Fatherhood (Books) , #1 in Guided Journals (Books) , #1 in Genealogy (Books)'}",1070527718,[],{},new,"[{'title': 'Mom, I Want to Hear Your Story: A Mother’s Guided Journal To Share Her Life & Her Love (Hear Your Story Books)', 'link': 'https://www.amazon.com/Mom-Want-Hear-Your-Story/dp/1081439793/ref=pd_bxgy_d_sccl_1/000-0000000-0000000?pd_rd_w=tyHe3&content-id=amzn1.sym.3858a394-39a9-4946-90e6-86a3153d2546&pf_rd_p=3858a394-39a9-4946-90e6-86a3153d2546&pf_rd_r=7C5CYFN7GCK3RT77FWVP&pd_rd_wg=YYfhY&pd_rd_r=6ef30599-6dc8-4a68-a8c6-67b9e505f3fc&pd_rd_i=1081439793&psc=1', 'price': '$11.95'}, {'title': ""Mom, I Want to Hear Your Story: A Mother's Guided Journal to Share Her Life & Her Love (Lavender) (Hear Your Story Books)"", 'link': 'https://www.amazon.com/Mom-Want-Hear-Your-Story/dp/1955034176/ref=pd_bxgy_d_sccl_2/000-0000000-0000000?pd_rd_w=tyHe3&content-id=amzn1.sym.3858a394-39a9-4946-90e6-86a3153d2546&pf_rd_p=3858a394-39a9-4946-90e6-86a3153d2546&pf_rd_r=7C5CYFN7GCK3RT77FWVP&pd_rd_wg=YYfhY&pd_rd_r=6ef30599-6dc8-4a68-a8c6-67b9e505f3fc&pd_rd_i=1955034176&psc=1', 'price': '$11.54'}]",[],82%,11%,4%,1%,2%
1728210356,"How to Catch a Witch Hardcover – Picture Book, August 2, 2022",,$5.95,$5.95,"1,967",4.6,Amazon.com,,,,,True,Alice Walstead | Megan Joyce (Illustrator),"[{'Hardcover': {'asin': '1728210356', 'price': '$5.95'}}, {'Paperback': {'asin': '1728210356', 'price': '$8.90'}}, {'Spiral-bound': {'asin': '1728210356', 'price': 'from $17.86'}}]",True,,"A New York Times and USA Today bestseller from the hit How to Catch series! Do YOU have what it takes to snatch a Halloween witch? It's Halloween night and something doesn't seem quite right... When the How to Catch Kids head out to trick-or-treat, there are ghosts, goblins, and ghouls everywhere! Our heroes discover a witch on a broom has opened a magical portal that let out spooky creatures all over the neighborhood. Follow along in this frightfully fun story as they set zany traps for the witch to close the portal and save Halloween before all the candy is gone! How to Catch a Witch is a treat sure to delight young readers and educators alike with STEAM concepts and classic hilarity and chaos. The perfect Halloween gift or basket stuffer that kids ages 3-7 will love! You've been waiting all year long to trick-or-treat with friends. But wait―a witch is on the loose! We'll catch her before night's end! Also in the How to Catch Series: How to Catch a Monster How to Catch a Unicorn How to Catch a Mermaid How to Catch a Dinosaur How to Catch an Elf and more!",['https://m.media-amazon.com/images/I/81BFQlGo5XL._SY522_.jpg'],10,Books > Children's Books > Literature & Fiction,https://www.amazon.com/-/dp/1728210356?_encoding=UTF8&th=1&psc=1&pf_rd_i=desktop&ref_=pd_gw_unk,Hardcover,,,,"{'Publisher': 'Sourcebooks Wonderland (August 2, 2022)', 'Language': 'English', 'Hardcover': '40 pages', 'ISBN-10': '1728210356', 'ISBN-13': '978-1728210353', 'Reading age': '3 - 6 years, from customers', 'Grade level': 'Kindergarten - 5', 'Item Weight': '9.6 ounces', 'Dimensions': '8.25 x 0.35 x 8.25 inches', 'Amazon Best Sellers Rank': ""#26 in Books , #1 in Children's Spine-Chilling Horror , #2 in Children's Fantasy & Magic Books , #2 in Children's Halloween Books (Books)""}",1728210356,[],{},new,"[{'title': 'How to Catch a Monster: A Halloween Picture Book for Kids About Conquering Fears!', 'link': 'https://www.amazon.com/How-Catch-Monster-Adam-Wallace/dp/1492648949/ref=pd_bxgy_d_sccl_1/000-0000000-0000000?pd_rd_w=PXzKB&content-id=amzn1.sym.3858a394-39a9-4946-90e6-86a3153d2546&pf_rd_p=3858a394-39a9-4946-90e6-86a3153d2546&pf_rd_r=K7BAAYR0HEA76P64FW59&pd_rd_wg=AjKNx&pd_rd_r=1bfb7456-26a7-4298-a4f5-c3cfe3233e0e&pd_rd_i=1492648949&psc=1', 'price': '$6.12'}, {'title': 'How to Catch a Turkey', 'link': 'https://www.amazon.com/How-Catch-Turkey-Adam-Wallace/dp/1492664359/ref=pd_bxgy_d_sccl_2/000-0000000-0000000?pd_rd_w=PXzKB&content-id=amzn1.sym.3858a394-39a9-4946-90e6-86a3153d2546&pf_rd_p=3858a394-39a9-4946-90e6-86a3153d2546&pf_rd_r=K7BAAYR0HEA76P64FW59&pd_rd_wg=AjKNx&pd_rd_r=1bfb7456-26a7-4298-a4f5-c3cfe3233e0e&pd_rd_i=1492664359&psc=1', 'price': '$5.86'}]","[{'badge': 'Amazon Charts', 'badge_text': '#20 this week'}]",80%,9%,5%,2%,3%
1641526270,"My First Learn-to-Write Workbook: Practice for Kids with Pen Control, Line Tracing, Letters, and More! Paperback – August 27, 2019",,$5.26,$8.99,"85,238",4.8,Amazon.com,,In Stock,,,True,Crystal Radke,"[{'Paperback': {'asin': '1641526270', 'price': '$5.26'}}, {'Spiral-bound': {'asin': '1641526270', 'price': '$15.99'}}]",False,,"Help your little one build communication skills with the ultimate writing workbook for kids ages 3 to 5. More than 1 million copies sold! Set kids up to succeed in school with a learn to write for kids guide that offers letter, shape, and number practice for kindergarten―and beyond. My First Learn-to-Write Workbook introduces early writers to proper pen control, line tracing, and more with dozens of handwriting exercises that engage their minds and boost their reading and writing comprehension. Get the best in learning books for 3+ year olds with: Comprehensive skill building ―As they explore these preschool and kindergarten learning activities, kids will build a strong foundation of reading comprehension, the alphabet, penmanship, and fine motor skills. 75+ practice pages ―Tons of engaging pencil-on-paper activities like connect-the-dots and fill-in-the-blanks offer enough repetition for real learning but enough variety to keep kids interested. Colorful fun ―This bestselling workbook is full of helpful (and slightly silly) pictures and illustrations that will spark kids' imaginations and get them excited to keep practicing. Get your child on the path to success with toddler learning activities that help them develop essential skills!",['https://m.media-amazon.com/images/I/71-IU8JFyZL._SY522_.jpg'],0,Books > Children's Books > Education & Reference,https://www.amazon.com/-/dp/1641526270?_encoding=UTF8&th=1&psc=1&pf_rd_i=desktop&ref_=pd_gw_unk,Paperback,,,,{},1641526270,[],{},new,"[{'title': 'Trace Letters: Alphabet Handwriting Practice workbook for kids: Preschool writing Workbook with Sight words for Pre K, Kindergarten and Kids Ages 3-5. ABC print handwriting book', 'link': 'https://www.amazon.com/Trace-Letters-Handwriting-Kindergarten-handwriting/dp/1686456964/ref=pd_bxgy_d_sccl_1/145-7115089-6291130?pd_rd_w=whoj0&content-id=amzn1.sym.3858a394-39a9-4946-90e6-86a3153d2546&pf_rd_p=3858a394-39a9-4946-90e6-86a3153d2546&pf_rd_r=H8D5WSG4FN2ZYKXHTHVT&pd_rd_wg=Too8Y&pd_rd_r=3b3a1c82-9456-42da-b6da-8b40110dac8f&pd_rd_i=1686456964&psc=1', 'price': '$5.99'}, {'title': 'My Kindergarten Workbook: 101 Games and Activities to Support Kindergarten Skills (My Workbook)', 'link': 'https://www.amazon.com/My-Kindergarten-Workbook-Activities-Support/dp/1641524987/ref=pd_bxgy_d_sccl_2/145-7115089-6291130?pd_rd_w=whoj0&content-id=amzn1.sym.3858a394-39a9-4946-90e6-86a3153d2546&pf_rd_p=3858a394-39a9-4946-90e6-86a3153d2546&pf_rd_r=H8D5WSG4FN2ZYKXHTHVT&pd_rd_wg=Too8Y&pd_rd_r=3b3a1c82-9456-42da-b6da-8b40110dac8f&pd_rd_i=1641524987&psc=1', 'price': '$6.86'}]","[{'badge': 'Amazon Charts', 'badge_text': '#20 this week'}]",85%,10%,3%,1%,1%
0735211299,"Atomic Habits: An Easy & Proven Way to Build Good Habits & Break Bad Ones Hardcover – October 16, 2018",,$13.79,$27.00,"133,702",4.8,Amazon.com,,In Stock,,,True,James Clear,"[{'Kindle': {'asin': '0735211299', 'price': '$14.99'}}, {'Audiobook': {'asin': '0735211299', 'price': '$0.99'}}, {'Hardcover': {'asin': '0735211299', 'price': '$13.79'}}, {'Paperback': {'asin': '0735211299', 'price': '$15.00'}}]",True,,"The #1 New York Times bestseller. Over 20 million copies sold! Tiny Changes, Remarkable Results No matter your goals, Atomic Habits offers a proven framework for improving--every day. James Clear, one of the world's leading experts on habit formation, reveals practical strategies that will teach you exactly how to form good habits, break bad ones, and master the tiny behaviors that lead to remarkable results. If you're having trouble changing your habits, the problem isn't you. The problem is your system. Bad habits repeat themselves again and again not because you don't want to change, but because you have the wrong system for change. You do not rise to the level of your goals. You fall to the level of your systems. Here, you'll get a proven system that can take you to new heights. Clear is known for his ability to distill complex topics into simple behaviors that can be easily applied to daily life and work. Here, he draws on the most proven ideas from biology, psychology, and neuroscience to create an easy-to-understand guide for making good habits inevitable and bad habits impossible. Along the way, readers will be inspired and entertained with true stories from Olympic gold medalists, award-winning artists, business leaders, life-saving physicians, and star comedians who have used the science of small habits to master their craft and vault to the top of their field. Learn how to: make time for new habits (even when life gets crazy); overcome a lack of motivation and willpower; design your environment to make success easier; get back on track when you fall off course; ...and much more. Atomic Habits will reshape the way you think about progress and success, and give you the tools and strategies you need to transform your habits--whether you are a team looking to win a championship, an organization hoping to redefine an industry, or simply an individual who wishes to quit smoking, lose weight, reduce stress, or achieve any other goal.",['https://m.media-amazon.com/images/I/81ANaVZk5LL._SY522_.jpg'],10,"Books > Health, Fitness & Dieting > Psychology & Counseling",https://www.amazon.com/-/dp/0735211299?_encoding=UTF8&th=1&psc=1&pf_rd_i=desktop&ref_=pd_gw_unk,Hardcover,,,,"{'Publisher': 'Avery; First Edition (October 16, 2018)', 'Language': 'English', 'Hardcover': '320 pages', 'ISBN-10': '0735211299', 'ISBN-13': '978-0735211292', 'Item Weight': '1.13 pounds', 'Dimensions': '6.28 x 1.07 x 9.27 inches', 'Amazon Best Sellers Rank': '#19 in Books , #2 in Personal Transformation Self-Help , #3 in Parenting (Books) , #3 in Popular Social Psychology & Interactions'}",0735211299,[],{},new,"[{'title': 'The Psychology of Money: Timeless lessons on wealth, greed, and happiness', 'link': 'https://www.amazon.com/Psychology-Money-Timeless-lessons-happiness/dp/0857197681/ref=pd_bxgy_d_sccl_1/000-0000000-0000000?pd_rd_w=gjRjT&content-id=amzn1.sym.3858a394-39a9-4946-90e6-86a3153d2546&pf_rd_p=3858a394-39a9-4946-90e6-86a3153d2546&pf_rd_r=03ZVJN0N6YAAB2MBP0HM&pd_rd_wg=owV44&pd_rd_r=b2840913-20bf-4118-b3b0-73114669d0fd&pd_rd_i=0857197681&psc=1', 'price': '$9.34'}, {'title': 'The 48 Laws of Power', 'link': 'https://www.amazon.com/48-Laws-Power-Robert-Greene/dp/0140280197/ref=pd_bxgy_d_sccl_2/000-0000000-0000000?pd_rd_w=gjRjT&content-id=amzn1.sym.3858a394-39a9-4946-90e6-86a3153d2546&pf_rd_p=3858a394-39a9-4946-90e6-86a3153d2546&pf_rd_r=03ZVJN0N6YAAB2MBP0HM&pd_rd_wg=owV44&pd_rd_r=b2840913-20bf-4118-b3b0-73114669d0fd&pd_rd_i=0140280197&psc=1', 'price': '$14.55'}]","[{'badge': 'Amazon Charts', 'badge_text': '#1 this week'}]",83%,12%,3%,1%,1%
B0D5HVSW5T,"Little Corner: Coloring Book for Adults and Teens, Super Cute Designs of Cozy, Hygge Spaces for Relaxation (Cozy Spaces Coloring) Paperback – May 29, 2024",,$7.99,$,"1,245",4.7,Amazon.com,,In Stock,,,True,Coco Wyo,"[{'Paperback': {'asin': 'B0D5HVSW5T', 'price': '$7.99'}}, {'Spiral-bound': {'asin': 'B0D5HVSW5T', 'price': '$17.95'}}]",True,,"If you enjoy decorating your own cozy room, this Little Corner Coloring Book is for you. This book features 40 illustrations of places with super cute decor, such as a fully equipped kitchen, a dreamy bedroom, a wooden fireplace, and many more! It's an ideal present for yourself, your family members, and your coloring buddy. This “Little Corner Coloring Book” features: 40 hand-drawn pages ready for coloring. Large, bold, and easy designs for an enjoyable coloring experience. Single-sided pages to prevent bleed-through (if using markers, remember to place a protective sheet behind the page you're coloring) A convenient size of 8.5 x 8.5 inches for easy handling. High-resolution prints for clear, crisp images.",['https://m.media-amazon.com/images/I/71QManc1wDL._SY522_.jpg'],10,Books > Arts & Photography > Architecture,https://www.amazon.com/-/dp/B0D5HVSW5T?_encoding=UTF8&th=1&psc=1&pf_rd_i=desktop&ref_=pd_gw_unk,Paperback,,,,"{'ASIN': 'B0D5HVSW5T', 'Publisher': 'Independently published (May 29, 2024)', 'Language': 'English', 'Paperback': '88 pages', 'ISBN-13': '979-8326983169', 'Item Weight': '6.4 ounces', 'Dimensions': '8.5 x 0.2 x 8.5 inches', 'Amazon Best Sellers Rank': '#22 in Books , #1 in Residential Architecture , #1 in Cities & Architecture Coloring Books for Grown-Ups'}",B0D5HVSW5T,[],{},new,"[{'title': 'Spooky Cutie: Coloring Book for Adults and Teens Featuring Adorable Creepy Creatures in Cozy Hygge Moments for Relaxation (Cozy Spaces Coloring)', 'link': 'https://www.amazon.com/Spooky-Cutie-Featuring-Creatures-Relaxation/dp/B0D943SQXV/ref=pd_bxgy_d_sccl_1/000-0000000-0000000?pd_rd_w=P00ul&content-id=amzn1.sym.3858a394-39a9-4946-90e6-86a3153d2546&pf_rd_p=3858a394-39a9-4946-90e6-86a3153d2546&pf_rd_r=J0GS3KVB0F5GKD0Y25CF&pd_rd_wg=vFePb&pd_rd_r=ecb50c70-3c2d-4f7d-b660-590d016eb22f&pd_rd_i=B0D943SQXV&psc=1', 'price': '$7.99'}, {'title': 'Cozy Friends: Coloring Book for Adults and Teens Featuring Super Cute Animal Characters with Easy and Simple Designs for Relaxation (Cozy Spaces Coloring)', 'link': 'https://www.amazon.com/Cozy-Friends-Featuring-Characters-Relaxation/dp/B0D4YLQRMP/ref=pd_bxgy_d_sccl_2/000-0000000-0000000?pd_rd_w=P00ul&content-id=amzn1.sym.3858a394-39a9-4946-90e6-86a3153d2546&pf_rd_p=3858a394-39a9-4946-90e6-86a3153d2546&pf_rd_r=J0GS3KVB0F5GKD0Y25CF&pd_rd_wg=vFePb&pd_rd_r=ecb50c70-3c2d-4f7d-b660-590d016eb22f&pd_rd_i=B0D4YLQRMP&psc=1', 'price': '$7.99'}]",[],85%,9%,3%,1%,2%
B0D4YLQRMP,"Cozy Friends: Coloring Book for Adults and Teens Featuring Super Cute Animal Characters with Easy and Simple Designs for Relaxation (Cozy Spaces Coloring) Paperback – May 22, 2024",,$7.99,$,884,4.8,Amazon.com,,In Stock,,,True,Coco Wyo,"[{'Paperback': {'asin': 'B0D4YLQRMP', 'price': '$7.99'}}, {'Spiral-bound': {'asin': 'B0D4YLQRMP', 'price': '$17.95'}}]",True,,"This book is filled with familiar everyday activities of super cute animal characters . You'll discover many interesting hidden stories. Things like doing laundry, cooking, and cleaning have never been this fun ! And it's even better when you do them with Cozy Friends . Get comfy and grab your colors to create some awesome and fun pictures. This 'Cozy Friends Coloring Book' includes: 40 hand-drawn pages ready for coloring. Super cute coloring pages for stress relief and relaxation. Single-sided pages to prevent bleed-through (if using markers, remember to place a protective sheet behind the page you're coloring) A convenient size of 8.5 x 8.5 inches for easy handling. High-resolution prints for clear, crisp images.",['https://m.media-amazon.com/images/I/71HEaIuLeUL._SY522_.jpg'],10,"Books > Crafts, Hobbies & Home > Crafts & Hobbies",https://www.amazon.com/-/dp/B0D4YLQRMP?_encoding=UTF8&th=1&psc=1&pf_rd_i=desktop&ref_=pd_gw_unk,Paperback,,,,"{'ASIN': 'B0D4YLQRMP', 'Publisher': 'Independently published (May 22, 2024)', 'Language': 'English', 'Paperback': '88 pages', 'ISBN-13': '979-8326332127', 'Item Weight': '6.4 ounces', 'Dimensions': '8.5 x 0.2 x 8.5 inches', 'Amazon Best Sellers Rank': '#23 in Books , #1 in Fantasy & Science Fiction Coloring Books for Grown-Ups , #1 in Animal Coloring Books for Grown-Ups'}",B0D4YLQRMP,[],{},new,"[{'title': 'Spooky Cutie: Coloring Book for Adults and Teens Featuring Adorable Creepy Creatures in Cozy Hygge Moments for Relaxation (Cozy Spaces Coloring)', 'link': 'https://www.amazon.com/Spooky-Cutie-Featuring-Creatures-Relaxation/dp/B0D943SQXV/ref=pd_bxgy_d_sccl_1/000-0000000-0000000?pd_rd_w=dlfIv&content-id=amzn1.sym.3858a394-39a9-4946-90e6-86a3153d2546&pf_rd_p=3858a394-39a9-4946-90e6-86a3153d2546&pf_rd_r=MDGPKPA4NZ21488Z4GQ8&pd_rd_wg=XMDfm&pd_rd_r=8660f420-f35b-4585-bd0b-1aecaec26d63&pd_rd_i=B0D943SQXV&psc=1', 'price': '$7.99'}, {'title': 'Little Corner: Coloring Book for Adults and Teens, Super Cute Designs of Cozy, Hygge Spaces for Relaxation (Cozy Spaces Coloring)', 'link': 'https://www.amazon.com/Little-Corner-Coloring-Designs-Relaxation/dp/B0D5HVSW5T/ref=pd_bxgy_d_sccl_2/000-0000000-0000000?pd_rd_w=dlfIv&content-id=amzn1.sym.3858a394-39a9-4946-90e6-86a3153d2546&pf_rd_p=3858a394-39a9-4946-90e6-86a3153d2546&pf_rd_r=MDGPKPA4NZ21488Z4GQ8&pd_rd_wg=XMDfm&pd_rd_r=8660f420-f35b-4585-bd0b-1aecaec26d63&pd_rd_i=B0D5HVSW5T&psc=1', 'price': '$7.99'}]",[],86%,8%,3%,1%,2%
