asin,name,brand,price,regular_price,total_reviews,average_rating,seller,seller_url,availability_status,availability_quantity,shipping_charge,is_prime,author,available_book_formats,is_aplus_page,small_description,full_description,images,video_count,productCategory,url,attributes,size,color,model,product_information,parent_asin,variation_asin,product_variations,product_condition,frequently_bought_together,product_badges,five_star,four_star,three_star,two_star,one_star
B08R6S1M1K,"Wall Charger, Surge Protector, QINLIANF 5 Outlet Extender with 4 USB Charging Ports (4.8A Total) 3-Sided 1680J Power Strip Multi Plug Adapter Spaced for Home Travel Office (3U1C)",QINLIANF,$12.97,,"83,660",4.7,RONGPUDA TECH,https://www.amazon.com/gp/help/seller/at-a-glance.html/ref=dp_merchant_link?ie=UTF8&seller=A1AILBD9XMY5HK&asin=B08R6S1M1K&ref_=dp_merchant_link&isAmazonFulfilled=1,In Stock,,,True,,,True,"【 Multi Function USB Outlet】- Securing onto the wall design. Fit duplex outlet perfectly, just plug in to use. You get 5 AC outlet splitter (3 sides) with wide space in between; 4 USB charger ports; using the screw at the middle to secure it onto the wall for duplex outlet, so it is not pulled out when pulling the plugged in devices and loss power. Note: this works on duplex outlet only, other types of outlet like GFCI outlet cannot be secured onto the wall.Best Ideal Stocking Stuffers for Adults. - 【The Groove Design on The Back and Wide space 】- 5 AC outlets with 2.1 inches long space in between, larger than standard 1.5-inch socket. Larger spacing makes it easier to use for all kinds of equipment. The groove at the back make it flush against the wall perfectly, good for all Duplex Receptacle Outlet. NOTE: This product can be used on wall outlet with space lager than 1 inches in between ,This product cannot be used on outlets with more than 2 set of parallel sockets. - 【 Smart Charge with USB A & USB C 】- 4 USB ports total 4.8 A, each USB A port features 5V/2.4A Max output. USB C charging port features 5V/3A MAX. Built in smart technology, detecting charging devices and deliver optimal charging speed automatically, compatible with Kindle and most USB devices. NOTE: The UCB-C port is not Quick Charger 3.0, doesn't support any other devices which need 9~22V charging voltage. - 【 Reliable Surge Protector Circuit 】- 3 level complementary Surge Protector Circuit which composed of TVS, MOV (metal oxide varistor), GDT (gas discharge tube), with minimum 1680J energy absorbing capacity, could protect your devices much more quickly and reliably than other brand’s 1 level MOV(metal oxide varistor) Surge Protection Circuits. - 【 Our After Sale Service 】- ETL Certified，Our friendly and reliable customer service will respond to you within 24 hours. You can purchase with confidence, with our 30-day return and 12-month Warranty Services.","QINLIANF Surge Protector With 5 Outlet Extender & 4 USB Charging Ports 5 WIDE SPACE AC OUTLETS 5 AC outlets surge protector with 2.1 inches long space in between, Larger spacing makes it easier to use for all kinds of equipment . 3 USB A & USB C SMART CHARGING PORTS 4 USB ports total 4.8 A, each USB A port features 5V/2.4A Max output. USB C charging port features 5V/3A MAX. 1680 JOULES SURGE PROTECTION 3 level complementary Surge Protector Circuit which composed of TVS, MOV (metal oxide varistor), GDT (gas discharge tube), with minimum 1680J energy absorbing capacity. FIREPROOF SHELL Reliable and safe fireproof Shell,Effective in avoiding fire. SCREW-IN DESIGN Using the screw at the middle to secure it onto the wall for duplex outlet, so it is not pulled out when pulling the plugged in devices and loss power. Multi Function USB Outlet Specifications: Input Voltage: 100-240VAC; 60HZ Max.Current: 15A Max.Power Rating: 1875W USB Port Output: DC 5V, Total 4.8A Surge Protection Rating: 1680 Joules USB Wall Charger, Surge Protector, 5 Outlet Extender with 4 USB Charging Ports 1680 Joules Surge Protector Power Strip With 5 Outlets And 4 USB Charging Ports 4 USB ports total 4.8 A, each USB A port features 5V/2.4A Max output. USB C charging port features 5V/3A MAX. Built in smart technology, detecting charging devices and deliver optimal charging speed automatically. 5 AC outlets surge protector with 2.1 inches long space in between, Unlike the standard 1.5-inch socket. Larger spacing makes it easier to use for all kinds of equipment. 5 AC Outlets 3 USB A & USB C Smart Charging Ports 3 Level Complementary Surge Protector Circuit Wide Space AC Outlet Dimension: 5.5*3.8*1.7 inch 4 USB ports total 4.8 A, each USB A port features 5V/2.4A Max output. USB C charging port features 5V/3A MAX. Built in smart technology, detecting charging devices and deliver optimal charging speed automatically, compatible with Kindle and most USB devices. NOTE : The UCB-C port is not Quick Charger 3.0, doesn't support any other devices which need 9~22V charging voltage. Easy To Carry And Wide Range Of Applications This Wall Outlet with 6 outlets & 2 USB ports is Easy To Carry And Wide Range Of Applications, such as living room/hotel/office/travel etc. 1680 Joules Surge Protection Reliable Surge Protector This product is made of safe and reliable fireproof material and 3 level complementary Surge Protector Circuit, which can effectively provide protection for your equipment. Securing onto the wall design using the screw at the middle to secure it onto the wall for duplex outlet, so it is not pulled out when pulling the plugged in devices and loss power. : this works on duplex outlet only, other types of outlet like GFCI outlet cannot be secured onto the wall.","['https://m.media-amazon.com/images/I/61Hh-YlfJOL._AC_SL1500_.jpg', 'https://m.media-amazon.com/images/I/61nLJRhM56L._AC_SL1200_.jpg', 'https://m.media-amazon.com/images/I/71IsqJKMo0L._AC_SL1500_.jpg', 'https://m.media-amazon.com/images/I/71Ej6NJHYzL._AC_SL1200_.jpg', 'https://m.media-amazon.com/images/I/71QmYwTr5TL._AC_SL1200_.jpg', 'https://m.media-amazon.com/images/I/71RcFE-nJ-L._AC_SL1200_.jpg', 'https://m.media-amazon.com/images/I/61XDN-4xUuL._AC_SL1200_.jpg']",10,Electronics > Accessories & Supplies > Power Strips & Surge Protectors > Power Strips,https://www.amazon.com/-/dp/B08R6S1M1K?_encoding=UTF8&th=1&psc=1&pf_rd_i=desktop&ref_=pd_gw_unk,"size: 3U1C, color: White",3U1C,White,,"{'Item Dimensions L x W': '5.46""L x 3.77""W', 'Item Shape': 'Octagon', 'Color': 'White', 'ASIN': 'B08R6S1M1K', 'Brand Name': 'QINLIANF', 'Material': 'Metal', 'Recommended Uses For Product': 'Office, Travel, Home', 'Power Plug': 'Type B - 3 pin (North American)', 'Surge Protection Rating': '1680 Joules', 'Amperage': '15 Amps', 'Number of Ports': '5', 'Compatible Devices': 'Air Conditioner', 'Plug Type': 'Type B', 'Special Features': 'Portable, Surge Protection, Compact, Usb Slot', 'Total Usb Ports': '4', 'Maximum Current': '15 Amps', 'Number of Outlets': '9', 'Voltage': '125 Volts', 'Amazon Best Sellers Rank': '#11 in Electronics , #2 in Power Strips'}",B0CQYF34TD,"[{'size_name': '2U2C', 'color_name': 'Grey', 'asin': 'B0D6R5Z921'}, {'size_name': '3U1C', 'color_name': 'Black', 'asin': 'B08Z9X2N7Y'}, {'size_name': '3U1C', 'color_name': 'White', 'asin': 'B08R6S1M1K'}, {'size_name': '2U2C', 'color_name': 'White', 'asin': 'B08R6T1M9T'}, {'size_name': '2U2C', 'color_name': 'Black', 'asin': 'B0CZMWCRSD'}, {'size_name': '3U1C', 'color_name': 'Grey', 'asin': 'B0D6R7TZJL'}]","{'size_name': ['2U2C', '3U1C'], 'color_name': ['Black', 'Grey', 'White']}",new,"[{'title': 'Hussell Car Charger Adapter - 3.0 Portable USB w/Fast Charge Technology & Dual Ports - Compatible w/Apple iPhone, Android, Tablet or Other USB Device - White Elephant, Stocking Stuffers', 'link': 'https://www.amazon.com/Car-Charger-Adapter-USB/dp/B07J6FWK57/ref=pd_bxgy_d_sccl_1/000-0000000-0000000?pd_rd_w=HncAr&content-id=amzn1.sym.3858a394-39a9-4946-90e6-86a3153d2546&pf_rd_p=3858a394-39a9-4946-90e6-86a3153d2546&pf_rd_r=182B4M5K3K10VE5KBWXZ&pd_rd_wg=ph8q7&pd_rd_r=5bf0e5fb-715f-4761-9c82-52caf784ef30&pd_rd_i=B07J6FWK57&psc=1', 'price': '$4.99'}, {'title': 'Fab totes 6 Pack Clothes Storage, Foldable Thick Fabric Blanket Storage Bags, Storage Containers for Organizing Bedroom, Closet, Clothing, Comforter, Organization and Storage with Handle,Grey', 'link': 'https://www.amazon.com/Fab-totes-Containers-Organizing-Organization/dp/B092ZDHJMN/ref=pd_bxgy_d_sccl_2/000-0000000-0000000?pd_rd_w=HncAr&content-id=amzn1.sym.3858a394-39a9-4946-90e6-86a3153d2546&pf_rd_p=3858a394-39a9-4946-90e6-86a3153d2546&pf_rd_r=182B4M5K3K10VE5KBWXZ&pd_rd_wg=ph8q7&pd_rd_r=5bf0e5fb-715f-4761-9c82-52caf784ef30&pd_rd_i=B092ZDHJMN&psc=1', 'price': '$29.99'}]","[{'badge': ""Amazon's Choice"", 'badge_text': None}]",80%,14%,4%,1%,2%
B0CZPGX972,"Beats Solo 4 - Wireless Bluetooth On-Ear Headphones, Apple & Android Compatible, Up to 50 Hours of Battery Life - Cloud Pink",Beats,$129.99,$199.95,"1,834",4.5,Amazon.com,,In Stock,,,True,,,False,"Custom acoustic architecture and updated drivers for powerful Beats sound. - Personalized Spatial Audio with dynamic head tracking. - Ultralight ergonomic design for all-day comfort. Flex-grip headband and ergonomically angled, adjustable ear cups for a stable fit. - UltraPlush ear cushions are designed for comfort and durability. - Up to 50 hours of battery life. - Fast Fuel means a quick 10-minute charge gives up to 5 hours of playback. - High-resolution lossless audio via USB-C or 3.5 mm audio cable. - Dual compatibility including one-touch pairing for both iOS and Android. - High-quality call performance and voice assistant interaction via built-in microphone. - Industry-leading Class 1 Bluetooth for extended range and fewer dropouts.",,"['https://m.media-amazon.com/images/I/51QskGMw40L._AC_SL1500_.jpg', 'https://m.media-amazon.com/images/I/71m5Zdec0NL._AC_SL1500_.jpg', 'https://m.media-amazon.com/images/I/6148MAgJ9DL._AC_SL1500_.jpg', 'https://m.media-amazon.com/images/I/51T8uWkwtXL._AC_SL1500_.jpg', 'https://m.media-amazon.com/images/I/61IlzMDw1kL._AC_SL1500_.jpg', 'https://m.media-amazon.com/images/I/71omacRNGpL._AC_SL1500_.jpg', 'https://m.media-amazon.com/images/I/51TJ030CetL._AC_SL1500_.jpg']",0,,https://www.amazon.com/-/dp/B0CZPGX972?_encoding=UTF8&th=1&psc=1&pf_rd_i=desktop&ref_=pd_gw_unk,"configuration: Without AppleCare+, color: Cloud Pink, style: Solo4",,Cloud Pink,,"{'Brand': 'Beats', 'Color': 'Cloud Pink', 'Ear Placement': 'On Ear', 'Form Factor': 'On Ear', 'Noise Control': 'Sound Isolation'}",B0DHDNXM2B,"[{'configuration': 'Without AppleCare+', 'color_name': 'Cloud Pink', 'style_name': 'Solo4', 'asin': 'B0CZPGX972'}, {'configuration': 'Without AppleCare+', 'color_name': 'Black/Gold', 'style_name': 'Solo4', 'asin': 'B0DDQLGDY3'}, {'configuration': 'Without AppleCare+', 'color_name': 'Cloud Pink', 'style_name': 'Solo4 & Power Adapter', 'asin': 'B0D2F2D2VJ'}, {'configuration': 'Without AppleCare+', 'color_name': 'Slate Blue', 'style_name': 'Solo4 & Power Adapter', 'asin': 'B0D2DXR339'}, {'configuration': 'Without AppleCare+', 'color_name': 'Slate Blue', 'style_name': 'Solo4', 'asin': 'B0CZPHPJLN'}, {'configuration': 'Without AppleCare+', 'color_name': 'Matte Black', 'style_name': 'Solo4 & Power Adapter', 'asin': 'B0D2F52XZ3'}, {'configuration': 'Without AppleCare+', 'color_name': 'Black/Gold', 'style_name': 'Solo4 & Power Adapter', 'asin': 'B0DGBDMJXV'}, {'configuration': 'Without AppleCare+', 'color_name': 'Matte Black', 'style_name': 'Solo4', 'asin': 'B0CZPLV566'}]","{'configuration': ['Without AppleCare+'], 'color_name': ['Black/Gold', 'Cloud Pink', 'Matte Black', 'Slate Blue'], 'style_name': ['Solo4', 'Solo4 & Power Adapter']}",new,[],"[{'badge': ""Amazon's Choice"", 'badge_text': None}]",77%,11%,4%,2%,5%
B0BCH5H2R3,"Roku Express | HD Roku Streaming Device with Standard Remote (no TV controls), Free & Live TV",Roku,$27.36,$29.99,"43,808",4.7,Amazon.com,,In Stock,,,True,,,True,"Fast and powerful: Enjoy a seamless HD streaming experience that’s perfect for new users yet powerful enough for seasoned pros​ - Quick guided setup: Just plug it in to your TV and connect to the internet to start streaming, no power adaptor needed - Watch what you love: Stream a massive selection of free, live, and premium TV including 400+ free live TV channels - Standard remote: The included remote has only the buttons you need to stream, including shortcuts to popular channels​ - Always up to date: Get the latest features, newest channels, and more with automatic software updates​","Roku Express delivers a seamless HD streaming experience on your TV at our best price. It’s easy to get started—just plug it into your TV with the included High Speed HDMI Cable and connect to the internet. With a short step by step setup and an easy on screen experience, Roku Express is perfect for new users, but powerful enough for seasoned pros. Start streaming a massive selection of free, live, and premium TV, including Roku® Originals only on The Roku Channel. The customizable home screen puts your favorite channels like Netflix, Prime Video, Amazon Freevee, Disney+, HBO Max, Apple TV+, Sling, and Hulu front and center, so you can spend your time streaming—not scrolling. Use the free Roku mobile app as a convenient second remote and enjoy voice search, headphone mode with wireless headphones, and more. Roku is America’s #1 TV streaming platform based on hours streamed – Hypothesis Group, December 2022","['https://m.media-amazon.com/images/I/71bHZpw548L._AC_SL1500_.jpg', 'https://m.media-amazon.com/images/I/713AFSedv+L._AC_SL1500_.jpg', 'https://m.media-amazon.com/images/I/61Ap3wYXqgL._AC_SL1500_.jpg', 'https://m.media-amazon.com/images/I/611T0XcydXL._AC_SL1500_.jpg', 'https://m.media-amazon.com/images/I/71owQKMk+HL._AC_SL1500_.jpg', 'https://m.media-amazon.com/images/I/81tOY7BPuzL._AC_SL1500_.jpg', 'https://m.media-amazon.com/images/I/81LhFwbTeoL._AC_SL1500_.jpg', 'https://m.media-amazon.com/images/I/71eYUD68DqL._AC_SL1500_.jpg', 'https://m.media-amazon.com/images/I/71fwX20p2eL._AC_SL1500_.jpg']",10,Electronics > Television & Video > Streaming Media Players,https://www.amazon.com/-/dp/B0BCH5H2R3?_encoding=UTF8&th=1&psc=1&pf_rd_i=desktop&ref_=pd_gw_unk,style: Without Camera,,,,"{'ASIN': 'B0BCH5H2R3', 'Model Name': 'Roku Express 2022', 'UPC': '829610004914', 'Brand Name': 'Roku', 'Model Number': '3960R', 'Color': 'Black', 'Item Dimensions L x W x H': '1.54""L x 0.75""W x 2.83""H', 'Item Weight': '1.1 Ounces', 'Form Factor': 'TV Stick', 'RAM Memory Installed': '512 MB', 'Compatible Devices': 'Television', 'Memory Storage Capacity': '16 GB', 'Video Output Resolution': '1920 x 1080 Pixels', 'Video Codec': 'h.264', 'Resolution': '1080p', 'Internet Applications': 'Netflix, Prime Video, Pandora, Hulu, Vudu', 'Controller Type': 'standard IR remote', 'Connectivity Technology': 'Wireless', 'Connector Type': 'HDMI', 'Additional Features': 'Works with Apple AirPlay and HomeKit / Works with Google Home / Works with Alexa', 'Amazon Best Sellers Rank': '#20 in Electronics , #7 in Streaming Media Players'}",B0DFLYWS4D,"[{'style_name': 'Without Camera', 'asin': 'B0BCH5H2R3'}]",{'style_name': ['Without Camera']},new,"[{'title': 'Roku Express 4K+ | Roku Streaming Device 4K/HDR, Roku Voice Remote, Free & Live TV', 'link': 'https://www.amazon.com/Roku-Express-Streaming-Wireless-Controls/dp/B0916TKFF2/ref=pd_bxgy_d_sccl_1/000-0000000-0000000?pd_rd_w=L4Wkc&content-id=amzn1.sym.3858a394-39a9-4946-90e6-86a3153d2546&pf_rd_p=3858a394-39a9-4946-90e6-86a3153d2546&pf_rd_r=NC7B63ET5NJ8TFCJSYCF&pd_rd_wg=7lX5j&pd_rd_r=ad045069-9f83-4145-b95d-fadf8ffe2f4b&pd_rd_i=B0916TKFF2&psc=1', 'price': '$37.72'}, {'title': 'Roku Streaming Stick 4K | Portable Roku Streaming Device 4K/HDR/Dolby Vision, Roku Voice Remote, Free & Live TV', 'link': 'https://www.amazon.com/Roku-Streaming-Device-Vision-Controls/dp/B09BKCDXZC/ref=pd_bxgy_d_sccl_2/000-0000000-0000000?pd_rd_w=L4Wkc&content-id=amzn1.sym.3858a394-39a9-4946-90e6-86a3153d2546&pf_rd_p=3858a394-39a9-4946-90e6-86a3153d2546&pf_rd_r=NC7B63ET5NJ8TFCJSYCF&pd_rd_wg=7lX5j&pd_rd_r=ad045069-9f83-4145-b95d-fadf8ffe2f4b&pd_rd_i=B09BKCDXZC&psc=1', 'price': '$42.97'}]","[{'badge': ""Amazon's Choice"", 'badge_text': None}]",82%,10%,3%,1%,3%
B096SV8SJG,"Beats Studio Buds - True Wireless Noise Cancelling Earbuds - Compatible with Apple & Android, Built-in Microphone, IPX4 Rating, Sweat Resistant Earphones, Class 1 Bluetooth Headphones - Black",Beats,$99.99,$99.99,"78,627",4.3,Amazon.com,,In Stock,,,True,,,False,"Custom acoustic platform delivers powerful, balanced sound - Control your sound with two distinct listening modes: Active Noise Cancelling (ANC) and Transparency mode - Three soft ear tip sizes for a stable and comfortable fit while ensuring an optimum acoustic seal - Up to 8 hours of listening time (up to 24 hours combined with pocket-sized charging case) - Industry-leading Class 1 Bluetooth for extended range and fewer dropouts - High-quality call performance and voice assistant interaction via built-in microphones - IPX4-rated sweat- and water-resistant wireless earbuds - Beats wireless headphones and earphones are compatible with Apple and Android devices - What’s in the box – Beats Studio Buds true wireless noise cancelling earphones, charging case, ear tips with three size options, USB-C to USB-C charging cable, Quick Start Guide, warranty card (USB-C power adapter sold separately)",,"['https://m.media-amazon.com/images/I/51bRSWrEc7S._AC_SL1500_.jpg', 'https://m.media-amazon.com/images/I/618wL2LMGMS._AC_SL1500_.jpg', 'https://m.media-amazon.com/images/I/61kiU1iGP0S._AC_SL1500_.jpg', 'https://m.media-amazon.com/images/I/61WQ-9iriYS._AC_SL1500_.jpg', 'https://m.media-amazon.com/images/I/61nwkA++RFS._AC_SL1500_.jpg', 'https://m.media-amazon.com/images/I/61cpNYd2UXS._AC_SL1500_.jpg', 'https://m.media-amazon.com/images/I/61X9Z2FMXLS._AC_SL1500_.jpg', 'https://m.media-amazon.com/images/I/71eX6hJXkHS._AC_SL1500_.jpg', 'https://m.media-amazon.com/images/I/61zJiWdOzFS._AC_SL1500_.jpg', 'https://m.media-amazon.com/images/I/41OvvMbyc2S._AC_SL1500_.jpg']",0,,https://www.amazon.com/-/dp/B096SV8SJG?_encoding=UTF8&th=1&psc=1&pf_rd_i=desktop&ref_=pd_gw_unk,"configuration: Without AppleCare+, color: Black, style: Studio Buds",,Black,,"{'Brand': 'Beats', 'Color': 'Black', 'Ear Placement': 'In Ear', 'Form Factor': 'In Ear', 'Noise Control': 'Active Noise Cancellation'}",B0DHF5CVSY,"[{'configuration': 'With AppleCare+ (2 Years)', 'color_name': 'Black', 'style_name': 'Studio Buds', 'asin': 'B0BH7QTZGN'}, {'configuration': 'Without AppleCare+', 'color_name': 'White', 'style_name': 'Studio Buds & Power Adapter', 'asin': 'B0C1KQ3ZSY'}, {'configuration': 'Without AppleCare+', 'color_name': 'Black', 'style_name': 'Studio Buds & Power Adapter', 'asin': 'B0C1KT6QHT'}, {'configuration': 'Without AppleCare+', 'color_name': 'Black', 'style_name': 'Studio Buds', 'asin': 'B096SV8SJG'}, {'configuration': 'With AppleCare+ (2 Years)', 'color_name': 'Red', 'style_name': 'Studio Buds', 'asin': 'B0BH7T1JLK'}, {'configuration': 'Without AppleCare+', 'color_name': 'White', 'style_name': 'Studio Buds', 'asin': 'B096SRYXMP'}, {'configuration': 'With AppleCare+ (2 Years)', 'color_name': 'White', 'style_name': 'Studio Buds', 'asin': 'B0BH7LRH32'}, {'configuration': 'Without AppleCare+', 'color_name': 'Red', 'style_name': 'Studio Buds & Power Adapter', 'asin': 'B0C1KT6R6Y'}, {'configuration': 'Without AppleCare+', 'color_name': 'Red', 'style_name': 'Studio Buds', 'asin': 'B096SSCV5K'}]","{'configuration': ['With AppleCare+ (2 Years)', 'Without AppleCare+'], 'color_name': ['Black', 'Red', 'White'], 'style_name': ['Studio Buds', 'Studio Buds & Power Adapter']}",new,[],"[{'badge': ""Amazon's Choice"", 'badge_text': None}]",67%,13%,7%,4%,8%
B0916TKFF2,"Roku Express 4K+ | Roku Streaming Device 4K/HDR, Roku Voice Remote, Free & Live TV",Roku,$37.72,$39.99,"85,317",4.7,Amazon.com,,In Stock,,,True,,,True,"Brilliant 4K picture quality: Stream in HD, 4K, and HDR with sharp resolution and vivid color optimized for your TV​ - Seamless streaming: Enjoy a smooth streaming experience with a faster wireless network connection​ - No more juggling remotes: Power up your TV, adjust the volume, and control your Roku device all with one remote​ - Voice search & control: Quickly search, play entertainment, and control your streaming device with the voice remote - Upgrade to Roku streaming: Enjoy a customizable home screen with your channels front and center, plus automatic updates - Quick guided setup: Just plug it in to your TV and connect to the internet to start streaming, no power adaptor needed - Watch what you love: Stream a massive selection of free, live, and premium TV including 350+ free live TV channels - Works with popular voice assistants: Enjoy easy voice control with Siri, Alexa, or Hey Google​ - Troubleshooting steps for wifi connection: Double check the network you selected and that you entered your password correctly. If you have other devices connected to this network, your streaming player should connect.","Roku Express 4K+ is the easy way to start streaming in brilliant 4K picture and vivid HDR color. Enjoy a smooth streaming experience with faster wireless performance, even with multiple streaming devices connected to your network. Power up your TV, adjust the volume, and control your streaming with the included Roku Voice Remote. Use your voice to quickly search, turn captions on, and more. Best of all, Roku streaming gives you a massive selection of free and live TV, and a customizable home screen with your favorite channels front and center, like Netflix, HBO Max, Disney Plus, Prime Video, Freevee, YouTube TV, Apple TV+, Sling TV, and Hulu. Setup is a cinch with everything you need in the box, including a Premium High Speed HDMI Cable. Roku Express 4K+ also works with popular voice assistants. Ask Alexa or Hey Google to launch channels, search for entertainment, control your streaming, and more. You can also control your TV using the Apple Home app or Siri on your Apple devices. Roku is America’s #1 TV streaming platform based on hours streamed – Hypothesis Group, December 2022","['https://m.media-amazon.com/images/I/7108AbztVsL._AC_SL1500_.jpg', 'https://m.media-amazon.com/images/I/71e0kfWJiZL._AC_SL1500_.jpg', 'https://m.media-amazon.com/images/I/71txjDvNUAL._AC_SL1500_.jpg', 'https://m.media-amazon.com/images/I/61GZg5iEGML._AC_SL1500_.jpg', 'https://m.media-amazon.com/images/I/81tOY7BPuzL._AC_SL1500_.jpg', 'https://m.media-amazon.com/images/I/81LhFwbTeoL._AC_SL1500_.jpg', 'https://m.media-amazon.com/images/I/71IMGr7disL._AC_SL1500_.jpg', 'https://m.media-amazon.com/images/I/71eYUD68DqL._AC_SL1500_.jpg', 'https://m.media-amazon.com/images/I/717PH+v3+2L._AC_SL1500_.jpg', 'https://m.media-amazon.com/images/I/81Gi5MZvaKS._AC_SL1500_.jpg']",10,Electronics > Television & Video > Streaming Media Players,https://www.amazon.com/-/dp/B0916TKFF2?_encoding=UTF8&th=1&psc=1&pf_rd_i=desktop&ref_=pd_gw_unk,style: NEW Roku Express 4K +,,,,"{'ASIN': 'B0916TKFF2', 'Model Name': 'Roku Express 4K+', 'UPC': '829610004624', 'Brand Name': 'Roku', 'Model Number': '3941R2', 'Color': 'Black', 'Item Dimensions L x W x H': '3""L x 1.6""W x 0.83""H', 'Item Weight': '1.6 Ounces', 'Form Factor': 'TV Box', 'RAM Memory Installed': '1 GB', 'Compatible Devices': 'iPhone, Andriod, Samsung, Smart Phone', 'Memory Storage Capacity': '16 GB', 'Video Output Resolution': '3840 x 2160 Pixels', 'Video Codec': 'h_264', 'Resolution': '4k', 'Internet Applications': 'Netflix, Prime Video, Pandora, Hulu, Vudu', 'Controller Type': 'Remote Control, App Control', 'Connectivity Technology': 'Wi-Fi', 'Connector Type': 'HDMI', 'Additional Features': '4K picture, HDR color', 'Amazon Best Sellers Rank': '#15 in Electronics , #6 in Streaming Media Players'}",B0DFM2ZKL3,"[{'style_name': 'NEW Roku Express 4K +', 'asin': 'B0916TKFF2'}]",{'style_name': ['NEW Roku Express 4K +']},new,"[{'title': 'Roku Streaming Stick 4K | Portable Roku Streaming Device 4K/HDR/Dolby Vision, Roku Voice Remote, Free & Live TV', 'link': 'https://www.amazon.com/Roku-Streaming-Device-Vision-Controls/dp/B09BKCDXZC/ref=pd_bxgy_d_sccl_1/000-0000000-0000000?pd_rd_w=FI3yq&content-id=amzn1.sym.3858a394-39a9-4946-90e6-86a3153d2546&pf_rd_p=3858a394-39a9-4946-90e6-86a3153d2546&pf_rd_r=KYX59QRMR2BJ1Z1NW4TT&pd_rd_wg=tLoXF&pd_rd_r=fcb72e54-f467-48b7-922c-c123f814ac8e&pd_rd_i=B09BKCDXZC&psc=1', 'price': '$42.97'}, {'title': 'Roku Express | HD Roku Streaming Device with Standard Remote (no TV controls), Free & Live TV', 'link': 'https://www.amazon.com/Roku-Express-Streaming-High-Speed-controls/dp/B0BCH5H2R3/ref=pd_bxgy_d_sccl_2/000-0000000-0000000?pd_rd_w=FI3yq&content-id=amzn1.sym.3858a394-39a9-4946-90e6-86a3153d2546&pf_rd_p=3858a394-39a9-4946-90e6-86a3153d2546&pf_rd_r=KYX59QRMR2BJ1Z1NW4TT&pd_rd_wg=tLoXF&pd_rd_r=fcb72e54-f467-48b7-922c-c123f814ac8e&pd_rd_i=B0BCH5H2R3&psc=1', 'price': '$27.36'}]","[{'badge': ""Amazon's Choice"", 'badge_text': None}]",82%,10%,3%,1%,3%
